"speaker","transcription","url","headlin","timing"
"Donald Trump","Well, thank you very much, Minnesota. There was supposed to only have like a hundred people. You know, we’re supposed to have these tiny little crowds. You can’t have any more than that. It’s very heavily restricted. That’s a lot of people showed up. I want to thank you. We’d love to have those rallies, but I guess you just can’t do that. And you’re not allowed to do that now. So we don’t do that, but we do the little airport hops and people like them and a lot of people come back. But unfortunately we had to hold off a lot of people in the back, which I feel badly about. In 78 days, we’re going to be. 78 days. We’re going to win this state. We’re going to take back the White House and we’re going to have an election that’s all about the survival, our nation.","https://www.rev.com/blog/transcripts/donald-trump-speech-transcript-minnesota-august-17","Donald Trump Speech Transcript Minnesota August 17","00:10"
"Donald Trump","This is a very important, in my opinion, I used to say 2016. And I must tell you, I think this is going to be the most important election in the history of our country. This is a very, very big deal going on. Joe Biden is the puppet of left wing extremists, trying to erase our borders, eliminate our police, indoctrinate our children, vilify our heroes, take away our energy. You know all about that. Take away our energy. If you can believe it. No fossil fuel. Destroy our second amendment, attack the right to life and replace American freedom with left wing fascism. Left wing. We’re going to left wing all the way. Fascists. They are fascists. Some of them, not all of them, but some of them, but they’re getting closer and closer. We have to win this election, but the proud people of Minnesota will not let this happen.","https://www.rev.com/blog/transcripts/donald-trump-speech-transcript-minnesota-august-17","Donald Trump Speech Transcript Minnesota August 17","00:56"
"Donald Trump","You will deliver a historic victory for our values, our citizens and our treasured way of life. We’ll save our cities in our suburbs from the future of crime and chaos, corruption, and economic collapse that puppet Joe Biden would unleash on America. This is a puppet. He won’t do it intentionally. He just says, “Well, whatever they want.” Because he has no clue. He has no clue.","https://www.rev.com/blog/transcripts/donald-trump-speech-transcript-minnesota-august-17","Donald Trump Speech Transcript Minnesota August 17","01:52"
"Donald Trump","I ended low income housing being built in the suburbs and destroying people’s American dream. You know that. If Biden and Harris get into power, they’ve pledged to raise your taxes by $4 trillion, which put in very simple terms, mean many of you will have to pay double and triple the taxes that you’re paying right now. This includes attacks of over $3,000 on a typical family of four. Biden Harris also pledged to eliminate fracking, natural gas, oil, and coal production. Forcing us to beg for energy from foreign suppliers. On my watch, America will proudly remain energy independent. First time, energy independent. We’ve met a lot of progress on energy.","https://www.rev.com/blog/transcripts/donald-trump-speech-transcript-minnesota-august-17","Donald Trump Speech Transcript Minnesota August 17","02:20"
"Donald Trump","I want to thank your terrific representatives in Congress, Tom Emmer. Where’s Tom? Tom, Tom, Tom.","https://www.rev.com/blog/transcripts/donald-trump-speech-transcript-minnesota-august-17","Donald Trump Speech Transcript Minnesota August 17","03:19"
"Tom Emmer","Right here.","https://www.rev.com/blog/transcripts/donald-trump-speech-transcript-minnesota-august-17","Donald Trump Speech Transcript Minnesota August 17","03:30"
"Donald Trump","There he is, what a man. These are warriors. Jim Hagedorn. Pete Stauber.","https://www.rev.com/blog/transcripts/donald-trump-speech-transcript-minnesota-august-17","Donald Trump Speech Transcript Minnesota August 17","03:30"
"Donald Trump","And this is a very important one, fellows. This is very important. Your next senator from Minnesota. Fantastic man. I just see that he’s even in the poll. Normally that doesn’t mean much, but that’s a big step and he’s fantastic. Jason Lewis, he’s going to be a fantastic senator. That’s big, Jason. That’s ahead of schedule. And I hear we’re doing very well in the poll too. We win Minnesota, it is over. It is over, right? We win Minnesota. But our great Republican candidates for Congress, Michelle Fischbach. Where’s Michelle? Michelle? I hear so many great things about you. I have heard so many great things. Go out and do it. You’re going to do it. We’re going to be out there working with you. Tyler Kistner. Tyler. Tyler. Tyler. Good luck, Tyler.","https://www.rev.com/blog/transcripts/donald-trump-speech-transcript-minnesota-august-17","Donald Trump Speech Transcript Minnesota August 17","03:42"
"Donald Trump","It’s a great group. And man whose name I love, Lacy Johnson. Great job. I’ve been following you, Lacy. You’re doing good. You’re doing good. Thank you, Lacy very much. We really have to get them. They’re warriors, all of them, all of them. We have to get them in because we have to stop this craziness that’s going on. No law enforcement, no anything. They don’t know what they’re doing. They’ll lose the country. You know, there’s somebody said the other day and I say it very strongly, “Sir, you’re the only one between that and the greatness of the American dream.” And there’s truth to it. We don’t stop. We don’t keep this position. We’re going to win the House. I feel confident we’re going to win the House.","https://www.rev.com/blog/transcripts/donald-trump-speech-transcript-minnesota-august-17","Donald Trump Speech Transcript Minnesota August 17","04:38"
"Donald Trump","We are going to win the House. I’m very much involved in every single race and with the Senate, we’re working very hard. I think we’re going to be in great shape in the Senate. And I think we’re a great, did you see that CNN, they raised us 10 points in one poll that took place over a short period of time? And it’s still not good enough. It’s still not good enough. You mean they’re getting more honest because I’ll tell you what, there’s never been enthusiasm like we have. There’s never been. Right, Tom? Including in 2016, we’ve never had. We had more enthusiasm than anyone’s seen maybe ever in a presidential campaign and it pales in comparison to what’s going on right now. It does.","https://www.rev.com/blog/transcripts/donald-trump-speech-transcript-minnesota-august-17","Donald Trump Speech Transcript Minnesota August 17","05:28"
"Donald Trump","Even this, we wanted to restrict the crowd. We didn’t tell anybody and look at what happens. But look at Voters for Trump. Look at Bikers for Trump. They have highways with thousands of people, thousands of people, right? You know, bikers going, I don’t know if I’m driving along and I get passed by 2,000 bikers, I don’t know what I’m going to do. And then they have, they set Guinness book, I hear, the world record yesterday for boats. But no matter where you… In Florida, no matter where you go, a river, a lake, an ocean, there’re boats up there by the thousands on the wicker. The weekend is unbelievable. Minnesota Senate majority leader, Paul Gazelka. Paul. Thank you, Paul. Good job, Paul. Are we doing good? We’re doing good. Right? I think we are too. And Minnesota House Republican leader. Another great one. Kurt Daudt. Kurt, thank you very much. Thank you, Kurt, very much.","https://www.rev.com/blog/transcripts/donald-trump-speech-transcript-minnesota-august-17","Donald Trump Speech Transcript Minnesota August 17","06:16"
"Donald Trump","I’m having a lot of fun today because it’s so windy. You can’t see these teleprompters at all. So I’m sort of making it up as I go along and that’s okay. I’ve had to do that plenty. Now these suckers are blowing, like I’m saying “What that hell?” Fortunately, I know these people. If I didn’t know these people, you would have been in big trouble. I will tell you that. Another one I know very well, he’s the single greatest ad buyer in the history of the world. And he also happens to make a very good product. His pillow. I use it. When I sleep well, I’m using his pillow and these suckers are about to fall down, but that’s okay because I know him very well. Mike Lindell.","https://www.rev.com/blog/transcripts/donald-trump-speech-transcript-minnesota-august-17","Donald Trump Speech Transcript Minnesota August 17","07:15"
"Donald Trump","Mike, thank you. And he’s the chairman of our campaign. If I don’t win Minnesota with you as the chairman of our campaign, I would say that would be very bad for me because if this guy can do anything, thank you, Mike. It’s an honor and we appreciate it very much. Thank you. You do a great job. Thank you. And it’s all made in Minnesota, right? All made in Minnesota. Thank you very much. Before the China virus invaded our shores, we built the greatest economy in history. There was nothing like it. We were beating everybody, including China. They had the worst year in 67 years. We were taking in billions and billions and billions of dollars in tariffs. Beautiful thing tariffs, when used properly, especially when you’re being taken advantage of by every nation of the world. We achieved record low unemployment for African American, Hispanic American, Asian American, young people, people with diplomas, people without diplomas, college students, crummy students, great students, horrible students, dumb people, liberal people, conservative people.","https://www.rev.com/blog/transcripts/donald-trump-speech-transcript-minnesota-august-17","Donald Trump Speech Transcript Minnesota August 17","08:00"
"Donald Trump","Everybody was doing the best they’ve ever done. PhDs from MIT. PhDs from crummy colleges. Everybody was doing the greatest, the best they’ve ever done. Median household income soared to the highest level ever recorded. Numbers were unbelievable to open new opportunities for Minnesota farmers and factory workers. We replaced the disaster known as NAFTA with a brand new USMCA, which has been a big hit. Dairy exports to Canada are now expected to surge by at least 50%. I know how good the deal is. Don’t tell Canada I said this because they were not happy about it. They had pickets. When they have pickets about a deal, that makes you feel good. But they’ve been taking advantage. You know, Canada. Oh, Canada. Wonderful song. Right? Oh, Canada. Nice, nice song. Only one problem. They took advantage of us like crazy with your dairy tariffs, 297% tariff on your dairy products, right?","https://www.rev.com/blog/transcripts/donald-trump-speech-transcript-minnesota-august-17","Donald Trump Speech Transcript Minnesota August 17","09:17"
"Donald Trump","I learned that when I came up here, they had specialty milk, a little thing, specialty milk. And I met a farmer and he said what had happened with specialty milk. And that got me over the edge. And I said, “We got to change this,” because you were taken, Tom. You were taken advantage of by Canada very badly and by Mexico and by China and by Japan and by friends and foe. And in many cases, friends who are worse than the foe. For years, you watched as politicians like Sleepy Joe Biden who’s been in office for 47 years, allowed foreign nations to crush Minnesota’s mining. Look at your mining industry, it was crushed by dumping tons and tons of cheap iron and steel into our country. I saw what was happening. I did something about it. I did something about it.","https://www.rev.com/blog/transcripts/donald-trump-speech-transcript-minnesota-august-17","Donald Trump Speech Transcript Minnesota August 17","10:31"
"Donald Trump","I will tell you, China wants me to lose so badly. They all do. They all do. And yet I get along with all of them. Although China I don’t speak to them. After the plague came in, you know, we made a great deal with China. They announced last week that China ordered the largest amount of corn in history and the largest amount of soybeans in history and big cattle purchases. One of the biggest anybody has seen. And I said, “See how smart they are? If they weren’t smart, they would’ve stopped and we would’ve said let’s decouple.” But by ordering so much, the farmers come to me, “Sir, we like this deal a lot. Please don’t do anything irrational.”","https://www.rev.com/blog/transcripts/donald-trump-speech-transcript-minnesota-august-17","Donald Trump Speech Transcript Minnesota August 17","11:26"
"Donald Trump","How smart is China? Right? The biggest corn order. Think. They said the biggest corn order in history. So I have to say, “Ah.” But I tell you, my view has changed a lot. We’ve made a great deal with China, but my view has changed a lot. USMCA is the biggest deal ever made. And that one is working out great between Canada and Mexico. And remember this, Minnesota, under the last administration, the last administration, Minnesota iron range was wiped out. Seven plants were idled and more than 2,000 workers were laid off. Obama and Biden closed it down. Do you remember that? The finest iron ore in the world, they say, I don’t know, what do I know? To me it all looks the same, but they say it’s the finest iron ore in the world. That’s good enough for me. And what did I do? Almost immediately after getting into office, I heard about this disaster, just like Keystone Pipeline, just like so much else, Jason. And you’ll be working on that with me and in the beautiful halls of the Senate. And he’s going to stay with us. He’s not going to be one of those that gets elected.","https://www.rev.com/blog/transcripts/donald-trump-speech-transcript-minnesota-august-17","Donald Trump Speech Transcript Minnesota August 17","12:08"
"Donald Trump","He’s not going to be one of them that get elected and then he walks into those gorgeous buildings when they had those big, beautiful dollar bills and they built marble columns. And it’s so beautiful. And so rich, he’s not going to say, “Darling, we finally arrived. Now we can go with majority.” He’s going to do what’s right. He’s going to do what’s right. I know Jason, you need Jason, get Jason elected please. But they closed it up. And I was here and a worker. I was making speeches before you had to stand 200 feet away from everybody, before you had to stand like two football fields away. And a worker came up to me with a group of his friends and they were all crying and they were tough. They never cried before in their life. Maybe when they were babies but I doubt it.","https://www.rev.com/blog/transcripts/donald-trump-speech-transcript-minnesota-august-17","Donald Trump Speech Transcript Minnesota August 17","13:27"
"Donald Trump","They were all crying. He said, “Sir, you gave us back our life.” He said that. I had that just recently in Maine, they took away 5,000 square miles. Think of a square mile and then multiply it times 5,000. Took away 5,000 square miles. That was, O-Biden. As I call them, O-Biden. That was Obama and Biden short. I like that term. O-Biden, because you save a lot of time, but that was Obama and Biden in Maine took away 5,000, Mike, square miles. You know what that is? That’s like I said, “Let me see what it looks like on a map.” They basically took away the Atlantic ocean from Maine. And Maine is the greatest in the world for lobster and the greatest in the world, just about, for fishing. I said, “Why did he take this area?”","https://www.rev.com/blog/transcripts/donald-trump-speech-transcript-minnesota-august-17","Donald Trump Speech Transcript Minnesota August 17","14:14"
"Donald Trump","They didn’t know, except that was the great fishing area. And I gave it back to them. I redid it. I took it off. I wiped it out. I gave an executive order that wiped it out immediately. Then we wiped out the tariffs that they were being charged by China. And by, as you know, the United Kingdom was charging tariffs. They were all charging tariffs to our fishermen, but we don’t charge tariffs to them. So I made it. I made it fair. European Union was a disaster charging tariffs. They were charging big tariffs. We wouldn’t. So here’s what was happening. So Canada, they would sell the fish and lobster to Canada for nothing, for peanuts and Canada would then sell it to China and also to the European Union, because Canada had a deal where they didn’t have to pay the tariffs. This was before my time, how this could’ve happened is a…","https://www.rev.com/blog/transcripts/donald-trump-speech-transcript-minnesota-august-17","Donald Trump Speech Transcript Minnesota August 17","15:07"
"Donald Trump","They didn’t have to pay the tariffs. This was before my time. How this could have happened is incredible. So I said, “Listen, if you don’t change your tariffs, I’m going to put your tariffs on your car.” It was amazing. They said, “We’ll change them immediately.” Thank you very much. That took about two minutes. So I did a lot for Maine. We’re going to see whether or not they remember but I think Maine’s going to remember but I did similar for you when I opened up your great iron ore and I put tariffs, I put tariffs on foreign steel and the Iron Range came roaring back to life. You know that, right? Right?","https://www.rev.com/blog/transcripts/donald-trump-speech-transcript-minnesota-august-17","Donald Trump Speech Transcript Minnesota August 17","16:03"
"Donald Trump","These guys came up to me, “You’ve given us back our life.” I’ve never forgotten that, “You’ve given us back our life.” They didn’t say thanks, they didn’t say thanks for the job, they said that’s what they’ve done all their life and Obama just came in and closed it up. I don’t say Biden because I don’t think he knows what the hell is happening. I think if you mention … IF you mention, “You shouldn’t have done that to Minnesota,” he’ll say, “Where’s Minnesota? [inaudible 00:16:58]. I don’t know what Minnesota is. Where is that please?”","https://www.rev.com/blog/transcripts/donald-trump-speech-transcript-minnesota-august-17","Donald Trump Speech Transcript Minnesota August 17","16:35"
"Donald Trump","How many times by the way has he been up at a speech where he’ll say the wrong state, right? He’ll get up, “It’s great to be in the wonderful state of Ohio.” “Sir, sir, you’re in Florida.” That’s the bad one, when you see palm trees. Wonderful to be in Ohio. Or, “I love being with the people from Iowa.” “Sir, you’re in Idaho.” He always gets New Hampshire mixed up with Vermont. But all the time he does that. I haven’t done it yet. If I do I’m just leaving because there’s no way you can save it. There’s no way you can save it.","https://www.rev.com/blog/transcripts/donald-trump-speech-transcript-minnesota-august-17","Donald Trump Speech Transcript Minnesota August 17","17:03"
"Donald Trump","We recently issued a directive protecting workers on the Iron Range from unfair job-killing regulation and frivolous litigation in addition to everything else. We started construction on the new soo lock, right? Soo lock, big deal. That’s been deteriorating for many years. Just about gone and we’re redoing it now, rebuilding it. That’s a big deal for your state and for others so that the iron ore can quickly get to market. Soo lock. Our miners are back on the job and wages have increased by as much as 50% and they’re doing great even during the China plague, they’re doing great and the China plague will fade but we will not forget. If Biden wins, the Iron Range will be shut down forever. You know that. He’ll shut it down very early on forever. I took a lot of heat by doing that. I took a lot of heat from the so-called environmentalists. I’m an environmentalist too in a big sense. We just signed something the every day. Cory Gardner, Steve Daines, senators, great senators, and we signed a bill that’s going to really be something incredible from an environmental standpoint, the biggest we’ve ever signed they say, other than Teddy Roosevelt. It goes back to Teddy Roosevelt. I said, “Why is [inaudible 00:19:09]?” Because we also did something tremendous for Utah, you know that. Thousands and thousands of acres, we opened it up. I said, “Why isn’t it bigger than Teddy Roosevelt? I want bigger. Otherwise I’m not signing,” they said, “Sir, he did the Grand Canyon and a few other things.” I said, “All right. That’s pretty big.” Grand Canyon is big. Do we agree? Even from Mike Lindell, the Grand Canyon. Even Mike would admit the Grand Canyon’s tough to beat, right? So anyway, but we did. We signed it and it’s one of the biggest acts. They say the biggest thing environmentally done since Teddy Roosevelt. That’s a long time ago.","https://www.rev.com/blog/transcripts/donald-trump-speech-transcript-minnesota-august-17","Donald Trump Speech Transcript Minnesota August 17","17:44"
"Donald Trump","We achieved together and what we’re doing together is nothing short of an economic miracle and now we’re doing it again. We did it, we built the greatest economy in the history of the world and now I have to do it again. You know what that is? That’s right, that’s God testing me. He said, “You know, you did it once,” and I said, “Did I do a great job, God? I’m the only one that could do it?” He said, “That you shouldn’t say. Now we’re going to have you do it again.” I said, “Okay, I agree. You got me.” But I did it once and now I’m doing it again and you see the kind of numbers that we’re putting up, they’re unbelievable. Best job numbers ever, three months, more jobs in the last three months than ever before. Best retail sales in history. Best car sales, did you see where the car sales are actually above what they were? Did you see the manufacturing, remember you’re not going to have manufacturing back. You needed a magic wand for manufacturing, well we got the magic wand because the manufacturing numbers are through the roof and your state, last year had the best year it ever had, right? Best year it ever had and now you’re going to have something that’s even better. So I just want to tell you, we are going to do it again.","https://www.rev.com/blog/transcripts/donald-trump-speech-transcript-minnesota-august-17","Donald Trump Speech Transcript Minnesota August 17","19:45"
"Donald Trump","By the way, third quarter numbers come out and interestingly they will come out just before November 1 and we’re going to see how I did but I think you’re going to have a great third quarter. People are now starting to predict it much to their chagrin, right? Much to their chagrin. [inaudible 00:21:20] just like CNN said, “He’s up 10 points.” They all said, “10 points? 10 points?” First of all, the first poll was rigged and wrong. It was a rigged poll, just like they want to try and rig the election with all these mail-in ballots. Let’s send out 62 million ballots. Let’s send … Well, some people say, “Gee, you shouldn’t talk.” I got to talk about it because absentee ballots are good. You send for the ballot, you’re not going to be in your state and you get it back and you do something and you send it back in and it’s a process. You have to work for it a little bit. But these ballots, they want to send them out in some states, they want to send them out and they want to just have millions of ballots, they say, “Oh, we drop them in a lockbox.”","https://www.rev.com/blog/transcripts/donald-trump-speech-transcript-minnesota-august-17","Donald Trump Speech Transcript Minnesota August 17","21:04"
"Donald Trump","I just saw, the great thing about Air Force One, there’s no lack of television. You have televisions on the ceilings, in the closets, on the floors. No matter where you go, there’s a television. You open the closet, there’s a television. I say, “No, too much Trump. I can’t watch it anymore.” I try and get away, you put yourself in a closet. But they have a lot of stuff and they showed this person getting on FOX, you know FOX now puts on more Democrats just about than they do Republicans. They have certainly changed a lot. FOX has changed a lot. They’re probably turning off right now as I speak but I don’t … See I don’t care. I tell the truth. It’s ridiculous.","https://www.rev.com/blog/transcripts/donald-trump-speech-transcript-minnesota-august-17","Donald Trump Speech Transcript Minnesota August 17","22:03"
"Donald Trump","One of the biggest differences between this year and four years ago is FOX. FOX is like from a different planet, and too bad. And you know what’s going to happen? If we don’t win, they’re going to go down the tubes along with every other media outlet, they’ll all be bust, they’ll all be gone, I can tell you that. Nobody’s going to want to cover Sleepy Joe. We’ll end up with one very boring socialist country that will go to hell, but when you look at it and when you look at what’s happening, that’s why we have to win this election, and if we don’t win this election, every one of you, me, all of us, it will never be the country … I don’t think the country can ever come back to it.","https://www.rev.com/blog/transcripts/donald-trump-speech-transcript-minnesota-august-17","Donald Trump Speech Transcript Minnesota August 17","22:41"
