"speaker","transcription","url","headlin","timing"
"Donald Trump","No. We have our deal with China. They’re going to be buying $250 billion worth of goods and 50 billion from our farmers, and it’s a great deal for our country. It’s about time somebody did that and, frankly, phase two, we’ll start negotiating. I did read one article, but I don’t think that article was representative, certainly not in my conversations with President Xi, and they know where it came from. We all know where it came from.","https://www.rev.com/blog/transcripts/donald-trump-speech-transcript-declares-coronavirus-national-emergency","Donald Trump Speech Transcript: Declares Coronavirus National Emergency","47:10"
"Yamiche A.","Thank you, Mr. President. Yamiche Alcindor from PBS News Hour.","https://www.rev.com/blog/transcripts/donald-trump-speech-transcript-declares-coronavirus-national-emergency","Donald Trump Speech Transcript: Declares Coronavirus National Emergency","47:41"
"Donald Trump","Yes.","https://www.rev.com/blog/transcripts/donald-trump-speech-transcript-declares-coronavirus-national-emergency","Donald Trump Speech Transcript: Declares Coronavirus National Emergency","47:44"
"Yamiche A.","My first question is, you said that you don’t take responsibility, but you did disband the White House pandemic office and the officials that were working in that office left this administration abruptly, so what responsibility do you take to that? The officials that worked in that office said that the White House lost valuable time because that office wasn’t disbanded. What do you make of that?","https://www.rev.com/blog/transcripts/donald-trump-speech-transcript-declares-coronavirus-national-emergency","Donald Trump Speech Transcript: Declares Coronavirus National Emergency","47:44"
"Donald Trump","I just think it’s a nasty question, because what we’ve done is … and Tony had said numerous times that we’ve saved thousands of lives because of the quick closing. When you say ‘me’, I didn’t do it. We have a group of people I could ask, perhaps in my administration, but I could perhaps ask Tony about that, because I don’t know anything about it. You say we did that. I don’t know anything about it.","https://www.rev.com/blog/transcripts/donald-trump-speech-transcript-declares-coronavirus-national-emergency","Donald Trump Speech Transcript: Declares Coronavirus National Emergency","48:04"
"Yamiche A.","You don’t know about the reorganization that happened at the National Security Council?","https://www.rev.com/blog/transcripts/donald-trump-speech-transcript-declares-coronavirus-national-emergency","Donald Trump Speech Transcript: Declares Coronavirus National Emergency","48:29"
"Donald Trump","[crosstalk 00:48:30]. It’s the administration. Perhaps they do that. People let people go. You used to be with a different newspaper than you are now. Things like that happen.","https://www.rev.com/blog/transcripts/donald-trump-speech-transcript-declares-coronavirus-national-emergency","Donald Trump Speech Transcript: Declares Coronavirus National Emergency","48:32"
"Yamiche A.","But this wasn’t-","https://www.rev.com/blog/transcripts/donald-trump-speech-transcript-declares-coronavirus-national-emergency","Donald Trump Speech Transcript: Declares Coronavirus National Emergency","48:38"
"Donald Trump","Okay, please go ahead.","https://www.rev.com/blog/transcripts/donald-trump-speech-transcript-declares-coronavirus-national-emergency","Donald Trump Speech Transcript: Declares Coronavirus National Emergency","48:39"
"Donald Trump","We’re doing a great job. Let me tell you, these professionals behind me and these great, incredible doctors and business people, the best in the world. I can say that whether it’s retailers or labs or anything you want to say, these are the best in the world. We’re doing a great job. We have 40 people right now. 40. Compare that with other countries that have many, many times that amount. One of the reasons we have 40 and others have … and again, that number’s going up, just so you understand, and a number of cases which are very small, relatively speaking, it’s going up, but we’ve done a great job because we acted quickly, we acted early, and there’s nothing we could have done that was better than closing our borders to highly infected areas.","https://www.rev.com/blog/transcripts/donald-trump-speech-transcript-declares-coronavirus-national-emergency","Donald Trump Speech Transcript: Declares Coronavirus National Emergency","48:41"
"Donald Trump","Please, go ahead.","https://www.rev.com/blog/transcripts/donald-trump-speech-transcript-declares-coronavirus-national-emergency","Donald Trump Speech Transcript: Declares Coronavirus National Emergency","49:21"
"Vanessa","Thank you, Mr. President. Vanessa [inaudible 00:49:24] for NTN24 for all Latin American countries and also for Spain, [foreign language 00:49:29]. I would like to ask you two very brief questions. One, for how long we’re going to have the national emergency?","https://www.rev.com/blog/transcripts/donald-trump-speech-transcript-declares-coronavirus-national-emergency","Donald Trump Speech Transcript: Declares Coronavirus National Emergency","49:22"
"Donald Trump","I hope not long, but it’s there now and it gives tremendous powers for things that we need. Tremendous power actually, and the Stafford Act and various other things that we’re involved with and have studied and memorized in so many different ways and forms. It gives the kind of power that we need to get rid of this virus, and we’re going to do it very quickly, and I hope we won’t need it very long, but whatever it takes.","https://www.rev.com/blog/transcripts/donald-trump-speech-transcript-declares-coronavirus-national-emergency","Donald Trump Speech Transcript: Declares Coronavirus National Emergency","49:39"
"Vanessa","For now, we still don’t know for how long? I have something very important I wanted to ask you is, do you really think it’s essential coordinating with other countries and learning from the lessons that they already suffered the same situation? Countries, of course, like China and South Korea, but now recently Italy and Spain, and how is that coordination done? Thank you so much, Mr. President.","https://www.rev.com/blog/transcripts/donald-trump-speech-transcript-declares-coronavirus-national-emergency","Donald Trump Speech Transcript: Declares Coronavirus National Emergency","50:04"
"Donald Trump","We’re in touch with Italy, and it’s a country that we love. We have millions and millions of people originally from Italy, and we’re working with them. They’re in, probably relatively speaking, the toughest position of all. We’re in touch with everybody. When I say everybody, we’re in touch with many of the countries that you know about that you’re writing about, and they’re calling us asking for advice. They’re asking for the advice of the people behind me. Italy’s got a tough situation, but they have really clamped down, and I think they’re going to see some very good results. It’s tough what they did. They really took their medicine, but they’re going to see some much better results.","https://www.rev.com/blog/transcripts/donald-trump-speech-transcript-declares-coronavirus-national-emergency","Donald Trump Speech Transcript: Declares Coronavirus National Emergency","50:26"
"Donald Trump","Yeah, Jeff.","https://www.rev.com/blog/transcripts/donald-trump-speech-transcript-declares-coronavirus-national-emergency","Donald Trump Speech Transcript: Declares Coronavirus National Emergency","51:14"
"Jeff","Thank you, sir. With regard to domestic travel, should Americans feel safe, or should Americans at all be traveling to states such as Washington state, New York, and other hotspots within this country? And a followup on Brazil. You’re asking people who come back from Europe, Americans who are coming back from Europe, to self-quarantine for a couple weeks. You were in a picture with somebody who now has Coronavirus from Brazil at Mar-a-Lago. How is that different?","https://www.rev.com/blog/transcripts/donald-trump-speech-transcript-declares-coronavirus-national-emergency","Donald Trump Speech Transcript: Declares Coronavirus National Emergency","51:17"
"Donald Trump","Well, I’ll tell you. First of all, I’m not coming back from someplace.","https://www.rev.com/blog/transcripts/donald-trump-speech-transcript-declares-coronavirus-national-emergency","Donald Trump Speech Transcript: Declares Coronavirus National Emergency","51:46"
"Jeff","But you were exposed.","https://www.rev.com/blog/transcripts/donald-trump-speech-transcript-declares-coronavirus-national-emergency","Donald Trump Speech Transcript: Declares Coronavirus National Emergency","51:49"
"Donald Trump","There was somebody that they say has it. I have no idea who he is, but I take pictures and it lasts for literally seconds. I don’t know the gentleman that we’re talking about. I have no idea who he is. I haven’t seen the picture. It’s said there’s a picture of somebody, but I take sometimes hundreds of pictures a day, and that night I was taking hundreds of pictures, so I just don’t know. Now, I did sit with the President for probably two hours, but he’s tested negative, so that’s good.","https://www.rev.com/blog/transcripts/donald-trump-speech-transcript-declares-coronavirus-national-emergency","Donald Trump Speech Transcript: Declares Coronavirus National Emergency","51:50"
"Jeff","It’s just a matter of-","https://www.rev.com/blog/transcripts/donald-trump-speech-transcript-declares-coronavirus-national-emergency","Donald Trump Speech Transcript: Declares Coronavirus National Emergency","52:15"
"Donald Trump","Please, go. Go ahead, please.","https://www.rev.com/blog/transcripts/donald-trump-speech-transcript-declares-coronavirus-national-emergency","Donald Trump Speech Transcript: Declares Coronavirus National Emergency","52:16"
"Donald Trump","I would say if you stay home, it’s not bad. It’s not bad. Now, there are certain parts of the country that essentially have zero problem. Washington’s been very tough, in particular, nursing home, but the state of Washington’s been very tough. When you talk about the 40 deaths, that’s been a big percentage of the deaths, as you know very well, and they all came from a certain area, unfortunately.","https://www.rev.com/blog/transcripts/donald-trump-speech-transcript-declares-coronavirus-national-emergency","Donald Trump Speech Transcript: Declares Coronavirus National Emergency","52:21"
"Donald Trump","Please, go ahead. Go ahead. Okay.","https://www.rev.com/blog/transcripts/donald-trump-speech-transcript-declares-coronavirus-national-emergency","Donald Trump Speech Transcript: Declares Coronavirus National Emergency","52:50"
"Cordelia L.","Thank you very much, Mr. President. Cordelia Lynch, Sky News. You talk this week about the UK doing a good job in tackling Coronavirus. In light of the rise in cases, are you changing your mind about that? You also just spoke about possible travel restrictions. Have you discussed when they might be put in place?","https://www.rev.com/blog/transcripts/donald-trump-speech-transcript-declares-coronavirus-national-emergency","Donald Trump Speech Transcript: Declares Coronavirus National Emergency","52:55"
"Donald Trump","As we discussed before, in light of the results, we’re going to be looking at it and I know the task force is looking at it very strongly. Vice President, everybody. It was looking good, but the results have been building up pretty rapidly, so we’ll be taking another look at that. Yes, absolutely.","https://www.rev.com/blog/transcripts/donald-trump-speech-transcript-declares-coronavirus-national-emergency","Donald Trump Speech Transcript: Declares Coronavirus National Emergency","53:14"
"Donald Trump","Go ahead, please.","https://www.rev.com/blog/transcripts/donald-trump-speech-transcript-declares-coronavirus-national-emergency","Donald Trump Speech Transcript: Declares Coronavirus National Emergency","53:33"
"Speaker 9","Mr. President, thank you. I want to first follow up on Jeff’s question, because the person you were standing next to, whether you know who he is or not, tested positive for Coronavirus. Dr. Fauci said this morning, if you stand next to somebody who tested positive, you should self-isolate and get a test. You say your White House doctor is telling you something different. Who should Americans listen to? My second question is-","https://www.rev.com/blog/transcripts/donald-trump-speech-transcript-declares-coronavirus-national-emergency","Donald Trump Speech Transcript: Declares Coronavirus National Emergency","53:36"
"Donald Trump","I think they have to listen to their doctors, and I think they shouldn’t be jumping to get the tests unless it’s necessary, but I think they have to listen to their doctors. I haven’t seen the picture. Somebody said there’s a picture of somebody taking a picture with me, but I haven’t seen it, but I can tell you-","https://www.rev.com/blog/transcripts/donald-trump-speech-transcript-declares-coronavirus-national-emergency","Donald Trump Speech Transcript: Declares Coronavirus National Emergency","54:01"
"Speaker 9","Doctors have said you might have it even if you don’t have symptoms. Are you being selfish by not getting tested and potentially exposing-","https://www.rev.com/blog/transcripts/donald-trump-speech-transcript-declares-coronavirus-national-emergency","Donald Trump Speech Transcript: Declares Coronavirus National Emergency","54:15"
"Donald Trump","I didn’t say I wasn’t going to be tested.","https://www.rev.com/blog/transcripts/donald-trump-speech-transcript-declares-coronavirus-national-emergency","Donald Trump Speech Transcript: Declares Coronavirus National Emergency","54:21"
"Speaker 9","Are you going to be?","https://www.rev.com/blog/transcripts/donald-trump-speech-transcript-declares-coronavirus-national-emergency","Donald Trump Speech Transcript: Declares Coronavirus National Emergency","54:23"
"Donald Trump","Most likely, yeah. Most likely.","https://www.rev.com/blog/transcripts/donald-trump-speech-transcript-declares-coronavirus-national-emergency","Donald Trump Speech Transcript: Declares Coronavirus National Emergency","54:24"
"Speaker 9","When do think that’ll happen?","https://www.rev.com/blog/transcripts/donald-trump-speech-transcript-declares-coronavirus-national-emergency","Donald Trump Speech Transcript: Declares Coronavirus National Emergency","54:26"
"Donald Trump","Not for that reason, but because I think I will do it anyway.","https://www.rev.com/blog/transcripts/donald-trump-speech-transcript-declares-coronavirus-national-emergency","Donald Trump Speech Transcript: Declares Coronavirus National Emergency","54:26"
"Speaker 9","Will you let us know the results?","https://www.rev.com/blog/transcripts/donald-trump-speech-transcript-declares-coronavirus-national-emergency","Donald Trump Speech Transcript: Declares Coronavirus National Emergency","54:30"
"Donald Trump","Fairly soon. We’re working on that. We’re working out a schedule.","https://www.rev.com/blog/transcripts/donald-trump-speech-transcript-declares-coronavirus-national-emergency","Donald Trump Speech Transcript: Declares Coronavirus National Emergency","54:30"
"Speaker 9","My second question, Mr. President. That was a follow-up.","https://www.rev.com/blog/transcripts/donald-trump-speech-transcript-declares-coronavirus-national-emergency","Donald Trump Speech Transcript: Declares Coronavirus National Emergency","54:33"
"Donald Trump","You, go ahead please. Go ahead. Yeah.","https://www.rev.com/blog/transcripts/donald-trump-speech-transcript-declares-coronavirus-national-emergency","Donald Trump Speech Transcript: Declares Coronavirus National Emergency","54:35"
"Speaker 10","I know there’s been a lot of talk about testing. I just want to make sure we’re clear though, because we’ve been hearing from doctors who say, as of today, they still can’t get patients tested who need a test. As of today, can everyone who a doctor wants to have tested get tested? If not, when? When will doctors-","https://www.rev.com/blog/transcripts/donald-trump-speech-transcript-declares-coronavirus-national-emergency","Donald Trump Speech Transcript: Declares Coronavirus National Emergency","54:42"
"Donald Trump","That’s been true for a while, but I’ll let Mike … Why don’t you answer that, Mike?","https://www.rev.com/blog/transcripts/donald-trump-speech-transcript-declares-coronavirus-national-emergency","Donald Trump Speech Transcript: Declares Coronavirus National Emergency","55:01"
"Mike Pence","As the President said, and Dr. Fauci has articulated, the nature of our current system where the CDC has samples sent and tests are performed or state labs perform tests, or in some cases, university and hospital labs perform tests, is generally adequate for an infectious disease or for people getting diagnostic work done, but given the sheer scale of this, the President tasked us with bringing together this extraordinary public and private partnership. Today, by some estimates, when you add all the labs together, and today the President made it possible for every state in the country and their state labs to authorize labs across their state to do Coronavirus testing.","https://www.rev.com/blog/transcripts/donald-trump-speech-transcript-declares-coronavirus-national-emergency","Donald Trump Speech Transcript: Declares Coronavirus National Emergency","55:08"
"Mike Pence","We’re estimating somewhere between 15 and 20,000 tests a day are able to be performed, but very soon with the program that was announced today, Americans will be able to visit one of the sites closest to them, as described on the website, if they’re symptomatic, if the questionnaire indicates it, be able to have a test there, and these incredible companies will process the test and they’ll receive that information. For now, the best advice that we can give for people is to speak to their doctor, as the President just said. If the doctor indicates, that physician, if it’s not a university hospital or an otherwise authorized lab, can contact the state lab.","https://www.rev.com/blog/transcripts/donald-trump-speech-transcript-declares-coronavirus-national-emergency","Donald Trump Speech Transcript: Declares Coronavirus National Emergency","55:56"
"Mike Pence","Again, every state lab in the country can perform tests today, but what the President charged us with when I was tasked to take over the White House Coronavirus task force was open up tests all across the country. The President said a few days ago that we made it clear that any American that wanted to get a test would be able clinically to get a test. I literally heard from the Governor of Washington state who said the doctors in Washington state were saying that if you were only mildly symptomatic, they would not order a test. Fortunately, the President directed CDC to clarify that. Now anyone in consultation with their physician, regardless of their symptoms, can request a test, and their doctors will contact those agencies, those labs in their state, but very soon, Americans will be able to go to these drive-in sites and be able to obtain and participate in a test.","https://www.rev.com/blog/transcripts/donald-trump-speech-transcript-declares-coronavirus-national-emergency","Donald Trump Speech Transcript: Declares Coronavirus National Emergency","56:44"
"Mike Pence","Dr. Burks, is there more to amplify that?","https://www.rev.com/blog/transcripts/donald-trump-speech-transcript-declares-coronavirus-national-emergency","Donald Trump Speech Transcript: Declares Coronavirus National Emergency","57:40"
"Deborah Birx","No, I think that’s perfectly said. Just to review one more time about the testing, with Lab Corp and Quest, I think many of you have been to doctor’s office and seen the little boxes outside. What they do is they deliver both the specimen collection piece, because remember it’s a nasal swab, it’s not a tube of blood, so they’ve delivered that to doctor’s offices and hospitals, and then they will arrange to pick that up. The important piece in this all is they’ve gone from a machine that may have a lower throughput to the potential to have automated extraction. I know you don’t want all these details, but it’s really key for the laboratory people. It’s an automated extraction of the RNA that then runs in an automated way on the machine with no one touching it, and the result comes out at the other end. Sample to machine to results. That cuts out a lot of the manual pieces that were happening that were delaying the test results.","https://www.rev.com/blog/transcripts/donald-trump-speech-transcript-declares-coronavirus-national-emergency","Donald Trump Speech Transcript: Declares Coronavirus National Emergency","57:42"
"Speaker 10","So with that, what’s the timeline like from when you’re tested to when you get results? Like next week, what should people expect?","https://www.rev.com/blog/transcripts/donald-trump-speech-transcript-declares-coronavirus-national-emergency","Donald Trump Speech Transcript: Declares Coronavirus National Emergency","58:41"
"Deborah Birx","With the prior testing, it was taking several days because the test is slower. We believe with this test, because of its throughput, that the testing can be from start, remember it has to transport, to the laboratory that will run it, and then we’re hoping that all can be finished within 24 hours, which is very similar to other tests that you receive today. These are not point-of-care tests. We are working on point-of-care tests, but we have to realize point-of-care tests take six months or more to develop, so we’re not waiting for those. We’re still diagnosing this on nucleic acid, so it is an antibody. This is actually the antigen, the actual virus in your nose that we’re amplifying.","https://www.rev.com/blog/transcripts/donald-trump-speech-transcript-declares-coronavirus-national-emergency","Donald Trump Speech Transcript: Declares Coronavirus National Emergency","58:47"
"Donald Trump","I think you have to remember though, we’re working very closely with states and to those you have a smaller form and more targeted form of government going in and doing it, like in New York where the relationship is very good. Like Gavin Newsom, where he made some very complimentary … that’s California. He made some really complementary comments the other day about how we’re working together. We worked on the ship together, but we worked on a lot of other things together having to do with this, and really, the relationship that we have, I can’t think of a bad relationship. We’re helping them, we’re funding them, in some cases, depending on what it is you’re talking about, and we’re all working together very closely. So we’ve done really, I think, a tremendous job of teamwork with the different states.","https://www.rev.com/blog/transcripts/donald-trump-speech-transcript-declares-coronavirus-national-emergency","Donald Trump Speech Transcript: Declares Coronavirus National Emergency","59:34"
"Donald Trump","All right, one or two more, and if you have questions for these folks … Does anybody have a question for the folks up here? Who has a question up here? You have? Okay, go ahead. If you have a question, go ahead.","https://www.rev.com/blog/transcripts/donald-trump-speech-transcript-declares-coronavirus-national-emergency","Donald Trump Speech Transcript: Declares Coronavirus National Emergency","01:00:22"
"Speaker 11","Thank you. I have one for you as well.","https://www.rev.com/blog/transcripts/donald-trump-speech-transcript-declares-coronavirus-national-emergency","Donald Trump Speech Transcript: Declares Coronavirus National Emergency","01:00:35"
"Donald Trump","I thought. I knew you would.","https://www.rev.com/blog/transcripts/donald-trump-speech-transcript-declares-coronavirus-national-emergency","Donald Trump Speech Transcript: Declares Coronavirus National Emergency","01:00:36"
"Speaker 11","I do have one for them because I haven’t heard this yet.","https://www.rev.com/blog/transcripts/donald-trump-speech-transcript-declares-coronavirus-national-emergency","Donald Trump Speech Transcript: Declares Coronavirus National Emergency","01:00:37"
"Donald Trump","I was waiting for that. Go ahead.","https://www.rev.com/blog/transcripts/donald-trump-speech-transcript-declares-coronavirus-national-emergency","Donald Trump Speech Transcript: Declares Coronavirus National Emergency","01:00:42"
"Speaker 11","Because I haven’t heard this yet.","https://www.rev.com/blog/transcripts/donald-trump-speech-transcript-declares-coronavirus-national-emergency","Donald Trump Speech Transcript: Declares Coronavirus National Emergency","01:00:42"
"Donald Trump","Ask them first please.","https://www.rev.com/blog/transcripts/donald-trump-speech-transcript-declares-coronavirus-national-emergency","Donald Trump Speech Transcript: Declares Coronavirus National Emergency","01:00:42"
"Speaker 11","Yes, I will. Okay, with regards to the CEOs, can you please tell us when you expect to see items like hand sanitizer, that have been going out of stock very quickly, back on the shelves? There have been a lot of reports about that, and for you, Mr. President, could you talk about a potential bailout for the cruise industry? You had suggested that could happen. Is that something you’re still looking at, and how much would that be?","https://www.rev.com/blog/transcripts/donald-trump-speech-transcript-declares-coronavirus-national-emergency","Donald Trump Speech Transcript: Declares Coronavirus National Emergency","01:00:43"
