"speaker","transcription","url","headlin","timing"
"Donald Trump","Not only did we push the FDA far beyond what the bureaucrats wanted to do. We also put up billions and billions of dollars, 10 billion to produce the vaccines before we knew they were going to work. It was called a calculated bet or a calculated risk. We took a risk because if we didn’t do that, you still wouldn’t have the vaccines. You wouldn’t have them for a long time. So think of that, we took this bet. We made a bet because we thought we were on a certain track, but you’d be starting to make them right now. It’d be a long time before you ever saw. It takes 60 to 100 days to manufacture and inspect new doses. And that means that 100% of the increased availability that we have now was initiated by our administration. 100%. In fact, the director of National Institutes of Health, Francis Collins, he’s Fauci’s boss, actually, I think he’s a Democrat too, by the way, recently said that our operation warp speed was absolutely breathtaking and that the Trump administration deserves full credit, which we do. And as conservatives and Republicans, never forget that we did it. Never let them take the credit because they don’t deserve the credit. They just followed now, they’re following our plan, but this has been something that they really call, they call it an absolute miracle. Joe Biden is only implementing the plan that we put in place. And if we had an honest media, which we don’t, they would say it loud and clear. By the time I left that magnificent house at 1600 Pennsylvania Avenue, almost 20 million Americans had already been vaccinated. 1.5 million doses were administered on my final day alone. 1.5 million in a day. Yet Biden said just a few days ago that when he got here, meaning The White House, there was no vaccine. He said, there’s no vaccine. Oh, good. Say it again, Joe. Now I don’t think he said that, frankly, in a malicious way. I really don’t. I actually believe he said that because he didn’t really know what the hell was happening.","https://www.rev.com/blog/transcripts/donald-trump-cpac-2021-speech-transcript","Donald Trump CPAC 2021 Speech Transcript","26:38"
"Donald Trump","Never let them forget. This was us. We did this. And the distribution is moving along, according to our plan. And it’s moving along really well. We had the military, what they’ve done, our generals and all of the people, what they’ve done is incredible. But remember, we took care of a lot of people, including, I guess on December 21st, we took care of Joe Biden. Cause he got his shot. He got his vaccine. He forgot. It shows you how un-painful all that vaccine shot is. So everybody go get your shot. He forgot so it wasn’t very traumatic obviously, but he got his shot and it’s good that he got his shot. Last year, I predicted to you that the extremism, corruption and incompetence of the Biden administration would be literally unprecedented in American history. Unfortunately he has proven me 100% right. Already as president, Biden has urged Congress to pass legislation shredding your Second Amendment. Your Second Amendment is in far bigger trouble than you now, and for four years I fought like hell to save your Second Amendment. And we saved it 100%.","https://www.rev.com/blog/transcripts/donald-trump-cpac-2021-speech-transcript","Donald Trump CPAC 2021 Speech Transcript","29:28"
"Donald Trump","We saved it. He signed an order to conduct politically correct far left indoctrination trainings in every department of the federal government, including the US military after I had terminated these horrible things that were being preached to our military and he wants it to go forward. It’s insane within his first few hours Biden eliminated our national security travel bands on nations plagued by terrorism. His first priority was to open our borders to un-vetted travelers from Libya, Yemen, Syria, Somalia, and many other countries where strict vetting cannot occur. Countries that have tremendous problems. Countries with tremendous terrorism problems. We did it a travel ban. It was a real achievement.","https://www.rev.com/blog/transcripts/donald-trump-cpac-2021-speech-transcript","Donald Trump CPAC 2021 Speech Transcript","30:49"
"Donald Trump","We told those countries, sorry, straighten out your act. We don’t want people coming in where they had an ideology or a problem. We just couldn’t have it. And it was incredible, how it worked was incredible. And he terminated it. We had to get it approved. It went all the way up to the Supreme Court of the United States. We got it approved and he terminates it. In addition, he’s already increased refugee admissions by nearly 10 times, but in effect, it’ll soon be hundreds of times as millions of people flow up through our soon to be open borders. And by the way, the border patrol and ICE, these are some of the great heroes of our country. These are incredible people. I got to know them very well.","https://www.rev.com/blog/transcripts/donald-trump-cpac-2021-speech-transcript","Donald Trump CPAC 2021 Speech Transcript","31:43"
"Donald Trump","Your families still cannot go out to eat at local restaurants. But Joe Biden is bringing in thousands upon thousands of refugees from all over the world. People that nobody knows anything about, we don’t have crime records. We don’t have health records. What are they bringing in with them? When I left office, we had virtually ended the endless wars, these endless wars, they go on forever. They go on forever. I would go to Dover and I would see caskets, coffins coming in. I’d see the parents and the wives and husbands. I would see the kids. Endless wars, 19 years in Afghanistan. We have it down to almost nothing left and I hear they might want to go back in. Iraq, remember I used to say, don’t go in, but if you’re going to go in, keep the oil, well, we went in and we didn’t keep the oil. We had made historic peace deals in the middle East. Like nobody thought were even possible with not a drop of bloodshed.","https://www.rev.com/blog/transcripts/donald-trump-cpac-2021-speech-transcript","Donald Trump CPAC 2021 Speech Transcript","32:29"
"Donald Trump","And by the way, not one American soldier has been killed in Afghanistan in over a year. Think of that. Not one. Those troops have largely come home. At the same time, the new administration unilaterally withdrew our crippling sanctions on Iran, foolishly giving away all of America’s leveraged before negotiations have even begun. Leave the sanctions negotiated. Does anybody understand what I’m saying here? Are there any good business people? You don’t have to be a good, are there any bad business people? They took off the sanctions. They took off the sanctions.","https://www.rev.com/blog/transcripts/donald-trump-cpac-2021-speech-transcript","Donald Trump CPAC 2021 Speech Transcript","33:40"
"Donald Trump","They say, well, we’re going to not have any sanctions. Let’s negotiate a deal. I don’t know, Matt Schlep. I don’t think you would have done that, do you think so, Matt? I don’t think so. Mercedes wouldn’t have. Now you do that, you make a deal and then you do what they want it. I will tell you something and I said it, had we had a fair election, the results would have been much different and we would have had a deal with Iran within the first week. They wanted those sanctions off. He took them off for nothing, for nothing. Now you watch how tough they negotiate. In another horrendous surrender he agreed to get back into the World Health Organization.","https://www.rev.com/blog/transcripts/donald-trump-cpac-2021-speech-transcript","Donald Trump CPAC 2021 Speech Transcript","34:35"
"Donald Trump","For approximately $500 million a year, which is what we were paying. When I withdrew from the WHO and you know the whole story with that, they called it badly. They really are puppets for China. They called and they wanted us to stay in. I said, how much are we paying approximately $500 million? How much is China paying a much larger in terms of population country, sir, they’re paying $39 million. I say, why are we paying 500 million and they’re paying 39? I could tell you why. Because the people that made the deal are stupid, that’s why.","https://www.rev.com/blog/transcripts/donald-trump-cpac-2021-speech-transcript","Donald Trump CPAC 2021 Speech Transcript","35:24"
"Donald Trump","And I had no idea how popular it was. I didn’t even know if I would be able to politically, because people were so happy when I did get out, but I said, so if we went in, we could get it for 39 million, which is what China, not 500 million, which is what we were stupidly paying. And they said, we can make a deal, we want you to go in, we can make a deal. Okay, and I decided not to do it, but we could have had it for 39. We could have had it for the same as China. And they decide now to go back into the World Health Organization and pay 500 million, what the hell is wrong with them? No, no, this is just emblematic.","https://www.rev.com/blog/transcripts/donald-trump-cpac-2021-speech-transcript","Donald Trump CPAC 2021 Speech Transcript","36:00"
"Donald Trump","It’s a tremendous amount of money, but compared to trillions, it’s not, but it’s a tremendous amount of money. Why would China pay 39 million? And we’re paying almost 500 million. Why? So we could have made the same deal that China had 39 million. And they just say, we’re going back in. We’re going back into the World Health Organization. They go back in, they pay 500. It is so sad, just like the Iran and the World Health Organization, Joe Biden put the United States back into the very unfair and very costly Paris Climate Accord without negotiating a better deal.","https://www.rev.com/blog/transcripts/donald-trump-cpac-2021-speech-transcript","Donald Trump CPAC 2021 Speech Transcript","36:46"
"Donald Trump","They wanted us so badly back in. I’ll tell you they wanted us. I was getting called from all of the countries. You must come back into the Paris Accord. I said, tell me why, give me one good reason. First of all, China doesn’t kick in for 10 years, Russia goes by an old standard, which was not a clean standard and other countries, but we get hit right from the beginning would have cost us hundreds of thousands and millions of jobs. It was a disaster, but they go back in, I could have made an unbelievable deal and gone back in, but I didn’t want to do that. Surrendering millions of jobs and trillions of dollars to all of these other countries, almost all of them that were in the deal. So they have favorable treatment, we don’t have favorable treatment. And we just said, we’re going back in. To go back in, they wanted us so badly, you could’ve negotiated, if you wanted to go back in which frankly, we have the cleanest air, the cleanest water and everything else that we’ve ever had. So I don’t know why we have to.","https://www.rev.com/blog/transcripts/donald-trump-cpac-2021-speech-transcript","Donald Trump CPAC 2021 Speech Transcript","37:24"
"Donald Trump","What good does it do when we’re clean, but China is not and Russia is not an India is not. So they are pouring fumes, you know the world is actually a small piece of the universe, right? They’re pouring fumes and we’re trying to protect everything and building products for three times more than is necessary. No, they could have made a great deal. If they were going to go back in, that’s fine. But they could have made a great deal and said, instead of just saying we’re back in. These people. And in one of his first official acts, which was incredible, because again, he talked about energy. He never said he was going to do this. He canceled the Keystone XL Pipeline destroying not the 8,000 or the 9,000 or the 11,000 jobs that you hear.","https://www.rev.com/blog/transcripts/donald-trump-cpac-2021-speech-transcript","Donald Trump CPAC 2021 Speech Transcript","38:23"
"Donald Trump","But 42,000 great paying jobs on just about day one, right? He never talked about that during a debate because he wouldn’t have gotten away with it. Well, he would have, because they cheated so much, it probably wouldn’t have been. No, but that was not a topic of conversation. Remember fracking, you can frack. Oh, we love fracking. During the primary no fracking. As soon as he got through that, he said, no, of course everybody can frack. No fracking. You wait till you see what happens with your gasoline. Wait till you see what happens and we cannot let this stuff continue to go on. One of my proudest accomplishments as president was to make America energy independent, the United States became the number one energy superpower on Earth. Number one.","https://www.rev.com/blog/transcripts/donald-trump-cpac-2021-speech-transcript","Donald Trump CPAC 2021 Speech Transcript","39:11"
"Donald Trump","Became number one. Bigger than Saudi Arabia, bigger than Russia by a lot. We left them all in the dust. They were all in the dust. But if the Democrats have their way, we are heading from energy dominance to energy disaster. That’s what’s happening. You have to see what’s going on. Everything’s being closed up. It’s a disaster. The blackouts we saw in California last summer and all the time and the windmill calamity that we’re witnessing in Texas. Great state of Texas. We love Texas, but it’s so sad when you look at it, that’ll just be the start. How bad is wind power. So I talk about it all the time at CPAC, right? We went to CPAC. Remember last I said, we’re going to watch the president, well, Alice, the wind isn’t blowing. I don’t believe we’ll have any electricity. I remember we would kid, but I wasn’t actually kidding.","https://www.rev.com/blog/transcripts/donald-trump-cpac-2021-speech-transcript","Donald Trump CPAC 2021 Speech Transcript","40:09"
"Donald Trump","It’s such an expensive form of energy. It’s so bad for the environment. It kills the birds. It destroys the landscapes. And remember, these are structural columns with fans on them. They wear out, and when they wear out all over the country, you see them, nobody takes them down. They’re rotting. They’re rusting, how this is environmentally good for our country. And it costs many, many times more than natural gas, which is clean and can fuel our great factories. Wind can’t do that. And solar, I love solar, but it doesn’t have the capacity to do what we have to do to make America great again, sorry it just doesn’t have it. Under the radical Democrat policies, the price of gasoline has already surged 30% since the election. And we’ll go to $5, $6, $7 and even higher.","https://www.rev.com/blog/transcripts/donald-trump-cpac-2021-speech-transcript","Donald Trump CPAC 2021 Speech Transcript","41:03"
"Donald Trump","So enjoy that when you go to the pump and they’ll say that’d be about $200 to fill up your van. Remember they used to go to the little small vans. They got away from the big ones that everybody wanted. They went to the small ones. Well, you know what? Probably a good investment. As long as these guys have their say because you know, it’s a shame what’s happening. Energy prices are going to go through the roof. And that includes your electric bills. That includes any bill having to do with energy, our biggest cost. We will now be relying on Russia and the middle East for oil. And they talk about Russia, Russia, Russia. What’s better than what this guy has done for Russia. I had oil where they were actually paying you to take it. Okay. Remember they were going to give you 37 a barrel, but you had to take it away.","https://www.rev.com/blog/transcripts/donald-trump-cpac-2021-speech-transcript","Donald Trump CPAC 2021 Speech Transcript","42:01"
"Donald Trump","You had free oil almost for a period of time and one way I was proud of it, but we also had to save the energy industry and it worked out well. And I dealt with Russia and Saudi Arabia and they cut back on production and we got it back up. But now it’s going the opposite because now they are taking this incredible energy independence away from the people of our country. And you’re going to see costs go like you have never seen them go before. It’s a very sad and very stupid thing that they’re doing. The Biden policies are a massive win for other oil producing countries and a massive loss for the United States and our great citizens, Joe Biden and the Democrats are even pushing policies that would destroy women’s sports.","https://www.rev.com/blog/transcripts/donald-trump-cpac-2021-speech-transcript","Donald Trump CPAC 2021 Speech Transcript","42:47"
"Donald Trump","A lot of new records are being broken in women’s sports. Hate to say that ladies, but got a lot of new records, they’re being shattered. For years, the weightlifting, every ounce is like a big deal for many years. All of a sudden somebody comes along and beats it by a hundred pounds. Boom. Now young girls and women are in sets that they are now being forced to compete against those who are biological males. It’s not good for women. It’s not good for women’s sports, which worked so long and so hard to get to where they are. The records that stood for years, even decades are now being smashed with these. Smashed. If this is not change women’s sports, as we know it will die. They’ll end, it’ll end.","https://www.rev.com/blog/transcripts/donald-trump-cpac-2021-speech-transcript","Donald Trump CPAC 2021 Speech Transcript","43:28"
"Donald Trump","What coach, if I’m a coach, I want to be a great coach. What coach, as an example, wants to recruit a young woman to compete, if her record can easily be broken by somebody who was born a man. Not too many of those coaches around, right? If they are around, they won’t be around long because they’re going to have a big problem when that record is we’re oh and 16, but we’re getting better. No I think it’s crazy. I think it’s just crazy what’s happening. We must protect the integrity of women’s sports so important after. And I don’t even know, is that controversial? Somebody said, well, that’s going to be very controversial. I said, that’s okay. You haven’t heard anything yet.","https://www.rev.com/blog/transcripts/donald-trump-cpac-2021-speech-transcript","Donald Trump CPAC 2021 Speech Transcript","44:23"
"Donald Trump","As you can see, the early weeks of the Biden administration have nothing less than, they’ve been a catastrophe for American workers and for American families, the task of our mission. And for us, it’s our movement. As I said, a movement like has never been seen, I think we could probably say, never been seen anywhere in the world. And nobody’s ever seen a movement like this. I’d grow up and I’d watch somebody who came in second in New Hampshire or first in Iowa and that was the end. And they became famous for the rest of their lives. We won the election twice. I mean, think about it, twice. The task for our movement and our party is to stand up to this destructive agenda with confidence and with result, the future of the Republican party is as a party that defends the social economic and cultural interests and values of working American families of every race, color, and creed. That’s why the party is growing so rapidly and is becoming a different party. And it’s becoming a party of love. You have to see outside the streets. I mean, there’s such love. The flags. Amazing. That’s right now, it’s a party that’s incredible. The people, the spirit, and there are, as you probably heard a little while ago, I mean, there’s more spirit now than there’s ever been, including even before the election, more spirit now than we’ve ever seen, because people are seeing how bad it can be. And again, I want to thank Rush and Catherine, because what he did to get the word out has been incredible. Some people are irreplaceable as Sean Hannity would say and he said Rush is irreplaceable, but his spirit lives on. And that’s something that we need and we love. Republicans believe that the needs of every citizen must come first. In fact, America must come first. We don’t put it first.","https://www.rev.com/blog/transcripts/donald-trump-cpac-2021-speech-transcript","Donald Trump CPAC 2021 Speech Transcript","45:31"
"Donald Trump","America must come first. We don’t put it first. They don’t put it first. Over the past four years my administration delivered for Americans of all backgrounds like never before, like never before. We built the strongest economy in the history of the world, raised wages and achieved the lowest African-American, Hispanic-American, Asian-American unemployment rates ever, ever, ever recorded. It was so great for everybody of all backgrounds that even after the China virus, we are leading the world. Nobody’s even close. We’re leading it in the comeback. Our economic comeback has been incredible. That’s because the financial and economic foundation we built was so strong, that unlike other countries who are having a hard time, we didn’t break. We came roaring back, and now our stock market and your 401(k)s are again at record levels, higher than ever before, actually.","https://www.rev.com/blog/transcripts/donald-trump-cpac-2021-speech-transcript","Donald Trump CPAC 2021 Speech Transcript","48:03"
"Donald Trump","Many people have asked, “What is Trumpism?” A new term being used more and more. I’m hearing that term more and more. I didn’t come up with it. But what it means is great deals, great trade deals. Great ones, not deals where we give away everything, our jobs, our money, like the USMCA replacement of the horrible NAFTA. NAFTA was one of the worst deals ever made, probably the worst trade deal ever made, and we ended it. A lot of people forget, we ended it.","https://www.rev.com/blog/transcripts/donald-trump-cpac-2021-speech-transcript","Donald Trump CPAC 2021 Speech Transcript","49:05"
"Donald Trump","Now we have the USMCA-Mexico-Canada. It’s incredible what it’s done for our farmers, who are doing fantastically. Did you see grain prices and grain sales are at an all-time high? Wheat, all-time high. So many elements of farms and farmers, and they love me. Remember, it’s going to be very close in Iowa. Well, it wasn’t close. We won in a landslide, Iowa, because our farmers know, and they put up with it, and we did a lot of work with the tariffs and all these things that we had to do to get it. Now the farmers are doing great, but they’re setting records.","https://www.rev.com/blog/transcripts/donald-trump-cpac-2021-speech-transcript","Donald Trump CPAC 2021 Speech Transcript","49:33"
"Donald Trump","It means low taxes and eliminating job-killing regulations, Trumpism. It means strong borders, but people coming into our country based on a system of merit. They come in and they can help us, as opposed to coming here and not being good for us, including criminals, of which there are many. It means no riots in the streets. It means law enforcement. It means very strong protection for the Second Amendment and the right to keep and bear arms. It means support for the forgotten men and women who have been taken advantage of for so many years. They were doing great. They were doing great before that horrible thing from China came in and hit us, and now they’re starting to do really well again.","https://www.rev.com/blog/transcripts/donald-trump-cpac-2021-speech-transcript","Donald Trump CPAC 2021 Speech Transcript","50:08"
"Donald Trump","If you think about it, we built the economy twice. We built it then, and then like every other country in the world, it went down, and then we built it again. Now it’s higher in many ways, certainly in the stock market, it’s higher in many ways than it was before. That’s because of the foundation, and no country comes even close to competing with our comeback. It means a strong military and taking care of our vets, but a strong military, which we have totally rebuilt. We have rebuilt it. Our military has never been stronger than it is today. It was tired. It was depleted. It was obsolete. Now we have the best brand-new equipment ever made, and it was all produced right here in the USA. Isn’t that nice? We take care of our vets. We had a poll recently just before leaving office. The vets had a 91% approval rating for the way we took care of them. That’s the highest number in the history of the polls, the vet polls.","https://www.rev.com/blog/transcripts/donald-trump-cpac-2021-speech-transcript","Donald Trump CPAC 2021 Speech Transcript","51:06"
"Donald Trump","On top of all of that, we have even created the Space Force, the first new branch of the United States military in nearly 75 years. The mission of the Democrat party is to promote socialism. They want to promote socialism, ultimately leading, unfortunately, to communism, and that will happen. If you look at Venezuela, you look at some of these countries, that’s why some of our biggest supporters are from South America, Latin America, because they’ve seen what goes on with all of this cancel culture, and you can’t speak, and let’s cut them off and let’s not give them words. The mission of our movement and of the Republican party must be to create a future of good jobs, strong families, safe communities, a vibrant culture, and a great nation for all Americans, and that’s what we’re creating.","https://www.rev.com/blog/transcripts/donald-trump-cpac-2021-speech-transcript","Donald Trump CPAC 2021 Speech Transcript","52:16"
