"speaker","transcription","url","headlin","timing"
"Donald Trump","Early on, we took aggressive action. We saved so many lives. Remember it was supposed to be 2.2 million. Under a scenario, it could have been more than. I took rapid action to ban travel from China and from Europe, heavily infected areas. And by the way, the scientists said, “Oh, don’t do it.” Two months later, they were saying, “Lucky he did do it.” Biden opposed both of these life saving decisions. You remember he said, “He’s xenophobic.” I said, “Joe, Joe, what does it mean, Joe?” He goes, “He doesn’t know.” Only in Pennsylvania. He goes, “He doesn’t know”.” Well, you’re right about that.","https://www.rev.com/blog/transcripts/donald-trump-erie-pa-rally-transcript-october-20","Donald Trump Erie, PA Rally Transcript October 20","30:26"
"Donald Trump","We pioneered incredible therapies. Excuse me, here I am. That was quick. That was quick. No, great doctors. We have great doctors and reduced the fatality rate 85%. Think of that. And I’m working to make the antibody treatment that I received available to anybody that needs it free. And it’s getting very close to getting approved. We will have 100 million vaccine doses before the end of the year, maybe sooner than that, maybe substantially before the Biden lockdown. He’s willing to lock you down. You guys aren’t even open yet. What the hell is going on with your state? You know, Florida is open. Florida had a surge. Great governor, surge, went down. Arizona had a surge, went down, great governor. Texas had a surge, went down. You guys never opened. What the hell is going on in Pennsylvania, right?","https://www.rev.com/blog/transcripts/donald-trump-erie-pa-rally-transcript-october-20","Donald Trump Erie, PA Rally Transcript October 20","31:07"
"Donald Trump","The Biden lockdown will crush America. We will crush the virus. We’re doing that. We’re crushing the virus. Look at our numbers compared to Europe. You know, they always said, “Oh Europe, Europe, Europe.” Look at our numbers compared, and we had the biggest of any country, the biggest comeback. We came back faster. We went down less, economically came back faster. If you want depression, doom and despair, vote for sleepy Joe Biden. And boredom.","https://www.rev.com/blog/transcripts/donald-trump-erie-pa-rally-transcript-october-20","Donald Trump Erie, PA Rally Transcript October 20","32:16"
"Donald Trump","You know the great thing. I always say, someday these people, look at all them. Look at all of those cameras. You know what I say, someday, they’re going to get smart. They’re going to endorse President Trump, because if you had sleepy Joe, nobody’s going to be interested in politics anymore. That’s going to be the end of that. They will all go out of business. They should have gone out of business four years ago. Then I came along.","https://www.rev.com/blog/transcripts/donald-trump-erie-pa-rally-transcript-october-20","Donald Trump Erie, PA Rally Transcript October 20","32:45"
"Donald Trump","If you want open schools, an open economy and a safe, healthy, thriving country. Vote for me. We’re going to do it. We’re doing it now. We’re doing it. Now we’re joined today by a few of my friends. I’ll tell you this one guy, he got it right from the beginning. That’s right. How did you know that? He’s a warrior. He’s tough as hell. He could have only been grown in Pennsylvania because he’s that kind of a guy. He said a long time ago when I knew him, it was a year before the election, and I said this is four years plus one. I said, “How do you think we’re going to do?” He said, “Sir, you’re going to win.” I said, “How the hell do you know that? I just started.” The escalator ride wasn’t too old. Right? The famous escalator with our First Lady. They love our First Lady. Wasn’t too old. We had just come down and a man named-","https://www.rev.com/blog/transcripts/donald-trump-erie-pa-rally-transcript-october-20","Donald Trump Erie, PA Rally Transcript October 20","33:09"
"Donald Trump","We had just come down and a man named Congressman Mike Kelly said, “Sir, you’re going to win in a landslide.” Come up here, Mike. Come up. Come on. I don’t know. Get up. He said, “I can’t do it again.” They’ll figure it out. Don’t hurt yourself though, Mike. Don’t prove everything, Mike. Hey, fellas, could you help the man? Just give him a hand. Take your time, Mike. Don’t hurt yourself. Can you imagine? He’s trying to climb over a barrier to show [inaudible 00:00:33]. We don’t want to hurt our Mike. Right from the beginning, he’s been with me.","https://www.rev.com/blog/transcripts/donald-trump-erie-pa-rally-transcript-october-20","Donald Trump Erie, PA Rally Transcript October 20","34:03"
"Donald Trump","Great guy. Come her, Mike. And also my Pennsylvania Campaign Chair, done a fantastic, really a fantastic job. Bernie Comfort. Bernie. Thank you. Great job. Great job. Are you okay? Don’t touch. Don’t touch me, Mike, we’ll get in trouble with the media. They’ll say, “They touched each other.” Do you ever see this? If he would have done that … I saved you, Mike. Maybe I saved your political career. They would have had front page story of our two hands touching. Mike, say a few words, please.","https://www.rev.com/blog/transcripts/donald-trump-erie-pa-rally-transcript-october-20","Donald Trump Erie, PA Rally Transcript October 20","34:43"
"Bernie Comfort","Thanks. [inaudible 00:01:15]. In our lifetimes, we will never see a president like Donald J. Trump again. I want every one of you to make a commitment to get out and vote November 3rd and absolutely refuse to lose. This is the president, this is the time, this is your solemn oath to America. We’re going to make America great again again because of Donald J. Trump. There’s no flu that’s going to keep this man down. He makes the Energizer Bunny look like a dead head. This guy never stops. He never sleeps. He is totally dedicated to each one of you and we should be totally dedicated to him. I love this president, I love his agenda, and I love the fact that on November 3rd, we’re going to put him back in the White House. Mr. President, thank you.","https://www.rev.com/blog/transcripts/donald-trump-erie-pa-rally-transcript-october-20","Donald Trump Erie, PA Rally Transcript October 20","35:14"
"Donald Trump","What a great guy. That was not a bad job?","https://www.rev.com/blog/transcripts/donald-trump-erie-pa-rally-transcript-october-20","Donald Trump Erie, PA Rally Transcript October 20","36:26"
"Crowd","Four more years. Four more years.","https://www.rev.com/blog/transcripts/donald-trump-erie-pa-rally-transcript-october-20","Donald Trump Erie, PA Rally Transcript October 20","36:39"
"Donald Trump","Not a bad job. He’s a great guy though, he really is. You’re lucky to have him. Good job. You know, he shows up without the jacket. I feel a little guilty, Mike, without … you’re not called Mike [inaudible 00:36:56], right? Don’t be too brave, we got to keep him around, right, Mike? Great job. I appreciate it.","https://www.rev.com/blog/transcripts/donald-trump-erie-pa-rally-transcript-october-20","Donald Trump Erie, PA Rally Transcript October 20","36:44"
"Donald Trump","Under my administration, we built the greatest economy in the history of the world, and now we’re doing it again. In my first three years, we increased family income over $6,000. Listen to this, more than five times, the gains in all eight years under the previous administration. Think of that. In just a short period of time. African-American unemployment, Hispanic-American, unemployment, and Asian-American unemployment all reached their lowest levels in the history of our country. Think of that.","https://www.rev.com/blog/transcripts/donald-trump-erie-pa-rally-transcript-october-20","Donald Trump Erie, PA Rally Transcript October 20","37:02"
"Donald Trump","We lifted nearly 7 million Americans out of poverty, a record. Including nearly 1.2 million African Americans, out a poverty since April, just since April, just now we created a record, never happened like this, 11. 4 million brand new American jobs. That’s never happened before.","https://www.rev.com/blog/transcripts/donald-trump-erie-pa-rally-transcript-october-20","Donald Trump Erie, PA Rally Transcript October 20","37:41"
"Donald Trump","And you know, you were hearing, it sounds terrible to me when I say it, but you were hearing about 38% unemployment, right? 38, you hearing 42%. So it was … yes, fake new. Hey, thank goodness. But you know what? It was two weeks ago, 7.8%. Now 7.8, well, we’re at 3.4 and 3.5, I don’t like to say 7.8, but when you think about it, they were saying, “We’re going to 42%.” You know, not our fault. We had this plague come in from China. We’re going to 42%, 38%. 7.8% and heading down rapidly. That’s pretty amazing when you think about it.","https://www.rev.com/blog/transcripts/donald-trump-erie-pa-rally-transcript-october-20","Donald Trump Erie, PA Rally Transcript October 20","38:08"
"Donald Trump","Under Biden, it took 30 months to recover more than half of the jobs lost in a crisis. We did it in less than five months. We’ve spent the last four years reversing the damage Joe Biden inflicted over the last 47 years. You saw what he’s done. You know, it’s amazing. He’s always like, it’s not him, he’s not being critical, but he has writers. They say, “Let’s do this, that.” You know, have all this up. Vice-President Biden said, he has no idea what he said, but you know what I get … he didn’t leave long ago. He was here for eight years as vice-president and 47 years plus as a politician in Washington. Think of it. And he’s always like, “Why didn’t you do this?” Why the hell didn’t he do it? Why didn’t he do it? 47 years, Joe, why didn’t you do it? He supported NAFTA, TPP, which would have destroyed your industry. And China’s entry into the World Trade Organization.","https://www.rev.com/blog/transcripts/donald-trump-erie-pa-rally-transcript-october-20","Donald Trump Erie, PA Rally Transcript October 20","38:52"
"Donald Trump","One cruel betrayal after another. It’s true. I mean, what he’s done. For decades or politicians spent trillions of dollars rebuilding foreign nations, fighting foreign wars, and defending foreign borders. Now we’re doing our borders. Do you like that better? But now we’re finally protecting our nation, rebuilding our cities, and we are bringing our jobs, our factories, and our troops, our beautiful, beloved trope, we’re bringing them all back home. It’s time. 19 years to save our auto industry. I withdrew from the last administration’s Transpacific Partnership. Pennsylvania gained, Michigan, auto factories, auto plants being built all over Michigan. Ohio. There wasn’t a plan built in 42 years. Now they’re being built all over the place. In Japan, I told the prime minister, you have to give us plants. You can’t just keep sending us cars. You got to make them over here. And they started and you’re a big beneficiary of it. To defend our steel, that aluminum workers, I imposed very historic tariffs on dumped steel, right? And US steel, all of your places started doing great.","https://www.rev.com/blog/transcripts/donald-trump-erie-pa-rally-transcript-october-20","Donald Trump Erie, PA Rally Transcript October 20","39:54"
"Donald Trump","I ended the NAFTA nightmare and signed the brand new USMCA, just kicked in. You know how I know it’s good? Because the other two countries aren’t so happy. It’s good. They took advantage of us for a long time. I took the toughest ever action to confront China’s rampant theft of American jobs. Nobody has ever done. And you know what? Nobody’s ever done anything like this to China. We’re taking in billions. Right now we’re taking in billions, billions and billions of dollars. It affects you a little bit. We gave $28 billion to our farmers because they were targeted by China. And that was just a small fraction of what I took in. Under my leadership we achieved the most secure border, Southern border in US history. So we’re building 10 miles. You know, the wall is going to be completed very soon. And we had radical opposition to the wall, radical opposition. We’ll be at 500 miles very soon and will be completed with the wall.","https://www.rev.com/blog/transcripts/donald-trump-erie-pa-rally-transcript-october-20","Donald Trump Erie, PA Rally Transcript October 20","41:14"
"Donald Trump","And by the way, Mexico, you know, they keep saying, Mexico is paying for the wall. They understand, that they’re paying for the wall. Mexico is paying for it and it’s very high just like I said it would be. And it actually goes down very deep. You know why? Two reasons actually, number one, to hold it up. Number two, to stop the tunnels. My opponent’s immigration plan is the most extreme proposal ever put forward by a presidential candidate. Biden would eliminate US borders. How about that? Do you like that idea?","https://www.rev.com/blog/transcripts/donald-trump-erie-pa-rally-transcript-october-20","Donald Trump Erie, PA Rally Transcript October 20","42:19"
"Crowd","No.","https://www.rev.com/blog/transcripts/donald-trump-erie-pa-rally-transcript-october-20","Donald Trump Erie, PA Rally Transcript October 20","42:52"
"Donald Trump","Okay. Just think of it from a … How the hell do you have a country if you don’t have borders? He would eliminate … and you know, that’s signed in the manifesto with Bernie Sanders. Crazy Bernie. Bernie, I’ll tell you what, he’s one of the greatest losers. And I mean that in a very nice way. Twice they took it away from him, right? Hillary took it away. And then Elizabeth Pocahontas Warren took it away. Because she stayed in on Super Tuesday. She took enough votes away, so he didn’t win any states.","https://www.rev.com/blog/transcripts/donald-trump-erie-pa-rally-transcript-october-20","Donald Trump Erie, PA Rally Transcript October 20","42:52"
"Donald Trump","And then he goes back to the Senate like nothing happened. This guy. I think he should be given … you know, in school, when I was a young guy in school, sportsmanship of the year. I never happened to receive that. I got other awards. I never got the best sportsmanship award. But Bernie Sanders should be given sportsman of the year. Sportsmanship, I guess, right? No, no. It’s amazing. This happened to him twice. Is Bernie running again in four more years? Bernie, are you running again? Crazy Bernie. But no, but they signed, they didn’t sign. I guess they have this deal, the manifesto, they agreed. Biden would eliminate and she’s more liberal than him. You know, she’s more liberal.","https://www.rev.com/blog/transcripts/donald-trump-erie-pa-rally-transcript-october-20","Donald Trump Erie, PA Rally Transcript October 20","43:22"
"Donald Trump","And there’s nobody that treated Biden worse than Kamala. That’s why I said, “Why would he ever pick her?” There’s nobody that treated him worse. Biden would eliminate US borders by implementing nationwide catch and release, which I ended. If it’s okay with you, you know what I did? You catch them, what do you do? They’re murderers, they’re rapists. You catch them and then you have to release them. This is called catch … this is a serious … this was a Democrat program headed up by crying Chuck Schumer. He’s the one. You catch them …","https://www.rev.com/blog/transcripts/donald-trump-erie-pa-rally-transcript-october-20","Donald Trump Erie, PA Rally Transcript October 20","44:01"
"Donald Trump","Crying Chuck. I’ve known him a long time. The only time he cries is when it’s necessary. Crying Chuck. No, no, you catch them. And you release them into the country. And you say in four and a half years, please come back for a trial. Nobody comes back. A couple of really stupid ones come back. Other than making every community into a sanctuary city and suspending all removals of illegal aliens. They want to suspend, in this manifesto, no more moving out illegal aliens, even if they’re really bad, including no violent criminals. You catch MS-13, can’t move them out. Thank you very much. We’re living with them. This is what these people want.","https://www.rev.com/blog/transcripts/donald-trump-erie-pa-rally-transcript-october-20","Donald Trump Erie, PA Rally Transcript October 20","44:34"
"Donald Trump","This is the most important election in the history of our country. Look, you know, we can play games and we can be nice and we can have a good time. You think I need to be standing out here in 50 degree weather, looking at Mike in a shirt, and he feels better about it than I do. Right Mike? No, this is the most important election in the history of our country. We can not allow this to happen. We’re going to win. We’re going to win so big. I think we’re going to win … you know the lines? The lines are record setting. The lines are big. The lines are big. There’s a lot of Trump, Trump … you know, a lot of people, great Americans, they never liked who they were voting for. They didn’t vote, they just didn’t vote. And they’re on line right now. There are a lot of people out there and it’s looking good. It’s early, but it’s looking good. Get out and vote.","https://www.rev.com/blog/transcripts/donald-trump-erie-pa-rally-transcript-october-20","Donald Trump Erie, PA Rally Transcript October 20","45:19"
"Donald Trump","Most important election, Mike, we’ve ever had. I really believe it. And you know what? Four or five months ago when we started this whole thing, because you know, before the plague came in, I had it made. I wasn’t coming to Erie. I mean, I have to be honest, there was no way I was coming. I didn’t have to. I would’ve called you and said, “Hey, Erie. You know, if you have a chance, get out and vote.” We had this thing won. We were so far up. We had the greatest economy ever, greatest jobs, greatest everything. And then we got hit with the plague and I had to go back to work. Hello, Erie, may I please have your vote? Right?","https://www.rev.com/blog/transcripts/donald-trump-erie-pa-rally-transcript-october-20","Donald Trump Erie, PA Rally Transcript October 20","46:18"
"Donald Trump","I love Erie. No. Hey, we had a big deal in Erie. We had a big deal in Erie, right? This was not supposed to be a Trump thing. There’s a lot of Democrats, but they’re Democrats that love Trump because I love them. And you know what? You’re workers, you’re like me. We work, we work, we work. But that was a pretty big upset, wasn’t it? Big, big upset.","https://www.rev.com/blog/transcripts/donald-trump-erie-pa-rally-transcript-october-20","Donald Trump Erie, PA Rally Transcript October 20","46:53"
"Donald Trump","But a Biden wins, your borders are gone, which means your healthcare is gone, the middle-class is gone, your safety is gone, your country is gone. That’s what’s going to happen. And don’t think it can happen. Take a look at Venezuela. This could be same ideology as what they’re talking about. This could be a Venezuela, but much, much, much bigger. It could happen. It could happen. You see these people, you see what they’re saying? You see Portland where they have anarchists through the streets. And it’s all Democrat run areas, no Republican areas. It’s all Democrat run areas. That’s where you have … with Portland, it’s anarchists.","https://www.rev.com/blog/transcripts/donald-trump-erie-pa-rally-transcript-october-20","Donald Trump Erie, PA Rally Transcript October 20","47:15"
"Donald Trump","Look at what’s happened to our beautiful New York. Since I’ve been gone, think of it. You know what? It’s like three and a half years. If you think of it. I think what I can say is if I would’ve stayed in New York, that wouldn’t have happened. It’s very … But look at what’s happened to New York in a few years. What’s happened in New York, what’s happened to Chicago. Look at what’s going on in Baltimore. And just remember this, with Obama Biden, they had nothing but problems. Look at Baltimore. Remember how bad that was? Ferguson. Look at St. Louis, look at Oakland, look at all the problems. You know, they act like, “Oh, it was … .” It was horrible. And you know, I say it all the time. If they were any good, I wouldn’t have run.","https://www.rev.com/blog/transcripts/donald-trump-erie-pa-rally-transcript-october-20","Donald Trump Erie, PA Rally Transcript October 20","47:55"
"Donald Trump","And if they were any good, if I did run, I couldn’t have won, right? But they were no good. They did a rotten job. They did a lousy job and Joe is not equipped right now, no longer. He never really was. You know, we used to call him 1% Joe and that was in prime time. How about this? And in non-prime time, he ends up getting the nomination. Figure that one out.","https://www.rev.com/blog/transcripts/donald-trump-erie-pa-rally-transcript-october-20","Donald Trump Erie, PA Rally Transcript October 20","48:40"
"Donald Trump","To secure our border, I took the corrupt media. We had to take it on and they are corrupt. The powerful special interests and the open borders lunatics, because they’ll destroy our country. In just three years, we removed over a half a million criminal aliens, including those charged or convicted of more than 145,000 assaults, 40,000 sex crimes and 6,000 murders. 6,000 murders. We got them the hell out. Some we had to keep because we didn’t even want them out, they were too dangerous. Because we don’t want them coming back.","https://www.rev.com/blog/transcripts/donald-trump-erie-pa-rally-transcript-october-20","Donald Trump Erie, PA Rally Transcript October 20","49:02"
"Donald Trump","And I want to thank ICE and I want to thank our great border patrol. Always law enforcement, but ICE and border patrol. Under a Biden administration, these criminals would be set free. Under my administration, these criminals are sent home or they have to be put in prison. We invested $2.5 trillion in the US military. We now have the greatest equipment we’ve ever had. We are the envy of Russia and China and everybody in the world. We have the best missiles and rockets and tanks and planes, F-35 Stealth. You can’t see it. Other than that, it’s not so great. You can’t see it. I went to one of the pilots, I said, “How good is this plane?” “Well, it’s really good.” “Why is it good?” “Because the enemy can’t see it.” I said, “I don’t know too much about what you do. Sounds good to me.”","https://www.rev.com/blog/transcripts/donald-trump-erie-pa-rally-transcript-october-20","Donald Trump Erie, PA Rally Transcript October 20","49:41"
"Donald Trump","And for our great veterans, we passed VA Choice and VA Accountability. We killed the leader of ISIS, al-Baghdadi. We killed the worst mass murderer terrorist in many, many generations. Soleimani is dead. Killed many soldiers, many people. I withdrew from the-","https://www.rev.com/blog/transcripts/donald-trump-erie-pa-rally-transcript-october-20","Donald Trump Erie, PA Rally Transcript October 20","50:36"
"Donald Trump","Killed many soldiers, many people. I withdrew from the last administration’s disastrous Iran nuclear deal. By the way, if and when we win, my first call is going to be from the heads of Iran, and they’re going to say, “Let’s make a deal.” Their economy, went from being strong, they were all over the world, terrorism. Now their economy is totally tanked with our sanctions and other things. And they’re down, GDP, think of this, GDP down 27%, nobody’s ever even heard of it. And I don’t want that, I want them to be a good sell, they can not have a nuclear weapon. They cannot have a nuclear weapon, but I want them to be good. I want them to be strong, I want them to have great country. The first call will be Iran. As soon as we win, they’re going to call and we’ll make a deal. And then others will also call, they’re all hoping.","https://www.rev.com/blog/transcripts/donald-trump-erie-pa-rally-transcript-october-20","Donald Trump Erie, PA Rally Transcript October 20","51:03"
"Donald Trump","China, oh China, China wants us to … Oh China. They want Joe Biden so badly, you have no idea. They want … They are dying for Joe Biden. The one they don’t want is, they don’t want Trump, they’ve had enough for Trump. Tens of billions of dollars we get. I recognized the true capital of Israel and opened the American embassy in Jerusalem. We don’t want Trump, please. We’ve had enough of Trump, let’s try somebody new, this isn’t working. Hey look, China has ripped us off more than any country in history. And by the way, plenty of our allies rip us off too, between trade and military and everything else, I could go into that. I could speak about that all night long. But nobody has ripped us like China for many, many, long before Obama, in all fairness and Biden, long before them. They’ve ripped us off … Where’s Hunter? I don’t know, that’s a good …","https://www.rev.com/blog/transcripts/donald-trump-erie-pa-rally-transcript-october-20","Donald Trump Erie, PA Rally Transcript October 20","51:51"
