"speaker","transcription","url","headlin","timing"
"Donald Trump","I used to use Venezuela a lot. I don’t know if I even really fully believed it but I’d say, “Venezuela, we would indeed become.” When I look at these maniacs in Portland, these anarchists in Portland, when I look at these people, that’s what they want for the rest of the country. They want to defund their police, they want to terminate their police. You know something about that. You’ve had your little stance where they want to … Did they actually do the, they actually are terminating the police department, right? They are actually doing it. They’re not even talking about it, they’re terminating the police department. These people are crazy, and by the way, when I sent in the National Guard, that’s when it all stopped and I kept calling. I kept calling and saying, “Send in the National Guard. Send in the National Guard.” They should have done it a lot sooner.","https://www.rev.com/blog/transcripts/donald-trump-speech-transcript-minnesota-august-17","Donald Trump Speech Transcript Minnesota August 17","23:23"
"Donald Trump","That was a beautiful … I just said, I just stopped some place else and I said, “To me it was a beautiful sight.” They were rioting all over, full of venom, vigor. They thought nobody was going to stop them. The police department is very good but they were told you can’t do anything. They have to be able to do what they do very well. So they were told they couldn’t do anything and the city was ablaze. It was ablaze. I’ll never forget the CNN reporter, he’s standing there with his very nice shaved head. Right now I wish I had a shaved head, it would be a good [inaudible 00:24:55] wind, but you know what? He’s standing there, [Velshi 00:24:59], right? Ali Velshi, and he’s standing there, “Things seem quite calm right now,” and behind him, they have the entire city looks like it’s burning down for blocks. He’s standing there talking because the fake news doesn’t report the truth and they don’t talk about how serious it is and how bad it is.","https://www.rev.com/blog/transcripts/donald-trump-speech-transcript-minnesota-august-17","Donald Trump Speech Transcript Minnesota August 17","24:16"
"Donald Trump","But remember this, it’s only a small part of our country. It’s not a big part, very small but they don’t report the facts because they don’t want to report those facts because those facts are very bad for Joe Biden and for the radical left and they want them to win. For whatever reason I don’t know because they’ll all lose their networks, they’ll all lose their wealth, everything will be gone but they’ll figure it out someday but we’re not going to let them have that chance. As much as in many ways they should not be rewarded, they’re going to be rewarded if I win because our country is only going up in one direction so that’s the way it is.","https://www.rev.com/blog/transcripts/donald-trump-speech-transcript-minnesota-august-17","Donald Trump Speech Transcript Minnesota August 17","25:18"
"Donald Trump","To fight the China virus, we’ve enacted the largest financial relief package in American history, through the Paycheck Protection Program we saved one million Minnesota jobs. We’ve also delivered nearly five billion dollars in economic relief straight to Minnesota families, you know that, we’ve kept it all going, and we’d like to do it again, except the Democrats, all they want is one trillion dollars, one trillion. They’re not interested in the people, they’re not interested in the Post Office. It’s all a ruse, it’s all a con. They’re only interested in getting a trillion dollars, you guys know that, getting a trillion dollars for states that are badly run blue states, very badly run by governors and mayors like New York, Illinois, California, I won’t name any more because to be honest, he’s going, “Minnesota, I don’t know.” I don’t like to be so personal but you do have some issues, I will say that. Of all places I would be very surprised, I was very surprised.","https://www.rev.com/blog/transcripts/donald-trump-speech-transcript-minnesota-august-17","Donald Trump Speech Transcript Minnesota August 17","25:54"
"Donald Trump","Unlike Sleepy Joe Biden our approach to the pandemic is based on science, not left-wing ideology. Slow Joe opposed the travel ban on China that I instituted. Remember he came out, “Oh it’s xenophobic.” I said, “What does that mean Joe? Tell me Joe. Can you describe?” Remember he came out and he called me all sorts of things, a racist and everything and then he said I was right. I was early, way, way early. We would have lost hundreds of thousands of additional lives and that’s pretty much agreed by everybody. Then I put the ban on Europe coming in because they were ahead of us and when I looked at Italy and I looked at France and Spain I said, “We got to put it on,” and a lot of people didn’t want that, they said we were right about that, and then we started getting into the manufacturing business with the ventilators and all of the equipment and what we did is incredible. The governors were not prepared. We made a lot of governors look good by supplying massive amounts of equipment. Massive. Not one person in this country, we didn’t have very many ventilators at all. Way under-supplied. Not one person in this country that needed a ventilator didn’t get the ventilators so every single person that needed one got one which is pretty amazing.","https://www.rev.com/blog/transcripts/donald-trump-speech-transcript-minnesota-august-17","Donald Trump Speech Transcript Minnesota August 17","26:57"
"Donald Trump","We have a big country with a lot of diversity, a lot of different states, and now we’re supplying, we’re making thousands of ventilators a month and we’re supplying them to the rest of the word because they’re not equipped to make a ventilator. It’s very complex, very expensive. We’re making thousands a month, we have all we can use.","https://www.rev.com/blog/transcripts/donald-trump-speech-transcript-minnesota-august-17","Donald Trump Speech Transcript Minnesota August 17","28:14"
"Donald Trump","Now Biden wants to lock all Americans in their basement for months on end which would inflict permanent irreversible harm on our nation’s children, families, health and economy. By contrast my administration is following data-driven and science-based approaches that apply to common sense mitigation, aggressively sheltering those at greatest risk, our seniors, we have to shelter them, and deliver effective medical treatments to save thousands and thousands of lives and when you look at the rest of the world, you know they were trying to say, “Oh, we weren’t doing that.” Now all of a sudden a lot of the places that they were using to hold up, they’re having a big surge, and I don’t want that, I don’t want that, but they were holding up names of countries and now they’re saying, “Whoops.” In fact, even New Zealand, you see what’s going on in New Zealand? They beat it, they beat it. It was like front page, they beat it because they wanted to show me something. The problem is, big surge in New Zealand. So you know, it’s terrible. We don’t want that but this is an invisible enemy that should have never been let to come to this country, to Europe or the rest of the world by China. Just remember it. Just remember it. [inaudible 00:29:46]","https://www.rev.com/blog/transcripts/donald-trump-speech-transcript-minnesota-august-17","Donald Trump Speech Transcript Minnesota August 17","28:32"
"Donald Trump","The fatality rate for Americans over 70 has declined by 85% since April. We’ve learned, we know, we have some great things now too. Europe by contrast has experienced a 40% higher rate of excess mortality than the United States. Think about that, you don’t hear those stories, they don’t tell you that Tom, do they? You don’t hear that in Congress, right? We launched the largest mobilization of American goods since the World War II. Think of it, since World War II. This is the largest mobilization since World War II, creating the most advanced testing system in the world, producing thousands of ventilators and launching Operation Warp Speed to deliver and distribute a vaccine before the end of the year in record time. We’re at a very, very close point to the vaccine and to therapeutics and therapeutics to me are more important right now. You go into the hospital, whether it’s a transfusion or whether it’s a shot and you feel better two days later or a day later or three days later but now would be a great thing and we’re very close, we have great, great companies working on it.","https://www.rev.com/blog/transcripts/donald-trump-speech-transcript-minnesota-august-17","Donald Trump Speech Transcript Minnesota August 17","29:48"
"Donald Trump","Because we will defeat the China virus, we’re going to be stronger than we ever were. Next year is going to be record setting numbers and you see that when you look at the V. The V is turning out to be true. I was saying a V and everybody was saying a V is impossible but the V, it’s beyond a V, it’s a super V based on the numbers that we have now. So we’ll see what happens and we would like to give additional money to people. We would like to … It wasn’t their fault that they got hit by China but you know what? We want to give them additional money and we’ll take care of … Again, the Post Office has been a disaster for many, many decades. We want to strengthen the Post Office, make it good. It lost $78 billion over a relatively short number of years. $78 billion, I want to strengthen the Post Office and we can do it so that if you look, Amazon and all these companies that now do, it’s a whole new business, they just drop a lot of it right into the Post Office and we lose two and three –","https://www.rev.com/blog/transcripts/donald-trump-speech-transcript-minnesota-august-17","Donald Trump Speech Transcript Minnesota August 17","31:01"
"Donald Trump","… just drop a lot of it right into the post office, and we lose two and $3 every time we deliver a package. What’s that all about? And he gets richer, and they get richer. How smart is that? For every package they deliver, it’s two and $3 a package. So why aren’t they raising the prices to Amazon and to these companies that are making all this money? Instead, we pay for it, and they always seem to open their distribution facilities right next to a post office.","https://www.rev.com/blog/transcripts/donald-trump-speech-transcript-minnesota-august-17","Donald Trump Speech Transcript Minnesota August 17","32:03"
"Donald Trump","So they take a lot of the goods that they can’t distribute, because the post office is massive, much bigger than those companies, believe it or not, you wouldn’t think it, but much, much bigger. And they go to areas of Minnesota, and other states that you can’t reach, you’ll never reach, and they just dump thousands of packages into the post office and they say, “Good luck. Here’s your $2. Here’s your $1. Here’s your 52 cents.” Now we got to do that. So that’s my opinion. What do I know about delivery? What do I know? That’s my opinion. That’s a new business, but we’re being taken advantage of by all of those companies, and they should pay, not the people.","https://www.rev.com/blog/transcripts/donald-trump-speech-transcript-minnesota-august-17","Donald Trump Speech Transcript Minnesota August 17","32:29"
"Donald Trump","My administration also understands that economic health is vital to public health. Over the past three months, we’ve gained nine million jobs nationwide, which is a new record. Retail spending is fully recovered and is now at an all-time high. We have more retail spending now than we did before the plague came in from China. Auto-production surge, 28%. Joe Biden would crush this unprecedented economic recovery. During his 47 years in Washington, think of that, 47 years, Joe Biden. And it’s really amazing, for 47 years, he did nothing, now he’s telling everybody how he’s going to make it wonderful, right? It doesn’t work that way, and he’s not exactly prime time now either, by the way.","https://www.rev.com/blog/transcripts/donald-trump-speech-transcript-minnesota-august-17","Donald Trump Speech Transcript Minnesota August 17","33:10"
"Donald Trump","Joe Biden supported every globalist attack on the American worker, NAFTA, which was a disaster, TPP, which I didn’t allow to happen, the horrible Korea deal. South China’s entry into the World Trade Organization might’ve been the worst of them all, it created China. Now Biden is running on the most extreme far-left agenda ever put forward by a major party. Biden’s joint manifesto, we call it a manifesto, with Bernie Sanders, crazy Bernie, would raise taxes and increase regulations at an unprecedented rate. He will kill the stock market, he will kill everything that we’re talking about today. He’d also abolish immigration enforcement, abolish bail, abolish the suburbs, abolish effective policing, abolish American energy, and abolish the American way of life, otherwise, he’d do quite a good job, I think.","https://www.rev.com/blog/transcripts/donald-trump-speech-transcript-minnesota-august-17","Donald Trump Speech Transcript Minnesota August 17","33:58"
"Donald Trump","He raised his hand and pledged to give free healthcare to illegal aliens, okay? A lot of you people, you don’t get free healthcare, but he wants to give it. He wants to give lawyers, free legal assistance to people that come into our country illegally, and his vice-presidential candidate, Biden picked Kamala, Kamala Harris. She’s [inaudible 00:03:22], she’s a beauty, who co-sponsored a $32 trillion socialist takeover of healthcare and our country, because our country would be ruined, destroyed. And think of this, you have 33 in healthcare and $93 trillion on the socialist Green New Deal, which doesn’t work. It’s like written by a child. It’s written by a child, a foolish child. It’s written by a foolish child.","https://www.rev.com/blog/transcripts/donald-trump-speech-transcript-minnesota-august-17","Donald Trump Speech Transcript Minnesota August 17","34:57"
"Donald Trump","I have a very different vision for America’s future, you got to see it before the plague, but you’re seeing it again right now, even more so. It starts with creating 10 million jobs in the next 10 months, and that’s what’s happening. Over the next four years, we will cut even more taxes, substantially, and regulations. That’s why people are pouring into our country to open up factories, they’re bringing them back to Minnesota and every place else. In Michigan, we have auto plants opening up left and right, and expanding. They haven’t seen that in 42 years. We will end our reliance on China. We will make our critical drugs and supplies right here in the United States.","https://www.rev.com/blog/transcripts/donald-trump-speech-transcript-minnesota-august-17","Donald Trump Speech Transcript Minnesota August 17","35:55"
"Donald Trump","And when you see the drug companies, they’re very rich, very sophisticated, when you see them taking the ads against Donald Trump, those ads are for one reason, because I’m bringing your drug prices way down, I instituted a favored nations clause. So if Germany, or any place, anywhere in the world is getting their drugs for less, which they do, a tiny fraction of what we pay, they have to meet those prices. Somebody should’ve done this. Obama, Biden, other presidents should’ve done this. Our drug prices are many times higher than other countries. Many, many times. In Canada, the price is half and better than that, and I gave Florida, Ron DeSantis, a great governor, gave him the right to buy his drugs directly from Canada. He’s going to save half. So right now you can’t do that. I gave him and I gave another state, Colorado, the authority to, if they want, they could go buy, prior to the favored nations kicking in.","https://www.rev.com/blog/transcripts/donald-trump-speech-transcript-minnesota-august-17","Donald Trump Speech Transcript Minnesota August 17","36:42"
"Donald Trump","But the favored nations clause could reduce drugs by 50, 60, 70, even 80%. Think of that one. And I’m the only president in 51 years, that had a year, last year, where drug prices came down, but that was peanut stuff compared to what I’m talking about. So when you see those ads, if you don’t mind, and you see the drug companies hitting me, you’ll say, “Thank you, President Trump for reducing drug prices.” I guarantee you, if they were going up, they wouldn’t be taking ads. It makes sense, I guess, right? I hope people understand that, because they are spending a lot of money. They don’t like me. I did something that was unthinkable.","https://www.rev.com/blog/transcripts/donald-trump-speech-transcript-minnesota-august-17","Donald Trump Speech Transcript Minnesota August 17","37:43"
"Donald Trump","Check out the words, favored nation, check out the word rebate, because now I take the rebate for the people and I take the rebate to reduce the prices. They took the rebate, went to a middleman. The middleman, I never heard the term middlewoman, but I guess probably that too. But the middleman got all this money, I don’t know who they are, nobody knows who they are. The middlemen, you always hear it, they made more money than the drug companies. At least the drug companies made a product, but the middleman is not liking Donald Trump too much. I probably have a lot of friends that are middlemen. I don’t even know if they have beautiful homes. I say, I wonder where they made their money? They’re very wealthy, but they’re not so wealthy anymore.","https://www.rev.com/blog/transcripts/donald-trump-speech-transcript-minnesota-august-17","Donald Trump Speech Transcript Minnesota August 17","38:26"
"Donald Trump","We are getting the rebates. We’re keeping the money for our people. We will create tax credits for companies that bring jobs from China back to America, and we’ll impose tariffs on companies that leave America to produce jobs overseas. One of the things in the USMCA that was very important, I don’t want our companies going to Mexico, going to Canada anymore. I watched that. I was man of the year, 11 years ago in Michigan. I don’t know why, but they picked me. That was long before I thought in terms of running. Are we glad I ran?","https://www.rev.com/blog/transcripts/donald-trump-speech-transcript-minnesota-august-17","Donald Trump Speech Transcript Minnesota August 17","39:07"
"Speaker 1","Yeah.","https://www.rev.com/blog/transcripts/donald-trump-speech-transcript-minnesota-august-17","Donald Trump Speech Transcript Minnesota August 17","39:41"
"Donald Trump","I think so. I think so. What do you think? Yes? I think so. But that was long before I thought about this, Mike, and I was in Michigan, very nice, man of the year, that was great, and I said, “They’re taking your car companies and moving them all to Mexico.” Anyway, 32% of our cars are made in Mexico. How crazy? But it’s that way, that’s the way it happened. But I said, the most important deal in the USMCA, I don’t want anybody moving to Mexico, firing their people, moving there, making a car, selling it in for no tax. I don’t want that anymore, can’t happen, and that’s not going to happen. There is such a huge economic disincentive to do that.","https://www.rev.com/blog/transcripts/donald-trump-speech-transcript-minnesota-august-17","Donald Trump Speech Transcript Minnesota August 17","39:42"
"Donald Trump","So we’ll strip federal contracts from companies that outsource critical industries, we’re going to strip it. With the help of Minnesota workers, we will be the premier medical and pharmaceutical manufacturer anywhere in the world, and you see it already. The drug companies are starting to give up. Now, I’ll tell you, if for some reason, the other side happens to have a victory on November 3rd, forget everything I said. It’ll all be made in China Plus, it’ll all be made in other countries like Vietnam, and other places. And you can just forget everything I said, because they’re typical politicians, but radical left wing. They will go right back to it, but even more so.","https://www.rev.com/blog/transcripts/donald-trump-speech-transcript-minnesota-august-17","Donald Trump Speech Transcript Minnesota August 17","40:24"
"Donald Trump","To protect our families and workers during the China pandemic, I sealed our border against illegal immigration, and suspended the entry of foreign workers who threatened American jobs. And yet, if you’re a farmer, a factory owner and you had people coming in from years, we made it easier for those people to keep coming in. I can’t shut them off, you’d have to close up your businesses. Joe Biden, on the other hand, has pledged to allow virtually unlimited immigration during a global pandemic, spreading the virus, overwhelming our healthcare system, and displacing millions of American job seekers. The Biden plan would institute catch and release, I got rid of it, along the entire Southwest border. This is where you catch perhaps a murderer, perhaps a rapist. You catch somebody, you take their number and you release them. You say, “Please show up to court in three years,” nobody shows up. 1% show up. You know who the 1% are? The ones that aren’t very smart. They’re the ones that show up, they’re the only ones that show up.","https://www.rev.com/blog/transcripts/donald-trump-speech-transcript-minnesota-august-17","Donald Trump Speech Transcript Minnesota August 17","41:08"
"Donald Trump","So we’ve built almost 300 miles of border wall and we’re adding 10 new miles each way, and if we didn’t have that, we’d be in trouble because sadly… And the President of Mexico is a friend of mine, he’s a great guy, Lacy, he’s a great guy like you, but I said to him, “We have to do this, and in the meantime, you have to give us a lot of troops along our border, because we’re paying you a lot of money with your cars, and otherwise I’m going to have to tariff.” And he said, “No, no, no. We will give you troops.” We have 27,000 Mexican soldiers on our Southern border. Nobody’s coming through unless we want them to. We have to come in legally into our country on the Southern border and elsewhere. We have 27,000 troops. You didn’t even know that, Tom, 27,000.","https://www.rev.com/blog/transcripts/donald-trump-speech-transcript-minnesota-august-17","Donald Trump Speech Transcript Minnesota August 17","42:17"
"Donald Trump","Furthermore, Joe Biden has pledged to increase refugee resettlement by not a bad number, 700%. You read that, right? That’s in the manifesto. He would overwhelm Minnesota with refugees, from terror hotspots, depleting public services, burdening schools, and straining city budgets. You already know about the hotspots, don’t you? You know about it. You’re having plenty of problems in Minnesota. And I’m going to be so politically correct, I’m not going to say a thing, but I know all about your hotspots, you got some hotspots. Very unfair to Minnesota, I will tell you that. And I’ll tell you, if I don’t win Minnesota, I’m never going to do it if I run for a third or fourth term, okay? I’ll never be back if I run, I’ve given up. I almost won last time. One more speech, Mike? almost won. I went to Michigan, I had a choice. I shouldn’t tell you this, but we won Michigan. One more speech, I would’ve won. I was so close, but if I don’t win it this time, I’m not coming back, never. Not for term three, four, five, or six.","https://www.rev.com/blog/transcripts/donald-trump-speech-transcript-minnesota-august-17","Donald Trump Speech Transcript Minnesota August 17","43:07"
"Donald Trump","Under my administration, we’ve dramatically reduced refugee resettlement and we’ve suspended refugee resettlement during the pandemic, you know that we’ve totally suspended it, nobody comes in. Lucky we have the wall, we’re up to 300 miles almost. If we didn’t have that wall, we would be inundated with people and unfortunately, and we’re helping them, we sent them a lot of ventilators and other equipment, but Mexico is being overrun with the pandemic and we would really have a problem. We’ve completely reformed refugee policy. We’ve instituted rigorous national security checks. We protected religious minorities, and we’ve shifted refugee admissions away from terror afflicted nations, like Syria, and Somalia.","https://www.rev.com/blog/transcripts/donald-trump-speech-transcript-minnesota-august-17","Donald Trump Speech Transcript Minnesota August 17","44:16"
