"speaker","transcription","url","headlin","timing"
"Donald Trump","Thank you very much. Hello, Erie. Remember that great victory we had? What a victory. 14 days from now, we’re going to win the Commonwealth of Pennsylvania and we are going to win four more years in the White House .with your vote, we will continue to cut your taxes, cut regulations, support our great police, protect our second amendment, defend our borders, keep jobs and wealth in America where it belongs. Thank you.","https://www.rev.com/blog/transcripts/donald-trump-erie-pa-rally-transcript-october-20","Donald Trump Erie, PA Rally Transcript October 20","07:07"
"Donald Trump","We will deliver record prosperity, epic growth and you know that? have you seen what’s been going on? How well we’re doing? Did you see the recent poll just came out? 56% of the people want to be here, not four years ago. They want to be with us in what we’re calling… we’re rounding the turn of the pandemic. 56%, and it’s a record. Epic job growth, safe vaccines that quickly end the pandemic. It’s ending. Normal life, that’s all we want. You know what we want? Normal life. Normal life will finally resume and next year will be the greatest economic year in the history of our country.","https://www.rev.com/blog/transcripts/donald-trump-erie-pa-rally-transcript-october-20","Donald Trump Erie, PA Rally Transcript October 20","07:48"
"Donald Trump","This is an election between the Trump super recovery, which is happening right now and a Biden depression. If he gets elected, you will have a depression the likes of which you’ve never seen. You know he’s going to double, triple and now quadruple your taxes. I don’t think so. I think I know the people of Erie pretty well. They don’t like that. It’s a choice between our plan to kill the virus or Biden’s plan to kill the American dream. That’s what he’d be doing. Biden will delay therapies, postpone the vaccine, prolong the pandemic, close your schools, shut down our country. By the way, Pennsylvania’s been shut down long enough. Get your governor to open up Pennsylvania.","https://www.rev.com/blog/transcripts/donald-trump-erie-pa-rally-transcript-october-20","Donald Trump Erie, PA Rally Transcript October 20","08:43"
"Donald Trump","Get your governor to open it up. He will massively raise your taxes, bury you in regulations, dismantle your police departments, dissolve our borders, confiscate your guns, second amendment. Oh, you’re so lucky I’m president. You wouldn’t have a second amendment. Eliminate private healthcare, terminate religious liberty, destroy the suburbs. I’m saving the suburbs. Knocked out the regulation. No, you don’t like projects being next to you beautiful house, your American dream. So much for the American dream.","https://www.rev.com/blog/transcripts/donald-trump-erie-pa-rally-transcript-october-20","Donald Trump Erie, PA Rally Transcript October 20","09:41"
"Donald Trump","Joe Biden will ban fracking and abolish Pennsylvania Energy. How many times did he say, “You’re fracking.” Mining industries will be outlawed, exiled, eradicated, and totally extinguished. And you know it because it’s not up to Sleepy Joe. He’s Gonzo. It’s up to the others of the party. Joe Biden has repeatedly pledged to ban fracking, right? You’ve all heard it. Have you heard it? Till he got the nomination then he came to Pennsylvania. He said, “Oh, well, I guess it’s okay.”","https://www.rev.com/blog/transcripts/donald-trump-erie-pa-rally-transcript-october-20","Donald Trump Erie, PA Rally Transcript October 20","10:19"
"Donald Trump","It’s always what they say first. His running mate, the most liberal member of the US Senate, sponsors the $100 trillion… Think of that 100 trillion. If we had a great year for a hundred years, we couldn’t make a $100 trillion. The $100 trillion socialist green new deal, which would eliminate fossil fuels. At this very moment, Biden’s website includes a pledge to mandate net zero carbon emissions, which means he would end all fracking. It’s what he said. He said it for a year and a half, he said it.","https://www.rev.com/blog/transcripts/donald-trump-erie-pa-rally-transcript-october-20","Donald Trump Erie, PA Rally Transcript October 20","10:55"
"Donald Trump","Under the Obama-Biden administration, more than 40% of all coal mining jobs will be destroyed. Totally gone. You know what’s happened? I mean, did you see what they did to West Virginia and other places, including Pennsylvania when they were here? Don’t forget. They’d been here for eight years before me. If they did a good job, I would have never run. I didn’t need this. I didn’t need this. Although, we’re having a good time, and we’re doing a good job.","https://www.rev.com/blog/transcripts/donald-trump-erie-pa-rally-transcript-october-20","Donald Trump Erie, PA Rally Transcript October 20","11:33"
"Donald Trump","No, but it’s true. If they did a good job, I wouldn’t have run.","https://www.rev.com/blog/transcripts/donald-trump-erie-pa-rally-transcript-october-20","Donald Trump Erie, PA Rally Transcript October 20","12:03"
"Speaker 2","We love you. We love you.","https://www.rev.com/blog/transcripts/donald-trump-erie-pa-rally-transcript-october-20","Donald Trump Erie, PA Rally Transcript October 20","12:06"
"Donald Trump","Thank you.","https://www.rev.com/blog/transcripts/donald-trump-erie-pa-rally-transcript-october-20","Donald Trump Erie, PA Rally Transcript October 20","12:09"
"Speaker 2","We love you. We love you.","https://www.rev.com/blog/transcripts/donald-trump-erie-pa-rally-transcript-october-20","Donald Trump Erie, PA Rally Transcript October 20","12:10"
"Donald Trump","Thank you. There’s a lot of people. There’s a lot of people. I always want the cameras to show. They never like to show. They don’t like to talk about it. You can hear how big these crowds are. By the way, in all fairness to Erie, all over the country, it makes you feel good all over the country. The biggest crowds anyone’s ever had, bigger than what we had four years ago. Bigger. Oh, and you have…","https://www.rev.com/blog/transcripts/donald-trump-erie-pa-rally-transcript-october-20","Donald Trump Erie, PA Rally Transcript October 20","12:28"
"Donald Trump","Leslie Stahl’s not going to be happy. The Democrat party hates fracking. They hate coal, good, beautiful, clean coal. They hate American energy and Joe Biden will shut it all down. He’s going to. Tonight. I want to do something. I want to give you. This is an original Donald Trump Broadway play. I had it done specifically… First time I’ve ever pulled it out. I had it done specifically for the people of Erie because you guys like energy. You like being energy independent. Do you like that? Energy… doesn’t that sound… We don’t need all these far away lands and everything else. We are now energy independent, and we’re going to keep it that way. Take a look at this clip. We had it made up, and I think you’ll like. First time I’ve ever done this, right? First time. Go ahead. Wherever it is, put it up.","https://www.rev.com/blog/transcripts/donald-trump-erie-pa-rally-transcript-october-20","Donald Trump Erie, PA Rally Transcript October 20","12:56"
"Speaker 3","Would there be any place for fossil fuels, including coal and fracking in a Biden administration?","https://www.rev.com/blog/transcripts/donald-trump-erie-pa-rally-transcript-october-20","Donald Trump Erie, PA Rally Transcript October 20","13:48"
"Joe Biden","No, we would work it out. We would make sure it’s eliminated and no more subsidies for either one of those. I guarantee you we’re going to end fossil fuel. No more. No new fracking. I’d gradually move away from fracking.","https://www.rev.com/blog/transcripts/donald-trump-erie-pa-rally-transcript-october-20","Donald Trump Erie, PA Rally Transcript October 20","13:55"
"Kamala harris","I think it’s critically important on Day One that we end any fossil fuel leases on public lands.","https://www.rev.com/blog/transcripts/donald-trump-erie-pa-rally-transcript-october-20","Donald Trump Erie, PA Rally Transcript October 20","14:09"
"Speaker 4","What about [inaudible 00:14:16] and fracking and stopping the pipeline [crosstalk 00:14:18]?","https://www.rev.com/blog/transcripts/donald-trump-erie-pa-rally-transcript-october-20","Donald Trump Erie, PA Rally Transcript October 20","14:14"
"Joe Biden","They want to do the same thing I want to do. They want to phase out fossil fuels and we’re going to phase out fossil fuels.","https://www.rev.com/blog/transcripts/donald-trump-erie-pa-rally-transcript-october-20","Donald Trump Erie, PA Rally Transcript October 20","14:21"
"Kamala harris","There’s no question I’m in favor of banning fracking.","https://www.rev.com/blog/transcripts/donald-trump-erie-pa-rally-transcript-october-20","Donald Trump Erie, PA Rally Transcript October 20","14:26"
"Donald Trump","What we don’t show is his more current version. “Oh, yes, we’ll have fracking.” The fake news, they don’t do anything about it. They don’t even talk to him about it. But right now he’s got bigger problems than fracking, I think. You know what it’s called? You know what his problem? It’s called the laptop from hell. The laptop from hell.","https://www.rev.com/blog/transcripts/donald-trump-erie-pa-rally-transcript-october-20","Donald Trump Erie, PA Rally Transcript October 20","14:37"
"Donald Trump","To all the people of Pennsylvania, hear this warning: If Biden’s elected, he will wipe out your energy industry. You have a million jobs. Just like he wiped out your steel industry and I brought it back. I brought it back. Only by voting for me, can you save your fracking in Pennsylvania. We are going to have a great time because you are going to reject the radical left. The United States, and I say it, and I’ll say it a thousand times, the United States will never be a socialist nation.","https://www.rev.com/blog/transcripts/donald-trump-erie-pa-rally-transcript-october-20","Donald Trump Erie, PA Rally Transcript October 20","15:05"
"Speaker 2","USA. USA. USA. USA. USA. USA. We love you, President Trump.","https://www.rev.com/blog/transcripts/donald-trump-erie-pa-rally-transcript-october-20","Donald Trump Erie, PA Rally Transcript October 20","15:57"
"Donald Trump","Think of it. Here we are in Erie. People as far as the eye can see. Look at that. I mean, it’s a great honor. It’s a great honor. It’s a great honor for all of us. We’re all in this together. We’re all in it. As long as I’m president, we will remain the number one producer of energy anywhere in the world. You know we’re now number one in the world with Pennsylvania. You, Texas, we have some great… How about North Dakota does a great job? North Dakota, Oklahoma, so many different… Ohio does a phenomenal job. Phenomenal. A couple of Ohioans and they have to have the fracking and they have to have the energy and we need the energy. You looked at your car. When did you think you were going to see $2 a gallon and less. You didn’t think you were going to see that. That’s like a tax cut. At the same time, our energy industry is vibrant. Last year, I visited …","https://www.rev.com/blog/transcripts/donald-trump-erie-pa-rally-transcript-october-20","Donald Trump Erie, PA Rally Transcript October 20","16:05"
"Donald Trump","G is vibrant. Last year, I visited the Shell petrochemical plant in Beaver County, the largest investment in your state’s history. Our opponents will put it out of business. They want to put it out of business. I don’t think that’s a great idea. Joe Biden has made a corrupt bargain exchange for his party’s nomination. He’s handed control of his party over to socialists, I added another word, communists, Marxists, left-wing extremists, and they’re full of hate and rage and scorn for the middle-class, and for everybody, frankly, for the middle-class and for everybody. The Biden Harris, Kamala, you like Kamala? Kamala. I’ll tell you. Did our Vice President do a great job? He did. Did a great job. I said, “Mike, was too easy.” But the Biden Harris agenda is projected to slash the typical American’s income by $6,500. This is in the Wall Street Journal today. A Nightmare for Pennsylvania family, $6,500. And that’s just, cut it down, what you could be making if you do this and what we’re doing, because for the last 47 years, Joe Biden has been outsourcing your jobs, offshoring your factories and selling out the American worker. And who knows it better than Pennsylvania? Look at all the empty halts that you still have despite all the jobs we’ve brought back. America lost 10,000 factories while he was Vice President. He has no clue, by the way. Just so you understand, he has no clue. How many? Oh, that’s okay.","https://www.rev.com/blog/transcripts/donald-trump-erie-pa-rally-transcript-october-20","Donald Trump Erie, PA Rally Transcript October 20","17:03"
"Donald Trump","He’s a servant of the globalists, lobbyists, wealthy donors and Washington vultures who got rich bleeding America dry. You know, I said the other day, I never thought of it because they’re raising a lot of money, $300 million. I could be the king of all fundraisers. I would be the greatest that ever lived, the President of the United States. All they have to do is give me a list of the top hundred companies. I’ll call the President of everyone. They will pay me whatever I want. I would set every record. The problem is I’d owe them. Because when they call and they have a problem for a lot more money than we’re talking about, it’s hard to say, “Hey, they were nice. They treated you good.” I don’t want to do that. I don’t want to do that. We don’t need the money. I don’t want to do that. I don’t want to do that.","https://www.rev.com/blog/transcripts/donald-trump-erie-pa-rally-transcript-october-20","Donald Trump Erie, PA Rally Transcript October 20","18:51"
"Donald Trump","But when you see them raise $300, $350 million in a month and a half, you know deals are being made. Just so you understand, deals are being made, big deals, deals. I mean, look at the deals that he’s making for himself. Okay? But deals are being made.","https://www.rev.com/blog/transcripts/donald-trump-erie-pa-rally-transcript-october-20","Donald Trump Erie, PA Rally Transcript October 20","19:35"
"Donald Trump","In 2016, Pennsylvania voted to fire this depraved political establishment and you elected an outsider as President who is finally putting America first. America first. The fact is whether you like it or not, whether you want to hear it or not. Joe Biden is a corrupt politician. He’s a corrupt politician. And smoking gun emails show that the Biden family sold the Vice Presidency for a very, very substantial amount of money, more money than anybody would believe. He let China plunder your jobs while his family raked in millions of dollars from China and foreign nations. The Bidens got rich while Pennsylvania got robbed and so did the rest of our country.","https://www.rev.com/blog/transcripts/donald-trump-erie-pa-rally-transcript-october-20","Donald Trump Erie, PA Rally Transcript October 20","19:50"
"Donald Trump","… Desperately trying to cover up everything. They don’t want to hear speeches like this. They don’t want to [inaudible 00:21:12] about it. [inaudible 00:04:16]. … Media, the big tech giants, the Washington swamp and the Democrat party is a part of all of them, every single one of them. They flood your communities with criminal aliens, drugs and crime, while they live behind beautiful gated compounds. They try to take away your guns, second amendment, they want to take it away, while they enjoy private security that’s fully armed. They support crippling lockdowns like your Governor is doing, while their jobs and their industries remain totally exempt. And it’s time to send a message to these wealthy liberal hypocrites by delivering Joe Biden, sleepy Joe, a thundering defeat on November 3rd. You got to get out and vote. Pennsylvania, you got to get out and vote.","https://www.rev.com/blog/transcripts/donald-trump-erie-pa-rally-transcript-october-20","Donald Trump Erie, PA Rally Transcript October 20","21:05"
"Donald Trump","You know, if we win Pennsylvania, we win the whole thing. We win the whole thing. I mean, it’s crazy. They’re saying, “Oh, it’s his home state.” It’s not his own state. He left you when he was nine. Right? His parents. I’m not blaming him for that. But you know, he likes to go over and, “Yeah, yeah, it’s my home state.” It’s not his home state. I actually went to college in Pennsylvania, okay, so I think I have more in common. But it’s not his home state. He comes from a place called Delaware and he never leaves Delaware. [inaudible 00:22:43] Delaware, too. But he never leaves. Here, he’s making another speech, well he doesn’t make many speeches, either. He took a five day lid. You know what a lid is? I never heard lid. Lid is like, they put the lid like a garbage can. Right? They put the lid. He took a five day lid. I mean, this guy, all he does is like stay home.","https://www.rev.com/blog/transcripts/donald-trump-erie-pa-rally-transcript-october-20","Donald Trump Erie, PA Rally Transcript October 20","22:14"
"Donald Trump","You know why? You know why? Because he can’t take any questions now from the press. He can’t take any questions. How about yesterday? He finally went outside. He went to get an ice cream and the press are [inaudible 00:06:19], these are all killers. I mean, there they are. Look, the fake news. They’re standing there. And all they wanted to know, think of me, they’re screaming at me a… All they wanted to know, “What flavor ice cream do you like?” Well, I like vanilla and chocolate. Thank you.” They don’t ask me those questions.","https://www.rev.com/blog/transcripts/donald-trump-erie-pa-rally-transcript-october-20","Donald Trump Erie, PA Rally Transcript October 20","23:04"
"Donald Trump","If I don’t sound like a typical Washington politician, it’s because I’m not a politician. And if I don’t always play by the rules of the Washington establishment, it’s because I was elected to fight for you and nobody has ever fought for you harder than I have. That I can tell you. I’m fighting so hard because I love my country. I love you, by the way. But I love my country.","https://www.rev.com/blog/transcripts/donald-trump-erie-pa-rally-transcript-october-20","Donald Trump Erie, PA Rally Transcript October 20","23:43"
"Audience","We love you! We love you! We love you!","https://www.rev.com/blog/transcripts/donald-trump-erie-pa-rally-transcript-october-20","Donald Trump Erie, PA Rally Transcript October 20","24:12"
"Donald Trump","Thank you. Thank you. And this is a tough group in front. The last time they said that, last time this guy said that to another man, I’d have [inaudible 00:24:37] you’d be dead a long time ago. But because I’m determined to ensure that the forgotten men and women of this country, remember, they showed up four years ago, and they’re showing up now. You see what’s going on. Do you see the lines? Do you see what’s happening all over the country? They still don’t want to report it. This is going to be bigger than four years ago. There’s more enthusiasm. The crowds are bigger. They’ll never be forgotten again, not after this one. They tried to find out who are all these people that showed up last time. Now they’re finding out again, except even more so.","https://www.rev.com/blog/transcripts/donald-trump-erie-pa-rally-transcript-october-20","Donald Trump Erie, PA Rally Transcript October 20","24:23"
"Donald Trump","No, you see what’s going on though with the lines and everything. And then they have the phony fake ballots all over the place. They’re throwing them in the garbage can. Oh, they happen to have the name Trump on them. Isn’t that shocking? How about the ones that were printed without my name on it? Right? They had everything on it. They had every race. They had everything. You had the Senate. You had everything. They forgot to put me down. Oh, thank you. And then they say, “He’s against freedom.” Oh, it’s wild.","https://www.rev.com/blog/transcripts/donald-trump-erie-pa-rally-transcript-october-20","Donald Trump Erie, PA Rally Transcript October 20","25:15"
"Donald Trump","The Biden Harris Warren police would be a catastrophe for public safety. You know, I think I have every single…","https://www.rev.com/blog/transcripts/donald-trump-erie-pa-rally-transcript-october-20","Donald Trump Erie, PA Rally Transcript October 20","25:43"
"Audience","Back the blue! Back the blue! Back the blue!","https://www.rev.com/blog/transcripts/donald-trump-erie-pa-rally-transcript-october-20","Donald Trump Erie, PA Rally Transcript October 20","25:54"
"Donald Trump","Correct. I like that. I like that. I think we have every single endorsement, even New York finest, New York City’s finest. We love it our finest.","https://www.rev.com/blog/transcripts/donald-trump-erie-pa-rally-transcript-october-20","Donald Trump Erie, PA Rally Transcript October 20","25:56"
"Donald Trump","(silence).","https://www.rev.com/blog/transcripts/donald-trump-erie-pa-rally-transcript-october-20","Donald Trump Erie, PA Rally Transcript October 20","26:14"
"Audience","Trump! Trump! Trump! Trump!","https://www.rev.com/blog/transcripts/donald-trump-erie-pa-rally-transcript-october-20","Donald Trump Erie, PA Rally Transcript October 20","26:14"
"Donald Trump","Is the mic ready? Yes. I wonder who did that to our mic. I don’t believe it was Joe. You know who it was? Crooked Hillary. Must have been. I think it was probably crooked Hillary. But Kamala, Kamala, by the way, she will not be your first woman president. She will not be. Can’t let that happen. There’ll be a woman president. You can not let that happen. Harris even urged their supporters to donate to a fund that bailed out rioters right out of jail, including attempted cop killers. I will always stand with the heroes of law enforcement. So will you.","https://www.rev.com/blog/transcripts/donald-trump-erie-pa-rally-transcript-october-20","Donald Trump Erie, PA Rally Transcript October 20","26:59"
"Donald Trump","And Biden’s policies would also decimate our seniors. Biden is pledging mass amnesty and free federal healthcare. Remember, he did that at a stage. You remember? Look, she’s shaking her head. She remembers. Remember when he put up his hand? You know, after 47 years, he knew it was not the right thing to do, but everybody else was raising. You know, they’re all radical left. And he felt very uncomfortable. He looked, he looked over there and they were all over the place. His people, they were all-","https://www.rev.com/blog/transcripts/donald-trump-erie-pa-rally-transcript-october-20","Donald Trump Erie, PA Rally Transcript October 20","27:55"
"Donald Trump","[inaudible 00:28:31] We just won the election.","https://www.rev.com/blog/transcripts/donald-trump-erie-pa-rally-transcript-october-20","Donald Trump Erie, PA Rally Transcript October 20","28:31"
"Donald Trump","(silence).","https://www.rev.com/blog/transcripts/donald-trump-erie-pa-rally-transcript-october-20","Donald Trump Erie, PA Rally Transcript October 20","28:32"
"Donald Trump","He knows they don’t get a free Rolls Royce. He lied to the American people. Oh, these are sick people. Thank goodness their ratings, CNN ratings, did you see them? They’re so bad. Fredo, all these people. The ratings are so bad. Their ratings are terrible. Thank goodness. But he will obliterate your Medicare, your social security. I will always protect your Medicare and your social security, as I said four years ago. I’m also proud that here in Pennsylvania, your Medicare Advantage, you know that. Everybody has it. Some people have it. The premiums have decreased, listen to this, under our management, 43% since I took office. Where do you hear that?","https://www.rev.com/blog/transcripts/donald-trump-erie-pa-rally-transcript-october-20","Donald Trump Erie, PA Rally Transcript October 20","28:48"
"Donald Trump","We will always defend our seniors and we defend them like nobody else can. The battle against the China virus, the China virus, that’s what it is. It’s a China. You know, they call it COVID. They call it all different names. It’s the China virus. China, maybe the China plague. We launched the largest mobilization since World War II. I’ll tell you what. The way they cover it, we have done such an incredible, we saved millions of lives. They refuse to cover it. Not for me, but for the people, the admirals, the generals, Mike Pence, everybody that works so hard on this, and they refuse to acknowledge it. We made a lot of really bad governors look good. And some good governors do just fine, but a lot of bad governors, we made them look good.","https://www.rev.com/blog/transcripts/donald-trump-erie-pa-rally-transcript-october-20","Donald Trump Erie, PA Rally Transcript October 20","29:36"
