"speaker","transcription","url","headlin","timing"
"Donald Trump","You don’t need it. You don’t –","https://www.rev.com/blog/transcripts/donald-trump-judge-jeanine-pirro-interview-transcript-september-12","Donald Trump Judge Jeanine Pirro Interview Transcript September 12","13:09"
"Jeanine Pirro","Not yet?","https://www.rev.com/blog/transcripts/donald-trump-judge-jeanine-pirro-interview-transcript-september-12","Donald Trump Judge Jeanine Pirro Interview Transcript September 12","13:09"
"Donald Trump","Oh I’d be willing to do it in a heartbeat if you needed it but we don’t need it. Our National Guard –","https://www.rev.com/blog/transcripts/donald-trump-judge-jeanine-pirro-interview-transcript-september-12","Donald Trump Judge Jeanine Pirro Interview Transcript September 12","13:10"
"Jeanine Pirro","When you do need it?","https://www.rev.com/blog/transcripts/donald-trump-judge-jeanine-pirro-interview-transcript-september-12","Donald Trump Judge Jeanine Pirro Interview Transcript September 12","13:14"
"Donald Trump","Our National Guard is so good and so tough.","https://www.rev.com/blog/transcripts/donald-trump-judge-jeanine-pirro-interview-transcript-september-12","Donald Trump Judge Jeanine Pirro Interview Transcript September 12","13:14"
"Jeanine Pirro","But they’ve got to be asked.","https://www.rev.com/blog/transcripts/donald-trump-judge-jeanine-pirro-interview-transcript-september-12","Donald Trump Judge Jeanine Pirro Interview Transcript September 12","13:17"
"Donald Trump","By the way, police departments, in places that we’re talking about, Seattle, we were going into Seattle and they solved the problem the night before we got there.","https://www.rev.com/blog/transcripts/donald-trump-judge-jeanine-pirro-interview-transcript-september-12","Donald Trump Judge Jeanine Pirro Interview Transcript September 12","13:18"
"Jeanine Pirro","Yeah, they didn’t want you there.","https://www.rev.com/blog/transcripts/donald-trump-judge-jeanine-pirro-interview-transcript-september-12","Donald Trump Judge Jeanine Pirro Interview Transcript September 12","13:25"
"Donald Trump","We were getting ready to go, they heard we were going in.","https://www.rev.com/blog/transcripts/donald-trump-judge-jeanine-pirro-interview-transcript-september-12","Donald Trump Judge Jeanine Pirro Interview Transcript September 12","13:25"
"Jeanine Pirro","Did you hear Ted Wheeler’s numbers? Like 20% in Portland.","https://www.rev.com/blog/transcripts/donald-trump-judge-jeanine-pirro-interview-transcript-september-12","Donald Trump Judge Jeanine Pirro Interview Transcript September 12","13:27"
"Donald Trump","Ted Wheeler’s a disaster. He’s a laughingstock. He went out to protest with the so-called agitators and they were going to destroy him. They were going to beat him up badly, he fortunately had security but they were going to beat him up badly. The man is a disaster. If he would say come into Portland, within a half an hour, the whole thing would be solved.","https://www.rev.com/blog/transcripts/donald-trump-judge-jeanine-pirro-interview-transcript-september-12","Donald Trump Judge Jeanine Pirro Interview Transcript September 12","13:32"
"Jeanine Pirro","He’s not going to say that.","https://www.rev.com/blog/transcripts/donald-trump-judge-jeanine-pirro-interview-transcript-september-12","Donald Trump Judge Jeanine Pirro Interview Transcript September 12","13:50"
"Donald Trump","The governor’s gotten closer. Look, what’s going on out there? I will tell you –","https://www.rev.com/blog/transcripts/donald-trump-judge-jeanine-pirro-interview-transcript-september-12","Donald Trump Judge Jeanine Pirro Interview Transcript September 12","13:53"
"Jeanine Pirro","That’s Kate Brown [inaudible 00:13:57]?","https://www.rev.com/blog/transcripts/donald-trump-judge-jeanine-pirro-interview-transcript-september-12","Donald Trump Judge Jeanine Pirro Interview Transcript September 12","13:55"
"Donald Trump","The governor has gotten closer. I’ve spoken to the governor two days ago.","https://www.rev.com/blog/transcripts/donald-trump-judge-jeanine-pirro-interview-transcript-september-12","Donald Trump Judge Jeanine Pirro Interview Transcript September 12","13:56"
"Jeanine Pirro","Good.","https://www.rev.com/blog/transcripts/donald-trump-judge-jeanine-pirro-interview-transcript-september-12","Donald Trump Judge Jeanine Pirro Interview Transcript September 12","13:59"
"Donald Trump","They’re arresting a lot of people that we sent in the U.S. Marshals for the killer, the man that killed the young man on the streets. He shot him.","https://www.rev.com/blog/transcripts/donald-trump-judge-jeanine-pirro-interview-transcript-september-12","Donald Trump Judge Jeanine Pirro Interview Transcript September 12","13:59"
"Jeanine Pirro","Right. Yeah, in cold blood.","https://www.rev.com/blog/transcripts/donald-trump-judge-jeanine-pirro-interview-transcript-september-12","Donald Trump Judge Jeanine Pirro Interview Transcript September 12","14:08"
"Donald Trump","I mean it was on television. Just cold-blooded killed him. He didn’t like his hat or he didn’t like something and it wasn’t a Trump hat.","https://www.rev.com/blog/transcripts/donald-trump-judge-jeanine-pirro-interview-transcript-september-12","Donald Trump Judge Jeanine Pirro Interview Transcript September 12","14:08"
"Jeanine Pirro","Right. It was peaceful prayer –","https://www.rev.com/blog/transcripts/donald-trump-judge-jeanine-pirro-interview-transcript-september-12","Donald Trump Judge Jeanine Pirro Interview Transcript September 12","14:15"
"Donald Trump","It was a lot, it was a religious hat, and he shot him, cold blood. Two and a half days went by and I put out when are you going to go get him? The U.S. Marshals went in to get him and in a short period of time, they ended in a gunfight. This guy was a violent criminal.","https://www.rev.com/blog/transcripts/donald-trump-judge-jeanine-pirro-interview-transcript-september-12","Donald Trump Judge Jeanine Pirro Interview Transcript September 12","14:17"
"Jeanine Pirro","A lot of them out there.","https://www.rev.com/blog/transcripts/donald-trump-judge-jeanine-pirro-interview-transcript-september-12","Donald Trump Judge Jeanine Pirro Interview Transcript September 12","14:34"
"Donald Trump","The U.S. Marshals killed him and I will tell you something, that’s the way it has to be. There has to be retribution when you have crime like this. There can’t be guys standing up that want to fight, they want to fight. You can’t throw bricks at people [inaudible 00:14:51].","https://www.rev.com/blog/transcripts/donald-trump-judge-jeanine-pirro-interview-transcript-september-12","Donald Trump Judge Jeanine Pirro Interview Transcript September 12","14:35"
"Jeanine Pirro","But the problem Mr. President, you and I both agree. The problem is there are now prosecutors who are not prosecuting the protestors. This is like a grassroots level, they’re being funded by socialists who are now electing people like I used to prosecute crime, they’re letting them go.","https://www.rev.com/blog/transcripts/donald-trump-judge-jeanine-pirro-interview-transcript-september-12","Donald Trump Judge Jeanine Pirro Interview Transcript September 12","14:50"
"Donald Trump","So what’s going to happen, and this is a shame, you’re going to have a backlash like you’ve never seen if these people don’t stop. Because you have very smart, very tough people that aren’t going to take it any more and once they say we’re not going to take it anymore, its going to end in a very vicious backlash and that’s a terrible thing.","https://www.rev.com/blog/transcripts/donald-trump-judge-jeanine-pirro-interview-transcript-september-12","Donald Trump Judge Jeanine Pirro Interview Transcript September 12","15:09"
"Jeanine Pirro","How does it end?","https://www.rev.com/blog/transcripts/donald-trump-judge-jeanine-pirro-interview-transcript-september-12","Donald Trump Judge Jeanine Pirro Interview Transcript September 12","15:24"
