"speaker","transcription","url","headlin","timing"
"Donald Trump","Their party is based upon unvarnished disdain for America, its past and its people. You see that happening. It’s horrible the way they treat the legacy of our country, the culture of our country. Our party is based on love for America and the belief that this is an exceptional nation, blessed by God. We take great pride in our country. We teach the truth about history. We celebrate our rich heritage and national traditions. We honor George Washington, Abraham Lincoln, Thomas Jefferson, and all national heroes, and of course, we respect our great American flag.","https://www.rev.com/blog/transcripts/donald-trump-cpac-2021-speech-transcript","Donald Trump CPAC 2021 Speech Transcript","53:17"
"Donald Trump","Thank you. Thank you. Thank you very much. Thank you very much.","https://www.rev.com/blog/transcripts/donald-trump-cpac-2021-speech-transcript","Donald Trump CPAC 2021 Speech Transcript","54:24"
"Audience","We love you. We love you. We love you. We love you. We love you. We love you. We love you. We love you. We love you. We love you.","https://www.rev.com/blog/transcripts/donald-trump-cpac-2021-speech-transcript","Donald Trump CPAC 2021 Speech Transcript","54:48"
"Donald Trump","Thank you.","https://www.rev.com/blog/transcripts/donald-trump-cpac-2021-speech-transcript","Donald Trump CPAC 2021 Speech Transcript","54:48"
"Audience","We love you. We love you. We love you.","https://www.rev.com/blog/transcripts/donald-trump-cpac-2021-speech-transcript","Donald Trump CPAC 2021 Speech Transcript","54:48"
"Donald Trump","Thank you very much, so nice.","https://www.rev.com/blog/transcripts/donald-trump-cpac-2021-speech-transcript","Donald Trump CPAC 2021 Speech Transcript","54:48"
"Audience","We love you.","https://www.rev.com/blog/transcripts/donald-trump-cpac-2021-speech-transcript","Donald Trump CPAC 2021 Speech Transcript","54:49"
"Donald Trump","I started that hearing… Really, we’re getting word of that, hearing that during some of the rallies, especially the latter rallies, where we set records. We had 56 unbelievable packed rallies, and nobody’s ever had anything like we had. We started hearing, “We love you.” I asked somebody, because we really liked Ronald Reagan. He was a great President. We had others, but I said, “Did anybody ever say that to Ronald Reagan or to any of our great…” and to the best of all of these political professionals’ knowledge and pollsters’, nobody’s ever heard that chant before, Matt, so it’s an honor. Believe me, it’s an honor. It’s a great honor. It’s a great honor. When you think about, we love you, you say that about, I hate to say it, am I a politician? I don’t know. Maybe I’m a politician. I hate to admit it, but that’s really… It’s an honor that you would say it.","https://www.rev.com/blog/transcripts/donald-trump-cpac-2021-speech-transcript","Donald Trump CPAC 2021 Speech Transcript","54:51"
"Donald Trump","We believe in patriotic education and strongly oppose the radical indoctrination of America’s youth. It’s horrible. We are committed to defending innocent life and to upholding the Judeo-Christian values of our founders and of our founding. We embrace free thought. We stand up to political correctives, and we reject left-wing lunacy, and in particular, we reject cancel culture.","https://www.rev.com/blog/transcripts/donald-trump-cpac-2021-speech-transcript","Donald Trump CPAC 2021 Speech Transcript","55:48"
"Donald Trump","We know that the rule of law is the ultimate safeguard. We affirm that the Constitution means exactly what it says, as written, as written. They want to change it. They want to change it. They want to get rid of it, frankly. We believe in law and order. We believe that the men and women of law enforcement are heroes who truly deserve our absolute support. We don’t defund the police. We are not defunding the police. We believe in standing up to China, shutting down, outsourcing, bringing back our factories and supply chains and ensuring that America, not China, dominates the future of the world. That’s what’s going to happen. By the way, we took in hundreds of billions of dollars from China during my administration, hundreds. They never gave us 25 cents. It was a one-way street. We took in hundreds of billions. During negotiations, they would say, “Look, the one thing, we don’t want any more of these tariffs, these tariffs.” Those tariffs, we took in so much money, and what happened is, they became competitive. What happened with people, they wouldn’t go to China. They’d build a lot of it back in our country. They would make it here instead. In addition to that, we were taking in billions and billions and billions of dollars from China. But in all fairness to China, we made a trade deal with them. This was prior to COVID. Once COVID happened, I no longer cared so much about the trade deal, because what happened with that was just disgraceful.","https://www.rev.com/blog/transcripts/donald-trump-cpac-2021-speech-transcript","Donald Trump CPAC 2021 Speech Transcript","56:40"
"Donald Trump","But that’s one of the things, that’s one of the reasons that right now our farmers are doing so good. I used to tell China, “Look, look, go and get a lot of wheat. Get a lot of different things, all of the things we just talked about, you better go out and do it, because this country has not been treated fairly by you for many, many years, many, many years.” We used to lose $504 billion trade deficit with China, 504, not million. $504 million is a lot, right? You know that through the World Health Organization. Now take 504 million and make it $504 billion, we had deficits with China. It was absolutely insane that this could keep going. It’s amazing that you still have a country left.","https://www.rev.com/blog/transcripts/donald-trump-cpac-2021-speech-transcript","Donald Trump CPAC 2021 Speech Transcript","58:21"
"Donald Trump","The people that did this to our country, they should be ashamed of themselves. They should be ashamed of themselves. Companies that leave America to create jobs in China and other countries that have ripped us off for years should not be rewarded. They should be tariffed, fined and punished. They should not be rewarded. That’s what the Biden administration is doing. But of course, as you know, they have a very close, personal relationship with China, so I don’t expect much to happen. It’s a shame, because it really is a threat. It’s a tremendous economic threat. Thank God we’ve rebuilt our military, but it’s a tremendous economic threat. Never forget it. These are the convictions that define our movement today and must define the Republican party in the years ahead. Very simple, it’s really quite simple, isn’t it?","https://www.rev.com/blog/transcripts/donald-trump-cpac-2021-speech-transcript","Donald Trump CPAC 2021 Speech Transcript","59:06"
"Donald Trump","Another one of the most urgent issues facing the Republican party is that of ensuring fair, honest and secure elections. Such a disgrace, such a disgrace, such a disgrace. We must pass comprehensive election reforms, and we must do it now. The Democrats used the China virus as an excuse to change all of the election rules without the approval of their state legislatures, making it therefore illegal and had a massive impact on the election. Again, you have to go to the legislatures to get these approvals. This alone would have easily changed the outcome of the election at levels that you wouldn’t have even believed. Even with COVID, even with all of the things, the numbers are staggering. We can never let this or other abuses of the 2020 election be repeated or happen again, can never let that happen again. You see what’s going on. We’ve been set back so greatly with other countries and with the world. We need election integrity and election reform immediately. Republicans should be the party of honest elections that can give everyone confidence in the future of our country. Without honest elections, who has confidence? Who has confidence? This issue is being studied and examined. But the reality is you cannot have a situation where ballots are indiscriminately pouring in from all over the country, tens of millions of ballots. Where are they coming from? They’re coming all over the place, where illegal aliens and dead people are voting, and many other horrible things are happening that are too voluminous to even mention, but people know.","https://www.rev.com/blog/transcripts/donald-trump-cpac-2021-speech-transcript","Donald Trump CPAC 2021 Speech Transcript","01:00:07"
"Donald Trump","I mean, it’s being studied, and the level of dishonesty is not to be believed. We have a very sick and corrupt electoral process that must be fixed immediately. This election was rigged, and the Supreme Court and other courts didn’t want to do anything about it.","https://www.rev.com/blog/transcripts/donald-trump-cpac-2021-speech-transcript","Donald Trump CPAC 2021 Speech Transcript","01:02:20"
"Audience","You won. You won. You won. You won. You won. You won. You won. You won. You won. You won. You won. You won. You won. You won. You won. You won. You won. You won. You won. You won. You won. You won.","https://www.rev.com/blog/transcripts/donald-trump-cpac-2021-speech-transcript","Donald Trump CPAC 2021 Speech Transcript","01:02:39"
"Donald Trump","We did.","https://www.rev.com/blog/transcripts/donald-trump-cpac-2021-speech-transcript","Donald Trump CPAC 2021 Speech Transcript","01:02:39"
"Audience","You won. You won. You won. You won.","https://www.rev.com/blog/transcripts/donald-trump-cpac-2021-speech-transcript","Donald Trump CPAC 2021 Speech Transcript","01:02:39"
"Donald Trump","If you just take that one element where they didn’t go through legislatures, it’s illegal. You can’t do it. It’s in the Constitution. They didn’t have the courage, the Supreme Court. They didn’t have the courage to act, but instead, used process and lack of standing. I was told the President of the United States has no standing. It’s my election. It’s your election. We have no standing. If you’re think of it, we had almost 20 states go into the Supreme Court so that we didn’t have a standing problem. They rejected it. They rejected it. They should be ashamed of themselves for what they’ve done to our country. They didn’t have the guts or the courage to make the right decision. They didn’t want to talk about it. You had the case led by the great State of Texas. 18 states went in, “You don’t have standing. Oh, let’s not talk about it.” They didn’t have the guts to do what should be done, and that’s on top of all of the other forms of cheating. But this is the most basic of all, they would have local courts and local politicians change the rules, in some cases, a day or two before the election. This should never be allowed to happen to another presidential candidate or presidential race, should never be allowed to happen.","https://www.rev.com/blog/transcripts/donald-trump-cpac-2021-speech-transcript","Donald Trump CPAC 2021 Speech Transcript","01:03:09"
"Donald Trump","Today I want to outline the steps that we must take to have an election system in this country that is honest, fair and accurate. We need one election day, not 45, 30, one day like it’s been. The Republicans don’t get this and the other things I’m going to say, that you should, like the Supreme Court, be ashamed of yourselves. One day, one day, and the only people that should be allowed to vote by mail are people that can be proven to be either very sick, or out of the country, or military where they can’t do it. One day. They have millions and millions of ballots sitting around all over the place for long periods of time. Gee, I wonder what happens with those ballots? I wonder what happens? It’s common sense. It’s a disgrace. It’s an absolute disgrace. There should be a legitimate reason for someone to vote absentee, has to have a reason. We should eliminate the insanity of mass and very corrupt mail-in voting.","https://www.rev.com/blog/transcripts/donald-trump-cpac-2021-speech-transcript","Donald Trump CPAC 2021 Speech Transcript","01:04:43"
"Donald Trump","We must have voter ID, voter ID. To get into the Democrat National Convention, when they had the convention, you needed voter ID. You needed an ID card. You couldn’t get in unless you had an ID. So many people told me you can’t get in that place. You need ID. Nobody had ID. You need voter ID. They know that. There’s a con job. They’re conning everybody. They know that. They know the wall was good. They knew the wall would work, but they didn’t want to have it, because we wanted it. I made one big mistake in the wall. I should have said, “We will not have a wall.” Then they would have said, “Let’s build a wall.” I made a big mistake. I made a big mistake. I’m sorry. It took us a year and a half extra. Because of that mistake, we will not have a wall. “We need a wall immediately,” said Chuck Schumer.","https://www.rev.com/blog/transcripts/donald-trump-cpac-2021-speech-transcript","Donald Trump CPAC 2021 Speech Transcript","01:06:03"
"Donald Trump","We need universal signature matching. They want to pass a bill where you don’t have to match signatures, where signatures don’t mean anything. Now they know it, just like with the wall, just like with voter ID, when you need to go into anything that’s Democrat run, you need it. But for voting, which is our most sacred institution, you don’t. They don’t want to let you have it. There should be a 100% requirement to verify the citizenship of every person who votes, and there must be a chain of custody protections for every ballot, every ballot. You saw what happened in Detroit and Philadelphia and many other places, swing states mostly, all over, but swing states mostly. You saw what happened? You saw what was going on.","https://www.rev.com/blog/transcripts/donald-trump-cpac-2021-speech-transcript","Donald Trump CPAC 2021 Speech Transcript","01:07:13"
"Donald Trump","You saw that more people… You take a look at the votes. When you have more votes than you have people, that’s a problem, right? Is that a problem? We have a little problem adjusting in Detroit. We seem to have more votes than we have people, a lot more votes, an election-changing number. We’re not talking about a number where you catch… No, these are election-changing numbers. In Pennsylvania, they had hundreds of thousands of more votes than they had people voting. What’s that all about? What’s that all about? Cheating, they say. Yeah, I’d say so.","https://www.rev.com/blog/transcripts/donald-trump-cpac-2021-speech-transcript","Donald Trump CPAC 2021 Speech Transcript","01:08:13"
"Donald Trump","In the history of our country, and it has taken place for years in Pennsylvania, in Detroit and various other places, but there’s tremendous, never like this, because they used COVID as a way of cheating. That’s what happened, and everybody knows it. Hundreds of thousands and millions of ballots, they used it as a way of getting what they’ve wanted for many years, and the Republicans have to do something about it. They’d better do something about it. Our election process is worse than that, in many cases, of a third-world country. You know that. You saw what was going on.","https://www.rev.com/blog/transcripts/donald-trump-cpac-2021-speech-transcript","Donald Trump CPAC 2021 Speech Transcript","01:08:50"
"Donald Trump","Even if you consider nothing else, it is undeniable that election rules were illegally changed at the last minute in almost every swing state, with the procedures rewritten by local politicians… you’re not allowed to do that… and local judges. They want more time. They want this. They want that. All done by local politicians or local judges, as opposed to state legislatures as required by the Constitution of the United States. These are numbers that are massive. These aren’t little numbers. These are numbers that in each state is a transformative number. It changes the outcome of the election, and it’s not close. Regardless of your political views, this should concern you as a constitutional matter. The Supreme court, again, didn’t have the guts or the courage to do anything about it, and neither did other judges.","https://www.rev.com/blog/transcripts/donald-trump-cpac-2021-speech-transcript","Donald Trump CPAC 2021 Speech Transcript","01:09:26"
"Donald Trump","Democrats even admitted in Time Magazine, which is I would say on the liberal side, that they couldn’t… They couldn’t hold it in. They had to brag about it, because what they did, they had a brag about it. They couldn’t do it. You got to read this story. It’s a disaster. It’s a disaster for our country that we can allow something so corrupt to happen. Read that article. I really encourage you. You read that article.","https://www.rev.com/blog/transcripts/donald-trump-cpac-2021-speech-transcript","Donald Trump CPAC 2021 Speech Transcript","01:10:24"
"Donald Trump","Yet all of the election integrity measures in the world will mean nothing if we don’t have free speech. That’s where we’re at now. If Republicans can be censored for speaking the truth and calling out corruption, we will not have democracy, and we will have only left-wing tyranny. We can do this. We can do this. We’re smarter than they are. We’re tougher than they are. For some reason, we just don’t. We don’t get it done. We let them attack our businesses, and we don’t attack their businesses. I believe your numbers are bigger than their numbers, but you’re nicer than they are. You’re not as vicious as they are.","https://www.rev.com/blog/transcripts/donald-trump-cpac-2021-speech-transcript","Donald Trump CPAC 2021 Speech Transcript","01:10:52"
"Donald Trump","In the past, we would debate. I would have it. I’d debate. You’ve seen me for many years. They’d throw something. I debate. They debate. Who knows who wins. People go. They vote. They see what happens, but they would have an idea. They would disagree. The public would hear it. The debate and discourse would take place, and then somebody would make a decision. You would win. You would lose. The public would make up its mind. But now there is no debate, because they refuse to allow our side to even speak or be heard.","https://www.rev.com/blog/transcripts/donald-trump-cpac-2021-speech-transcript","Donald Trump CPAC 2021 Speech Transcript","01:11:35"
"Donald Trump","There is no debate because they refuse to allow our side to even speak or be heard. They don’t want debate, because we have easy victories in a debate, very easy victories. It’s is called common sense. It’s called other things, but it’s called common sense. So they don’t want a debate. The time has come to break up big tech monopolies and restore fair competition. Republicans, conservatives must open up our platforms and repeal section 230 liability protections. And if the federal government refuses to act, then every state in the union where we have the votes, which is a lot of them, big tech giants, like Twitter, Google, and Facebook should be punished with major sanctions whenever they silence conservative voices. And governor Ron DeSantis of Florida and in Texas and in other States are doing this. If they do what they’re doing, Florida, and that legislation will pass. And Texas and others will have tremendous power to do what’s right and what’s fair.","https://www.rev.com/blog/transcripts/donald-trump-cpac-2021-speech-transcript","Donald Trump CPAC 2021 Speech Transcript","01:12:03"
"Donald Trump","We have no time to waste, Nancy Pelosi and the Democrats in Congress are racing to pass a flagrantly unconstitutional attack on the first amendment and the integrity of our elections known as HR 1. Do you know what HR 1 is? It’s a disaster. Their bill would drastically restrict political speech, empower power the federal government to shut down decent. And turn the Federal Election Commission into a partisan political weapon. In addition, it virtually eliminates voter ID requirements nationwide, effectively ends all registration deadlines. Can you believe this? Requires States to give ballots to felons, automatically registers every welfare recipient to vote, and puts unaccountable unelected bureaucrats in charge of drawing congressional districts. That’s going to be a lot of fun. This monster must be stopped. It cannot be allowed to pass. Now more than ever is the time for tough strong and energetic Republican leaders who have spines of steel. We need strong leadership. We cannot have leaders who show more passion for condemning their fellow Americans than they have ever shown for standing up to Democrats, the media, and the radicals who want to turn America into a socialist country. Instead of attacking me and more importantly the voters of our movement, top establishment Republicans in Washington should be spending their energy in opposing Biden, Pelosi, Schumer, and the Democrats. I’ve said to some of them, I said, “You know, during the Obama years, and now during Biden, if you spent the same energy on attacking them, you’d actually be successful as you do on attacking me, in many cases.” The Democrats don’t have grandstanders like Mitt Romney, little Ben Sasse, Richard Burr, Bill Cassidy, Susan Collins, Lisa Murkowski, Pat Toomey, and in the house, Tom Rice, South Carolina, Adam Kinzinger, Dan Newhouse, Anthony Gonzalez. That’s another beauty. Fred Upton, Jaime Herrera Beutler, Peter Meyer, John Katko, David Valadao. And of course the warmonger, a person that loves seeing our troops fighting, Liz Cheney. How about that? The good news is in her state, she’s been censured, and in her state, her poll numbers have dropped faster than any human being I’ve ever seen. So hopefully they’ll get rid of her with the next election. Get rid of them all. Democrats are vicious. Remember this, it’s true. Democrats are vicious.","https://www.rev.com/blog/transcripts/donald-trump-cpac-2021-speech-transcript","Donald Trump CPAC 2021 Speech Transcript","01:13:33"
"Donald Trump","He said evil, well, there is evil there, but they’re vicious, they’re smart, and they do one thing. You got to hand it to them. They always stick together. You don’t have Mitt Romney’s in the group. They always stick together. Fortunately, for the Republican party, the Democrats have horrible policies like open borders, sanctuary cities, defunding the police, and the ridiculous, totally ridiculous green new deal. So, they stick together, they’re smart. They’re vicious, they got everything going, but their policies are no good. So hence, we have, congratulations, the Republican party. After this, they may not stick with those policies. We have to be careful. No, their policies are horrible. Think of it, defund the police. How did that work out? But if Republicans do not stick together, the rhinos that we’re surrounded with will destroy the Republican party and the American worker, and will destroy our country itself, the rhinos, Republican in name only, but the Republican party is united. The only division is between a handful of Washington DC establishment political hacks, and everybody else all over the country.","https://www.rev.com/blog/transcripts/donald-trump-cpac-2021-speech-transcript","Donald Trump CPAC 2021 Speech Transcript","01:16:52"
"Donald Trump","I think we have tremendous unity. When you look at the crowds outside that want your seats so badly, they will take your seat in two seconds. They want your seat. Congratulations. Congratulations on getting in by the way. I’m very impressed. And that’s why I’m announcing that I will be actively working to elect strong, tough and smart Republican leaders.","https://www.rev.com/blog/transcripts/donald-trump-cpac-2021-speech-transcript","Donald Trump CPAC 2021 Speech Transcript","01:18:19"
"Crowd","USA, USA, USA, USA, USA, USA, USA, USA, USA.","https://www.rev.com/blog/transcripts/donald-trump-cpac-2021-speech-transcript","Donald Trump CPAC 2021 Speech Transcript","01:18:44"
"Donald Trump","Speaking of that, I heard Jim Jordan did a great job. Right? Thank you. I heard that from Mark Meadows. I heard it, oh, there he is. Look at that. Hi Jim. I heard you were great. In fact, I hated to follow you. I want to follow other people. I could name them too. I like to follow other people. I heard you were great. Thank you Jim, very much. Jim Jordan. A great, great athlete. People don’t know he was a great wrestler, tremendous numbers of victories. He was a champion. He was college champion for a long period of time. He’s a winner and a leader and he doesn’t play games. He likes to win. He likes to win. And we have a lot of people in our party that like to win Jim, right? But I heard you were great, thank you very much. But we want Republican leaders who are loyal to the voters and who will work proudly for the vision that I’ve laid out today. And what is it? So simple, right? So simple, military, law and order, great trade deals, great education. So simple.","https://www.rev.com/blog/transcripts/donald-trump-cpac-2021-speech-transcript","Donald Trump CPAC 2021 Speech Transcript","01:19:13"
