"speaker","transcription","url","headlin","timing"
"Donald Trump","Thank you. Thank you.","https://www.rev.com/blog/transcripts/donald-trump-speech-transcript-gang-violence-law-enforcement-police","Donald Trump Speech Transcript on Gang Violence to Law Enforcement Officers","00:13"
"Crowd","USA. USA. USA. USA. USA. USA.","https://www.rev.com/blog/transcripts/donald-trump-speech-transcript-gang-violence-law-enforcement-police","Donald Trump Speech Transcript on Gang Violence to Law Enforcement Officers","00:13"
"Donald Trump","Well, thank you very much. This is certainly being home for me. I spent a lot of time right here. I was in Queens, so I’d come here and this was like the luxury location for me and I love it. I love the people here. Even coming in from the airport, I sat with Nikki Haley, who’s here someplace. Where’s our Nikki? Ambassador Nikki Haley, who is so incredible. And she’s seen crowds in her life. And she said, “Boy. Those are really big crowds.” Crowds of people all lining the streets all the way over to here and it’s really a special place. And so when I heard about this, I said, “I want to do that one.” But I really wanted to do it, not because of location, but because, as you know, I am the big, big believer and admirer of the people in law enforcement. Okay? From day one. From day one.","https://www.rev.com/blog/transcripts/donald-trump-speech-transcript-gang-violence-law-enforcement-police","Donald Trump Speech Transcript on Gang Violence to Law Enforcement Officers","00:38"
"Donald Trump","We love our police. We love our sheriffs and we love our ICE officers and they have been working hard. Thank you. They have been working hard","https://www.rev.com/blog/transcripts/donald-trump-speech-transcript-gang-violence-law-enforcement-police","Donald Trump Speech Transcript on Gang Violence to Law Enforcement Officers","01:38"
"Donald Trump","Together we’re going to restore safety to our streets and peace to our communities. And we’re going to destroy the vile criminal cartel, MS-13, and many other gangs… But MS-13 is particularly violent. They don’t like shooting people because it’s too quick. It’s too fast. I was reading… One of these animals was caught and explaining they liked to knife them and cut them and let them die slowly because that way it’s more painful and they enjoy watching that much more. These are animals.","https://www.rev.com/blog/transcripts/donald-trump-speech-transcript-gang-violence-law-enforcement-police","Donald Trump Speech Transcript on Gang Violence to Law Enforcement Officers","01:52"
"Donald Trump","We’re joined today by police and sheriffs from Suffolk, Nassau, Duchess and Ulster counties. State police from New York and New Jersey. Many of you I know. Great friends. Immigration and customs enforcement officers, and law enforcement personnel from a number of federal agencies, so we’re loaded up with great people. That’s what I call it. And I want to just tell you all together right now, and the reason I came… This is the most important sentence to me. On behalf of the American people, I want to say, “Thank you. Thank you very much.”","https://www.rev.com/blog/transcripts/donald-trump-speech-transcript-gang-violence-law-enforcement-police","Donald Trump Speech Transcript on Gang Violence to Law Enforcement Officers","02:29"
"Donald Trump","Thank you. And I don’t think you know how much the public respects and admires you. You’re saving American lives every day and we have your backs. Believe me. We have your backs 100%. Not like the old days. Not like the old days.","https://www.rev.com/blog/transcripts/donald-trump-speech-transcript-gang-violence-law-enforcement-police","Donald Trump Speech Transcript on Gang Violence to Law Enforcement Officers","03:13"
"Donald Trump","You know, when you want to take over used military equipment, they were saying you couldn’t do it, you know what I said. That was my first day. You can do it. In fact, that stuff is disappearing so fast we have none left. You guys know how to you… You really knew how to get that, but that’s my honor. And I’ll tell you what, it’s being put to good use.","https://www.rev.com/blog/transcripts/donald-trump-speech-transcript-gang-violence-law-enforcement-police","Donald Trump Speech Transcript on Gang Violence to Law Enforcement Officers","03:51"
"Donald Trump","I especially want to thank ICE director, Tom Homan, who has done an incredible job in just a short period of time. Tom. Get up here. I know you’re just…","https://www.rev.com/blog/transcripts/donald-trump-speech-transcript-gang-violence-law-enforcement-police","Donald Trump Speech Transcript on Gang Violence to Law Enforcement Officers","04:28"
"Donald Trump","Tom is determined to rid our nation of cartels and criminals who are preying on our citizens. And I can only say to Tom, “Keep up the great work.” He’s a tough guy. He’s a tough cookie. Somebody said the other day… They saw him on television. Somebody that were interviewed after that, they said, “He looks very nasty. He looks very mean.” I said, “That’s what I’m looking for.” That’s exactly what I was looking for.","https://www.rev.com/blog/transcripts/donald-trump-speech-transcript-gang-violence-law-enforcement-police","Donald Trump Speech Transcript on Gang Violence to Law Enforcement Officers","04:50"
"Donald Trump","And for that, I want to congratulate John Kelly, who has done an incredible job of Secretary of Homeland Security. Incredible. One of our real stars. Truly one of our stars. John Kelly is one of our great stars. You know, the borders down 78%. under past administrations, the border didn’t go down it went up. But if it went down 1%, it was like, this was a great thing. Down 78%. And, in fact, the Southern border of Mexico? We did them a big favor. Believe me. They get very little traffic in there anymore because they know they’re not going to get through the border to the United States. So, that whole group has been incredible. Led by General Kelly.","https://www.rev.com/blog/transcripts/donald-trump-speech-transcript-gang-violence-law-enforcement-police","Donald Trump Speech Transcript on Gang Violence to Law Enforcement Officers","05:16"
"Donald Trump","Let me also express our gratitude to the members of the New York delegation here today. Congressman Chris Collins. Where’s Chris? Where’s Chris? Oh. Chris. Right from the beginning, he said, “Trump is going to win.” Trump is going to win. That’s why I like him. I didn’t like him that much before now. I love him. I’ll never… Dan Donovan. Thanks, Dan. Thank you, Dan. And Lee Zeldin, who I supported right from the beginning when they said he didn’t have a chance of beating a pretty popular incumbent. And I saw him in a debate, I said, “I think this guy’s going to win.” But he fought a pretty popular guy. And I said, “I think he’s going to win.” And went heavy for him and he won. And he won pretty easily, didn’t you? Pretty good. I’m proud of you. Great job.","https://www.rev.com/blog/transcripts/donald-trump-speech-transcript-gang-violence-law-enforcement-police","Donald Trump Speech Transcript on Gang Violence to Law Enforcement Officers","06:05"
"Donald Trump","And, of course, a legend, somebody that we all know very well, sort of my neighbor because I consider him a neighbor, but he’s really a great and highly respected man in Washington, Congressman Peter King. Very respected guy. He is a respected man that people like to ask opinions of. I do. Congressman King and his colleagues know the terrible pain and violence MS-13 has inflicted upon this community and this country. And if you remember, just a little more than two years ago, when I came down the escalator with Melania and I made the speech. People coming into this country, everyone said, “What does he know? What’s he talking about?” And there was Bedlam. Remember Bedlam? And then about two months later, they said, “You know, he’s right.” So I’m honored to have brought it to everybody’s attention, but the suffering and the pain that we were going through… And now you can look at the numbers. It’s a whole different world. And it will get better and better and better because we’ve been able to start nipping it in the bud. We’ve nipped it in the bud. Let’s call it, “Start nipping it in the…. In the bud.”","https://www.rev.com/blog/transcripts/donald-trump-speech-transcript-gang-violence-law-enforcement-police","Donald Trump Speech Transcript on Gang Violence to Law Enforcement Officers","07:08"
"Donald Trump","And MS-13, the cartel, has spread gruesome bloodshed throughout the United States. We’ve gotten a lot of them out of here. Big, big percentage. But the rest of coming. They’ll be out of here quickly, right? Quickly. Good.","https://www.rev.com/blog/transcripts/donald-trump-speech-transcript-gang-violence-law-enforcement-police","Donald Trump Speech Transcript on Gang Violence to Law Enforcement Officers","08:29"
"Donald Trump","So, I asked Tom on the plane… He was ever in Air Force One, I said, “How do you like it?” He said, “I like it.” But I said, “Hey, Tom, let me ask you a question. How tough are these guys? MS-13?” He said-","https://www.rev.com/blog/transcripts/donald-trump-speech-transcript-gang-violence-law-enforcement-police","Donald Trump Speech Transcript on Gang Violence to Law Enforcement Officers","08:51"
"Donald Trump","Tom, let me ask you a question. How tough are these guys, MS-13? He said, “They’re nothing compared to my guys. Nothing.” And that’s what you need. Sometimes that’s what you need. Right? For many years, they exploited America’s weak borders and lax immigration enforcement to bring drugs and violence to cities and towns all across America. They’re there right now because of weak political leadership, weak leadership, weak policing, and in many cases, because the police weren’t allowed to do their job. I’ve met police that are great police that aren’t allowed to do their job because they have a pathetic mayor, or a mayor doesn’t know what’s going on. Were you applauding for someone in particular? It’s sad. It’s sad. You look at what’s happening, it’s sad. But hopefully, certainly in the country, those days are over. You may have a little bit longer to wait. But from now on, we’re going to enforce our laws, protect our borders and support our police like our police have never been supported before. We’re going to support you like you’ve never been supported before.","https://www.rev.com/blog/transcripts/donald-trump-speech-transcript-gang-violence-law-enforcement-police","Donald Trump Speech Transcript on Gang Violence to Law Enforcement Officers","09:03"
"Donald Trump","Few communities have suffered worse at the hands of these MS-13 thugs than the people of Long Island. Hard to believe. I grew up on long Island. I didn’t know about this. I didn’t know about this. And then all of a sudden, this is like a new phenomena. Our hearts and our nation grieve for the victims and their families. Since January 16th, think of this, MS-13 gang members have brutally murdered 17 beautiful young lives in this area on Long Island alone. Think of it. They butchered those little girls. They kidnap, they extort, they rape and they rob. They prey on children. They shouldn’t be here. They stomp on their victims, they beat them with clubs, they slash them with machetes, and they stab them with knives. They have transformed peaceful parks and beautiful quiet neighborhoods into blood stained killing fields. They’re animals.","https://www.rev.com/blog/transcripts/donald-trump-speech-transcript-gang-violence-law-enforcement-police","Donald Trump Speech Transcript on Gang Violence to Law Enforcement Officers","10:49"
"Donald Trump","We cannot tolerate as a society the spilling of innocent, young, wonderful, vibrant people, sons and daughters, even husbands and wives. We cannot accept this violence one day more. Can’t do it. And we’re not going to do it. Because of you, we’re not going to be able to do it. You’re not going to allow it to happen. And we’re backing you up 100%. Remember that, 100%.","https://www.rev.com/blog/transcripts/donald-trump-speech-transcript-gang-violence-law-enforcement-police","Donald Trump Speech Transcript on Gang Violence to Law Enforcement Officers","12:07"
"Donald Trump","It is the policy of this administration to dismantle, decimate, and eradicate MS-13 at every other … And I have to say, MS- 13, that’s a name. Rough groups, that’s fine. We’ve got a lot of others. And they were all let in here over a relatively short period of time. Not during my period of time, believe me, but we’re getting them out. They’re going to jails, and then they’re going back to their country. Or, they’re going back to their country, period.","https://www.rev.com/blog/transcripts/donald-trump-speech-transcript-gang-violence-law-enforcement-police","Donald Trump Speech Transcript on Gang Violence to Law Enforcement Officers","12:52"
"Donald Trump","One by one, we’re liberating our American towns. Can you believe that I’m saying that? I’m talking about liberating our towns. It’s like I’d see in a movie. They’re liberating the town, like in the old wild West, right? We’re liberating our towns. I never thought I’d be standing up here talking about liberating the towns on Long Island, where I grew up, but that’s what you’re doing. And I can tell you, I saw some photos where Tom’s guys, rough guys, they’re rough. I don’t want to be, I don’t want to, you know, say it because they’ll say that’s not politically correct. You’re not allowed to have rough people doing this kind of work. We have to get … Just like they don’t want to have rich people at the head of Treasury. Okay?","https://www.rev.com/blog/transcripts/donald-trump-speech-transcript-gang-violence-law-enforcement-police","Donald Trump Speech Transcript on Gang Violence to Law Enforcement Officers","13:29"
"Donald Trump","Like, I want a rich guy at the head of Treasury, right? Right? Right? I want a rich guy at the head of Commerce, because we’ve been screwed so badly on trade deals, I want people that made a lot of money now to make a lot of money for our country. And by the way, as I was walking up, they just gave me the numbers. Our numbers just came out this morning. GDP is up double from what it was in the first quarter. 2.6%. We’re doing well. We’re doing really well. And we took off all those restrictions and some we’re statutorily stuck with for a little while. But eventually that statute comes up and we’re going to be able to cut a lot more. But we’ve sort of liberated the world of creating jobs, like you’re liberating us and the people that live in areas.","https://www.rev.com/blog/transcripts/donald-trump-speech-transcript-gang-violence-law-enforcement-police","Donald Trump Speech Transcript on Gang Violence to Law Enforcement Officers","14:17"
"Donald Trump","But I have to say, one by one, we are indeed freeing up these great American towns and cities that are under siege from gang violence. Look at Los Angeles. Look at what’s going on in Los Angeles. Look at Chicago. What is going on? Is anybody here from Chicago? We have to send some of you to Chicago, I think. What’s going on? I mean, you see what’s happening there? Do we agree? Is there something maybe … Is there something …","https://www.rev.com/blog/transcripts/donald-trump-speech-transcript-gang-violence-law-enforcement-police","Donald Trump Speech Transcript on Gang Violence to Law Enforcement Officers","15:27"
"Donald Trump","I have to tell you one Chicago story. So, Chicago is having this unbelievable violence. People being killed. Four, five, six in a weekend, and I’m saying what is going on? When I was running, we had motorcycle brigades take us to the planes and stuff. And one of the guys, really good, you could see a really respected officer, police officer. He was at the head. He was the boss. And you could see he was the boss. He actually talked like the boss, come on, get lined up, because I’d always take pictures with the police, because I did that. My guys said don’t do it. Don’t do it. Other candidates didn’t do it, that I was beating by 40 points. Can you believe it? But I did it. Maybe that’s why I was winning by 40 points, but other candidates wouldn’t do it. But I always took the pictures with the police.","https://www.rev.com/blog/transcripts/donald-trump-speech-transcript-gang-violence-law-enforcement-police","Donald Trump Speech Transcript on Gang Violence to Law Enforcement Officers","16:12"
"Donald Trump","But we’re in Chicago and we had massive motorcycle brigades. And you know, those people have to volunteer. I don’t know if you know that, but from what I understand they have to volunteer. And I had the biggest brigades. I had brigades sometimes with almost 300 motorcycles. Even I was impressed. I’d look ahead and it was nothing but motorcycles, because they’d volunteer from all of the various states. But this one guy was impressive. He was a rough cookie and really respected guy. I could see he was respected. And he’s like, “All right, come on, get over here, get over here. He’s got to get to work. Get over here.” And I said, “So let me tell you, you’re from Chicago?” “Yes, sir.” I said, “What the hell is going on?” And he said, “It’s a problem can be straightened out.” I said, “ow long would it take you to straighten out this problem?” He said, “If he gave me the authority, couple of days. I really mean it.” I said, “You really think so?” He said, “A couple of days. We know all the bad ones.”","https://www.rev.com/blog/transcripts/donald-trump-speech-transcript-gang-violence-law-enforcement-police","Donald Trump Speech Transcript on Gang Violence to Law Enforcement Officers","17:02"
"Donald Trump","I said, you really think so? He said a couple of days. We know all the bad ones, we know them all. And he said, the office is you guys, you know all the bad ones in your area, you know them by their names. I said, we know them all. A couple of days. I said, you’ve got to be kidding. Now this is a year and a half ago. I said, give me your card. And he gave me a card and I sent it to the mayor. I said, you ought to try using this guy. Guess what happened? Never heard. And last week they had another record. It’s horrible, but we’re just getting started. We will restore law and order on Long Island. We’ll bring back justice to the United States. I’m very happy to have gotten a great justice of the United States Supreme court, not only nominated but approved. And by the way, your second amendment is safe.","https://www.rev.com/blog/transcripts/donald-trump-speech-transcript-gang-violence-law-enforcement-police","Donald Trump Speech Transcript on Gang Violence to Law Enforcement Officers","18:03"
"Donald Trump","Your second amendment is safe. I feel very good about that. Wasn’t looking so good for the second amendment. Was it? Huh? If Trump doesn’t win, your second amendment is gone. Your second amendment would be gone. But I have a simple message today for every gang member and criminal alien that are threatening, so violently, our people. We will find you, we will arrest you, we will jail you and we will deport you. And we had some problems with certain countries, still do with a couple, but we’ll take care of them. Don’t worry about it. Anytime we have a trade deficit, it’s very easy, which is almost everywhere. We have trade deficits with almost every country, because we had a lot of really bad negotiators making deals with other countries. So it’s almost everywhere. So that takes care of itself. But we had certain countries in South America where they wouldn’t take the people back.","https://www.rev.com/blog/transcripts/donald-trump-speech-transcript-gang-violence-law-enforcement-police","Donald Trump Speech Transcript on Gang Violence to Law Enforcement Officers","19:09"
"Donald Trump","I said, that’s okay, no more trade. All of a sudden they started taking their people back. It’s amazing. Isn’t it? They used to send to the former secretary of state of the country, please call, would you please work it so that we could take? And they used to just tell her, no, we won’t take back. They take back with us every single time. We’re having very little problem. Are we having any problem right now with that? Huh? You better believe it. Give me the names of the few problems. We’ll take care of it, I’m telling you. It’s unbelievable. One of the people that represented the other administration, I said, why didn’t you use that? The power of economic? Sir, we think one thing has nothing to do with another. I said, oh, really? So we’ll have big deficits and they won’t take back these criminals that came from there and should be back there?","https://www.rev.com/blog/transcripts/donald-trump-speech-transcript-gang-violence-law-enforcement-police","Donald Trump Speech Transcript on Gang Violence to Law Enforcement Officers","20:23"
"Donald Trump","Well, believe me to me, everything matters, but they’re all taking them back. I saw offices recently conducted the largest crackdown on criminal gangs in the history of our country. In just six weeks, ICE and our law enforcement partners arrested nearly 1,400 suspects and sees more than 200 illegal firearms and some beauties and nearly 600 pounds of narcotics. The men and women of ICE are turning the tide in the battle against MS-13, but we need more resources from Congress and we’re getting them. Congress is actually opening up and really doing a job. They should have approved healthcare last night, but you can’t have everything. Boy, oh, boy. They’ve been working on that one for seven years. Can you believe that? The swamp, but we’ll get it done. We’re going to get it done. I said from the beginning, let Obamacare implode and then do it. I turned out to be right. Let Obamacare implode.","https://www.rev.com/blog/transcripts/donald-trump-speech-transcript-gang-violence-law-enforcement-police","Donald Trump Speech Transcript on Gang Violence to Law Enforcement Officers","21:20"
"Donald Trump","Right now we have less than 6,000 enforcement and removal officers in ICE. This is not enough to protect a nation of more than 320 million people. It’s essential that Congress fund another 10,000 ICE officers, and we’re asking for that, so that we can eliminate MS-13 and root out the criminal cartels from our country. Now we’re getting them out anyway, but we would like to get them out a lot faster. And when you see these towns and when you see these thugs being thrown into the back of a patty wagon, you just see them thrown in rough. I said, please, don’t be too nice. Like when you guys put somebody in the car and you’re protecting their head, the way you put their hand over… Like don’t hit their head and they’ve just killed somebody. Don’t hit their head. I said, you can take the hand away. Okay? It’s essential that Congress fund hundreds more federal immigration judges and prosecutors. And we need them quickly.","https://www.rev.com/blog/transcripts/donald-trump-speech-transcript-gang-violence-law-enforcement-police","Donald Trump Speech Transcript on Gang Violence to Law Enforcement Officers","22:40"
"Donald Trump","If we’re going to dismantle these deadly networks and I have to tell you, the laws are so horrendously stacked against us because for years and years, they’ve been made to protect the criminal. Totally made to protect the criminal, not the offices. You do something wrong, you’re in more jeopardy than they are. These laws are stacked against you. We’re changing those laws. But in the meantime, we need judges for the simplest thing, things that you should be able to do without a judge, but we have to have those judges quickly. In the meantime, we’re trying to change the laws. We’re also working with chairman Bob Goodlatte on a series of enforcement measures, and he’s a terrific guy, to keep our country safe from crime and terrorism. And in particular, radical Islamic terrorism. A term never uttered by past administration, never uttered. Did anybody ever hear that term? I don’t think so.","https://www.rev.com/blog/transcripts/donald-trump-speech-transcript-gang-violence-law-enforcement-police","Donald Trump Speech Transcript on Gang Violence to Law Enforcement Officers","23:57"
"Speaker 2","No! [crosstalk 00:25:08]","https://www.rev.com/blog/transcripts/donald-trump-speech-transcript-gang-violence-law-enforcement-police","Donald Trump Speech Transcript on Gang Violence to Law Enforcement Officers","25:06"
