"speaker","transcription","url","headlin","timing"
"Speaker 2","No.","https://www.rev.com/blog/transcripts/donald-trump-speech-transcript-at-the-hope-for-prisoners-graduation-ceremony","Donald Trump Speech Transcript at the Hope for Prisoners Graduation Ceremony","23:05"
"Donald Trump","Okay. You’re going to have some recommendations. I want your recommendations, because you have… we have thousands of people in prison that have stories like Alice Johnson, thousands and thousands of people. And I love doing it. I love doing it. And you can be poor, you can be middle-income, you can be rich. It’s injustice is injustice, but you have thousands of people that shouldn’t be there. And I love finding those people. As you find them as you really think… but you can’t let me down. They got to be right, because there are some people you don’t want to do this with. You do know that.","https://www.rev.com/blog/transcripts/donald-trump-speech-transcript-at-the-hope-for-prisoners-graduation-ceremony","Donald Trump Speech Transcript at the Hope for Prisoners Graduation Ceremony","23:05"
"Donald Trump","I said to Alice, “So Alice, let me ask you, you have a lot of people like yourself, right?” Yes. But you have bad people too, don’t you? Yes, we do. Some very bad people. I said, “Good, because I wouldn’t want somebody to say no, everybody’s good, because that’s not the case.” But she’s given us great recommendations and she’s a great woman.","https://www.rev.com/blog/transcripts/donald-trump-speech-transcript-at-the-hope-for-prisoners-graduation-ceremony","Donald Trump Speech Transcript at the Hope for Prisoners Graduation Ceremony","23:43"
"Donald Trump","To redress unfairness in the justice system, just over one year ago, I led the effort to pass the criminal justice reform, and others had tried and failed. They didn’t try too hard because they know it couldn’t be done. But we got it done. This law rolls back provisions of the really terrible 1994 Criminal Clinton Crime Law that disproportionately impacted the African American community. I mean they like Clinton, but they passed a law that was a disaster. You know that. But we did something about it. They were unable to do it all the way back. We did something about it.","https://www.rev.com/blog/transcripts/donald-trump-speech-transcript-at-the-hope-for-prisoners-graduation-ceremony","Donald Trump Speech Transcript at the Hope for Prisoners Graduation Ceremony","24:02"
"Donald Trump","And my recent budget provides over $400 million to expand vocational training, drug treatment, and critical reentry programs just like this one. Okay. You know that. He knows it. By enacting criminal justice reform, we’re sending a powerful message to prisoners who have reformed their lives. When you return to society, we are not going to leave you behind. We’re not leaving you behind. But now we don’t have the excuse of a bad economy. They used to have the excuse, well, we can’t do it, the economy’s no good. The unemployment rates were very high. We’re down to 3.5%. We’re probably going lower and wages are going up, first time in 21 years. They’re really going up and going up. It’s a beautiful thing. If you’re in my world, it’s a beautiful thing to watch. It’s like a picture. Everyone in this room is here to make sure that you have the support that you need to succeed, thrive, and to never ever look back. You’re not going to look back. We’re not going to look back.","https://www.rev.com/blog/transcripts/donald-trump-speech-transcript-at-the-hope-for-prisoners-graduation-ceremony","Donald Trump Speech Transcript at the Hope for Prisoners Graduation Ceremony","24:51"
"Donald Trump","And we’re joined today by many great pastors and faith leaders, some of whom I know pretty well, who trust the power of prayer and the mercy of God to transform their lives. And I want to thank you all for being here. Thank you. Great, great faith leaders. Thank you. Please stand up. Please stand up. Great. Thank you. Thank you, father. Great job. Actually been to a couple of their churches. Thank you very much.","https://www.rev.com/blog/transcripts/donald-trump-speech-transcript-at-the-hope-for-prisoners-graduation-ceremony","Donald Trump Speech Transcript at the Hope for Prisoners Graduation Ceremony","25:58"
"Donald Trump","Also with us or our employers of many different industries who are here to recruit you. Don’t ask for too much. Just take it nice and easy. Don’t forget they want to make a good deal, but you do too. But they want to recruit you for great jobs and they’re here. Who are the people that are looking? Who are the people, the employers please? Yeah, stand up please. That’s great. That’s good. That’s great. Great. You’re going to be happy. You’re going to be very happy.","https://www.rev.com/blog/transcripts/donald-trump-speech-transcript-at-the-hope-for-prisoners-graduation-ceremony","Donald Trump Speech Transcript at the Hope for Prisoners Graduation Ceremony","26:29"
"Donald Trump","Including the Las Vegas Chamber of Commerce, who really has done a fantastic job over the years. I’ve known how hard they work and what a great job they do. Station’s Casinos, Martin and Harris Construction, civil work, general contractor, Silver State Transportation, Keolis Transit and Workforce Connections. And I want to thank you all and we have a lot of others outside that are coming in too, and you’re going to have a lot of… you’re going to have a lot of fun. It’s nice to be loved, right? It’s nice to be wanted. You’re wanted. You’re wanted. Finally… you are. You’re wanted. Right John?","https://www.rev.com/blog/transcripts/donald-trump-speech-transcript-at-the-hope-for-prisoners-graduation-ceremony","Donald Trump Speech Transcript at the Hope for Prisoners Graduation Ceremony","27:03"
"Donald Trump","Finally, we’re proudly, really proud to be joined by more than 80 men and women, these people are so incredible, of law enforcement. The job they do. Sheriff, the job… please stand up. You don’t know how much people respect you. You don’t hear it. You don’t hear it. People respect you like you wouldn’t believe. So we just want to thank you all. The job you do is incredible, law enforcement. We honor your selfless service and bravery.","https://www.rev.com/blog/transcripts/donald-trump-speech-transcript-at-the-hope-for-prisoners-graduation-ceremony","Donald Trump Speech Transcript at the Hope for Prisoners Graduation Ceremony","27:48"
"Donald Trump","By the way, fire department also. I just left an area of the country where two firemen were just killed and a terrible. Up in certain portion of beautiful place in California where a building collapsed. Two people killed, two firemen killed, and we honor them. This took place yesterday, but they’re fantastic. But I want to thank law enforcement, because the job you do is incredible and the respect that people have for you, you’ll never know how strong it is. It’s strong and I think it’s stronger now than ever before. And now you have an administration that loves you, backs you. We give you the equipment that you need. We gave billions of dollars of equipment. We had surplus equipment, military equipment, incredible stuff sitting in hundreds of warehouses all over the United States. And for some reason other people didn’t want to give it out. But I gave it out and I assume you got some of it right? You got some of it. I know the man, he probably got most of it. Right? That’s good. It keeps you safe.","https://www.rev.com/blog/transcripts/donald-trump-speech-transcript-at-the-hope-for-prisoners-graduation-ceremony","Donald Trump Speech Transcript at the Hope for Prisoners Graduation Ceremony","28:34"
"Donald Trump","As you know, Hope for Prisoners has pioneered a mentorship program with law enforcement, which has given strength and support to former inmates like Lois Hockersmith and she joins us today. Lois. Where’s Lois? For many years, Lois struggled with addiction. In May of 2012, she found herself pregnant and in jail. After she served her time, Lois participated in Hope for Prisoners program. She graduated in 2013 and since then Lois has stayed totally sober. She’s earned back custody of her precious, beautiful son and she is one of the best case managers here at Hope for Prisoners. Is that right? That’s good, that’s great. Thank you. Wow. Come on up here, Lois. Come on up here. Through it all, Lois has been encouraged by her mentor who is the same officer who arrested her nearly eight years ago. Lieutenant Steve Riback, who also joins us today. Hey Steve, come on up. Is Steve here? Steve is here. Steve, come up.","https://www.rev.com/blog/transcripts/donald-trump-speech-transcript-at-the-hope-for-prisoners-graduation-ceremony","Donald Trump Speech Transcript at the Hope for Prisoners Graduation Ceremony","29:41"
"Donald Trump","Thank you.","https://www.rev.com/blog/transcripts/donald-trump-speech-transcript-at-the-hope-for-prisoners-graduation-ceremony","Donald Trump Speech Transcript at the Hope for Prisoners Graduation Ceremony","31:12"
"Lois Hockersmith","Pleasure to meet you sir.","https://www.rev.com/blog/transcripts/donald-trump-speech-transcript-at-the-hope-for-prisoners-graduation-ceremony","Donald Trump Speech Transcript at the Hope for Prisoners Graduation Ceremony","31:12"
"Donald Trump","Hey, whoa, he’s good looking, huh? Come here. Thank you. Thank you. Well, we’re with you 100%. It’s good. Please. You like to say something?","https://www.rev.com/blog/transcripts/donald-trump-speech-transcript-at-the-hope-for-prisoners-graduation-ceremony","Donald Trump Speech Transcript at the Hope for Prisoners Graduation Ceremony","31:12"
"Lois Hockersmith","Yes. So first of all, I want to thank this officer. He saved our lives that night that he arrested me and my son. He arrested me. I was pregnant with him and I gave birth to him that night. And not all our heroes wear capes. Some wear badges. Had he not been doing his job that night, I wouldn’t be here. John Ponder, listen, we’ve been through a lot of things together. 2012, that’s when I went through the program and my life changed that day. I am standing in front of the president. A little bit nervous. I just want you to know that I’m standing amongst heroes, but you guys, if it wasn’t for you guys to come back in and for me able to pour back into you, this is how I keep it, by giving it back to you guys.","https://www.rev.com/blog/transcripts/donald-trump-speech-transcript-at-the-hope-for-prisoners-graduation-ceremony","Donald Trump Speech Transcript at the Hope for Prisoners Graduation Ceremony","31:17"
"Speaker 2","Right.","https://www.rev.com/blog/transcripts/donald-trump-speech-transcript-at-the-hope-for-prisoners-graduation-ceremony","Donald Trump Speech Transcript at the Hope for Prisoners Graduation Ceremony","32:08"
"Lois Hockersmith","Thank you. And thank you Mr. President.","https://www.rev.com/blog/transcripts/donald-trump-speech-transcript-at-the-hope-for-prisoners-graduation-ceremony","Donald Trump Speech Transcript at the Hope for Prisoners Graduation Ceremony","32:08"
"Donald Trump","[inaudible 00:32:12] Thank you. Take care of mom, right? He’s so beautiful. Would you like to say something? Please. He feels very comfortable.","https://www.rev.com/blog/transcripts/donald-trump-speech-transcript-at-the-hope-for-prisoners-graduation-ceremony","Donald Trump Speech Transcript at the Hope for Prisoners Graduation Ceremony","32:12"
"Lt. Steve Riback","I had a well prepared speech for this. The credit 100% goes to Lois and not to be completely candid, I was doing nothing, no different than I had done for years and years that night. I definitely believe it was divine that we came across each other, but the credit goes to her. The credit goes to John. The credit goes to you guys as hopefuls and I just wish you a tremendous amount of success in the rest of your life. It’s only forward at this point and you have an incredible team, an incredible community, and I’m so honored to be a part of it. But again, the credit goes to these people right here. Thank you.","https://www.rev.com/blog/transcripts/donald-trump-speech-transcript-at-the-hope-for-prisoners-graduation-ceremony","Donald Trump Speech Transcript at the Hope for Prisoners Graduation Ceremony","32:27"
"Donald Trump","You did a good job. That was a good job. Wow. He did okay fellows, right? He did. He did a great job. Thank you both. Lois and Steve, you remind us really that, all of us, that anything’s possible, and Lois is among the roughly 100 Hope for Prisoners alumni here today, all of whom are doing incredibly well. Please stand. Please stand, all of the alumni. Wow, that’s great. That’s great. That’s great. Great. Congratulations. Thank you very much.","https://www.rev.com/blog/transcripts/donald-trump-speech-transcript-at-the-hope-for-prisoners-graduation-ceremony","Donald Trump Speech Transcript at the Hope for Prisoners Graduation Ceremony","33:01"
"Donald Trump","But they’re really a testament to the bright future that awaits you all. It’s a great time in our country in so many ways. Our military is strong. Our country is just strong. We’re stronger in, I would say, just about every way than we ever have been before. Militarily. You take a look at what we’re doing with the stock market. We’ve had 144 out of three years. I’ve been here just a little more than three years and in a little more than three years, John, we’ve had 144 stock market records. Now that’s good for everybody. It’s good for your 401ks and it’s good for jobs and it’s good for… those are the ones that I think about first, jobs, 401ks, that and people are making a lot of money and people are getting tremendous… you’ll be investing some of your money in this now. You’d be doing fantastically well and you’re going to have 401ks or something, the equivalent and you’re going to do fantastically well.","https://www.rev.com/blog/transcripts/donald-trump-speech-transcript-at-the-hope-for-prisoners-graduation-ceremony","Donald Trump Speech Transcript at the Hope for Prisoners Graduation Ceremony","33:54"
"Donald Trump","And as I say, sometimes in speeches, the best is yet to come. We have tremendous potential. We have done… we’ve just made some incredible trade deals that will soon start kicking in. It’s going to make it a different country economically, as good as it does, it’s going to be much better. We had horrible, horrible deals, or no deals at all, and now we have phenomenal deals. We made a massive deal with China than we did the USMCA, that’s Mexico, Canada. We did a $40 billion a year deal with Japan and we did a deal with South Korea, and we have other deals too, and I’m going to India next week and we’re talking about… they have 1.5 billion people and Prime Minister Modi is number two on Facebook. Number two, think of that. You know who number one is? Trump. Can you believe that? Number one, I just found out. The head of Facebook, Mr. Zuckerberg came in three weeks ago. He said, “Congratulations.” I said, “On what?” He said, “You’re number one on Facebook.” I said, “That’s cool.” Number one on Twitter too. But that’s because… true.","https://www.rev.com/blog/transcripts/donald-trump-speech-transcript-at-the-hope-for-prisoners-graduation-ceremony","Donald Trump Speech Transcript at the Hope for Prisoners Graduation Ceremony","34:51"
"Donald Trump","But that’s because… And if I wasn’t, I could never say it because it would be breaking news that Trump told the fib. Now number one and I congratulated a Prime Minister Modi. I said, “But you know, you have 1.5 billion people. I have 350 million. You have an advantage.” But we’re going to India and we may make a tremendous deal there. Maybe we’ll slow it down, we’ll do it after the election. I think that could happen too. So we’ll see what happens but we’re only making deals if they’re good deals because we’re putting America first, whether people like it or not. We’re putting America first.","https://www.rev.com/blog/transcripts/donald-trump-speech-transcript-at-the-hope-for-prisoners-graduation-ceremony","Donald Trump Speech Transcript at the Hope for Prisoners Graduation Ceremony","36:01"
"Donald Trump","So to help you find housing, jobs and support, I established, as you know very well, the Council on Crime Prevention and Re-entry. They’ve done a fantastic job and here with us today, our new executive director, Tony Lowden.","https://www.rev.com/blog/transcripts/donald-trump-speech-transcript-at-the-hope-for-prisoners-graduation-ceremony","Donald Trump Speech Transcript at the Hope for Prisoners Graduation Ceremony","36:43"
"Donald Trump","Tony, would you just come up and say a few words please? Tony Lowden. Thank you, Tony.","https://www.rev.com/blog/transcripts/donald-trump-speech-transcript-at-the-hope-for-prisoners-graduation-ceremony","Donald Trump Speech Transcript at the Hope for Prisoners Graduation Ceremony","36:58"
"Donald Trump","He looks good.","https://www.rev.com/blog/transcripts/donald-trump-speech-transcript-at-the-hope-for-prisoners-graduation-ceremony","Donald Trump Speech Transcript at the Hope for Prisoners Graduation Ceremony","37:10"
"Tony Lowden","To God be the glory. Listen, is what re-entry looks like when our law enforcement, our returning citizens, our faith community, business and our community along with their children, can come together in a holistic approach and bring us together under this president has showed America what re-entry looks like.","https://www.rev.com/blog/transcripts/donald-trump-speech-transcript-at-the-hope-for-prisoners-graduation-ceremony","Donald Trump Speech Transcript at the Hope for Prisoners Graduation Ceremony","37:16"
"Tony Lowden","They say what happens in Vegas stays in Vegas, but I want to tell you that today the entire world have been put on notice that here, John, under this president and our administration, this will no longer be a secret. This will be the norm for America. God bless you.","https://www.rev.com/blog/transcripts/donald-trump-speech-transcript-at-the-hope-for-prisoners-graduation-ceremony","Donald Trump Speech Transcript at the Hope for Prisoners Graduation Ceremony","37:45"
"Donald Trump","Thank you, Tony. Wow. Thank you Tony. Wow, that’s great. Respected guy.","https://www.rev.com/blog/transcripts/donald-trump-speech-transcript-at-the-hope-for-prisoners-graduation-ceremony","Donald Trump Speech Transcript at the Hope for Prisoners Graduation Ceremony","38:09"
"Donald Trump","For too long, citizens with a record were not even considered for jobs. You know that even if they were qualified, rehabilitated, totally and ready to go to work, they wanted to go to work but all of that is changing and we began a nationwide campaign to encourage businesses to expand Second Chance Hiring; call it Second Chance Hiring. When we say hire American, we mean all Americans, all Americans.","https://www.rev.com/blog/transcripts/donald-trump-speech-transcript-at-the-hope-for-prisoners-graduation-ceremony","Donald Trump Speech Transcript at the Hope for Prisoners Graduation Ceremony","38:25"
"Donald Trump","And our entire nation wins when citizens with a record have a chance to succeed, such a tremendous, it’s what’s happened over the last three years is incredible. People came out, they didn’t have a chance and now they’re not only having a chance, you’re going to see in a little while when these guys try and make a deal. I want a little bit more. Give me a little bit more.","https://www.rev.com/blog/transcripts/donald-trump-speech-transcript-at-the-hope-for-prisoners-graduation-ceremony","Donald Trump Speech Transcript at the Hope for Prisoners Graduation Ceremony","38:52"
"Donald Trump","Together, we’re rebuilding the most prosperous economy and the most inclusive society, John, ever to exist. We are becoming a very inclusive society, much more so than in the past and a lot of people haven’t figured that out yet but I think they will. I think people are going to figure it out pretty soon. We want every citizen to join America’s unparalleled success in every community to take part in America’s extraordinary rise.","https://www.rev.com/blog/transcripts/donald-trump-speech-transcript-at-the-hope-for-prisoners-graduation-ceremony","Donald Trump Speech Transcript at the Hope for Prisoners Graduation Ceremony","39:18"
"Donald Trump","Since my election, we have created 7 million new jobs. The unemployment rate has reached the lowest rate in over 51 years. Think of that, 51 years; half a century. And by the way, the 7 million jobs, they thought it might be 2 million if we’re lucky. You go back three years, they were saying 2 million. We did 7 million and it’s pretty amazing.","https://www.rev.com/blog/transcripts/donald-trump-speech-transcript-at-the-hope-for-prisoners-graduation-ceremony","Donald Trump Speech Transcript at the Hope for Prisoners Graduation Ceremony","39:47"
"Donald Trump","African-American poverty has declined to the lowest rate ever recorded but I think one of the things we’re most proud of in this incredible economy, we’ll call it Trump Economy, call it, we’ll call it the ponder economy, we’ll call it something, but whatever we call it, this economy has been great and the thing that might be the best of all is what we’ve done with criminal justice reform. I really think so.","https://www.rev.com/blog/transcripts/donald-trump-speech-transcript-at-the-hope-for-prisoners-graduation-ceremony","Donald Trump Speech Transcript at the Hope for Prisoners Graduation Ceremony","40:19"
"Donald Trump","Our jobs market is so strong that businesses are recruiting the former prisoners off the sidelines in, by the way, record numbers. Record numbers, never happened anywhere, even close to these numbers. We know that having a job gives you the best chance to work hard to earn the paycheck, care for your families, chase your dreams and succeed, through our pledge to America’s workers, spearheaded by a very famous young woman. Did you ever hear of Ivanka?","https://www.rev.com/blog/transcripts/donald-trump-speech-transcript-at-the-hope-for-prisoners-graduation-ceremony","Donald Trump Speech Transcript at the Hope for Prisoners Graduation Ceremony","40:53"
"Donald Trump","She said, “Daddy, I want to help with jobs.” I said, “Well, I’ll put you here, there.” “No, no. I want to help with jobs. I want to get people jobs. They have to be trained. They have to be…’ So she had a goal of 500,000 jobs. That’s a lot; half a million jobs. She just broke Jared. I guess, is Jared around? She just broke… She just broke Jared Kushner. She just broke the father of criminal justice reform. He really is. I mean, he works so hard and Ivanka just broke 15 million jobs. Mayor, that’s good, right? And this is where they train the people in the companies. The government can’t do this. Walmart took a million people. Think of it. These big companies take and they train them. It’s very complicated stuff with computerization and all the things you have to learn. That’s not for government.","https://www.rev.com/blog/transcripts/donald-trump-speech-transcript-at-the-hope-for-prisoners-graduation-ceremony","Donald Trump Speech Transcript at the Hope for Prisoners Graduation Ceremony","41:28"
"Donald Trump","15 million people taken by many of the biggest companies, but also midsize companies, even some smaller, but she broke 15 million people about two weeks ago and her goal was 500,000 people over a fairly long period of time; 15 million. But if you know Ivanka, you’re not at all surprised. Believe me, I wasn’t surprised. I was sort of saying, “So what else is new.”","https://www.rev.com/blog/transcripts/donald-trump-speech-transcript-at-the-hope-for-prisoners-graduation-ceremony","Donald Trump Speech Transcript at the Hope for Prisoners Graduation Ceremony","42:19"
"Donald Trump","To everyone returning citizen here today, I know that there are some in our society who want to tell you what you can’t do. They’re going to tell you what you can’t do. It’s one of the reasons I wanted to be here. I wanted to say what I had to say to John too, because I sort of had that in my mind for a long time. Actually, the first time I met him but they want to tell you what you can’t do. They want to tell you why you can’t succeed. No way you can succeed.","https://www.rev.com/blog/transcripts/donald-trump-speech-transcript-at-the-hope-for-prisoners-graduation-ceremony","Donald Trump Speech Transcript at the Hope for Prisoners Graduation Ceremony","42:42"
"Donald Trump","You don’t want to listen to them because you’re proving different. They want to say why you can’t make it in this country. Why you can’t make it in any country. They think you’re not going to make it period, but do not believe those voices for one second because I’m here today because I believe in what you can do.","https://www.rev.com/blog/transcripts/donald-trump-speech-transcript-at-the-hope-for-prisoners-graduation-ceremony","Donald Trump Speech Transcript at the Hope for Prisoners Graduation Ceremony","43:08"
"Donald Trump","You’re going to be incredible. You’re going to be incredible. You’re going to see it and it’s going to go quickly. Each of you is a citizen of the greatest country on earth. There is more opportunity, more equality and more potential in America today than in any society in the history of the world. It’s true.","https://www.rev.com/blog/transcripts/donald-trump-speech-transcript-at-the-hope-for-prisoners-graduation-ceremony","Donald Trump Speech Transcript at the Hope for Prisoners Graduation Ceremony","43:29"
