"speaker","transcription","url","headlin","timing"
"Donald Trump","We’re talking about it, country to country. But we did discuss if he had a problem. It was reported that he may have it, and he doesn’t, fortunately. Yeah.","https://www.rev.com/blog/transcripts/donald-trump-speech-transcript-declares-coronavirus-national-emergency","Donald Trump Speech Transcript: Declares Coronavirus National Emergency","30:57"
"Speaker 3","Thank you so much, Mr. President. Dr. Fauci said earlier this week that the lag in testing was in fact, failing. Do you take responsibility for that? And when can you guarantee that every single American who needs a test will be able to have a test? What’s the date of that?","https://www.rev.com/blog/transcripts/donald-trump-speech-transcript-declares-coronavirus-national-emergency","Donald Trump Speech Transcript: Declares Coronavirus National Emergency","31:05"
"Donald Trump","Yeah. No, I don’t take responsibility at all because we were given a set of circumstances, and we were given rules, regulations and specifications from a different time. It wasn’t meant for this kind of an event with the kind of numbers that we’re talking about. And what we’ve done is, redesigned it very quickly with the help of the people behind me. We’re now in very, very strong shape. I think we’ll be announcing, as I said, Sunday night. This will start very quickly. We’ll have the ability to do in the millions over a very, very quick period of time. So, no.","https://www.rev.com/blog/transcripts/donald-trump-speech-transcript-declares-coronavirus-national-emergency","Donald Trump Speech Transcript: Declares Coronavirus National Emergency","31:25"
"Donald Trump","What we have done and we are going to be leaving a very indelible print for the future in case something like this happens again. But it was a… And that’s not the fault of anybody. Frankly, the old system worked very well for smaller numbers, much smaller numbers, but not for these kinds of numbers. Tony, maybe you’d like to say something.","https://www.rev.com/blog/transcripts/donald-trump-speech-transcript-declares-coronavirus-national-emergency","Donald Trump Speech Transcript: Declares Coronavirus National Emergency","32:03"
"Speaker 3","By Sunday night, will have… yes, please. By Sunday night, will every American be able to get a test?","https://www.rev.com/blog/transcripts/donald-trump-speech-transcript-declares-coronavirus-national-emergency","Donald Trump Speech Transcript: Declares Coronavirus National Emergency","32:21"
"Tony Fauci","So just to reiterate what I said to many of you multiple times, it’s a dissent of a system. The system was not designed… For what it was designed for, it worked very well. The CDC designed a good system. If you want to get the kind of blanket testing and availability that anybody can get it, or you could even do surveillance to find out what the penetrance is, you have to embrace the private sector. And this is exactly what you’re seeing, because you can’t do it without it. So when I said that, I meant the system was not designed for what we need. Now looking forward, the system will take care of it.","https://www.rev.com/blog/transcripts/donald-trump-speech-transcript-declares-coronavirus-national-emergency","Donald Trump Speech Transcript: Declares Coronavirus National Emergency","32:25"
"Speaker 3","Mr. President, with respect-","https://www.rev.com/blog/transcripts/donald-trump-speech-transcript-declares-coronavirus-national-emergency","Donald Trump Speech Transcript: Declares Coronavirus National Emergency","33:01"
"Donald Trump","And interestingly, if you go back… Please. If you go back to the swine flu, it was nothing like this. They didn’t do testing like this. And actually, they lost approximately 14,000 people. And they didn’t do the testing. They started thinking about testing when it was far too late. What we’ve done and one of the reasons I think people are respecting what we’ve done, we’ve done it very early. We’ve gotten it very early, and we’ve also kept a lot of people out.","https://www.rev.com/blog/transcripts/donald-trump-speech-transcript-declares-coronavirus-national-emergency","Donald Trump Speech Transcript: Declares Coronavirus National Emergency","33:03"
"Speaker 3","Mr. President. Mr. President.","https://www.rev.com/blog/transcripts/donald-trump-speech-transcript-declares-coronavirus-national-emergency","Donald Trump Speech Transcript: Declares Coronavirus National Emergency","33:30"
"Donald Trump","Yes. Please, go ahead.","https://www.rev.com/blog/transcripts/donald-trump-speech-transcript-declares-coronavirus-national-emergency","Donald Trump Speech Transcript: Declares Coronavirus National Emergency","33:31"
"Speaker 3","The last administration that they had tested a million people at this point. You’ve been-","https://www.rev.com/blog/transcripts/donald-trump-speech-transcript-declares-coronavirus-national-emergency","Donald Trump Speech Transcript: Declares Coronavirus National Emergency","33:31"
"Donald Trump","Well, ask them how they did with the swine flu. It was a disaster.","https://www.rev.com/blog/transcripts/donald-trump-speech-transcript-declares-coronavirus-national-emergency","Donald Trump Speech Transcript: Declares Coronavirus National Emergency","33:35"
"Speaker 3","But with respect-","https://www.rev.com/blog/transcripts/donald-trump-speech-transcript-declares-coronavirus-national-emergency","Donald Trump Speech Transcript: Declares Coronavirus National Emergency","33:38"
"Donald Trump","Next, please. Next, please. They had a very big failure with swine flu, a very big failure.","https://www.rev.com/blog/transcripts/donald-trump-speech-transcript-declares-coronavirus-national-emergency","Donald Trump Speech Transcript: Declares Coronavirus National Emergency","33:38"
"Speaker 4","Mr. President, I want to ask you about the European travel ban that goes into effect at midnight tonight, and the exemption that you’ve offered to the U.K. There are 17 countries that are in the so-called Schengen Zone that have fewer coronavirus cases than the U.K. And just in the past 24 hours, the U.K. has added 208 coronavirus cases to their total. Why do they, Mr. President, deserve an exemption? And would you consider adding them to this travel ban list?","https://www.rev.com/blog/transcripts/donald-trump-speech-transcript-declares-coronavirus-national-emergency","Donald Trump Speech Transcript: Declares Coronavirus National Emergency","33:45"
"Donald Trump","Well, that was recommended to me by a group of professionals. We are looking at it based on the new numbers that are coming out, and we may have to include them in the list of countries that we will… you could say ban or whatever it is, during this period of time. But yeah, their numbers have gone up fairly precipitously over the last 24 hours, so we may be adding that. And we may be adding a couple of others. And we may frankly, start thinking about taking some off. Go ahead.","https://www.rev.com/blog/transcripts/donald-trump-speech-transcript-declares-coronavirus-national-emergency","Donald Trump Speech Transcript: Declares Coronavirus National Emergency","34:15"
"Speaker 5","Thank you, Mr President. I’m a correspondent with Hong Kong Phoenix TV. You have mentioned that the number in China has been decreasing, and China has made tremendous progress in the past weeks.","https://www.rev.com/blog/transcripts/donald-trump-speech-transcript-declares-coronavirus-national-emergency","Donald Trump Speech Transcript: Declares Coronavirus National Emergency","34:46"
"Donald Trump","True.","https://www.rev.com/blog/transcripts/donald-trump-speech-transcript-declares-coronavirus-national-emergency","Donald Trump Speech Transcript: Declares Coronavirus National Emergency","34:58"
"Speaker 5","I’m wondering, how much confidence does this give you to control the virus in the United States? And do you think the data China has been sharing with the United States has been helpful?","https://www.rev.com/blog/transcripts/donald-trump-speech-transcript-declares-coronavirus-national-emergency","Donald Trump Speech Transcript: Declares Coronavirus National Emergency","34:59"
"Donald Trump","I think it has been helpful. We have been working very much with China. I’ve spoken, as you know, with President Xi. They went through hell. Their numbers are starting to look very good. They’re really looking very good. We’re very happy about that. We are sharing data, yes. In fact, we’re sharing quite a bit of data, including the fact that some of our pharmaceutical companies are working over there right now with large groups of people. Yeah. Go ahead, please.","https://www.rev.com/blog/transcripts/donald-trump-speech-transcript-declares-coronavirus-national-emergency","Donald Trump Speech Transcript: Declares Coronavirus National Emergency","35:12"
"Ross Palombo","Thank you, Mr. President. You spoke with Canadian Prime Minister Trudeau yesterday.","https://www.rev.com/blog/transcripts/donald-trump-speech-transcript-declares-coronavirus-national-emergency","Donald Trump Speech Transcript: Declares Coronavirus National Emergency","35:39"
"Donald Trump","Yes, sir.","https://www.rev.com/blog/transcripts/donald-trump-speech-transcript-declares-coronavirus-national-emergency","Donald Trump Speech Transcript: Declares Coronavirus National Emergency","35:43"
"Ross Palombo","Did you discuss the potential closing of the border between Canada and the U.S.? And by extension, are you considering ways to salvage the $2 billion daily trade between the two countries?","https://www.rev.com/blog/transcripts/donald-trump-speech-transcript-declares-coronavirus-national-emergency","Donald Trump Speech Transcript: Declares Coronavirus National Emergency","35:44"
"Donald Trump","So we didn’t discuss the border. We’ve had a very good relationship. Just about finished with the USMCA, as you know. He called. Actually, he called me to tell me that. I think that was the primary reason for the call. At the time, his wife had not been diagnosed. She’s a lovely lady, wonderful lady, great lady. Since then, I’ve heard, read, that the result was that she has it. I was a little surprised. I think he was surprised also. We did discuss it prior, too. She’s going to be fine. But he thought that she would not most likely have the virus. Unfortunately, she does. But we didn’t discuss the border yesterday, no. Go ahead, please. If you have any questions for these great geniuses up here, you should, even a business question related to what we’re talking about.","https://www.rev.com/blog/transcripts/donald-trump-speech-transcript-declares-coronavirus-national-emergency","Donald Trump Speech Transcript: Declares Coronavirus National Emergency","35:57"
"Ross Palombo","Mr. President, Ross Palombo from ABC News Miami. As a relatively new Floridian, what is your message today to the cruise line industry and the travel industry, that Florida depends upon? And since Senator Rick Scott and Miami Dade Mayor Carlos A. Giménez have the same exposure as you and they are self-isolating, what’s your message to them, that they shouldn’t be?","https://www.rev.com/blog/transcripts/donald-trump-speech-transcript-declares-coronavirus-national-emergency","Donald Trump Speech Transcript: Declares Coronavirus National Emergency","36:49"
"Donald Trump","Well, I don’t know that I had exposure, but I don’t have any of the symptoms. We do have a White House doctor. I should say, many White House doctors, frankly. I asked them that same question, and they said, “You don’t have any symptoms whatsoever.” We don’t want people without symptoms to go and do the test. The test is not insignificant. As far as the cruise line business, we’re with them all the way. It’s a great business. It’s a great U.S. business, frankly. I know how important they are to the country. That includes airlines. But the cruise line business obviously, was hit very hard.","https://www.rev.com/blog/transcripts/donald-trump-speech-transcript-declares-coronavirus-national-emergency","Donald Trump Speech Transcript: Declares Coronavirus National Emergency","37:11"
"Donald Trump","We had a tremendous success out in Oakland, where moved… Vice President Pence did a fantastic job with that. We worked with U.K., we worked with Canada. They took their people back in. Canada’s approximately 600 people. U.K. likewise, took a large number of people back to the United Kingdom. We have people quarantined. It was a big operation, and it worked out really… You don’t hear about it anymore. It worked out really well. Mike, you may even want to say something about that, because that was really done properly.","https://www.rev.com/blog/transcripts/donald-trump-speech-transcript-declares-coronavirus-national-emergency","Donald Trump Speech Transcript: Declares Coronavirus National Emergency","37:48"
"Mike Pence","Well, thank you, Mr. President. That program with the Grand Princess, the ship, is continuing to be administered in the highest standards. Orderly way, as the President directed. Americans that needed treatment have received them. I spoke to the Governor of Iowa today, and some of those who now have been cleared are able in proper supervision, to be returning to Iowa. They’re making arrangements for them to do that. Others in Texas, others in Georgia. Again, it’s another example of the extraordinary cooperation. Governor Abbott, Governor Gavin Newsom, Governor Brian Kemp of Georgia.","https://www.rev.com/blog/transcripts/donald-trump-speech-transcript-declares-coronavirus-national-emergency","Donald Trump Speech Transcript: Declares Coronavirus National Emergency","38:20"
"Mike Pence","But to add to that, the President directed me last Saturday to travel down to Miami. We met with all the leaders of the cruise line industry. Several cruise lines have announced a 60-day pause in operations. Our Department of Homeland Security has praised them for doing that, because of the unique health challenges particularly presented to seniors with underlying conditions. We have a proposal from the cruise line industry, but they’re currently considering what other steps that they might take. Perhaps even similar to what those other lines have taken. We’re anticipating some response on that in the next 24 hours.","https://www.rev.com/blog/transcripts/donald-trump-speech-transcript-declares-coronavirus-national-emergency","Donald Trump Speech Transcript: Declares Coronavirus National Emergency","38:59"
"Mike Pence","But as the President said, the American people cherish our cruise line industry. The men and women who work on the ships, the men and women who work on the shore. All the economies that are so benefited by a vibrant cruise line industry. And what the President has directed us to do is… whether there is a pause in the moment as some cruise lines are doing. And as we all continue to discuss, we want to work with the cruise line industry to ensure that when we come through this, the cruise lines and the medical services that are available and for the passengers and all of the crew, that cruise lines are safer than ever before, and can prosper for many years to come.","https://www.rev.com/blog/transcripts/donald-trump-speech-transcript-declares-coronavirus-national-emergency","Donald Trump Speech Transcript: Declares Coronavirus National Emergency","39:44"
"Donald Trump","Go ahead, please.","https://www.rev.com/blog/transcripts/donald-trump-speech-transcript-declares-coronavirus-national-emergency","Donald Trump Speech Transcript: Declares Coronavirus National Emergency","40:22"
"Speaker 6","This question is for Drs. Fauci and Berks. Dr. Fauci, based on what you currently know, what is the trajectory for when this outbreak will peak? How long will the American people have to remain on this emergency footing? And for Dr. Berks, as the administration tries to get its arms around this test kit shortage issue, the next glaring need could respirators and related hospital equipment. So what is the administration doing right now to ramp up production of respirators and that kind of equipment, should this outbreak persist?","https://www.rev.com/blog/transcripts/donald-trump-speech-transcript-declares-coronavirus-national-emergency","Donald Trump Speech Transcript: Declares Coronavirus National Emergency","40:29"
"Tony Fauci","When you have an outbreak like this, particularly if you’re trying to interfere with it, it’s really impossible to predict the time element of when it’s going to peak and when it’s naturally going to go down. So if you look at the situation where countries really did not get to the point of trying to contain and mitigate very well, you see a peak over several weeks, and then down again over other several weeks. What we’re trying to do with the efforts that we’re doing, is to blunt that peak. And I mentioned it many times. And I think it’s important and appropriate for me to mention it again, because it answers your question.","https://www.rev.com/blog/transcripts/donald-trump-speech-transcript-declares-coronavirus-national-emergency","Donald Trump Speech Transcript: Declares Coronavirus National Emergency","41:00"
"Tony Fauci","When you talk about preventing infections from without in, which is the kind of travel restrictions we’re talking about, then how do you handle what you already have in your country? You continue some sort of containment, but you also do mitigation. And you try to proportionate to the areas where there are the most infections. The success of that and how much you make this turn into this, is going to give you the amount of time. If we’re successful, it’ll be less. If we’re not successful, it’s going to be more. But these kind of things generally run out in a few months. Hopefully, we’ll make it several weeks. Eight, nine, whatever weeks. But I can’t give you a number, because it depends on how successful we are.","https://www.rev.com/blog/transcripts/donald-trump-speech-transcript-declares-coronavirus-national-emergency","Donald Trump Speech Transcript: Declares Coronavirus National Emergency","41:35"
"Deborah Birx","Great. Thank you. It’s a great question. Dr. Fauci and I have worked together a very long time, and continue. It’s a privilege to work with him every day. I think you can learn very… I appreciate there was some graphics done by some of the reporting over the last several days. If you align the data from China with the data with South Korea, you can start to see almost a complete overlay of that data. So that’s what we’re tracking very closely, as well as Italy.","https://www.rev.com/blog/transcripts/donald-trump-speech-transcript-declares-coronavirus-national-emergency","Donald Trump Speech Transcript: Declares Coronavirus National Emergency","42:21"
"Deborah Birx","But you have an excellent question. I just want to make one note. In South Korea, I want to repeat, only 4% of the tests were positive. That means 96% of the people had a different respiratory disease. Because we’re in the middle of flu season, cold season, and all of the other respiratory diseases that we get every day. In LabCorp and Quest’s early data, they’re running about 1% to 2% positive. That means that we have a lot more other respiratory disease out there besides the coronavirus, and that’s why the screening is critical. But even with the screening, we’re going to run what we think are very low rates.","https://www.rev.com/blog/transcripts/donald-trump-speech-transcript-declares-coronavirus-national-emergency","Donald Trump Speech Transcript: Declares Coronavirus National Emergency","42:47"
"Deborah Birx","Needless to say though, we’re taking it extraordinarily seriously to plan for what could come. What Dr. Fauci talked about, blunting the curve, that makes it much less high need at that peak of the curve that we’re all planning for. So we’re in full inventory of all of our assets by the President, on lacking and this emergency order and the Secretary of HHS’s ability. It unlocks all of those stockpiles, those needs. What the VA has, what the DOD has, what the National Guard has, and what every hospital has. The hospital emergency preparedness plan allows them to defer elective issues to keep those hospital beds open for those who might need it. So we’re in full planning mode for each of those things.","https://www.rev.com/blog/transcripts/donald-trump-speech-transcript-declares-coronavirus-national-emergency","Donald Trump Speech Transcript: Declares Coronavirus National Emergency","43:25"
"Donald Trump","I might add that we are in the process and in some cases have already done it, ordered a large number of respirators just in case. We hope we don’t need them, but we’ve ordered a large number. Yeah. Go ahead, please.","https://www.rev.com/blog/transcripts/donald-trump-speech-transcript-declares-coronavirus-national-emergency","Donald Trump Speech Transcript: Declares Coronavirus National Emergency","44:10"
"Speaker 7","Thank you very much, Mr. President. In your speech to the nation, you mentioned the situation in China and South Korea have improved. And you are thinking about remove the restrictions, also the warning in place right now. When can we expect that announcement, and how do you see the overall progress that Asian countries made?","https://www.rev.com/blog/transcripts/donald-trump-speech-transcript-declares-coronavirus-national-emergency","Donald Trump Speech Transcript: Declares Coronavirus National Emergency","44:25"
"Donald Trump","Well, some were making progress. Some are not, as you know. But some are making progress. And as they make progress, as they get down to the number that we all think is right, that they know is right, we know is right, we’ll be opening it up. Some are really moving along rapidly. We hope to be able to open things up as quickly as possible. Go ahead, please. Go ahead.","https://www.rev.com/blog/transcripts/donald-trump-speech-transcript-declares-coronavirus-national-emergency","Donald Trump Speech Transcript: Declares Coronavirus National Emergency","44:47"
"Speaker 8","Mr. President, I’d like to ask Secretary Azar and Dr. Fauci, just how… Dr. Fauci, okay.","https://www.rev.com/blog/transcripts/donald-trump-speech-transcript-declares-coronavirus-national-emergency","Donald Trump Speech Transcript: Declares Coronavirus National Emergency","45:07"
"Donald Trump","Right, better. Better. Not 100%, but 90%.","https://www.rev.com/blog/transcripts/donald-trump-speech-transcript-declares-coronavirus-national-emergency","Donald Trump Speech Transcript: Declares Coronavirus National Emergency","45:22"
"Speaker 8","Right.","https://www.rev.com/blog/transcripts/donald-trump-speech-transcript-declares-coronavirus-national-emergency","Donald Trump Speech Transcript: Declares Coronavirus National Emergency","45:25"
"Donald Trump","Go ahead.","https://www.rev.com/blog/transcripts/donald-trump-speech-transcript-declares-coronavirus-national-emergency","Donald Trump Speech Transcript: Declares Coronavirus National Emergency","45:25"
"Speaker 8","This affects the elderly, primarily. In that sense, it’s an unusual disease. Is any specific research being done as to why it affects our senior citizens more than others?","https://www.rev.com/blog/transcripts/donald-trump-speech-transcript-declares-coronavirus-national-emergency","Donald Trump Speech Transcript: Declares Coronavirus National Emergency","45:26"
"Tony Fauci","I don’t mean to diminish your question, but we already know why it would affect senior citizens more. Because when you talk about anything that requires a robust immune system, as you get older, your immune system is not as potent as it is when you were young. And that’s the reason why when you talk about-","https://www.rev.com/blog/transcripts/donald-trump-speech-transcript-declares-coronavirus-national-emergency","Donald Trump Speech Transcript: Declares Coronavirus National Emergency","45:42"
"Tony Fauci","When you were young, and that’s the reason why when you talk about even influenza, which we have extraordinary experience with over decades and decades, the people who are very vulnerable are the elderly and those with underlying conditions. The same thing holds true for a variety of other disease. Why cancer is more prevalent in some, in mostly in older individuals. Of course, the immune system that screens for it is less robust, so it really is something that is kind of well known over a lot of studies.","https://www.rev.com/blog/transcripts/donald-trump-speech-transcript-declares-coronavirus-national-emergency","Donald Trump Speech Transcript: Declares Coronavirus National Emergency","46:03"
"Donald Trump","Okay. OAN please. OAN.","https://www.rev.com/blog/transcripts/donald-trump-speech-transcript-declares-coronavirus-national-emergency","Donald Trump Speech Transcript: Declares Coronavirus National Emergency","46:34"
"OAN","Mr. President, the Chinese officials are expressing some tones of discontent with where the source of this virus has come from, and they’re spinning some odd narratives. What are your response to the Chinese officials who are doing that, and have they signaled any kind of resistance to upcoming trade talks in response to how we’re handling this virus?","https://www.rev.com/blog/transcripts/donald-trump-speech-transcript-declares-coronavirus-national-emergency","Donald Trump Speech Transcript: Declares Coronavirus National Emergency","46:40"
