"speaker","transcription","url","headlin","timing"
"Donald Trump","To unleash the full power of the federal government in this effort today, I am officially declaring a National Emergency. Two very big words. The action I am taking will open up access to up to 50 billion dollars of very important and a large amount of money for states and territories and localities in our shared fight against this disease.","https://www.rev.com/blog/transcripts/donald-trump-speech-transcript-declares-coronavirus-national-emergency","Donald Trump Speech Transcript: Declares Coronavirus National Emergency","00:00"
"Donald Trump","In furtherance of the order, I’m urging every state to set up emergency operation centers effective immediately. You’re going to be hearing from some of the largest companies and greatest retailers and medical companies in the world. They’re standing right behind me and the side of me. I’m also asking every hospital in this country to activate its emergency preparedness plan so that they can meet the needs of Americans everywhere. The hospitals are very engaged. New York and various other places are also various engaged. I just spoke with governor Cuomo. We had a very good conversation and we’re working very strongly with the many states including New York.","https://www.rev.com/blog/transcripts/donald-trump-speech-transcript-declares-coronavirus-national-emergency","Donald Trump Speech Transcript: Declares Coronavirus National Emergency","00:28"
"Donald Trump","The urgency orders I’m issuing today will also confer broad new authority to the Secretary of Health and Human Services. The Secretary of HHS will be able to immediately wave revisions of applicable laws and regulations to give doctors, hospital all hospitals and healthcare providers, maximum flexibility to respond to the virus and care for patients. This includes the following critical authorities, the ability to waive laws to enable telehealth, a fairly new and incredible thing that’s happened in the not so distant past. I tell you what they’ve done with telehealth has incredible. It gives remote doctors visits and hospital check-ins the power to waive certain federal license requirements so that doctors from other states can provide services in states with the greatest need.","https://www.rev.com/blog/transcripts/donald-trump-speech-transcript-declares-coronavirus-national-emergency","Donald Trump Speech Transcript: Declares Coronavirus National Emergency","01:11"
"Donald Trump","Number two, the ability to waive requirements that critical access hospitals limit the number of beds to 25 and the length of stay to 96 hours. The ability to waive the requirements of a three day hospital stay prior to admission to a nursing home; big thing. The authority to waive rules to hinder hospital’s ability to bring additional physicians on board or obtain needed office space. They can do as they want. They can do what they have to do. They know what they have to do. Now they don’t have any problem getting it done.","https://www.rev.com/blog/transcripts/donald-trump-speech-transcript-declares-coronavirus-national-emergency","Donald Trump Speech Transcript: Declares Coronavirus National Emergency","02:12"
"Donald Trump","The authority to waive rules that severely restrict where hospitals can care for patients within the hospital itself. Ensuring that the emergency capacity can be quickly established. We’ll remove or eliminate every obstacle necessary to deliver our people the care that they need and that they’re entitled to. No resource will be spared. Nothing whatsoever. 10 days ago, I brought together the CEOs of commercial labs at the White House and directed them to immediately begin working on the solution to dramatically increase the availability of tests.","https://www.rev.com/blog/transcripts/donald-trump-speech-transcript-declares-coronavirus-national-emergency","Donald Trump Speech Transcript: Declares Coronavirus National Emergency","02:51"
"Donald Trump","Other countries have called us and worked with us and they’re doing similar things or will be doing similar things as a result of that action. Today we are announcing a new partnership with private sector to vastly increase and accelerate our capacity to test for the Coronavirus. We want to make sure that those who need a test can get a test very safely, quickly and conveniently but we don’t want people to take a test if we feel that they shouldn’t be doing it and we don’t want everyone running out and taking; only if you have certain symptoms.","https://www.rev.com/blog/transcripts/donald-trump-speech-transcript-declares-coronavirus-national-emergency","Donald Trump Speech Transcript: Declares Coronavirus National Emergency","03:30"
"Donald Trump","Using federal emergency authorities, the FDA approved a new test for the virus. We did this within hours after receiving the application from Roche, a process that would normally take weeks. We therefore expect up to a half a million additional tests will be available early next week. We’ll be announcing locations probably on Sunday night. I want to thank Roche, great company for their incredible work. I’d also like to thank Thermo Fisher. The FDA’s goal is to hopefully authorize your application within 24 hours. It’ll go very quickly. It’s going very quickly. Which will bring additionally 1.4 million tests on board next week and five million within a month. I doubt we’ll need anywhere near that.","https://www.rev.com/blog/transcripts/donald-trump-speech-transcript-declares-coronavirus-national-emergency","Donald Trump Speech Transcript: Declares Coronavirus National Emergency","00:00"
"Donald Trump","At the same time, we’ve been in discussions with pharmacies and retailers to make drive-through tests available in the critical locations identified by public health professionals. The goal is for individuals to be able to drive up and be swabbed without having to leave your car. I want to thank Google. Google is helping to develop a website. It’s going to be very quickly done, unlike websites of the past, to determine whether a test is warranted and to facilitate testing at a nearby convenient location. And we have many, many locations behind us, by the way. We cover this country and large parts of the world, by the way. We’re not going to be talking about the world right now. But we cover very, very strongly our country.","https://www.rev.com/blog/transcripts/donald-trump-speech-transcript-declares-coronavirus-national-emergency","Donald Trump Speech Transcript: Declares Coronavirus National Emergency","00:47"
"Donald Trump","Stores in virtually every location. Google has 1,700 engineers working on this right now. They’ve made tremendous progress. Our overriding goal is to stop the spread of the virus and to help all Americans who have been impacted by this. Again, we don’t want everybody taking this test. It’s totally unnecessary. And this will pass. This will pass through and we’re going to be even stronger for it. We’ve learned a lot, a tremendous amount has been learned. I want to thank Deborah Birx and I want to ask her maybe to come up and say a few words as to what’s happening. Dr. Birx is a highly respected person. I’ve gotten to know her very well over the last six days and what we’ve done is we built something that was very old, very old fashioned, somewhat obsolete, certainly obsolete when it comes to the kind of numbers that we’re talking about. Dr. Birx, please. Thank you, Deborah.","https://www.rev.com/blog/transcripts/donald-trump-speech-transcript-declares-coronavirus-national-emergency","Donald Trump Speech Transcript: Declares Coronavirus National Emergency","01:39"
"Deborah Birx","Thank you, Mr. President. It’s a pleasure to be here with all of you. I think you know at the beginning of this epidemic, HHS through CDC proactively developed an assay, built on the existing flu surveillance system. That surveillance system was then converted to diagnostic system. But last Tuesday, seeing the spread of the virus around the globe, the President realized that our current approach to testing was inadequate to meet the needs of the American public. He asked for an entire overhaul of the testing approach. He immediately called the private sector laboratories to the White House, as noted, and charged them with developing a high throughput quality platform that can meet the needs of the American public.","https://www.rev.com/blog/transcripts/donald-trump-speech-transcript-declares-coronavirus-national-emergency","Donald Trump Speech Transcript: Declares Coronavirus National Emergency","02:47"
"Deborah Birx","We are grateful to LabCorp and Quest for taking up the charge immediately after the meeting and within 72 hours, bringing additional testing access, particularly to the outbreak areas of Washington State and California and now across the country. We are also very grateful to the universities and large hospital systems that took up the charge to develop their own quality tests made available by new FDA guidance. This has resolved and expanded testing across New York, California, Washington, Colorado, and you see sometimes those drive-through options that have been made available through these high throughput options.","https://www.rev.com/blog/transcripts/donald-trump-speech-transcript-declares-coronavirus-national-emergency","Donald Trump Speech Transcript: Declares Coronavirus National Emergency","03:33"
"Deborah Birx","Following the meeting last week, major commercial laboratory equipment and diagnostic companies took immediate action to adopt and develop new testing systems. Last night, the initial company, Roche, received FDA approval, moving from request, to development, to approval in record time. This innovative approach centered fully on unleashing the power of the private sector, focusing on providing convenient testing to hundreds of thousands of Americans within short turnaround times. In less than two weeks together, we have developed a solution that we believe will meet the future testing needs of Americans. I understand how difficult this has been. I was part of the HIV/AIDS response in the 80s.","https://www.rev.com/blog/transcripts/donald-trump-speech-transcript-declares-coronavirus-national-emergency","Donald Trump Speech Transcript: Declares Coronavirus National Emergency","04:10"
"Deborah Birx","We knew from first finding cases in 1981, it took us to almost 1985 to have a test. It took us another 11 years to have effective therapy. It is because of the lessons learned from that, that we were able to mobilize and bring those individuals that were key to the HIV response to this response. I understand that a lot of this behind the scenes action over the last couple of weeks was invisible to the press and the American people, but this intense effort has not only resulted in innovative solutions, but an automated high throughput system bringing the availability of these quality corona-viral testing to the American people at unprecedented speed.","https://www.rev.com/blog/transcripts/donald-trump-speech-transcript-declares-coronavirus-national-emergency","Donald Trump Speech Transcript: Declares Coronavirus National Emergency","04:56"
"Deborah Birx","Finally, I want you to know in South Korea, they did have a large number of tests available over the last several weeks. Their positivity rate is between three and 4%. With LabCorp and Quest expanded testing, their positivity rate is between one and 2%. So we want to also announce this new approach to testing, which we’ll start in this screening website up here facilitated by Google, where clients and patients and people of interest can go, fill out a screening questionnaire, move down for symptoms or risk factors. Yes, they would move down this and be told where the drive-through options would be for them to receive this test. The labs will then move to the high throughput automated machines to be able to provide results in 24 to 36 hours. That is the intent of this approach. We have seen it work just in our own United States and we want to bring this across the continent. Thank you very much.","https://www.rev.com/blog/transcripts/donald-trump-speech-transcript-declares-coronavirus-national-emergency","Donald Trump Speech Transcript: Declares Coronavirus National Emergency","05:43"
"Donald Trump","Thank you very much. [inaudible 00:06:49]. I’d like to maybe have, Tony, do you want to come up? You’ve become a … I think everybody out here knows you pretty well, but Tony has been doing a tremendous job working long, long hours and you’ve seen a lot happen, but this has been … It’s been a great experience and working with you has been terrific. Tony, please.","https://www.rev.com/blog/transcripts/donald-trump-speech-transcript-declares-coronavirus-national-emergency","Donald Trump Speech Transcript: Declares Coronavirus National Emergency","06:48"
"Mike Pence","Hold the mic down [inaudible 00:07:11].","https://www.rev.com/blog/transcripts/donald-trump-speech-transcript-declares-coronavirus-national-emergency","Donald Trump Speech Transcript: Declares Coronavirus National Emergency","07:10"
"Tony Fauci","Thank you very much, Mr. President. This is an example of another example of what I’ve been referring to in my discussions with many of you in the audience as a proactive leaning forward, aggressive, trying to stay ahead of the curve. And what you’ve seen now with this order is that we’re going to be able to remove the constraints so that people at the state, the local level, the individual physician, all the way up through the federal government will have as many constraints as possible, removed for them to do everything they possibly can so that we can implement the things that we’ve been talking about.","https://www.rev.com/blog/transcripts/donald-trump-speech-transcript-declares-coronavirus-national-emergency","Donald Trump Speech Transcript: Declares Coronavirus National Emergency","07:13"
"Tony Fauci","The containment, the mitigation, so that as I’ve said, many times, that curve that I refer to that goes up. We don’t want to have that curve. We want to suppress it down to that small mound and I think what we’ve done today is something that is going to be a very important element in having us be successful in doing that. We still have a long way to go. There will be many more cases, but we’ll take care of that. And ultimately, as the President said, this will end, but what’s going on here today is going to help it to end sooner than it would have. Thank you.","https://www.rev.com/blog/transcripts/donald-trump-speech-transcript-declares-coronavirus-national-emergency","Donald Trump Speech Transcript: Declares Coronavirus National Emergency","07:52"
"Donald Trump","Thank you very much, Tony. If I could, some of these folks, we know they’re celebrities in their own right. They’re the biggest business people, the greatest retailers anywhere in the world, and one of them is Doug McMillon from Walmart and I’d like to have Doug, if you would say a few words wherever you may be. [inaudible 00:08:46] Doug, please.","https://www.rev.com/blog/transcripts/donald-trump-speech-transcript-declares-coronavirus-national-emergency","Donald Trump Speech Transcript: Declares Coronavirus National Emergency","08:26"
"Doug McMillon","When we got the call yesterday from the White House, we were eager to do our part to help serve the country. And given what we’re facing, that’s certainly important to do. We should all be doing that. So we’ve been asked to make portions of our parking lot available in select locations in the beginning and scaling over time as supply increases so that people can experience the drive-through experience that the President described. We’ll stay involved and do everything we can from a supply chain point of view to be of assistance. Thank you, sir.","https://www.rev.com/blog/transcripts/donald-trump-speech-transcript-declares-coronavirus-national-emergency","Donald Trump Speech Transcript: Declares Coronavirus National Emergency","08:48"
"Donald Trump","Thank you very much, Doug. Appreciate it very much. I’ll just stay right over here, and Richard, if you could come up please. Richard, please. Walgreens. Thank you.","https://www.rev.com/blog/transcripts/donald-trump-speech-transcript-declares-coronavirus-national-emergency","Donald Trump Speech Transcript: Declares Coronavirus National Emergency","09:11"
"Richard Ashworth","Yep. Thank you, Mr. President. And similar to Doug and Walmart, we’re happy to stand in here and help in communities all across America, because a lot of times when we have natural disasters, our stores are a beacon in the community and this situation is no different. So we look forward to partnering with the CDC, the administration, HHS, and the taskforce and specifically to the Vice President’s doing such a fantastic job. We’re ready to engage and help. Thank you.","https://www.rev.com/blog/transcripts/donald-trump-speech-transcript-declares-coronavirus-national-emergency","Donald Trump Speech Transcript: Declares Coronavirus National Emergency","09:21"
"Donald Trump","Thank you very much. Great job. Thank you very much. Brian Cornell, Target. Thank you, Brian. Thank you. Please.","https://www.rev.com/blog/transcripts/donald-trump-speech-transcript-declares-coronavirus-national-emergency","Donald Trump Speech Transcript: Declares Coronavirus National Emergency","09:46"
"Brian Cornell","Well, Mr. President, thank you for inviting us here today along with our colleagues from Walmart, and Walgreens, and our partners at CVS. Normally, you’d view us as competitors, but today we’re focused on a common competitor and that’s defeating the spread of the coronavirus. And we look forward to working with the administration to do our fair share to alleviate this growing threat. So thank you for including us today. In the near term, we’re all committed to making sure we’re keeping our stores open to serve the American consumer who’s rapidly stocking up on household essentials, key food and beverage items that they need during this time. Making sure we run safe stores and create an environment that’s safe for our team members, making sure that they feel supported during this very critical time. So thank you for including us.","https://www.rev.com/blog/transcripts/donald-trump-speech-transcript-declares-coronavirus-national-emergency","Donald Trump Speech Transcript: Declares Coronavirus National Emergency","09:56"
"Donald Trump","Thank you very much. Great job.","https://www.rev.com/blog/transcripts/donald-trump-speech-transcript-declares-coronavirus-national-emergency","Donald Trump Speech Transcript: Declares Coronavirus National Emergency","10:42"
"Mike Pence","Great job.","https://www.rev.com/blog/transcripts/donald-trump-speech-transcript-declares-coronavirus-national-emergency","Donald Trump Speech Transcript: Declares Coronavirus National Emergency","10:43"
"Donald Trump","Is Tom here? Tom Polen. Tom? Tom Polen, please.","https://www.rev.com/blog/transcripts/donald-trump-speech-transcript-declares-coronavirus-national-emergency","Donald Trump Speech Transcript: Declares Coronavirus National Emergency","10:45"
"Tom Polen","Thank you, Mr. President. As a CEO of Becton Dickinson, we’re one of the leading providers of medical devices as well as collection products for testing of coronavirus. We were ramping up our manufacturing capacity to ensure that the right collection devices and testing equipment are ready to address this issue. Thank you, Mr. President.","https://www.rev.com/blog/transcripts/donald-trump-speech-transcript-declares-coronavirus-national-emergency","Donald Trump Speech Transcript: Declares Coronavirus National Emergency","10:50"
"Donald Trump","Thank you very much, Tom. Great job you’ve done. [Steven Rakowski 00:00:11:10], Quest Diagnostics. Please. Great job. Thank you very much.","https://www.rev.com/blog/transcripts/donald-trump-speech-transcript-declares-coronavirus-national-emergency","Donald Trump Speech Transcript: Declares Coronavirus National Emergency","11:07"
"Steven Rakowski","Thank you very much. Thank you, Mr. President. So as mentioned, we were called through the leadership of the Vice President last week to come together as an industry and we took advantage of that opportunity to work with the FDA, to work with the Center for Disease Control and we were up and running with tests in a number of our facilities. As the President mentioned, we now have capabilities from Roche Diagnostics that we will bring into our facilities this weekend. And I know myself and as my colleague at LabCorp will be doing the same. So the capacity available to the American public to support this action with consumers will be considerably increased in the next few weeks. Thank you, Mr. President.","https://www.rev.com/blog/transcripts/donald-trump-speech-transcript-declares-coronavirus-national-emergency","Donald Trump Speech Transcript: Declares Coronavirus National Emergency","11:17"
"Donald Trump","Thank you very much. I appreciate it.","https://www.rev.com/blog/transcripts/donald-trump-speech-transcript-declares-coronavirus-national-emergency","Donald Trump Speech Transcript: Declares Coronavirus National Emergency","11:56"
"Mike Pence","Thanks.","https://www.rev.com/blog/transcripts/donald-trump-speech-transcript-declares-coronavirus-national-emergency","Donald Trump Speech Transcript: Declares Coronavirus National Emergency","11:57"
"Donald Trump","And Matt Sause, please, of Roche. Matt. Thank you, Matt.","https://www.rev.com/blog/transcripts/donald-trump-speech-transcript-declares-coronavirus-national-emergency","Donald Trump Speech Transcript: Declares Coronavirus National Emergency","11:58"
"Matt Sause","Thank you, Mr. President. So from Roche, we want to thank the FDA for their rapid approval of our coronavirus test. We really appreciate the partnership with the CDC and the FDA to get that to market as fast as possible, because it’s critical for us to make that available to help patients in need and working with laboratories to get it up and going in the near future, which will bring hundreds of thousands of tests available to patients in need in the United States. So thank you.","https://www.rev.com/blog/transcripts/donald-trump-speech-transcript-declares-coronavirus-national-emergency","Donald Trump Speech Transcript: Declares Coronavirus National Emergency","12:04"
"Donald Trump","And you can do it. You can do it.","https://www.rev.com/blog/transcripts/donald-trump-speech-transcript-declares-coronavirus-national-emergency","Donald Trump Speech Transcript: Declares Coronavirus National Emergency","12:33"
"Mike Pence","You can.","https://www.rev.com/blog/transcripts/donald-trump-speech-transcript-declares-coronavirus-national-emergency","Donald Trump Speech Transcript: Declares Coronavirus National Emergency","12:35"
"Donald Trump","You’re a great company. David Pierre of Signify. Signify Health, please. Excellent.","https://www.rev.com/blog/transcripts/donald-trump-speech-transcript-declares-coronavirus-national-emergency","Donald Trump Speech Transcript: Declares Coronavirus National Emergency","12:35"
"David Pierre","Great. Thank you, Mr. President. We are the largest house call provider in the US and we go to the homes of the most vulnerable elderly and through our network and our logistics engine, we stand ready to help and provide our clinicians to be where they’re needed, whether they’re in retail clinics or in the home. And we’re here to assist. Thank you very much.","https://www.rev.com/blog/transcripts/donald-trump-speech-transcript-declares-coronavirus-national-emergency","Donald Trump Speech Transcript: Declares Coronavirus National Emergency","12:41"
"Donald Trump","Thank you very much. And we’ll be changing a lot of the rules, regulations for future should this happen in the future, which we hope it never does, but it will, I guess, somewhere out there. We had some bad ones over the years and I guess that’ll continue to an extent, but we hope it never happens. But we are going to be changing a lot of the old rules and specifications and regulations. Adam Schechter, who’s really been of tremendous help. LabCorp, please. Adam.","https://www.rev.com/blog/transcripts/donald-trump-speech-transcript-declares-coronavirus-national-emergency","Donald Trump Speech Transcript: Declares Coronavirus National Emergency","13:05"
"Adam Schechter","Thank you, Mr. President. At LabCorp, we’re working every second of every day to increase the number of tests that we can run. We’re working with academic medical centers, with our colleagues at Quest, with other hospital and other laboratories to ensure that we do everything we can to increase the testing as we move forward. And I can tell you, we understand how important the testing is and we are committed to doing everything possible.","https://www.rev.com/blog/transcripts/donald-trump-speech-transcript-declares-coronavirus-national-emergency","Donald Trump Speech Transcript: Declares Coronavirus National Emergency","13:38"
"Donald Trump","Thank you very much. Great job. Thank you.","https://www.rev.com/blog/transcripts/donald-trump-speech-transcript-declares-coronavirus-national-emergency","Donald Trump Speech Transcript: Declares Coronavirus National Emergency","14:00"
"Mike Pence","Great.","https://www.rev.com/blog/transcripts/donald-trump-speech-transcript-declares-coronavirus-national-emergency","Donald Trump Speech Transcript: Declares Coronavirus National Emergency","14:02"
