"speaker","transcription","url","headlin","timing"
"Donald Trump","Baloney. They shouldn’t have done that. I think you should redo that election. And you know, the opponent is screaming that he can’t believe it. Ballots are lost, ballots are defrauded. It’s a total mess. And they called it for her. The reason is because I’ve been using it as a case, I’ve been using it as a case. So look, we are going to have an election that takes place on a beautiful day, November 3rd. And usually at the end of the evening, they say, “Donald Trump has won the election. Donald Trump is your new president.” Whatever they say, you know what? You’re not going to know this, possibly, if you really did it right, for months or for years, because these ballots are all going to be lost.","https://www.rev.com/blog/transcripts/donald-trump-august-15-press-conference-transcript-in-nj-talks-mark-esper-postmaster-general-dejoy-and-snowden","Donald Trump August 15 Press Conference Transcript in NJ: Talks Mark Esper, Postmaster General DeJoy, and Snowden","16:02"
"Donald Trump","They’re going to be gone, and just take a look at a smaller basis. But it’s great tests. We’re doing tests. I mean, you could call them polls. You could call them tests. Look at what’s happening all over the country, where you have universal mail-in, wait a minute. The ballots are lost, there’s fraud, there’s theft, it’s happening all over the place. Now, we’re going to do it with this whole vast, big section of the country? It’s crazy.","https://www.rev.com/blog/transcripts/donald-trump-august-15-press-conference-transcript-in-nj-talks-mark-esper-postmaster-general-dejoy-and-snowden","Donald Trump August 15 Press Conference Transcript in NJ: Talks Mark Esper, Postmaster General DeJoy, and Snowden","16:42"
"Speaker 1","Mr. President, you have made it so plain that you are opposed and do not trust mail-in voting. Is your Postmaster General using the agency of the Postal Service to create delays because-","https://www.rev.com/blog/transcripts/donald-trump-august-15-press-conference-transcript-in-nj-talks-mark-esper-postmaster-general-dejoy-and-snowden","Donald Trump August 15 Press Conference Transcript in NJ: Talks Mark Esper, Postmaster General DeJoy, and Snowden","17:14"
"Donald Trump","No, not at all. He would love to see it happen. I didn’t speak to him about it, but I will tell you this. I would imagine he would say, number one, they didn’t give me the funding for it, because it’s sitting in Congress because they want a trillion dollars to bail out states, just so you understand what they want. They want a trillion dollars to bail out badly run, Democrat-run states. Okay. That’s what they want. They’re not giving the money to the post office. They have to give the money to the post office.","https://www.rev.com/blog/transcripts/donald-trump-august-15-press-conference-transcript-in-nj-talks-mark-esper-postmaster-general-dejoy-and-snowden","Donald Trump August 15 Press Conference Transcript in NJ: Talks Mark Esper, Postmaster General DeJoy, and Snowden","17:26"
"Speaker 1","The steps the Postmaster General is taking are creating some delays now-","https://www.rev.com/blog/transcripts/donald-trump-august-15-press-conference-transcript-in-nj-talks-mark-esper-postmaster-general-dejoy-and-snowden","Donald Trump August 15 Press Conference Transcript in NJ: Talks Mark Esper, Postmaster General DeJoy, and Snowden","17:57"
"Donald Trump","No, the steps he’s creating. Yeah.","https://www.rev.com/blog/transcripts/donald-trump-august-15-press-conference-transcript-in-nj-talks-mark-esper-postmaster-general-dejoy-and-snowden","Donald Trump August 15 Press Conference Transcript in NJ: Talks Mark Esper, Postmaster General DeJoy, and Snowden","17:58"
"Speaker 1","Are you trying to-","https://www.rev.com/blog/transcripts/donald-trump-august-15-press-conference-transcript-in-nj-talks-mark-esper-postmaster-general-dejoy-and-snowden","Donald Trump August 15 Press Conference Transcript in NJ: Talks Mark Esper, Postmaster General DeJoy, and Snowden","18:00"
"Donald Trump","No, not at all. The steps that he’s taking are trying to stop the tremendous losses that have taken place for many, many years. He’s trying to streamline the post office and make it great again.","https://www.rev.com/blog/transcripts/donald-trump-august-15-press-conference-transcript-in-nj-talks-mark-esper-postmaster-general-dejoy-and-snowden","Donald Trump August 15 Press Conference Transcript in NJ: Talks Mark Esper, Postmaster General DeJoy, and Snowden","18:01"
"Speaker 1","80 days before an election sir?","https://www.rev.com/blog/transcripts/donald-trump-august-15-press-conference-transcript-in-nj-talks-mark-esper-postmaster-general-dejoy-and-snowden","Donald Trump August 15 Press Conference Transcript in NJ: Talks Mark Esper, Postmaster General DeJoy, and Snowden","18:12"
"Donald Trump","Well, Wait a minute. You just threw, look, I just read last night that now New Jersey is going to try the universal mail-in voting. Well, they didn’t know this. So now all of a sudden New Jersey is going to be hit with millions of ballots to be sent out. They didn’t know anything about this. So how does a postal service that doesn’t know about it, now all of a sudden New Jersey is supposed to take out, and millions of ballots are going to be sent to all over New Jersey? And if you look at some of the things they say, take the state of Nevada, take that little scam that’s going on over there with the clubhouse politician governor, take that, where the votes don’t even have to be in till seven, they get counted seven days after November 3rd. That means, Nevada is a very important state, I think we have a great chance of winning that state. If the votes don’t have to be in for seven, and they’re not counting the votes, seven days later, that means how are they going to predict a winner on November 3rd?","https://www.rev.com/blog/transcripts/donald-trump-august-15-press-conference-transcript-in-nj-talks-mark-esper-postmaster-general-dejoy-and-snowden","Donald Trump August 15 Press Conference Transcript in NJ: Talks Mark Esper, Postmaster General DeJoy, and Snowden","18:15"
"Speaker 2","Whether a ballot was automatically sent to somebody or if-","https://www.rev.com/blog/transcripts/donald-trump-august-15-press-conference-transcript-in-nj-talks-mark-esper-postmaster-general-dejoy-and-snowden","Donald Trump August 15 Press Conference Transcript in NJ: Talks Mark Esper, Postmaster General DeJoy, and Snowden","19:20"
"Donald Trump","No, absentee is okay.","https://www.rev.com/blog/transcripts/donald-trump-august-15-press-conference-transcript-in-nj-talks-mark-esper-postmaster-general-dejoy-and-snowden","Donald Trump August 15 Press Conference Transcript in NJ: Talks Mark Esper, Postmaster General DeJoy, and Snowden","19:23"
"Speaker 2","Okay but once a ballot gets into the mail, it doesn’t matter. The workers have to sort it. So the bottom line is there must be more resources per post office across the country-","https://www.rev.com/blog/transcripts/donald-trump-august-15-press-conference-transcript-in-nj-talks-mark-esper-postmaster-general-dejoy-and-snowden","Donald Trump August 15 Press Conference Transcript in NJ: Talks Mark Esper, Postmaster General DeJoy, and Snowden","19:26"
"Donald Trump","But the Democrats are not, they are not approving the resources. You’re right. There has to be more resources. I agree. Because all of a sudden the post office is tripling up and… The problem is, the Democrats are not approving the funds necessary. It’s in there. Now they have 25 billion. I’ve seen 15 billion. I’ve seen a lot of money. I don’t know how you’re going to spend that much, but that’s what they’re saying. They’re saying. So not only do they want a trillion dollars to hand out as welfare to all these states that are run by Democrats doing badly, they want $25 billion for the post office, but they’re not approving it. Now, what I want is a lot of money, thousands of dollars to go to people because they need money. Despite the good numbers, despite numbers like that, they need money to live. And I want that to happen. The Democrats don’t care about that. They just want to give bailout money to their friends running big states poorly.","https://www.rev.com/blog/transcripts/donald-trump-august-15-press-conference-transcript-in-nj-talks-mark-esper-postmaster-general-dejoy-and-snowden","Donald Trump August 15 Press Conference Transcript in NJ: Talks Mark Esper, Postmaster General DeJoy, and Snowden","19:36"
"Speaker 3","Are you insuring the people in the United States mailing-","https://www.rev.com/blog/transcripts/donald-trump-august-15-press-conference-transcript-in-nj-talks-mark-esper-postmaster-general-dejoy-and-snowden","Donald Trump August 15 Press Conference Transcript in NJ: Talks Mark Esper, Postmaster General DeJoy, and Snowden","20:30"
"Speaker 4","Do you want to give Edward Snowden a pardon and bring him back? You once suggested-","https://www.rev.com/blog/transcripts/donald-trump-august-15-press-conference-transcript-in-nj-talks-mark-esper-postmaster-general-dejoy-and-snowden","Donald Trump August 15 Press Conference Transcript in NJ: Talks Mark Esper, Postmaster General DeJoy, and Snowden","20:33"
"Donald Trump","Well I’m going to look at it. I mean, I’m not that aware of the Snowden situation, but I’m going to start looking at it. There are many, many people. It seems to be a split decision. There are many people think that he should be somehow treated differently, and other people think he did very bad things. And I’m going to take a very good look at it. I mean, I’ve seen people that are very conservative and very liberal and they agree on the same issue. They agree both ways. I’m going to take a look at that very strongly, Edward Snowden. Yeah, please.","https://www.rev.com/blog/transcripts/donald-trump-august-15-press-conference-transcript-in-nj-talks-mark-esper-postmaster-general-dejoy-and-snowden","Donald Trump August 15 Press Conference Transcript in NJ: Talks Mark Esper, Postmaster General DeJoy, and Snowden","20:38"
"Speaker 5","Do you agree with Dr. Robert Redfield, who earlier this week said, “If America doesn’t follow public health guidelines, we could be in store for one of the worst falls we’ve ever faced from a public health perspective?”","https://www.rev.com/blog/transcripts/donald-trump-august-15-press-conference-transcript-in-nj-talks-mark-esper-postmaster-general-dejoy-and-snowden","Donald Trump August 15 Press Conference Transcript in NJ: Talks Mark Esper, Postmaster General DeJoy, and Snowden","21:09"
"Donald Trump","No. I mean, you can’t compare it to 1917. That was incredible. That was the worst ever by far. You look at that, they lost possibly a hundred million people. No, I don’t agree with that. But if you look at these numbers, they’re coming down very substantially. And I do believe that Americans, many are wearing masks, which is a good thing. Again, some people thought that you shouldn’t wear a mask. When this whole thing started, Dr. Fauci, who I like and respect said don’t wear masks. And so did Dr. Redfield. And then all of a sudden it was like, everybody should wear a mask. And that’s okay. People could change their mind. But wash your hands. Good hygiene. All of those things, I think people are really doing it to a level that they’ve never done before. And when you look at the numbers, the way the numbers are coming out, I mean, it’s very impressive when you see what’s happening. By the way, Florida doing well, did you see that? And hospitalizations and all, normally you would have had to build more, like we did for the first surge.","https://www.rev.com/blog/transcripts/donald-trump-august-15-press-conference-transcript-in-nj-talks-mark-esper-postmaster-general-dejoy-and-snowden","Donald Trump August 15 Press Conference Transcript in NJ: Talks Mark Esper, Postmaster General DeJoy, and Snowden","21:19"
"Donald Trump","We’ve done it right. We’ve closed it up. We had the greatest economy in history. We closed it up. We understand the disease now. Nobody knew, nobody knew what was hitting us. Nobody knew that old people would be very, very susceptible, especially if they have heart and diabetes problems, and other problems. That old people would be very susceptible and young people would be extremely good with it. If you look at the percentages, there are a tiny percentage that have problems, especially the big problem. So no, I think that we’re doing very well, we’re on our way. And we’re also opening up our economy, and our economy is going to set records. And if stupid people aren’t elected next year, we’re going to have one of the greatest years that we’ve ever had. Jennifer, go ahead, please.","https://www.rev.com/blog/transcripts/donald-trump-august-15-press-conference-transcript-in-nj-talks-mark-esper-postmaster-general-dejoy-and-snowden","Donald Trump August 15 Press Conference Transcript in NJ: Talks Mark Esper, Postmaster General DeJoy, and Snowden","22:20"
"Jennifer","Thank you, Mr. President. You’ve already taken action on TikTok and WeChat, which other Chinese tech companies are you looking at banning from operating in the United States?","https://www.rev.com/blog/transcripts/donald-trump-august-15-press-conference-transcript-in-nj-talks-mark-esper-postmaster-general-dejoy-and-snowden","Donald Trump August 15 Press Conference Transcript in NJ: Talks Mark Esper, Postmaster General DeJoy, and Snowden","23:06"
"Donald Trump","Well, the big thing is Huawei, right? Huawei’s not here. And Huawei, I’m not allowing. And I’ve told European countries, and others, Australia has been fantastic as an example, but Huawei’s not coming here. And we told certain countries that were thinking about Huawei, that’s okay. You can use them, but we’re not going to be sharing intelligence. And they’ve all backed away. You look at the UK, it looked like they were going that way. And now they’ve backed out. Scotland Yard.","https://www.rev.com/blog/transcripts/donald-trump-august-15-press-conference-transcript-in-nj-talks-mark-esper-postmaster-general-dejoy-and-snowden","Donald Trump August 15 Press Conference Transcript in NJ: Talks Mark Esper, Postmaster General DeJoy, and Snowden","23:16"
"Jennifer","Are there other particular companies?","https://www.rev.com/blog/transcripts/donald-trump-august-15-press-conference-transcript-in-nj-talks-mark-esper-postmaster-general-dejoy-and-snowden","Donald Trump August 15 Press Conference Transcript in NJ: Talks Mark Esper, Postmaster General DeJoy, and Snowden","23:40"
"Donald Trump","There are most, well, yeah, they were looking at other things. Yes, we are. We are.","https://www.rev.com/blog/transcripts/donald-trump-august-15-press-conference-transcript-in-nj-talks-mark-esper-postmaster-general-dejoy-and-snowden","Donald Trump August 15 Press Conference Transcript in NJ: Talks Mark Esper, Postmaster General DeJoy, and Snowden","23:42"
"Speaker 6","Mr. President, you say that you want the mail to be processed as quickly as it can, but why is your postal service dismantling these mail sorting machines across the country at this time?","https://www.rev.com/blog/transcripts/donald-trump-august-15-press-conference-transcript-in-nj-talks-mark-esper-postmaster-general-dejoy-and-snowden","Donald Trump August 15 Press Conference Transcript in NJ: Talks Mark Esper, Postmaster General DeJoy, and Snowden","23:47"
"Donald Trump","Well, you’ll have to ask him. I know this, he’s a very efficient operator, a very good operator, but again, he needs money to operate if you’re going to hit him with…","https://www.rev.com/blog/transcripts/donald-trump-august-15-press-conference-transcript-in-nj-talks-mark-esper-postmaster-general-dejoy-and-snowden","Donald Trump August 15 Press Conference Transcript in NJ: Talks Mark Esper, Postmaster General DeJoy, and Snowden","23:56"
"Donald Trump","Operator, but again, he needs money to operate if you’re going to hit him with millions of ballots. And if you ask him, he will tell you, and he’ll tell you very nicely, you have the money, it’s sitting there. It’s ready to go. The Democrats don’t want to approve it, but I want money for other things too. I want money to go to people so they can live very nicely, because China caused the problem, they didn’t.","https://www.rev.com/blog/transcripts/donald-trump-august-15-press-conference-transcript-in-nj-talks-mark-esper-postmaster-general-dejoy-and-snowden","Donald Trump August 15 Press Conference Transcript in NJ: Talks Mark Esper, Postmaster General DeJoy, and Snowden","24:03"
"Speaker 1","On the campaign, will you say now that Kamala Harris is eligible to run and be vice president or president based on being born in Oakland California?","https://www.rev.com/blog/transcripts/donald-trump-august-15-press-conference-transcript-in-nj-talks-mark-esper-postmaster-general-dejoy-and-snowden","Donald Trump August 15 Press Conference Transcript in NJ: Talks Mark Esper, Postmaster General DeJoy, and Snowden","24:24"
"Donald Trump","So I have nothing to do with that. I read something about it, and I will say that he is a brilliant lawyer, I guess he wrote an article about it. So I know nothing about it, but it’s not something that bothers me.","https://www.rev.com/blog/transcripts/donald-trump-august-15-press-conference-transcript-in-nj-talks-mark-esper-postmaster-general-dejoy-and-snowden","Donald Trump August 15 Press Conference Transcript in NJ: Talks Mark Esper, Postmaster General DeJoy, and Snowden","24:34"
"Speaker 1","But sir, when you do that, it creates-","https://www.rev.com/blog/transcripts/donald-trump-august-15-press-conference-transcript-in-nj-talks-mark-esper-postmaster-general-dejoy-and-snowden","Donald Trump August 15 Press Conference Transcript in NJ: Talks Mark Esper, Postmaster General DeJoy, and Snowden","24:45"
"Donald Trump","Why do you say that? I just don’t know about it. But it’s not something that we will be pursuing. Let me put it differently. [crosstalk 00:24:53]","https://www.rev.com/blog/transcripts/donald-trump-august-15-press-conference-transcript-in-nj-talks-mark-esper-postmaster-general-dejoy-and-snowden","Donald Trump August 15 Press Conference Transcript in NJ: Talks Mark Esper, Postmaster General DeJoy, and Snowden","24:47"
"Speaker 1","You do know sir. Mr. President, you know.","https://www.rev.com/blog/transcripts/donald-trump-august-15-press-conference-transcript-in-nj-talks-mark-esper-postmaster-general-dejoy-and-snowden","Donald Trump August 15 Press Conference Transcript in NJ: Talks Mark Esper, Postmaster General DeJoy, and Snowden","24:53"
"Donald Trump","Let me put it differently. Don’t tell me what I know. Let me put it differently. Let me put it differently. To me, it doesn’t bother me at all. I don’t know about it. I read one quick article. The lawyer happens to be a brilliant lawyer, as you probably know. He wrote an article saying there could be a problem. It’s not something that I’m going to be pursuing.","https://www.rev.com/blog/transcripts/donald-trump-august-15-press-conference-transcript-in-nj-talks-mark-esper-postmaster-general-dejoy-and-snowden","Donald Trump August 15 Press Conference Transcript in NJ: Talks Mark Esper, Postmaster General DeJoy, and Snowden","24:54"
"Speaker 1","Is she eligible sir?","https://www.rev.com/blog/transcripts/donald-trump-august-15-press-conference-transcript-in-nj-talks-mark-esper-postmaster-general-dejoy-and-snowden","Donald Trump August 15 Press Conference Transcript in NJ: Talks Mark Esper, Postmaster General DeJoy, and Snowden","25:18"
"Donald Trump","I just told you, I have not gone into it in great detail. If she’s got a problem, you would have thought that she would have been vetted. You would have thought that she would have been vetted by Sleepy Joe. Yeah, go ahead.","https://www.rev.com/blog/transcripts/donald-trump-august-15-press-conference-transcript-in-nj-talks-mark-esper-postmaster-general-dejoy-and-snowden","Donald Trump August 15 Press Conference Transcript in NJ: Talks Mark Esper, Postmaster General DeJoy, and Snowden","25:18"
"Speaker 7","Mr. President, sorry, I just want to ask you, after three weeks of absolutely no deal, you have been ragging on Democrats constantly, why not come to the table personally, and sit with them? I mean, I know that speaker Pelosi, and minority leader Schumer were in the Oval Office in December 2018, that did not go so well, everybody in the world saw that. Why not invite them? If they don’t want to come, that’s on them.","https://www.rev.com/blog/transcripts/donald-trump-august-15-press-conference-transcript-in-nj-talks-mark-esper-postmaster-general-dejoy-and-snowden","Donald Trump August 15 Press Conference Transcript in NJ: Talks Mark Esper, Postmaster General DeJoy, and Snowden","25:29"
"Donald Trump","So I think we’ve done very well. We’ve had three phases. We’re into phase four. We’ve gotten everything we wanted. And we’ve also gotten a great economy. All you have to do is take a look at these charts. Our economy is doing good. But we want different things than them. I want money for the people. They want money to bail out Democrat governors, and Democrat mayors. Listen to me, listen to me. My people are doing very good. And my people call me, they’re in the office, they call me. They call me when it’s right. Nobody knows the deal better than I do. When it’s right, I’ll meet. But right now it’s not right.","https://www.rev.com/blog/transcripts/donald-trump-august-15-press-conference-transcript-in-nj-talks-mark-esper-postmaster-general-dejoy-and-snowden","Donald Trump August 15 Press Conference Transcript in NJ: Talks Mark Esper, Postmaster General DeJoy, and Snowden","25:51"
"Donald Trump","They want a trillion dollars to bail out badly run states. If they’re Democrat, they’re Democrat states. Will something happen? Possibly. But I want to tell you, the country is doing very well right now. We can live very happily with it, without it, but I’d like to do it because I want to give money to the people. I want to put money into the people’s hands. They want to put money at the politicians hands, so that the politicians don’t look stupid. Steve, please?","https://www.rev.com/blog/transcripts/donald-trump-august-15-press-conference-transcript-in-nj-talks-mark-esper-postmaster-general-dejoy-and-snowden","Donald Trump August 15 Press Conference Transcript in NJ: Talks Mark Esper, Postmaster General DeJoy, and Snowden","26:24"
"Steve","You’ve had some differences with your defense secretary, Mark Esper. Do you have confidence in his leadership there?","https://www.rev.com/blog/transcripts/donald-trump-august-15-press-conference-transcript-in-nj-talks-mark-esper-postmaster-general-dejoy-and-snowden","Donald Trump August 15 Press Conference Transcript in NJ: Talks Mark Esper, Postmaster General DeJoy, and Snowden","26:52"
"Donald Trump","Mark Yesper? Did you call him Yesper? Oh, okay. Some people call him Yesper. No, I get along with him. I get along with him fine. It’s fine. Yeah, no problem.","https://www.rev.com/blog/transcripts/donald-trump-august-15-press-conference-transcript-in-nj-talks-mark-esper-postmaster-general-dejoy-and-snowden","Donald Trump August 15 Press Conference Transcript in NJ: Talks Mark Esper, Postmaster General DeJoy, and Snowden","26:58"
"Speaker 8","Have you considered firing him, Mr. President?","https://www.rev.com/blog/transcripts/donald-trump-august-15-press-conference-transcript-in-nj-talks-mark-esper-postmaster-general-dejoy-and-snowden","Donald Trump August 15 Press Conference Transcript in NJ: Talks Mark Esper, Postmaster General DeJoy, and Snowden","27:08"
"Donald Trump","I consider firing everybody. At some point, that’s what happens. Jennifer, do you have something Jennifer? You’re working so hard.","https://www.rev.com/blog/transcripts/donald-trump-august-15-press-conference-transcript-in-nj-talks-mark-esper-postmaster-general-dejoy-and-snowden","Donald Trump August 15 Press Conference Transcript in NJ: Talks Mark Esper, Postmaster General DeJoy, and Snowden","27:10"
"Jennifer","Do you think that there’ll be anyone else who leaves your cabinet after the election, sir?","https://www.rev.com/blog/transcripts/donald-trump-august-15-press-conference-transcript-in-nj-talks-mark-esper-postmaster-general-dejoy-and-snowden","Donald Trump August 15 Press Conference Transcript in NJ: Talks Mark Esper, Postmaster General DeJoy, and Snowden","27:20"
"Donald Trump","So if we have the success, I think we have a silent majority the likes of which has never been seen before. I think you read about it. Where 62% of the people say they’re not even telling the truth on polling. And where the polling is fake. Where they do registered voters and where they do many more Democrats than they do Republican. Same as happened last time. But this year, I think we have much more enthusiasm. Maybe those people back there would understand it better than anybody. But I think there’s more enthusiasm for 2020 than there was even for 2016. And 2016 was a record. You found that out. And I believe there’s much more enthusiasm now than there was even in 2016. We have a silent majority, the likes of which nobody has seen. I just looked, there are thousands of boats in lakes, rivers, and oceans, thousands and thousands of boats.","https://www.rev.com/blog/transcripts/donald-trump-august-15-press-conference-transcript-in-nj-talks-mark-esper-postmaster-general-dejoy-and-snowden","Donald Trump August 15 Press Conference Transcript in NJ: Talks Mark Esper, Postmaster General DeJoy, and Snowden","27:25"
