"speaker","transcription","url","headlin","timing"
"Donald Trump","I don’t, does anybody get it? What are they doing? Does anybody get it? It has just been stated that President Trump’s endorsement is the most powerful asset in politics. Do you believe that? Who would’ve thought that was going to happen? Who would have thought that’s going to happen, Jim? In last year’s congressional primaries, 120, listen to this, it’s crazy. 120 of 122 candidates I endorsed won, 120. That’s almost as good as Jim’s wrestling record. And the two that lost were beaten by people claiming to be more Trump than their opponent. So I like those two people very much also. In the Senate, I was undefeated in endorsements with a record of 21 and 0, my endorsement of Mitch McConnell, at his request-","https://www.rev.com/blog/transcripts/donald-trump-cpac-2021-speech-transcript","Donald Trump CPAC 2021 Speech Transcript","01:20:18"
"Crowd","Boo.","https://www.rev.com/blog/transcripts/donald-trump-cpac-2021-speech-transcript","Donald Trump CPAC 2021 Speech Transcript","01:21:16"
"Donald Trump","It’s all right, it’s all right. Now, he made a request. He asked for my endorsement, brought him from one point down to 20 points up, and he won his race in the great state, and actually the great Commonwealth of Kentucky. And he won it very easily. And I said, “I wonder if I’m doing the right thing here.” But you know what? I did what I did. But he went from one point down to 20 points up very quickly, immediately actually. And he won his race. And if you compare that to his other elections, I’m sure you’ll see something interesting. But you know what? We got a Republican elected. And now we have to use Republicans to take care of the election frauds and all of the other things that are happening that shouldn’t be allowed to happen in our country. It’s very simple. Because of my efforts campaigning, we had huge gains in the House, and I helped keep many senators in their seats, and they will admit it, so that it’s now 50/50, instead of Republicans being down anywhere from eight to 10 seats.","https://www.rev.com/blog/transcripts/donald-trump-cpac-2021-speech-transcript","Donald Trump CPAC 2021 Speech Transcript","01:21:16"
"Donald Trump","And they’ll admit it, we’d be down eight to 10 seats if I didn’t campaign. We held rallies for some of the senators that were down. And nobody talks about that. Nobody wants to talk, the press doesn’t talk about it. With me at the top of the ticket, not a single Republican member of Congress lost their race for the first time in decades. We won 26 of 26 toss up races. Toss up. Think of that, 26 of 20, and those are toss up. Those are races that could go any way. We were expected to lose 25 seats, and instead we won 15 seats, and almost, oh, why couldn’t we have done a couple of more, almost cost crazy Nancy her job. We’ll do that the next time around. I received almost, listen to this number, because you know, the fake news doesn’t ever talk about these numbers. I just heard this one for the first time. I received almost 1.5 million more votes than all of the Republican House candidates combined.","https://www.rev.com/blog/transcripts/donald-trump-cpac-2021-speech-transcript","Donald Trump CPAC 2021 Speech Transcript","01:22:25"
"Donald Trump","So how the hell is it possible that we lost? It’s not possible. I got more votes. I got more, which is me, when I say I, I’m talking about we. We, we got more votes than any incumbent, any incumbent president in the history of our country, almost 75 million votes. And that doesn’t include the votes and ballots they threw out. If you include them, you’ll see numbers that are much different. We did even better in the second election than we did in the first, you know I won the first? And we won the second, we did much better. Sort of strange, right? How did you do? Well, we did much better the second time. Oh, you did? Really? What a disgrace, what a disgrace to our country. I got over 11 million, very close to 12 million more votes than we got in 2016. And I was told by John McLaughlin that if you, the great pollster, that if you get to, we had 63 in 2016, 63 million.","https://www.rev.com/blog/transcripts/donald-trump-cpac-2021-speech-transcript","Donald Trump CPAC 2021 Speech Transcript","01:23:34"
"Donald Trump","Sir, if you get to 66 million, you have it made. We got to almost 75 million. Then what the hell happened? What happened? What happened when they closed all of the counting booths? What happened at 3:00 in the morning? What happened at 3:02 in the morning? What happened? No president has ever lost an election after carrying Florida, Ohio, and Iowa. And I won them all. And I won them by a lot. By a lot. I won 94% of the primary vote, no incumbent president who received more than 75% of the primary vote has ever lost an election. I had a record number, and no president has ever, ever, and we’re talking about a much lower number than we got, has ever lost an election. Thanks to my coattails, thank you. We have to have a sense of humor. Thanks to my coattails, democrats failed to flip a single state legislature. Think of it, or a legislative chamber, because Republicans came out to vote for me. Now they say it differently. The press, the fake news spins it differently.","https://www.rev.com/blog/transcripts/donald-trump-cpac-2021-speech-transcript","Donald Trump CPAC 2021 Speech Transcript","01:24:39"
"Donald Trump","They say, “Despite how well they did, Trump didn’t win.” That’s such a lie. And many legislators, many legislators told me, they said, they were going to lose their race. It wasn’t going to happen. And then what happened is one in particular told me from a great swing state, said, “You know, I thought I was going to lose my position, lose my race. And I went out with my wife the night before the election. And I saw all these Trump signs and the American flags and the spirits on the streets.” I said, “You know, darling, I think we’re going to win.” He said, “But you were far, far, far more popular than me.” They do lots of polls. You were way, way ahead of me, sir. And the next day I was right. He said, he won the election by a lot, and you lost the election. And sir, it’s not possible that you lost, because you got a lower number than I did. And you were so far ahead of me. You’re the person that brought everybody out to vote.","https://www.rev.com/blog/transcripts/donald-trump-cpac-2021-speech-transcript","Donald Trump CPAC 2021 Speech Transcript","01:25:58"
"Donald Trump","And I happen to agree with that 1, 000%. never forget that conversation. He couldn’t believe it. And I’ve heard it from more than one. And in November, 18 of 19 bellwether counties, you heard about the bellwether counties? 18 of 19 bellwether counties that have correctly predicted every presidential election election for decades. Many decades, voted for Trump, not for Biden. And it was a shocker to those people that go for the stats. It was a shocker. They voted for Trump, 18 of 19 voted for Trump. There’s never been anything like that. And yet did Biden win? No. If you want to help us take back the future of our country, go to DonaldJTrump.com. I don’t do this. I’ve never done this, but it’s time that we have to put forces together, because these people with their big tech and their fake news media right back there, okay? And you know, when you talk about election, they turn off.","https://www.rev.com/blog/transcripts/donald-trump-cpac-2021-speech-transcript","Donald Trump CPAC 2021 Speech Transcript","01:26:57"
"Donald Trump","When you talk about, they probably have them going, because they also care about ratings. But when they talk about election, they turn off the cameras. You know why? It’s a very sore subject, okay? They don’t like that subject. There’s only one way to contribute to our efforts, to elect America first Republican conservatives, and in turn to make America great again, and that’s through Save America, PAC, and DonaldJTrump.com. So go out there and do whatever you can because we’re going to help a lot of great people. We know the right people to help. We need your help to win, and to fight big tech and the radical left and the DC establishment. We need to save your second amendment, which is under siege. We need to help protect funding for our military and for our great vets. And that’s what we’re doing. As we discussed earlier, we’re in a struggle for the survival of America as we know it. This is a struggle. This is a terrible, terrible, painful struggle. The path ahead will not be easy, but we will win. We are going to win. Ultimately we always win.","https://www.rev.com/blog/transcripts/donald-trump-cpac-2021-speech-transcript","Donald Trump CPAC 2021 Speech Transcript","01:28:04"
"Donald Trump","And when we do, history will show that this was the moment when we could have given up, when we could have despaired. But instead, we chose to keep on pushing forward. The greater the challenge and tougher the task, the more determined we must be to pull through to triumph. We have to have triumph. We have to have victory. With the talent and dedication of everyone here today, and you have tremendous, not only dedication, tremendous talent in this room. I know many of you. That is exactly what we will do. We will go on to victory. We will summon the spirit of generations of American Patriots before us, like those heroes who crossed the Delaware, conquered the Rockies, stormed the beaches, won the battles, and tamed the unknown frontiers. We will persist, and we will prevail. We’re tougher than they are. We’re stronger than they are. Together, in the coming years, we will carry forward the torch of American Liberty. We will lead the conservative movement and the Republican party back to a totally conclusive victory.","https://www.rev.com/blog/transcripts/donald-trump-cpac-2021-speech-transcript","Donald Trump CPAC 2021 Speech Transcript","01:29:11"
"Donald Trump","And we’ve had tremendous victories. Don’t ever forget it. With your help, we will take back the House. We will win the Senate. And then, a Republican president will make a triumphant return to the White House. And I wonder who that will be? I wonder who that will be? Who, who, who will that be? I wonder. Standing before you today, I am supremely confident that for our movement, for our party, and for our country, our brightest days are just ahead. And that together we will make America prouder, freer, stronger and greater than it ever has been before. Thank you CPAC, God bless you, and God bless America. Thank you all. Thank you.","https://www.rev.com/blog/transcripts/donald-trump-cpac-2021-speech-transcript","Donald Trump CPAC 2021 Speech Transcript","01:30:26"
"Speaker 2","(Singing)","https://www.rev.com/blog/transcripts/donald-trump-cpac-2021-speech-transcript","Donald Trump CPAC 2021 Speech Transcript","01:31:34"
