"speaker","transcription","url","headlin","timing"
"Jeanine Pirro","Mr. President, thanks so much for doing this. Joe Biden has indicated after the Woodward information came out that your handling of the coronavirus and that situation was not only despicable but it’s almost criminal. What do you say to Joe Biden?","https://www.rev.com/blog/transcripts/donald-trump-judge-jeanine-pirro-interview-transcript-september-12","Donald Trump Judge Jeanine Pirro Interview Transcript September 12","00:18"
"Donald Trump","Well I think a statement like that is criminal because we did a much better job than he could ever have done. As you know he was months later before he even thought the ban was a good thing and ultimately he had to apologize for what he did. We would have lost hundreds of thousands of lives and what I said to Woodward was actually good. I said calm, we need calm. We don’t need panic. You want me to jump up and down and start screaming, is everyone going to die, is everyone going to … That’s not what leadership is about. I’m a cheerleader for the country. We need calm. That’s all I’ve said, and by the way, that was done after, that was done after I had already banned China –","https://www.rev.com/blog/transcripts/donald-trump-judge-jeanine-pirro-interview-transcript-september-12","Donald Trump Judge Jeanine Pirro Interview Transcript September 12","00:34"
"Jeanine Pirro","Right.","https://www.rev.com/blog/transcripts/donald-trump-judge-jeanine-pirro-interview-transcript-september-12","Donald Trump Judge Jeanine Pirro Interview Transcript September 12","01:08"
"Donald Trump","From coming into the country. So I took big steps.","https://www.rev.com/blog/transcripts/donald-trump-judge-jeanine-pirro-interview-transcript-september-12","Donald Trump Judge Jeanine Pirro Interview Transcript September 12","01:08"
"Jeanine Pirro","That was in February. You did the ban January 31.","https://www.rev.com/blog/transcripts/donald-trump-judge-jeanine-pirro-interview-transcript-september-12","Donald Trump Judge Jeanine Pirro Interview Transcript September 12","01:09"
"Donald Trump","So Jeanine, I took tremendous steps, everybody knew how I feel, otherwise I wouldn’t be banning China and then shortly thereafter I banned Europe. We saved hundreds of thousands of lives with each one of those bans and saved probably two or two and a half million lives by doing what we did early.","https://www.rev.com/blog/transcripts/donald-trump-judge-jeanine-pirro-interview-transcript-september-12","Donald Trump Judge Jeanine Pirro Interview Transcript September 12","01:12"
"Jeanine Pirro","So you say that your timing was good but let me ask you about Bob Woodward’s timing. He did this interview with you on February 7 where you talked about how dangerous the virus was and yet he waited until September, seven months later, to announce to the American public how dangerous you said it was. Was his timing good?","https://www.rev.com/blog/transcripts/donald-trump-judge-jeanine-pirro-interview-transcript-september-12","Donald Trump Judge Jeanine Pirro Interview Transcript September 12","01:28"
"Donald Trump","Look, he is an opportunist and not a bad guy to be honest, he’s doing his thing. His first book I didn’t have anything to do with it and he wrote things that were false and untrue and I could have straightened it out and I said, “Let me do,” I took quite a few phone calls, 16 phone calls or something like that and we had some good conversations, not long, but good conversations. I don’t even know if the book is good or bad. I can tell you that what this says is that I said don’t panic, we don’t want panic. The press will make everything look bad because it’s fake, the fake news, most of it. I’d say 85% unfortunately, that’s the number we’re up to. But I discussed with him lots of different things. I think that they were very good discussions. We’ll see how it comes out but on this subject if you look, and he’s actually being [inaudible 00:02:37] because if he thought it was wrong, then he should have reported it early. If lives were going to be lost, he should have reported it early. The truth is he didn’t think there was anything wrong with it and I think that he thought it was surprising that the press even picked it up. It’s fake news. It’s all fake news.","https://www.rev.com/blog/transcripts/donald-trump-judge-jeanine-pirro-interview-transcript-september-12","Donald Trump Judge Jeanine Pirro Interview Transcript September 12","01:48"
"Jeanine Pirro","Well in fact when he called you in March a month later you said to him, “I didn’t want to cause panic,” and that’s precisely why I as a leader didn’t go out just say everyone’s going to die.","https://www.rev.com/blog/transcripts/donald-trump-judge-jeanine-pirro-interview-transcript-september-12","Donald Trump Judge Jeanine Pirro Interview Transcript September 12","02:52"
"Donald Trump","Well go out and look at the great leaders of the world. Winston Churchill stood on the rooftops in London, very calm, making speeches. Winston Churchill. You want calmness. You don’t want to somebody going to be jumping up and down. I could do that too. I could jump up and down, say, “Oh, this is terrible. This is terrible.” We want strength, we want leadership and we don’t want panic.","https://www.rev.com/blog/transcripts/donald-trump-judge-jeanine-pirro-interview-transcript-september-12","Donald Trump Judge Jeanine Pirro Interview Transcript September 12","03:05"
"Jeanine Pirro","What about the vaccine itself? Now Joe Biden and Kamala Harris and the Gallup survey that they just did says that the acceptance of the vaccine is pretty much going along political lines. The Democrats don’t want to accept it because they don’t trust it because it’s coming out of your administration.","https://www.rev.com/blog/transcripts/donald-trump-judge-jeanine-pirro-interview-transcript-september-12","Donald Trump Judge Jeanine Pirro Interview Transcript September 12","03:25"
"Donald Trump","They don’t want it because they think it’s going to make me look good and it wins the election for me but we’re very close to a vaccine. We also have already come out with therapeutics. If you look at remdesivir and others, the plasma, you take a look at the things that we’ve come out with already and the number, we’re 85% better in terms of fatalities. You look at the kind of numbers, I don’t know if you’ve been seeing this but we’re really rounding the corner and this is actually without anything further than we already have and we have some very good things out there already in terms of … I would say in terms of … You can’t use the word cure yet but pretty close to a cure. You’re going to be pretty close to a cure. The vaccine itself, I mean it could come out in October, but whether it’s October, November, December, it’s going to come out very soon. We have great companies that are very advanced and the results are going to be very good.","https://www.rev.com/blog/transcripts/donald-trump-judge-jeanine-pirro-interview-transcript-september-12","Donald Trump Judge Jeanine Pirro Interview Transcript September 12","03:42"
"Jeanine Pirro","Well the numbers, you’re correct, the numbers are going down, and there’s a question as to whether or not the lockdown works, that maybe people need to get outside and if the coronavirus cases are dropping and Joe Biden now is coming out and saying, “On the advice of the scientists I would shut it all down again.” How do you think that’s going to work for him?","https://www.rev.com/blog/transcripts/donald-trump-judge-jeanine-pirro-interview-transcript-september-12","Donald Trump Judge Jeanine Pirro Interview Transcript September 12","04:34"
"Donald Trump","Well it would be a disaster and we’re setting records on job production. We’re 10.4 million for the last four months. Nobody’s ever seen numbers like this, we’re setting records by millions and millions of jobs. The country’s coming back, it’s a super V, it’s beyond a V, it’s a super V, retail sales are beyond any number they were ever at. I mean think of it, we’re doing numbers now as we’re rounding I think the final turn, and that’s with, without, it doesn’t matter. With or without. Having the vaccine is great, it’s going to happen very soon. Could happen in October, it could very well happen October but we’re rounding the turn on the virus. They have to open up. It’s only the Democrats that are closed and in my opinion they’re closed for political reasons. They have North Carolina, you have Michigan, you have a couple of other states that are …","https://www.rev.com/blog/transcripts/donald-trump-judge-jeanine-pirro-interview-transcript-september-12","Donald Trump Judge Jeanine Pirro Interview Transcript September 12","04:54"
"Donald Trump","New York, I mean, look at New York, what they’re doing in New York, that poor city with the restaurants. You can’t go to a restaurant. It’s like a ghost town. What they’ve done to New York and people are leaving is disgraceful between Cuomo and DeBlasio. That combination, I’ve never seen anything like it in my life. Coming from New York, it’s a very sad thing to witness, but we have to open up our states, totally open them. They’re keeping them closed because they want on November 3, they want to have the numbers as bad as possible. Based on the numbers that you’re seeing it’s not even affecting this but probably it would be better if these states were open. Forget about numbers though. The people that are inside those lockdowns, they’re suffering between depression, losing their jobs, drugs, alcohol, all of the different things that are happening to those people. That’s causing much more damage than the virus itself.","https://www.rev.com/blog/transcripts/donald-trump-judge-jeanine-pirro-interview-transcript-september-12","Donald Trump Judge Jeanine Pirro Interview Transcript September 12","05:41"
"Jeanine Pirro","Well what’s interesting, you mentioned North Carolina. Voting has already started in North Carolina. They’re on lockdown. How do you think that impacts people who want to vote for you?","https://www.rev.com/blog/transcripts/donald-trump-judge-jeanine-pirro-interview-transcript-september-12","Donald Trump Judge Jeanine Pirro Interview Transcript September 12","06:32"
"Donald Trump","Well look, I’d like people to go out and vote but if they want to sign something … You have solicited and unsolicited ballots –","https://www.rev.com/blog/transcripts/donald-trump-judge-jeanine-pirro-interview-transcript-september-12","Donald Trump Judge Jeanine Pirro Interview Transcript September 12","06:39"
"Jeanine Pirro","Right. Mail-in. Yep.","https://www.rev.com/blog/transcripts/donald-trump-judge-jeanine-pirro-interview-transcript-september-12","Donald Trump Judge Jeanine Pirro Interview Transcript September 12","06:46"
"Donald Trump","In the country. They’re going to send out 80 million unsolicited. In other words people that don’t even know what a ballot is, all of a sudden, here comes a ballot. Now we don’t even know if the people are going to get it. That’s my problem. Supposing they’re not sending them to Republican neighborhoods. Supposing they’re not sending them to wherever. Or supposing the people aren’t giving them back, or they go out and they harvest them. Somebody … It could be either way, but the Democrats seem to do that. I mean they played that game for a long time.","https://www.rev.com/blog/transcripts/donald-trump-judge-jeanine-pirro-interview-transcript-september-12","Donald Trump Judge Jeanine Pirro Interview Transcript September 12","06:47"
"Jeanine Pirro","Yeah, I’ve prosecuted those cases. So I’m familiar with it.","https://www.rev.com/blog/transcripts/donald-trump-judge-jeanine-pirro-interview-transcript-september-12","Donald Trump Judge Jeanine Pirro Interview Transcript September 12","07:14"
"Donald Trump","Well, you might have to prosecute a lot more. The fact is they’re playing very dirty. 80 million ballots. We never had any number like that, anywhere close to that, and you’re going to see a mess on Election Night that’s going to be … It’s going to be legendary, and all they have to do is say, “Go out and vote,” or request a ballot. Get what’s called a solicited ballot or absentee, a lot of people use the word absentee. Get an absentee ballot where you request it, it comes to you, you vote and you send it back. That’s different, but they’re just sending out all over, they’re sending out 80 million ballots.","https://www.rev.com/blog/transcripts/donald-trump-judge-jeanine-pirro-interview-transcript-september-12","Donald Trump Judge Jeanine Pirro Interview Transcript September 12","07:16"
"Jeanine Pirro","Well they’re generic and a lot of people don’t know what to do with them, a lot of people have moved, a lot of people have died, the registration rolls, a lot of them haven’t been purged, it’s a whole problem.","https://www.rev.com/blog/transcripts/donald-trump-judge-jeanine-pirro-interview-transcript-september-12","Donald Trump Judge Jeanine Pirro Interview Transcript September 12","07:53"
"Donald Trump","How about signatures? They don’t even want to have signatures verified.","https://www.rev.com/blog/transcripts/donald-trump-judge-jeanine-pirro-interview-transcript-september-12","Donald Trump Judge Jeanine Pirro Interview Transcript September 12","08:01"
"Jeanine Pirro","They’re not confirming. Right. [inaudible 00:08:05]","https://www.rev.com/blog/transcripts/donald-trump-judge-jeanine-pirro-interview-transcript-september-12","Donald Trump Judge Jeanine Pirro Interview Transcript September 12","08:03"
"Donald Trump","They don’t want to have signatures verified. Where are they sending them? Who are they sending them to? Who’s sending them back? Who’s sending them back? It’s a very … It’s so unconstitutional, it’s so dishonest, and you have states that can’t even do small elections that way.","https://www.rev.com/blog/transcripts/donald-trump-judge-jeanine-pirro-interview-transcript-september-12","Donald Trump Judge Jeanine Pirro Interview Transcript September 12","08:04"
"Jeanine Pirro","So what can you do about it?","https://www.rev.com/blog/transcripts/donald-trump-judge-jeanine-pirro-interview-transcript-september-12","Donald Trump Judge Jeanine Pirro Interview Transcript September 12","08:19"
"Donald Trump","Well we’re in courts, in many, many courts right now and hopefully the courts are going to decide because if they don’t you’re going to have one hell of a mess on Election Night.","https://www.rev.com/blog/transcripts/donald-trump-judge-jeanine-pirro-interview-transcript-september-12","Donald Trump Judge Jeanine Pirro Interview Transcript September 12","08:20"
"Jeanine Pirro","So you talked about Election Night. I want to talk about Election Night also but it brings me to the issue of law and order and you, when you ran in 2016, you were the law and order candidate. It’s almost prescient to think that four years later, that is one of the main issues. So we’ve got this anarchy going on in the streets, we’ve got towns and states run by Democrat governors and mayors who are refusing to allow the National Guard to come in. There are people in those cities and states who want order to come in, but you can’t go in unless they request your help.","https://www.rev.com/blog/transcripts/donald-trump-judge-jeanine-pirro-interview-transcript-september-12","Donald Trump Judge Jeanine Pirro Interview Transcript September 12","08:28"
"Donald Trump","That’s right. Every problem.","https://www.rev.com/blog/transcripts/donald-trump-judge-jeanine-pirro-interview-transcript-september-12","Donald Trump Judge Jeanine Pirro Interview Transcript September 12","09:04"
"Jeanine Pirro","What are you going to do … Let’s say there are threats, they say that they’re going to threaten riots if they lose on Election Night, assuming we get a winner on Election Night. What are you going to do?","https://www.rev.com/blog/transcripts/donald-trump-judge-jeanine-pirro-interview-transcript-september-12","Donald Trump Judge Jeanine Pirro Interview Transcript September 12","09:05"
"Donald Trump","We’ll put them down very quickly if they do that.","https://www.rev.com/blog/transcripts/donald-trump-judge-jeanine-pirro-interview-transcript-september-12","Donald Trump Judge Jeanine Pirro Interview Transcript September 12","09:17"
"Jeanine Pirro","How are you going to do that?","https://www.rev.com/blog/transcripts/donald-trump-judge-jeanine-pirro-interview-transcript-september-12","Donald Trump Judge Jeanine Pirro Interview Transcript September 12","09:18"
"Donald Trump","We have the right to do that, we have the power to do that if we want. Look, it’s called insurrection. We just send them in and we do it very easy. I mean it’s very easy. I’d rather not do that because there’s no reason for it but if we had to we’d do that and put it down within minutes, within minutes. Minneapolis, they were having problems. We sent in the National Guard within a half an hour. That was the end of the problem. It all went away.","https://www.rev.com/blog/transcripts/donald-trump-judge-jeanine-pirro-interview-transcript-september-12","Donald Trump Judge Jeanine Pirro Interview Transcript September 12","09:19"
"Jeanine Pirro","Kenosha.","https://www.rev.com/blog/transcripts/donald-trump-judge-jeanine-pirro-interview-transcript-september-12","Donald Trump Judge Jeanine Pirro Interview Transcript September 12","09:40"
"Donald Trump","You look at Kenosha. Look at the problems they had. In fact the sheriffs there, the police chief, they’re all on my side, 100%. Law enforcement all over the country is on my side and I will say this. Look, we have … Even with the horrible things that are going on in New York and Chicago, all run by Democrats. Everything we’re talking about is run by Democrats. We’re not talking about one Republican place. It’s all run by Democrats. Even the police chiefs, they’re all quitting all over the country. Every single one, I think I saw 15 or 20, every single one of them is from a Democrat city. Look, before China sent us the plague, before the plague came in, we had the best crime numbers in history. When the plague came it changed things, let’s face it, it changed things, but all of the problems are in Democrat run cities. They’re badly run, the taxes are too much, they want to defund their police. Biden is all in that. He hasn’t still to this day used the term law and order. He’s afraid to use the term because he’s going to lose. He would lose the radical left supporters that he’s got if they even show up for him because there’s a question as to whether or not they’re going to show up, but they don’t want to talk about law and order.","https://www.rev.com/blog/transcripts/donald-trump-judge-jeanine-pirro-interview-transcript-september-12","Donald Trump Judge Jeanine Pirro Interview Transcript September 12","09:40"
"Donald Trump","One other thing, you have a lot of people living in the suburbs, you know it well. You live in Westchester, you know it well. I ended a rule or regulation where low-income housing has been forced into the suburbs and this has been going on for a long time but especially so under Biden and Obama. I ended it, I terminated it. Not going to happen anymore unless I’m not here in which case they’re going to [inaudible 00:11:13] worse. So the suburbs are not going to have these projects forced into them. Now who in the suburbs is not going to vote for me? They’re going to make the projects bigger, better. They’re putting Cory Booker in charge. I mean one of the most liberal, the most liberal is Kamala, but Cory’s right there, and he’s going to be in charge of building projects in the suburbs. You’re going to destroy your suburbs. It’s already happening because you see what’s going on, you see what they’ve done. They take over the zoning and they force projects, projects. Really terrible situation.","https://www.rev.com/blog/transcripts/donald-trump-judge-jeanine-pirro-interview-transcript-september-12","Donald Trump Judge Jeanine Pirro Interview Transcript September 12","10:51"
"Jeanine Pirro","So the cities are being destroyed and the combination of lawlessness and the pandemic shutdown, New York City, and now the suburbs but you know –","https://www.rev.com/blog/transcripts/donald-trump-judge-jeanine-pirro-interview-transcript-september-12","Donald Trump Judge Jeanine Pirro Interview Transcript September 12","11:45"
"Donald Trump","Well the suburbs are going to be next.","https://www.rev.com/blog/transcripts/donald-trump-judge-jeanine-pirro-interview-transcript-september-12","Donald Trump Judge Jeanine Pirro Interview Transcript September 12","11:53"
"Jeanine Pirro","Yeah –","https://www.rev.com/blog/transcripts/donald-trump-judge-jeanine-pirro-interview-transcript-september-12","Donald Trump Judge Jeanine Pirro Interview Transcript September 12","11:55"
"Donald Trump","Look, the suburbs, the people, these same protesters, but they’re not protesters, they’re anarchists, they’re agitators, and they’re rioters –","https://www.rev.com/blog/transcripts/donald-trump-judge-jeanine-pirro-interview-transcript-september-12","Donald Trump Judge Jeanine Pirro Interview Transcript September 12","11:55"
"Jeanine Pirro","Who are they? Who are they?","https://www.rev.com/blog/transcripts/donald-trump-judge-jeanine-pirro-interview-transcript-september-12","Donald Trump Judge Jeanine Pirro Interview Transcript September 12","12:01"
"Donald Trump","They’re people that in many cases are paid –","https://www.rev.com/blog/transcripts/donald-trump-judge-jeanine-pirro-interview-transcript-september-12","Donald Trump Judge Jeanine Pirro Interview Transcript September 12","12:02"
"Jeanine Pirro","By whom?","https://www.rev.com/blog/transcripts/donald-trump-judge-jeanine-pirro-interview-transcript-september-12","Donald Trump Judge Jeanine Pirro Interview Transcript September 12","12:04"
"Donald Trump","And then their stupid kids.","https://www.rev.com/blog/transcripts/donald-trump-judge-jeanine-pirro-interview-transcript-september-12","Donald Trump Judge Jeanine Pirro Interview Transcript September 12","12:05"
"Jeanine Pirro","Who’s paying them?","https://www.rev.com/blog/transcripts/donald-trump-judge-jeanine-pirro-interview-transcript-september-12","Donald Trump Judge Jeanine Pirro Interview Transcript September 12","12:07"
"Donald Trump","By people that we’re looking at right now. We’re looking at them right now.","https://www.rev.com/blog/transcripts/donald-trump-judge-jeanine-pirro-interview-transcript-september-12","Donald Trump Judge Jeanine Pirro Interview Transcript September 12","12:08"
"Jeanine Pirro","Can you tell me?","https://www.rev.com/blog/transcripts/donald-trump-judge-jeanine-pirro-interview-transcript-september-12","Donald Trump Judge Jeanine Pirro Interview Transcript September 12","12:12"
"Donald Trump","No, not yet, but you’re going to be finding out pretty soon. Look, they’re stupid people too, because they’ll be overthrown as soon as they get their wish. These people don’t respect them, they’re just using their money. These are super liberal people that have money and they’re helping these anarchists and their agitators and they’re dangerous … Did you see what happened over the weekend with the people walking up to a restaurant and grabbing the steak off –","https://www.rev.com/blog/transcripts/donald-trump-judge-jeanine-pirro-interview-transcript-september-12","Donald Trump Judge Jeanine Pirro Interview Transcript September 12","12:13"
"Jeanine Pirro","Grabbing their food –","https://www.rev.com/blog/transcripts/donald-trump-judge-jeanine-pirro-interview-transcript-september-12","Donald Trump Judge Jeanine Pirro Interview Transcript September 12","12:35"
"Donald Trump","The plate and biting the steak and then dropping it down, two elderly people having dinner at a restaurant and they walk in and they take a steak and they take the potato and they eat it?","https://www.rev.com/blog/transcripts/donald-trump-judge-jeanine-pirro-interview-transcript-september-12","Donald Trump Judge Jeanine Pirro Interview Transcript September 12","12:35"
"Jeanine Pirro","That’s exactly the problem. Now you’re waiting to be asked in. When does that change? When you do cross the Rubicon?","https://www.rev.com/blog/transcripts/donald-trump-judge-jeanine-pirro-interview-transcript-september-12","Donald Trump Judge Jeanine Pirro Interview Transcript September 12","12:45"
"Donald Trump","Well in Kenosha they asked me in, and we did a job like nobody’s ever seen before.","https://www.rev.com/blog/transcripts/donald-trump-judge-jeanine-pirro-interview-transcript-september-12","Donald Trump Judge Jeanine Pirro Interview Transcript September 12","12:54"
"Jeanine Pirro","But if they don’t ask you when, there are American people who want you.","https://www.rev.com/blog/transcripts/donald-trump-judge-jeanine-pirro-interview-transcript-september-12","Donald Trump Judge Jeanine Pirro Interview Transcript September 12","13:00"
"Donald Trump","Then you’re not allowed to do it, unless you do insurrection in which case it’s just not big enough for insurrection.","https://www.rev.com/blog/transcripts/donald-trump-judge-jeanine-pirro-interview-transcript-september-12","Donald Trump Judge Jeanine Pirro Interview Transcript September 12","13:03"
"Jeanine Pirro","You won’t do insurrection before an election?","https://www.rev.com/blog/transcripts/donald-trump-judge-jeanine-pirro-interview-transcript-september-12","Donald Trump Judge Jeanine Pirro Interview Transcript September 12","13:07"
