"speaker","transcription","url","headlin","timing"
"Donald Trump","Thank you very much. Before I provide an update on our continued progress against the China virus, I’d like to discuss our latest actions against the Iranian regime.","https://www.rev.com/blog/transcripts/donald-trump-press-conference-transcript-august-19","Donald Trump August 19 White House Press Conference Transcript","00:20"
"Donald Trump","Today, I’m directing the Secretary of State Mike Pompeo to notify the UN Security Council that the United States intends to restore virtually all of the previously suspended United Nations sanctions on Iran. It’s a snapback. Not uncommon. Two years ago, I withdrew the United States from the disastrous Iran Nuclear Deal, which was a product of the Obama Biden foreign policy failure, a failure like few people have seen in terms of the amount of money we paid for absolutely nothing and a short term deal. This deal funneled tens of billions of dollars to around 150 billion to be exact, plus 1.8 billion in cash, which I don’t know that the president had the authority to give. Gave 1.8 billion in cash. Just another great deal that turned out to be a total disaster that would have funded all of the chaos and the bloodshed and the terror in the region and all throughout the world.","https://www.rev.com/blog/transcripts/donald-trump-press-conference-transcript-august-19","Donald Trump August 19 White House Press Conference Transcript","00:36"
"Donald Trump","And I won’t say anything because I don’t like saying it, but Iran doesn’t have so much money to give to the world anymore, to the terrorist, to give to Al Qaeda, various other groups of people that they were funding. They have to keep their own regime together and it’s not easy for them. And if, and when I win the election within the first month, Iran will come to us and they are going to be asking for a deal so quickly because they are doing very poorly, but that deal was a disaster. $150 billion. $1.8 billion in cash and we got nothing except the short term little deal. Short term, expiring and starting to expire already. It’s terminated but it would have, if we didn’t terminate it, start to expire very shortly.","https://www.rev.com/blog/transcripts/donald-trump-press-conference-transcript-august-19","Donald Trump August 19 White House Press Conference Transcript","01:48"
"Donald Trump","A good deal was the deal we made with UAE and Israel and by the way, other countries, I will tell you now, want to come into that deal. Countries that you wouldn’t even believe want to come into that deal and all of a sudden, you’re going to have peace in the Middle East and you couldn’t have done it with this ridiculous Iran Nuclear Deal, as they call it, that President Obama made along with sleepy Joe Biden. I imposed the toughest ever sanctions on Iran and this has caused great difficulty for them, giving money to terrorist organizations and if they do, they’ll have hell to pay. Earlier this year, I ordered the strike that took out the world’s number one terrorist Qasem Soleimani. In addition to previously terminating leader and founder of ISIS Abu Bakr al-Baghdadi.","https://www.rev.com/blog/transcripts/donald-trump-press-conference-transcript-august-19","Donald Trump August 19 White House Press Conference Transcript","02:36"
"Donald Trump","The two leading terrorists by far in the world. The founder of ISIS, nobody even talks about that. And we also defeated, we now have 100% of the ISIS caliphate in Syria. When I took over, it was a mess. It was a total mess. It was, they were all over the place.","https://www.rev.com/blog/transcripts/donald-trump-press-conference-transcript-august-19","Donald Trump August 19 White House Press Conference Transcript","03:35"
"Donald Trump","My administration will not allow this Iran nuclear situation to go on. They will never have a nuclear weapon. Iran will never have, mark it down. Mark it down. Iran will never have a nuclear weapon. When the United States entered into the Iran deal, it was clear that the United States would always have the right to restore the UN sanctions that will prevent Iran from developing a nuclear weapon. We paid a fortune for a failed concept and a failed policy, a policy that would have made it impossible to have peace in the Middle East.","https://www.rev.com/blog/transcripts/donald-trump-press-conference-transcript-august-19","Donald Trump August 19 White House Press Conference Transcript","03:57"
"Donald Trump","Here at home, through Operation legend, we are confronting the wave of crime in Democrat run American cities, that’s absolutely shocking. When you look at Portland or New York, San Francisco, Seattle, Chicago, sometimes Los Angeles, Democrat run cities. They’re a mess because they don’t get it. Either they don’t get it or there’s something that nobody else understands.","https://www.rev.com/blog/transcripts/donald-trump-press-conference-transcript-august-19","Donald Trump August 19 White House Press Conference Transcript","04:40"
"Donald Trump","We’ve deployed more than 1,000 additional federal agents to help these Democrat run disasters. We just have done this. We have to give them a hand and we can stop it immediately. Like at Portland, would be so easy to stop. Would stop it immediately. We only sent in some Homeland people who are great, by the way, to save the courthouse, cause it would have been blown up or burned down and they did that very easily. But if we were called upon, we would send in, whether it’s Homeland, whether it’s FBI, whether it’s just law enforcement and we’d send them in quickly. We would eradicate it just like happened in Minneapolis. Soon as they were called in, they should have been called in a lot sooner. You would have had far less damage today.","https://www.rev.com/blog/transcripts/donald-trump-press-conference-transcript-august-19","Donald Trump August 19 White House Press Conference Transcript","05:14"
"Donald Trump","Today we announced that Operation legend has successfully resulted in nearly 1,500 arrests already. Bad ones. Bad ones. Really bad people. Prosecutions and prison sentences will follow and there’ll be very long time in prison for what they’ve done to these cities. Most cities are well run. Most of the nation as well run and the areas that we’re talking about are all, they’re all cases run by Democrats, usually radical left leaning Democrats like in New York or in Portland.","https://www.rev.com/blog/transcripts/donald-trump-press-conference-transcript-august-19","Donald Trump August 19 White House Press Conference Transcript","06:06"
"Donald Trump","We’ve made arrests in Kansas City, Chicago, Cleveland, Detroit, Milwaukee, Saint Louis, Memphis and Albuquerque for many violent crimes, including gun crimes, arson and 91 murders. We’re also using the full power of the federal government to defeat, as you know, the China virus.","https://www.rev.com/blog/transcripts/donald-trump-press-conference-transcript-august-19","Donald Trump August 19 White House Press Conference Transcript","06:43"
"Donald Trump","New cases have declined in 80% of the jurisdictions in the past week; 80%. New Zealand, by the way, had a big outbreak and other countries that were held up to try and make us look not as good as we should look because we have done an incredible job, but they’re having a lot of outbreaks, but they’ll be able to put them out and we put them out. The hospitalization rate has fallen in our country. 54% since its peak in April; 54%. Older Americans are still the most vulnerable to the virus. 92% of deaths have occurred among those 55 and older. Only 2.7% of deaths have occurred among those 44 years. Think of that. 44 years and younger. So 44 years old and younger only 2.7% of…","https://www.rev.com/blog/transcripts/donald-trump-press-conference-transcript-august-19","Donald Trump August 19 White House Press Conference Transcript","07:07"
"Donald Trump","… and younger. Only 2.7% of deaths have occurred. And many of those people had preexisting conditions, had problems, heart, diabetes, and other problems, but many of those. So think of that. Only 2.7% under 44 years of age. Excess mortality in Europe this year is 33% higher than the United States. Evidence that the tragic cost of this virus is higher in other Western nations. South Korea. You’ve been reading about South Korea doing well, well, they just had a very big breakout, but they’ll be able to solve the problem. We must all remain vigilant and continue to exercise extreme caution around those at highest risk as we know. Multiple colleges and universities announced that they would suspend in-person teaching. We have learned one thing, there’s nothing like campus. There’s nothing like being with the teacher as opposed to being on a computer board. It’s been proven, a lot better.","https://www.rev.com/blog/transcripts/donald-trump-press-conference-transcript-august-19","Donald Trump August 19 White House Press Conference Transcript","08:02"
"Donald Trump","It’s a lot better. The iPads are wonderful, but you’re not going to learn the same way you do by being there. So nevertheless, certain colleges and universities have announced that they would suspend the in-person teaching. For older people and individuals with underlying conditions, the China virus is very dangerous, but for university students, the likelihood of severe illness is less than or equal to the risk of a seasonal flu. And the seasonal flu happens and comes and it goes, and it can be very bad, but people don’t talk about it in the same way and they shouldn’t. But if you look at that, the odds are less than or equal to. Instead of saving lives, the decision to close universities could cost lives. It is significantly safer for students to live with other young people than to go home and spread the virus to older Americans. Makes sense.","https://www.rev.com/blog/transcripts/donald-trump-press-conference-transcript-august-19","Donald Trump August 19 White House Press Conference Transcript","09:16"
"Donald Trump","And the shut down thing is causing tremendous depression for those places that are still shut down. You look at certain areas that, in all cases, Democrat run, still shut down. And their numbers there aren’t even good. But causing tremendous depression, suicide, drugs, alcohol, abuse. A lot of problems are being caused. Probably far more, I would say Scott, than is caused by the virus itself now that we understand the virus. Colleges should take reasonable precautions. Students who feel sick should not attend class and should limit social interaction as they would for any other illness. And universities should implement measures to protect the high risk students or professors and teachers. The ultimate goal of testing is to prevent transmission in high risk settings and to prevent transmission, period. But especially in nursing homes and to care for the vulnerable and our elderly, which really fit into that definition of who is vulnerable.","https://www.rev.com/blog/transcripts/donald-trump-press-conference-transcript-august-19","Donald Trump August 19 White House Press Conference Transcript","10:20"
"Donald Trump","We have tremendous unused testing capacity in our country. We have a tremendous unused testing capacity. It’s something that a lot of other nations are very impressed with, they tell us. In our path forward, we will continue to follow a science based approach to protecting the high risk while enabling healthy Americans to safely go back to work in school. Our country will be open. Our country is getting opened quickly. Our stock markets are almost back to where they were prior to the China virus disaster coming in. And I want to thank you all for being here and we’ll take some questions. Yes, please.","https://www.rev.com/blog/transcripts/donald-trump-press-conference-transcript-august-19","Donald Trump August 19 White House Press Conference Transcript","11:44"
"Speaker 1","During the pandemic, the QAnon movement appears to be gaining a lot of followers. Can you talk about what you think about that and what you have to say to people who are following this movement right now?","https://www.rev.com/blog/transcripts/donald-trump-press-conference-transcript-august-19","Donald Trump August 19 White House Press Conference Transcript","12:28"
"Donald Trump","Well, I don’t know much about the movement other than I understand they like me very much, which I appreciate. But I don’t know much about the movement. I have heard that it is gaining in popularity. And from what I’ve hear is these are people that when they watch the streets of Portland, when they watch what happened in New York city in just the last six or seven months, but this was starting even four years ago when I came here. Almost four years, can you believe it? These are people that don’t like seeing what’s going on in places like Portland and places like Chicago and New York and other cities and states.","https://www.rev.com/blog/transcripts/donald-trump-press-conference-transcript-august-19","Donald Trump August 19 White House Press Conference Transcript","12:40"
"Donald Trump","And I’ve heard these are people that love our country and they just don’t like seeing it. So I don’t know really anything about it other than they do supposedly like me. And they also would like to see problems in these areas, especially the areas that we’re talking about, go away. Because there’s no reason the Democrats can’t run a city. And if they can’t, we will send in all of the federal, whether it’s troops or law enforcement, whatever, they’d like. We’ll send them in. We’ll straighten out their problem in 24 hours or less.","https://www.rev.com/blog/transcripts/donald-trump-press-conference-transcript-august-19","Donald Trump August 19 White House Press Conference Transcript","13:21"
"Speaker 1","The cause of the theory is this belief that you are secretly saving the world from this satanic cult of pedophiles and cannibals. Does that sound like something you are behind or-","https://www.rev.com/blog/transcripts/donald-trump-press-conference-transcript-august-19","Donald Trump August 19 White House Press Conference Transcript","13:57"
"Donald Trump","Well, I haven’t heard that. But is that supposed to be a bad thing or a good thing? I mean, if I can help save the world from problems, I’m willing to do it. I’m willing to put myself out there. And we are actually. We’re saving the world from a radical left philosophy that will destroy this country. And when this country is gone, the rest of the world would follow. The rest of the world would follow. That’s the importance of this country. And when you look at some of the things that these people are saying with defund the police and no borders, open borders, everybody just pour right into our country, no testing, no nothing. You talk about testing, no testing. Mexico as you know has a very high rate of infection. The wall is now going to be, next week, 300 miles long.","https://www.rev.com/blog/transcripts/donald-trump-press-conference-transcript-august-19","Donald Trump August 19 White House Press Conference Transcript","14:12"
"Donald Trump","Our numbers are extraordinary on the border. And this is through luck, perhaps more than talent, although the talent is getting it built when one party refuses to allow it. And you don’t hear talk about the wall anymore. But I will say this, we need strength in our country not weakness. Too much weakness. Yes. John.","https://www.rev.com/blog/transcripts/donald-trump-press-conference-transcript-august-19","Donald Trump August 19 White House Press Conference Transcript","15:09"
"John","Mr. President, you have been very bullish on the promise of convalescent plasma to treat coronavirus. The FDA appeared to be on the brink of issuing an emergency use authorization for convalescent plasma. But after hearing from top officials at the NIH that there wasn’t enough evidence to go ahead with that, the FDA has put that on pause. Your reaction to that. And do you believe that convalescent plasma should be in the arsenal of treatments-","https://www.rev.com/blog/transcripts/donald-trump-press-conference-transcript-august-19","Donald Trump August 19 White House Press Conference Transcript","15:30"
"Donald Trump","Well, I hear great things about it, John. That’s all I can tell you. And it could be a political decision and-","https://www.rev.com/blog/transcripts/donald-trump-press-conference-transcript-august-19","Donald Trump August 19 White House Press Conference Transcript","15:57"
"Donald Trump","I can tell you and it could be a political decision because you have a lot of people over there that don’t want to rush things because they want to do it after November 3rd, and you’ve heard that one before, but I’ve heard fantastic things about Convalescent Plasma, and I’ve heard numbers way over 50 percent success and people are dying and we should have it approved if it’s good and I’m hearing its good. I heard from people at the FDA that it’s good, so we’ll see. I’m going to check that right after this conference.","https://www.rev.com/blog/transcripts/donald-trump-press-conference-transcript-august-19","Donald Trump August 19 White House Press Conference Transcript","16:02"
"John","My understanding that the White House will encourage the NIH and the FDA to get this out there as quickly as possible?","https://www.rev.com/blog/transcripts/donald-trump-press-conference-transcript-august-19","Donald Trump August 19 White House Press Conference Transcript","16:33"
"Donald Trump","Well if the numbers are as good as I’m hearing. I’m hearing over 50 percent and that’s very good, and we’ve approved certain things that are 31 percent and that’s okay too. That’s not bad, and it’s really had a tremendous impact, but no I have… you’re telling me something right now that surprises me, but we’ll check it out right after this.","https://www.rev.com/blog/transcripts/donald-trump-press-conference-transcript-august-19","Donald Trump August 19 White House Press Conference Transcript","16:39"
"John","Are you concerned about a delay?","https://www.rev.com/blog/transcripts/donald-trump-press-conference-transcript-august-19","Donald Trump August 19 White House Press Conference Transcript","17:01"
"Donald Trump","I don’t want delays. I don’t want people dying. I don’t want people dying. Yeah, please go ahead.","https://www.rev.com/blog/transcripts/donald-trump-press-conference-transcript-august-19","Donald Trump August 19 White House Press Conference Transcript","17:03"
"Speaker 2","Mr. President, I want to ask you about your tweet earlier today on Goodyear. It was essentially calling for a boycott on Goodyear tires-","https://www.rev.com/blog/transcripts/donald-trump-press-conference-transcript-august-19","Donald Trump August 19 White House Press Conference Transcript","17:09"
"Donald Trump","Yeah.","https://www.rev.com/blog/transcripts/donald-trump-press-conference-transcript-august-19","Donald Trump August 19 White House Press Conference Transcript","17:15"
"Speaker 2","… do you want the federal government to stop buying and using Goodyear product as well and is there anything-","https://www.rev.com/blog/transcripts/donald-trump-press-conference-transcript-august-19","Donald Trump August 19 White House Press Conference Transcript","17:15"
"Donald Trump","Well I’m not happy with Goodyear because what they’re doing is playing politics and the funny thing is the people that work for Goodyear, I can guarantee you, I pole very well with all of those great workers in Goodyear, and when they say that you can’t have Blue Lives Matter, you can’t show a blue line, you can’t wear a MAGA hat, but you can have other things that are Marxist in nature, there’s something wrong with the top of Goodyear. And what the radical left does is they make it impossible for people to do business if they’re Republican or if they’re conservative, they put out all sorts of effort, don’t shop there. They do vicious things. Not so different than what you saw on the streets of Portland two nights ago.","https://www.rev.com/blog/transcripts/donald-trump-press-conference-transcript-august-19","Donald Trump August 19 White House Press Conference Transcript","17:20"
"Speaker 2","But what kind of boycott do you envision?","https://www.rev.com/blog/transcripts/donald-trump-press-conference-transcript-august-19","Donald Trump August 19 White House Press Conference Transcript","18:09"
"Donald Trump","Oh, I don’t know that’s up to people, but I wouldn’t recommend it. If they want a whole political speech. If they want to let you not do what everybody’s doing. If they want to wear a MAGA hat, or if they want to wear a Blue Life, you know what Blue Lives Matter, right, that’s police men and women. That’s a terrible thing. That’s a terrible thing. They’re using their power over these people. And these people want to wear whatever it is that we’re talking about. You know that. And so I would be very much in favor of people don’t want to buy there, and you know what, they’ll be able to get a good job, because we set a jobs record over the last quarter as you know. The most jobs ever in the history of our country. You’ll be able to get another good job.","https://www.rev.com/blog/transcripts/donald-trump-press-conference-transcript-august-19","Donald Trump August 19 White House Press Conference Transcript","18:10"
"Donald Trump","I think it’s disgraceful that they did this. Please go ahead, in the back.","https://www.rev.com/blog/transcripts/donald-trump-press-conference-transcript-august-19","Donald Trump August 19 White House Press Conference Transcript","18:55"
"Speaker 3","Yes, Mr. President, you’ve said that the arrest of Jimmy Lai in Hong Kong is “a terrible thing,” do you have a message for Jimmy Lai? Has your administration spoken directly with him? Is your state department working for his release?","https://www.rev.com/blog/transcripts/donald-trump-press-conference-transcript-august-19","Donald Trump August 19 White House Press Conference Transcript","19:00"
"Donald Trump","Well I sent him best wishes. I hear he’s a wonderful gentleman, certainly a brave man and I send him best wishes. With that being said, because of that and obviously what happened in Hong Kong, we’ve taken all of the vast amounts of money that we use to subsidize Hong Kong, we essentially subsidize Hong Kong by giving them all sorts of incentives and that’s what made Hong Kong the exchange and business in Hong Kong successful. I’ve taken it all back. That means that the United States is going to do a lot more business.","https://www.rev.com/blog/transcripts/donald-trump-press-conference-transcript-august-19","Donald Trump August 19 White House Press Conference Transcript","19:12"
"Donald Trump","We really gave them tremendous incentive and subsidy in order that they be successful for freedom. But now that the freedom obviously seems to have been taken away, we will keep all of the incentives that we were giving them, which is billions, and billions of dollars, and all of that business will come into our country, including the New York Stock Exchange and Nasdaq, and it’ll all come here. But I feel badly for him, because I hear he’s a good person. I don’t know him, but I hear he’s a good person, obviously a very brave person.","https://www.rev.com/blog/transcripts/donald-trump-press-conference-transcript-august-19","Donald Trump August 19 White House Press Conference Transcript","19:48"
"Donald Trump","Did you have something, go ahead.","https://www.rev.com/blog/transcripts/donald-trump-press-conference-transcript-august-19","Donald Trump August 19 White House Press Conference Transcript","20:24"
"Speaker 4","Yes sir. Thank you Mr. President. With the Iraqi Prime Minister coming in tomorrow, what about-","https://www.rev.com/blog/transcripts/donald-trump-press-conference-transcript-august-19","Donald Trump August 19 White House Press Conference Transcript","20:25"
"Donald Trump","Say it?","https://www.rev.com/blog/transcripts/donald-trump-press-conference-transcript-august-19","Donald Trump August 19 White House Press Conference Transcript","20:30"
"Speaker 4","The Iraqi Prime Minister is coming in tomorrow to meet with you and how do you feel about this notion that Iraq can once again become the buffer between Iranian influence and Russian influence in the Middle East? Do you feel that under this Prime Minister that that’s possible once again? What are your thoughts on it?","https://www.rev.com/blog/transcripts/donald-trump-press-conference-transcript-august-19","Donald Trump August 19 White House Press Conference Transcript","20:32"
"Donald Trump","Well this is a man that I get along with very well. We’re largely out of Iraq, we down to very few soldiers I said. We’re getting out of these endless wars, these ridiculous endless wars. We should have never been there in the first place. I think it was the worst decision made in the history of our country. Should have never been there, in the Middle East we should have never been, but we’re getting out rapidly over the course of three years. And getting out, it’s very sticky getting out and some people agree, and many people don’t agree, but I think most people very much agree.","https://www.rev.com/blog/transcripts/donald-trump-press-conference-transcript-august-19","Donald Trump August 19 White House Press Conference Transcript","20:51"
