"speaker","transcription","url","headlin","timing"
"Donald Trump","Where’s Hunter? Remember we said that, “Where’s Hunter?” Then we made the T-shirt, it was a number one selling T-shirt. Where’s Hunter? What happened to Hunter? Where’s Hunter? I also recognized Israeli sovereignty over the Golan Heights, 52 years they tried to do it, I did it in about two hours. I even got nominated for three Nobel Peace Prizes. And for all different things, one’s the Middle East, one is Kosovo, Serbia. We’re doing a deal with these countries, I say, “Well, you guys have been fighting and killing each other.” We’re doing a deal. Let’s get them to be like, let’s not kill each other. And we worked out a deal, a beautiful economic deal between two places that just killed each other for years and years. And it just seems so easy and so natural, right?","https://www.rev.com/blog/transcripts/donald-trump-erie-pa-rally-transcript-october-20","Donald Trump Erie, PA Rally Transcript October 20","52:52"
"Donald Trump","Anyway, in the Middle East, instead of all of the blood pouring all over the sand, we’re ending all of that and you see what’s happening, countries in joining left and right, no blood, we did it a different way. We did it … How many times was I criticized, “He can’t get it done that way.” You see this guy, John Kerry who’s grossly incompetent? The only time he ever left the negotiating table, was to go into a bicycle race, he was 73 years old. And he fell, he broke his leg and his arm. Other than that, it was a wonderful day, riding a bicycle. And I pledged that I will never be in a bicycle race, okay? I did more in 47 months than Joe Biden did in 47 years, that’s true.","https://www.rev.com/blog/transcripts/donald-trump-erie-pa-rally-transcript-october-20","Donald Trump Erie, PA Rally Transcript October 20","53:47"
"Donald Trump","A vote for Republicans is about for safe communities, great jobs, and a limitless future for all Americans. A vote for Republicans and a vote for me, is a vote for the American dream. That’s what it is, it’s a vote for the American. And in conclusion, we’ll make us a little shorter, it’s like about 40 degrees. I don’t want people … I don’t want to lose anybody, you got to go vote. So, got to go a little shorter because you got to go home. And I see, even Mike he’s so brave, he’s had to freeze his ass off, off camera. He said, “Okay, look, I proved my point. Let’s say, President, let’s get me the hell out of here.” Over the next four years, we will make America into the manufacturing superpower of the world and we will end our reliance on China once and for all, we’re already doing that. We will hire more police, increase penalties for assaults on law enforcement and we will ban deadly sanctuary cities. Banned. We will uphold religious liberty, free speech and the right to keep and bear arms, Second Amendment.","https://www.rev.com/blog/transcripts/donald-trump-erie-pa-rally-transcript-october-20","Donald Trump Erie, PA Rally Transcript October 20","54:34"
"Donald Trump","And if they get in, you will lose your Second Amendment. Remember that when you’re getting ready to press Trump. We will strike down terrorists who threaten our citizens and we will keep America out of these ridiculous, horrible, endless wars. They’re endless. We will maintain America’s unrivaled military might, and we will ensure peace through strength. We will end surprise medical billing, require price transparency, already signed, starts on January 1st, it’ll be bigger than healthcare, watch this. And further reduce the cost of prescription drugs, which I’ve done with favorite nations, the drug companies do not like me too much. You will have drug prices going down 50, 60, 70, 80%. Could you imagine if he were in this position and people would go up to him, “Mr. President, you’ve done a great job on drug prices.” “Oh, really? What happened?” “They’re down 82%, Sir.” “Really? I can’t believe it.” You better give me the credit, dammit, I’ll tell you.","https://www.rev.com/blog/transcripts/donald-trump-erie-pa-rally-transcript-october-20","Donald Trump Erie, PA Rally Transcript October 20","55:46"
"Donald Trump","What I’ve gone through, the drug companies, they’re spending a fortune on fake ads. They don’t want me. They don’t want me. China doesn’t want me. Iran doesn’t want me. Nobody wants me. Nobody. Erie, Erie wants me. Erie wants me. And we’ll always protect patients with pre-existing conditions, always. America will land the first woman on the moon and the United States will be the first nation to land an astronaut on Mars. That’s already moving along. We will stop the radical indoctrination of our students and restore patriotic education to our schools, right? We will teach our children to love our country, honor our history and always respect our great American flag. And we will live by the timeless words of our great national motto, it’ll never be changed. They want to change that. They want to take certain words out, like the word God, okay. In God we trust, we’ll always keep it. For years, you had a president who apologized for America. Now, you have a president who is standing up for America and standing up for the great people of Pennsylvania, always will. Great state, great place, a lot of friends. So, get your friends, get your family, get your neighbors, get your coworkers, get your boss, right? Get your boss, “Come on boss, we got to vote.” And get out and vote. You tend to vote very late, which is good, I understand that. But it’s just the norms and you tend to vote late, get out and vote, get out and vote. This is the biggest election of our lifetime, get out and vote. From Scranton to Allentown, from Pittsburgh to Harrisburg and from Eastern to right here in Erie, we stand on the shoulders of red blooded, American patriots who poured out their heart, sweat and soul, to secure liberty and defend our freedom.","https://www.rev.com/blog/transcripts/donald-trump-erie-pa-rally-transcript-october-20","Donald Trump Erie, PA Rally Transcript October 20","56:54"
"Donald Trump","Pennsylvania is the state, where our founding fathers to declared American independence. Think of it, Pennsylvania, think of what you represent as a state. What state … Honestly, and we can say it to the other states, I love them, they’ve been great to me. They voted for us, everything, but what state’s done some of the things that have taken place in Pennsylvania? It’s where the army weathered its brutal winter at Valley Forge, where general George Washington led his men on a daring mission across the Delaware and where our union was saved by the incredible heroes at Gettysburg, right? I mean, who can say these things and these names, right? Gettysburg, these names. This is the place where generations of tough, strong Pennsylvania miners, steelers, factory workers, forged the greatest nation in the history of the world. And believe me, the best is yet to come. It’s coming. It’s all happening. The best is yet to come.","https://www.rev.com/blog/transcripts/donald-trump-erie-pa-rally-transcript-october-20","Donald Trump Erie, PA Rally Transcript October 20","59:21"
"Donald Trump","Proud citizens like you helped build this country and together we are taking back our country. We are returning power to you, the American people, we are returning power to you. And I said that a long time ago, when we started. It was being taken away, I just didn’t know quite how deep the swamp was. It’s a little deeper, a little more treacherous than I thought, but we’re beating them. Oh, well their head will explode on November 3rd. Can you imagine? And then, you know what’s going to happen? You know what’s going to happen? I think they’re finally going to say, “Okay, that’s enough. Let’s go.” I think by that time, they’re going to have it. They will have had it. He goes, “They better.” With your help, your devotion and your drive, we are going to keep on working. We are going to keep on fighting and we are going to keep on winning, winning, winning. We are one movement, one people, one family, and one glorious nation under God, and together with the incredible, and I mean that, I know you well. A lot of time in this incredible land, this beautiful place, this place of history. The incredible people of Pennsylvania, we have made America powerful again, our military had never been like this. Remember at the beginning, when the overrated general said to me, “Sir, we have no ammunition.” I said, “No president should ever have that.” No president should ever hear those words, “Sir, we have no ammunition.” We now have so much ammunition that even Mike would be impressed. So, we’ve made it powerful again. We’ve made America wealthy again. Stock market, new records, your 401ks, everybody happy with their 401k?","https://www.rev.com/blog/transcripts/donald-trump-erie-pa-rally-transcript-october-20","Donald Trump Erie, PA Rally Transcript October 20","01:00:27"
"Donald Trump","You want to see your 401ks crash? It was on today. Varney, Varney, you know Stuart. He had a gentlemen on, he said, “You know, if Trump gets in, the market’s going to go through the roof. If Trump loses and this other guy gets in, you’re going to have a problem like you’ve never seen before.” And I agree. Your 401ks, your stocks, you want to see them drop like a rock? If you want to have some fun with your family, explaining, “Why is it down 80% dad? We don’t love you anymore, dad.” Now, your 401ks are doing great. Everything’s doing great. We’re going to be in a position very soon, like we’ve never been in, even better than we were a year ago. We’ve made America strong again. We have made America proud again. We have made America safe again and we will make America great again. Thank you very much, Pennsylvania. Go out and vote. Go out and vote. Thank you, Pennsylvania. Thank you, thank you.","https://www.rev.com/blog/transcripts/donald-trump-erie-pa-rally-transcript-october-20","Donald Trump Erie, PA Rally Transcript October 20","01:02:34"
