"speaker","transcription","url","headlin","timing"
"President Donald Trump","Thank you very much. I guess I might begin. It’s an honor to be with you and really brave men and women, the job you do is incredible. And the progress that you’ve made in the last short period of time has been unbelievable.","https://www.rev.com/blog/transcripts/donald-trump-news-briefing-transcript-on-counternarcotics-operations","Donald Trump News Briefing Transcript on Counternarcotics Operations","00:09"
"President Donald Trump","On April first of this year, I announced the launch of a powerful US military law enforcement operation to combat the flow of illegal drugs across the Western hemisphere. Today, I’m pleased to be with Admiral Craig Faller, and his team, done an incredible job at the U S Southern command headquarters to provide an update on this incredible successful effort. We’re joined by secretary of defense, Mark Esper, thank you, Mark. Acting secretary of Homeland security, Chad Wolf, Chad, thank you, thank you. Commandant of US coast guard, Admiral Karl Schultz, Admiral. Associate deputy attorney general, Amanda Liskamm. Thank you, thank you, Amanda. Congressman Mario Diaz Bullock, who is a friend of mine for a long time. Thank you very much for a great job you’re doing down here. And many, many others, leaders and military geniuses and people that do a fantastic job.","https://www.rev.com/blog/transcripts/donald-trump-news-briefing-transcript-on-counternarcotics-operations","Donald Trump News Briefing Transcript on Counternarcotics Operations","00:31"
"President Donald Trump","In just 12 weeks, SOUTHCOMs surge operation conducted with key regional partners has resulted in more than 1000 arrests and the interdiction of 120 metric tons. I can only tell you that’s a lot of narcotics worth billions and billions of dollars. We’re determined to keep dangerous drugs out of the country and away from our children. We’re securing our seas. We’re securing our borders. This is a new operation, not been done before, and this operation has been incredibly successful. As you know, in the United States, at least before the COVID came to us, the flu, the virus, the China virus, whatever you’d like to call it, it’s got many different names, but before it hit, we were doing really well. We’re still doing very well, but now we’re getting back on track.","https://www.rev.com/blog/transcripts/donald-trump-news-briefing-transcript-on-counternarcotics-operations","Donald Trump News Briefing Transcript on Counternarcotics Operations","01:36"
"President Donald Trump","Last year, 70,000 precious American lives were taken because of the poison the cartels bring into our country. Under my administration, drug overdose deaths fell for the first time in nearly 30 years, and they fell fairly substantially. Unfortunately, the shutdowns caused by the China virus have led to a recent rise in overdose deaths, still below the level that they were at, but nevertheless went up a little bit. This is one of the reasons that we’re working to safely and responsibly reopen our country, reopen our schools, get our country going again a hundred percent. Were setting records on jobs, were setting records on many different things. We’re going to have a great third quarter, third quarter is going to be tremendous numbers, fourth quarter, likewise. And next year economically, will be one of the best years we’ve ever had, but you’ll see the numbers starting to come out really, really high in the third quarter. And you’ve already seen the record breaking, job numbers, NASDAQ just hit recently about 12 record highs, 12 days record highs, and the other markets are right behind it. There’ll be hitting records hopefully very shortly also. That means people have a lot of confidence in what we’re doing.","https://www.rev.com/blog/transcripts/donald-trump-news-briefing-transcript-on-counternarcotics-operations","Donald Trump News Briefing Transcript on Counternarcotics Operations","02:27"
"President Donald Trump","With the help of the heroes here at SOUTHCOM, coast guard, CBP, DEA and law enforcement will work relentlessly to seize illegal drugs, arrest traffickers, the traffickers are truly vile. They’re terrible, terrible people, what they do mostly to women and children, but women, and dismantle criminal cartels who are responsible for the deaths of thousands and thousands of Americans.","https://www.rev.com/blog/transcripts/donald-trump-news-briefing-transcript-on-counternarcotics-operations","Donald Trump News Briefing Transcript on Counternarcotics Operations","03:40"
"President Donald Trump","I’d like now to introduce secretary Asper, to say a few words. Mark, please. Thank you.","https://www.rev.com/blog/transcripts/donald-trump-news-briefing-transcript-on-counternarcotics-operations","Donald Trump News Briefing Transcript on Counternarcotics Operations","04:06"
"Secretary Asper","Yes. Thank you Mr. President. Thank you very much, sir. And good afternoon, everyone. It’s a pleasure to be here today to discuss the successes of our enhanced counteract narcotics operations in the Eastern Pacific ocean and the Caribbean sea.","https://www.rev.com/blog/transcripts/donald-trump-news-briefing-transcript-on-counternarcotics-operations","Donald Trump News Briefing Transcript on Counternarcotics Operations","04:13"
"Secretary Asper","The department of defense began this initiative alongside our inter-agency partners at the president’s direction on April 1st as part of our whole of government effort to combat the flow of illicit drugs into our country and to protect the American people.","https://www.rev.com/blog/transcripts/donald-trump-news-briefing-transcript-on-counternarcotics-operations","Donald Trump News Briefing Transcript on Counternarcotics Operations","04:26"
"Secretary Asper","Transnational criminal organizations have destroyed far too many American lives by smuggling, heroin cocaine, fentanyl, and methamphetamines in our country, leading to drug overdoses and addiction in our communities. Moreover, the profits derived from these activities support a range of bad actors, from cartels in Mexico to the illegitimate Maduro regime, which continues to oppress the Venezuelan people.","https://www.rev.com/blog/transcripts/donald-trump-news-briefing-transcript-on-counternarcotics-operations","Donald Trump News Briefing Transcript on Counternarcotics Operations","04:42"
"Secretary Asper","Despite the challenges posed by the coronavirus pandemic, our enhanced counter-narcotics operations have shown great success in countering those threats by disrupting the flow of illicit drugs, denying our adversaries financial resources and strengthening the capacity of partner countries in the region.","https://www.rev.com/blog/transcripts/donald-trump-news-briefing-transcript-on-counternarcotics-operations","Donald Trump News Briefing Transcript on Counternarcotics Operations","05:08"
"Secretary Asper","Since the end of March, we have employed in the US Southern command area of responsibility, 75% more surveillance aircraft and 65% more ships than normal for drug interdiction. These additional assets include four Navy destroyers, five coast guard cutters, and eight aircraft.","https://www.rev.com/blog/transcripts/donald-trump-news-briefing-transcript-on-counternarcotics-operations","Donald Trump News Briefing Transcript on Counternarcotics Operations","05:25"
"Secretary Asper","Currently nearly a dozen Navy and coast guard ships and over 15 aircraft from across the inner agency are supporting our efforts in addition to security forces deployed to the region. Further, we have successfully engaged and encouraged 22 partner nations to join us in this fight, and step up their involvement in drug introductions.","https://www.rev.com/blog/transcripts/donald-trump-news-briefing-transcript-on-counternarcotics-operations","Donald Trump News Briefing Transcript on Counternarcotics Operations","05:41"
"Secretary Asper","As a result of these enhanced operations, SOUTHCOM and our inter-agency and international partners have disrupted more than 122 metric tons of cocaine, as well as over 18,000 pounds of marijuana. We denied nearly $2 billion in drug profits, increased our targeting of known smuggling maritime events by 60% and neutralized dozens of members of transnational criminal organizations.","https://www.rev.com/blog/transcripts/donald-trump-news-briefing-transcript-on-counternarcotics-operations","Donald Trump News Briefing Transcript on Counternarcotics Operations","06:02"
"Secretary Asper","These efforts have been critical to saving countless American lives and making our communities healthier, safer, and stronger. I want to thank the president, president Trump for his leadership and bringing us together and support this critical mission. Thank you, sir. And I’m grateful for the hard work of our partners, including the US coast guard, the department of Homeland security, the drug enforcement administration, the department of justice, members of the intelligence community and support from Congress as well for all of their efforts. Together, we will maintain our enhanced presence in the region, keep the pressure on transnational criminal groups and protect America and our communities from the scourge of illicit drugs. Thank you.","https://www.rev.com/blog/transcripts/donald-trump-news-briefing-transcript-on-counternarcotics-operations","Donald Trump News Briefing Transcript on Counternarcotics Operations","06:27"
"President Donald Trump","Thank you Admiral.","https://www.rev.com/blog/transcripts/donald-trump-news-briefing-transcript-on-counternarcotics-operations","Donald Trump News Briefing Transcript on Counternarcotics Operations","07:13"
"Admiral","Thank you, sir.","https://www.rev.com/blog/transcripts/donald-trump-news-briefing-transcript-on-counternarcotics-operations","Donald Trump News Briefing Transcript on Counternarcotics Operations","07:14"
"Admiral","Mr. President, secretary Esper, secretary Wolf, Shipmate, Charles Schultz, hometown Congressman here, Mario Diaz, thank you all for your support on this important mission. This mission is vital to our Homeland defense. It truly is. And I’m proud to say the efforts are making a difference, Mr. President, and they’re saving lives. And a team here that’s assembled deserves the credit, but the resources that you’ve ordered have made that happen.","https://www.rev.com/blog/transcripts/donald-trump-news-briefing-transcript-on-counternarcotics-operations","Donald Trump News Briefing Transcript on Counternarcotics Operations","07:16"
"Admiral","Other nations have stepped up, Mr. President. Columbia for one have stepped up, despite COVID. US leadership has been a key piece.","https://www.rev.com/blog/transcripts/donald-trump-news-briefing-transcript-on-counternarcotics-operations","Donald Trump News Briefing Transcript on Counternarcotics Operations","07:43"
"Admiral","Mr.President, if I would, I just wanted to show a map, I have a little version of front of you, just orient on the hemisphere here. If we could put the map up. So the South comes a responsibility, this Western hemisphere really it’s our neighborhood it’s so close to home. So what impacts the neighbors really has a high impact on us at home Mr. President. And that’s why this is so important.","https://www.rev.com/blog/transcripts/donald-trump-news-briefing-transcript-on-counternarcotics-operations","Donald Trump News Briefing Transcript on Counternarcotics Operations","07:53"
"Admiral","There’s so much opportunity here. It’s our number two trading partner outside of Asia. And so trade, economics and democracy importantly. And our partner nations are willing, they want to work with us and we work with partners from Guatemala on South and out into the Caribbean.","https://www.rev.com/blog/transcripts/donald-trump-news-briefing-transcript-on-counternarcotics-operations","Donald Trump News Briefing Transcript on Counternarcotics Operations","08:16"
"Admiral","But that’s under assault, this vicious circle of threats that you see led by the transnational criminal organizations about a $90 billion a year enterprise, and it heeds off corruption, and now the added instability of COVID. But as I said, that partners have stepped up despite the COVID, which is a tribute to their security teams.","https://www.rev.com/blog/transcripts/donald-trump-news-briefing-transcript-on-counternarcotics-operations","Donald Trump News Briefing Transcript on Counternarcotics Operations","08:34"
"Admiral","There’s also another aspect in this neighborhood of ours, and it’s what we call a national defense strategy, great power competition.","https://www.rev.com/blog/transcripts/donald-trump-news-briefing-transcript-on-counternarcotics-operations","Donald Trump News Briefing Transcript on Counternarcotics Operations","08:55"
"Admiral","So China has certainly looked at this neighborhood as an opportunity for them. And when you think about the proximity of some of their investments, Jamaica and El Salvador, it’s just as close to Washington as is to Miami, is if you look at comparative distances.","https://www.rev.com/blog/transcripts/donald-trump-news-briefing-transcript-on-counternarcotics-operations","Donald Trump News Briefing Transcript on Counternarcotics Operations","09:02"
"Admiral","Slide, please. But what our citizens want, I know certainly my dad in Western PA, who’s watching once is they want to know if we’re making a difference. And the numbers, as we’ve stated, really have, at 15% more disruptions, that’s detainees, that’s drugs off the street. That’s at 122 metric tons, Mr. President. And 60% more targeting is a big deal for us because that means we can put more assets on more targets. And the enemy has seen. That we’ve gotten information from our intelligence agencies that says the enemies watch that, and they’re waiting and they’re stockpiling, and they’re trying to change their tactics.","https://www.rev.com/blog/transcripts/donald-trump-news-briefing-transcript-on-counternarcotics-operations","Donald Trump News Briefing Transcript on Counternarcotics Operations","09:18"
"Admiral","Those additional Navy ships, the AWACS from the air force, Oklahoma guard MC twelves, DEA agents, a whole team effort, really, as we make a difference…","https://www.rev.com/blog/transcripts/donald-trump-news-briefing-transcript-on-counternarcotics-operations","Donald Trump News Briefing Transcript on Counternarcotics Operations","09:54"
"Admiral","… DEA agents, a whole team effort really as we make a difference here. But that 70% partner participation is key, Mr. President. And I think of it this way, on the field to compete when you go to golf or baseball, you want the best players with you. And we certainly have those winners with us here today. Just wanted to introduce you to two, Mr. President. Brigadier General Juan Carlos Correa, if you’d stand up, General. [inaudible 00:00:26].","https://www.rev.com/blog/transcripts/donald-trump-news-briefing-transcript-on-counternarcotics-operations","Donald Trump News Briefing Transcript on Counternarcotics Operations","10:03"
"Admiral","President Duque has sent us his best and paying for it. So he comes here fully paid by Colombia and he works for me. And it’s a recognition that Colombia’s with us in the Korean War and they’re with us today and making a difference. [inaudible 00:10:44] And our Brazilian, President Bolsonaro, very new addition to our headquarters, Major General David. One of the sharpest and Brazilian armed forces NRJ5 organization. Again, Brazilian’s paying for him to come here and work for me to make a difference in security. Brazil has been with us since World War II and our relationship is growing even stronger, Mr. President. [inaudible 00:01:09].","https://www.rev.com/blog/transcripts/donald-trump-news-briefing-transcript-on-counternarcotics-operations","Donald Trump News Briefing Transcript on Counternarcotics Operations","10:26"
"Admiral","Last two points, Mr. President, the tactical into this fight, and you remember being in Key West at joint interagency task force, [inaudible 00:11:17] you rang that bell. And the war fighters responsible for that fight, Rear Admiral Doug Fears at the end Commands [inaudible 00:11:24] South and Master Chief Henry [inaudible 00:11:26] is the senior enlisted there. They’re the ones that are really day in and day out the tactical edge of this fight, sir. And I’ll tell you, Mr. President, they’re ringing the enemies bell every day, sir.","https://www.rev.com/blog/transcripts/donald-trump-news-briefing-transcript-on-counternarcotics-operations","Donald Trump News Briefing Transcript on Counternarcotics Operations","11:09"
"President Donald Trump","They seem to be. It’s a fantastic job.","https://www.rev.com/blog/transcripts/donald-trump-news-briefing-transcript-on-counternarcotics-operations","Donald Trump News Briefing Transcript on Counternarcotics Operations","11:37"
"Admiral","Thank you, sir.","https://www.rev.com/blog/transcripts/donald-trump-news-briefing-transcript-on-counternarcotics-operations","Donald Trump News Briefing Transcript on Counternarcotics Operations","11:39"
"President Donald Trump","Thank you very much. Mr. Congressmen, you like to say something, thank you.","https://www.rev.com/blog/transcripts/donald-trump-news-briefing-transcript-on-counternarcotics-operations","Donald Trump News Briefing Transcript on Counternarcotics Operations","11:39"
"Secretary Asper","Mr. President, nothing prepared, but I can tell you in my time of Congress, which is now almost 18 years, this region has frankly been looked over. Just barely any attention paid to it. And sometimes when the attention was paid, bad things were done. I will tell you that your administration has emphasized freedom. I want to thank you by the way, on a personal note, a little bit of a more parochial note for your emphasis on helping the people of Venezuela regain their freedom. Helping the people of Nicaragua regain their freedom. And your solidarity to the people of Cuba, which has been frankly, like we’ve never seen. But your leadership here in fighting narcotics coming to the United States is literally saving American lives.","https://www.rev.com/blog/transcripts/donald-trump-news-briefing-transcript-on-counternarcotics-operations","Donald Trump News Briefing Transcript on Counternarcotics Operations","11:45"
"Secretary Asper","So again, just as one who represents Southern Command grateful for your emphasis of this command and what they do, but for your leadership and actually saving American lives, those who are victimized every year by this scourge of illicit narcotics. So thank you for being here, but more importantly, thank you for your leadership and your emphasis on those key issues.","https://www.rev.com/blog/transcripts/donald-trump-news-briefing-transcript-on-counternarcotics-operations","Donald Trump News Briefing Transcript on Counternarcotics Operations","12:43"
"President Donald Trump","Well, I want to thank you for your leadership. You have done a fantastic job. You represent the area so well, I know this area quite well, as you can imagine, but I know it very well. Little Venezuela we call it and incredible people, I know the people. And we’re going to be fighting for Venezuela. We’re going to be fighting for our friends from Cuba. They know that we’ve been doing that and so many other places. But Cuba, Venezuela, we have it very well under control and you know what we’re doing and we’re in touch all the time. So I want to thank you for your tremendous work. And maybe I could ask Amanda to say a few words, please.","https://www.rev.com/blog/transcripts/donald-trump-news-briefing-transcript-on-counternarcotics-operations","Donald Trump News Briefing Transcript on Counternarcotics Operations","13:03"
"Amanda","Thank you. I’m honored to be here today with our interagency partner to recognize the incredible work being done, to disrupt the flow of drugs to the United States. Drug trafficking organizations are devastating this country with the drugs that they are pumping in. We continue to see Mexican cartels traffic, cocaine, methamphetamine, heroin, and fentanyl into the United States. This fentanyl is fueling the ongoing domestic opioid crisis, and we are seeing an increasing surge in low cost, high purity and high potency methamphetamine. Further, Colombian cartels continue to control the production and supply of cocaine and rely on a partnership with Mexican cartels to export multi-ton quantities of cocaine from Colombia to US markets. As these drugs are more readily available and more deadly, we are seeing record level overdose death rates. Every year more Americans die from overdoses in the United States than died in the entirety of the Vietnam war.","https://www.rev.com/blog/transcripts/donald-trump-news-briefing-transcript-on-counternarcotics-operations","Donald Trump News Briefing Transcript on Counternarcotics Operations","13:40"
"Amanda","And now for the first time in our country’s history, our odds of dying from an opioid overdose are greater than from a motor vehicle crash. The Department of Justice is committed to defeating these cartels who are directly responsible for the deaths of tens of thousands of Americans each year by flooding this country with addictive poison. The Department charged a record number of defendants with drug trafficking offenses last year in an effort to hold these traffickers accountable. Indeed, several leaders of Mexican cartels received significant sentences, such as life imprisonment over the past several years. And despite the influx of drugs into the United States, DEA has domestic seizures are at record levels.","https://www.rev.com/blog/transcripts/donald-trump-news-briefing-transcript-on-counternarcotics-operations","Donald Trump News Briefing Transcript on Counternarcotics Operations","14:37"
"Amanda","However, this work alone is not enough. It is clear that we can obtain the most immediate result by increasing our ability to make drug interdictions at sea before they reach the United States. This surge has been a tremendous success with over 120 metric tons of cocaine seized. The drugs seized represent almost $2 billion in profits denied to these cartels and an untold number of American lives saved. Numerous traffickers responsible for these loads of drugs will be held accountable in United States federal district courts. Since the start of the search, the Department of Justice has charged more than 60 defendants for their role and trafficking these drugs into the United States. This is truly a whole of government effort. And when we are proud to be a part of. Working together, we can and will interdict these deadly drugs before they reach our country and destroy the cartels who are responsible. Thank you.","https://www.rev.com/blog/transcripts/donald-trump-news-briefing-transcript-on-counternarcotics-operations","Donald Trump News Briefing Transcript on Counternarcotics Operations","15:17"
"President Donald Trump","Thank you, Amanda. Great job you’re doing, appreciate it. Thank you. Admiral, please.","https://www.rev.com/blog/transcripts/donald-trump-news-briefing-transcript-on-counternarcotics-operations","Donald Trump News Briefing Transcript on Counternarcotics Operations","16:07"
"Edward","Mr. President, it’s an honor to be here with you and it’s honored to be back at SOUTHCOM. I had the privilege of serving. This is a great team, highly professional, doing tremendous things in the region, sir. To the DHS team, just starting, your Coast Guard has been in this game with our DHS partners, CVP, Air Marine, the Homeland Security Investigations office. We’ve been involved about 1.8 million pounds of cocaine eradicated here in the last four years. This surge here with the support of the SecDef and your support and the SOUTHCOM team, sir, has been successful. We integrate in a joint environment remarkably well. We’ve heard the numbers, so I won’t repeat them. But these are transnational criminals, sir. And these are very sophisticated groups. Craig mentioned, it’s a $90 billion annual industry that we’re disrupting here.","https://www.rev.com/blog/transcripts/donald-trump-news-briefing-transcript-on-counternarcotics-operations","Donald Trump News Briefing Transcript on Counternarcotics Operations","16:12"
"Edward","So I’m very excited about being here. The Coast Guard has committed to a doubling down our efforts here through the end of the calendar year. We take some risk other places, but this is righteous work. The numbers on American streets, it’s something north of 70,000 when you roll in the overdoses, you roll in drug related violence. You look at the corruption in the region, sir, this is important work for the nation. So thank you for your support and honored to be here.","https://www.rev.com/blog/transcripts/donald-trump-news-briefing-transcript-on-counternarcotics-operations","Donald Trump News Briefing Transcript on Counternarcotics Operations","16:52"
"President Donald Trump","Thank you very much, Edward. Appreciate it. Now, Chad Wolfe, maybe you could also mention what’s going on in Portland because we sent you there recently. It was out of control. The locals couldn’t handle it and you people are handling it very nicely. So nicely that the press doesn’t want to write about it. But why don’t you tell them what you’re doing in Portland and also go into this please.","https://www.rev.com/blog/transcripts/donald-trump-news-briefing-transcript-on-counternarcotics-operations","Donald Trump News Briefing Transcript on Counternarcotics Operations","17:12"
