"speaker","transcription","url","headlin","timing"
"Donald Trump","Well, thank you very much. And hello, CPAC. Do you miss me yet? Do you miss me yet? A lot of things going on.","https://www.rev.com/blog/transcripts/donald-trump-cpac-2021-speech-transcript","Donald Trump CPAC 2021 Speech Transcript","01:24"
"Donald Trump","There’s so many wonderful friends, conservatives and fellow citizens in this room and all across our country. I stand before you today to declare that the incredible journey we’ve begun together, we went through a journey like nobody else. There’s never been a journey like it. There’s never been a journey so successful. We began it together four years ago, and it is far from being over. We’ve just started.","https://www.rev.com/blog/transcripts/donald-trump-cpac-2021-speech-transcript","Donald Trump CPAC 2021 Speech Transcript","01:36"
"Crowd","USA USA USA USA.","https://www.rev.com/blog/transcripts/donald-trump-cpac-2021-speech-transcript","Donald Trump CPAC 2021 Speech Transcript","02:04"
"Donald Trump","Our movement of proud, hardworking, and you know what? This is the hardest working people, hard working American Patriots is just getting started. And in the end we will win. We will win.","https://www.rev.com/blog/transcripts/donald-trump-cpac-2021-speech-transcript","Donald Trump CPAC 2021 Speech Transcript","02:11"
"Donald Trump","We’ve been doing a lot of winning as we gather this week, we’re in the middle of a historic struggle for America’s future, America’s culture, and America’s institutions, borders, and most cherished principles. Our security, our prosperity, and our very identity as Americans is at stake, like perhaps at no other time.","https://www.rev.com/blog/transcripts/donald-trump-cpac-2021-speech-transcript","Donald Trump CPAC 2021 Speech Transcript","02:29"
"Donald Trump","So no matter how much the Washington establishment and the powerful, special interests may want to silence us, let there be no doubt. We will be victorious. And America will be stronger and greater than ever before.","https://www.rev.com/blog/transcripts/donald-trump-cpac-2021-speech-transcript","Donald Trump CPAC 2021 Speech Transcript","02:56"
"Donald Trump","I want to thank my great friends, Matt and Mercedes Schlep. Matt, thank you. Thank you. Mercedes, thank you very much. And the American Conservative Union for hosting this extraordinary event. They’re talking about it all over the world, Matt. I know you don’t like that, but that’s okay, all over the world.","https://www.rev.com/blog/transcripts/donald-trump-cpac-2021-speech-transcript","Donald Trump CPAC 2021 Speech Transcript","03:18"
"Donald Trump","I also want to pay my love and respect to the great Rush Limbaugh who is watching closely and smiling down on us. He’s watching and he’s loving it and he loves Catherine. Catherine, thank you for being here, so great. Thank you Catherine. He loved you, Catherine. I will tell you that. Fantastic. Thank you Catherine very much.","https://www.rev.com/blog/transcripts/donald-trump-cpac-2021-speech-transcript","Donald Trump CPAC 2021 Speech Transcript","03:39"
"Donald Trump","To each and every one of you here at CPAC, I am more grateful to you than you will ever know. We’re gathered this afternoon to talk about the future of our movement, the future of our party, and the future of our beloved country. For the next four years, the brave Republicans in this room will be at the heart of the effort to oppose the radical Democrats, the fake news media, and their toxic cancel culture. Something new to our ears, cancel culture. And I want you to know that I’m going to continue to fight right by your side. We will do what we’ve done right from the beginning, which is to win. We’re not starting new parties. They kept saying, he’s going to start a brand new party. We have the Republican party. It’s going to unite and be stronger than ever before. I am not starting a new party. That was fake news, fake news.","https://www.rev.com/blog/transcripts/donald-trump-cpac-2021-speech-transcript","Donald Trump CPAC 2021 Speech Transcript","04:15"
"Donald Trump","No. Wouldn’t that be brilliant? Let’s start a new party and let’s divide our vote so that you can never win. No, we’re not interested in that. No we have tremendous, Mr. McLaughlin just gave me numbers that nobody’s ever heard of before, more popular than anybody. That’s all of us. It’s all of us. Those are great numbers. And I want to thank you very much. Those are incredible numbers. I came here and he was giving me 95%, 97%, 92%. I said, they’re great. And I want to thank everybody in this room and everybody all throughout the country, throughout the world, if you want to really know that. Thank you though. Thank you.","https://www.rev.com/blog/transcripts/donald-trump-cpac-2021-speech-transcript","Donald Trump CPAC 2021 Speech Transcript","05:22"
"Donald Trump","We will be united and strong like never before. We will save and strengthen America. And we will fight the onslaught of radicalism, socialism, and indeed it all leads to communism once and for all. That’s what it leads to. You’ll be hearing more and more about that as we go along. But that’s what it leads to. You know that. We all knew that the Biden administration was going to be bad. But none of us even imagined just how bad they would be and how far left they would go. He never talked about this. We would have those wonderful debates. He would never talk about this. We didn’t know what the hell he was talking about actually.","https://www.rev.com/blog/transcripts/donald-trump-cpac-2021-speech-transcript","Donald Trump CPAC 2021 Speech Transcript","06:02"
"Donald Trump","His campaign was all lies. Talked about energy, I thought I said, “This guy actually, he’s okay with energy.” He wasn’t okay with energy. He wants to put you all out of business. He’s not okay with energy. He wants windmills, the windmills. The windmills that don’t work when you need them. Joe Biden has had the most disastrous first month of any president in modern history. That’s true. Already the Biden administration has proven that they are anti jobs, anti-family, anti borders, anti energy, anti-women, and anti science. In just one short month, we have gone from America first to America last. You think about it, right? America last. There’s no better example than the new and horrible crisis on our Southern border. We did such a good job. It was all worked. Nobody’s ever seen anything that we did. And now he wants it all to go to hell. When I left office just six weeks ago, we had created the most secure border in us history.","https://www.rev.com/blog/transcripts/donald-trump-cpac-2021-speech-transcript","Donald Trump CPAC 2021 Speech Transcript","06:48"
"Donald Trump","We had built almost 500 miles of a great border wall that helped us with these numbers because once it’s up, they used to say, “A wall doesn’t work.” Well, you know what I’ve always said, walls and wheels. Those are two things that will never change. The wall has been amazing. It’s been incredible and little sections of it to complete, They don’t want to complete it. They don’t want to complete little sections in certain little areas. They don’t want to complete. But it’s had an impact that nobody would have even believed. It’s amazing considering that the Democrats’ number one priority was to make sure that the wall would never, ever get built, would never, ever happen, would never get financed. We got it financed. We ended catch and release, ended asylum fraud, and brought illegal crossings to historic lows. When illegal aliens trespass across our borders, they were properly caught, detained and sent back home. And these were some rough customers. I want to tell you some rough customers were entering our country.","https://www.rev.com/blog/transcripts/donald-trump-cpac-2021-speech-transcript","Donald Trump CPAC 2021 Speech Transcript","08:06"
"Donald Trump","It took them the new administration only a few weeks to turn this unprecedented accomplishment into self-inflicted humanitarian and national security disaster by recklessly eliminating our border, security measures, controls, all of the things that we put into place. Joe Biden has triggered a massive flood of illegal immigration into our country, the likes of which we have never seen before. They’re coming up by the tens of thousands. They’re all coming to take advantage of the things that he said that’s luring everybody to come to America. And we’re one country. We can’t afford the problems of the world, as much as we’d love to. We’d love to help. But we can’t do that. So they’re all coming because of promises and foolish words.","https://www.rev.com/blog/transcripts/donald-trump-cpac-2021-speech-transcript","Donald Trump CPAC 2021 Speech Transcript","09:16"
"Donald Trump","Perhaps worst of all, Joe Biden’s decision to cancel border security has single-handedly launched a youth migrant crisis that is enriching child smugglers, vicious criminal cartels, and some of the most evil people on the planet. You see it every day, just turn on the news. You’ll see it every day. Under my administration, we stopped the child smugglers. We dismantle the criminal cartels. We greatly limited drug and human trafficking to a level that nobody actually thought was possible. And the wall helped us a lot. And we protected vulnerable people from the ravages of dangerous predators. And that’s what they are dangerous, dangerous predators.","https://www.rev.com/blog/transcripts/donald-trump-cpac-2021-speech-transcript","Donald Trump CPAC 2021 Speech Transcript","10:11"
"Donald Trump","But the Biden administration has put the vial coyotes back in business and it has done so in a very, very big way. Under the new administration, catch and release has been restored. Can you imagine? We work so hard, catch, you know where that is? You catch them, you take their name, they may be killers. They may be rapists. They may be drug smugglers. You take their name and you release them into our country. We did the opposite.","https://www.rev.com/blog/transcripts/donald-trump-cpac-2021-speech-transcript","Donald Trump CPAC 2021 Speech Transcript","10:58"
"Donald Trump","We not only didn’t release them, we had them brought back to their country. Illegal immigrants are now being apprehended and released along the entire Southern border, just the opposite of what it was two months ago. They weren’t coming because they couldn’t get in. Once they think they can get in, they’re coming. And they are coming at levels that you haven’t even seen yet, by the hundreds of thousands, by the millions they’ll be coming.","https://www.rev.com/blog/transcripts/donald-trump-cpac-2021-speech-transcript","Donald Trump CPAC 2021 Speech Transcript","11:29"
"Donald Trump","The Biden administration is now actively expediting the admission of illegal migrants, enabling them to lodge frivolous asylum claims and admitting them by the thousands and thousands and thousands a day, crowded together in unsanitary conditions, despite the ongoing economic and public health crisis, COVID-19, or as I call it, the China virus.","https://www.rev.com/blog/transcripts/donald-trump-cpac-2021-speech-transcript","Donald Trump CPAC 2021 Speech Transcript","11:54"
"Donald Trump","There’s no masks. There’s no double mask. That was a new one that came out two weeks ago. First Fauci said, “You don’t need masks, no masks, no good. No, no.” Then all of a sudden, you want them; and now he wants double masks. No social distancing, no nothing, no nothing. And together, and it’s sad actually. And it’s sad for them. And it sad for our country, what the Biden administration is doing to push young migrants into the hands of human traffickers and coyotes is dangerous, immoral, and indefensible, hard to believe it’s happening. Biden has failed in his number one duty as chief executive enforcing America’s laws. This alone should be reason enough for Democrats to suffer withering losses in the midterms and to lose the White House decisively four years from now.","https://www.rev.com/blog/transcripts/donald-trump-cpac-2021-speech-transcript","Donald Trump CPAC 2021 Speech Transcript","12:26"
"Crowd","USA USA USA USA USA USA USA USA USA USA USA USA USA.","https://www.rev.com/blog/transcripts/donald-trump-cpac-2021-speech-transcript","Donald Trump CPAC 2021 Speech Transcript","13:28"
"Donald Trump","Actually, as you know, they just lost the White House. But it’s one of those things. But who knows, who knows? I may even decide to beat them for a third time. Okay? For a third time. True. Joe Biden defunded the border wall and stopped all future construction, even on small open sections that just needed to be finished up routine little work, it’s already been bought. Wait until the contractors get to them. And they say, “No, it costs us much more money not to finish this small section than if we finished it.” That’s going to be nice. Wait until you see those bills start pouring in.","https://www.rev.com/blog/transcripts/donald-trump-cpac-2021-speech-transcript","Donald Trump CPAC 2021 Speech Transcript","13:59"
"Donald Trump","He revoked the executive order cracking down on deadly sanctuary cities. He has effectively ordered a shutdown of ICE, halting virtually all deportations, everyone, murderers, everybody, no more. Let’s not deport people and restricting our law enforcement professionals. And they are great professionals. You have many of them represented here today, from conducting almost any immigration enforcement of any kind. The Biden policy of releasing criminals into the US interior is making America into a sanctuary nation where criminals, illegal immigrants, including gang members and sex offenders are set free into American communities.","https://www.rev.com/blog/transcripts/donald-trump-cpac-2021-speech-transcript","Donald Trump CPAC 2021 Speech Transcript","15:01"
"Donald Trump","They have no idea who’s coming up. And remember with the caravans, these countries, not only the three of them, but many, many countries all over the world. They’re not giving us their best and their finest, because they’re intelligent. They’re not giving us their best and their finest. Remember I said that. I said that a long time ago, when I made the first remarks, when I came down the escalator with our great future first lady who says, hello, who loves you as much as I love you. But I said that a long time ago. And we turned out to be 100% correct.","https://www.rev.com/blog/transcripts/donald-trump-cpac-2021-speech-transcript","Donald Trump CPAC 2021 Speech Transcript","15:45"
"Donald Trump","Biden’s radical immigration policies aren’t just illegal. They’re immoral. They’re heartless. And they are a betrayal of our nation’s core values. It’s a terrible thing that’s happening.","https://www.rev.com/blog/transcripts/donald-trump-cpac-2021-speech-transcript","Donald Trump CPAC 2021 Speech Transcript","16:29"
"Donald Trump","The Republican party must hold Joe Biden and the Democrats accountable. They ripped up the diplomatic agreements we negotiated with Honduras, Guatemala and El Salvador to shut down illegal immigration. They got a fortune, they got paid $500 million a year. When I came into office, those countries were refusing to take back illegal alien gang members, including MS 13, the most vicious probably of them all. No matter where you go in the world, MS 13, they do things that even the worst don’t think about. So I asked how much do we pay these countries? How much do we pay them? Sir, we pay them approximately $ 500 million a year. It’s a lot of money.","https://www.rev.com/blog/transcripts/donald-trump-cpac-2021-speech-transcript","Donald Trump CPAC 2021 Speech Transcript","16:43"
"Donald Trump","I mean, it’s peanuts compared to the way other countries rip us off, but that’s a lot of money. I said, “Okay, we aren’t going to pay them anymore because they wouldn’t take back the criminals.” And this was true with the Obama administration. It was true for many, many years. So we’d catch a murderer. We’d want to bring them back to Guatemala, or Honduras, or El Salvador. They wouldn’t take them back. “No, we don’t want them.” We’d fly them in. They wouldn’t let the plane land. We’d bus them in. They wouldn’t let the buses get anywhere near the border.","https://www.rev.com/blog/transcripts/donald-trump-cpac-2021-speech-transcript","Donald Trump CPAC 2021 Speech Transcript","17:34"
"Donald Trump","And I said, “We’re not going to pay them anymore.” So after I said that, and I stopped payment, like a term that we use in the world of business, let’s stop payment. So we stopped payment. They were delinquent. We stopped payment and they very quickly came to the table and we made a deal, very quick deal. We still kept the money. We still didn’t pay because… Or we made a deal.","https://www.rev.com/blog/transcripts/donald-trump-cpac-2021-speech-transcript","Donald Trump CPAC 2021 Speech Transcript","18:08"
"Donald Trump","And when illegal aliens came across our border, they were rapidly deported and lovingly accepted by those countries from where they came. And it worked out great. So now they accept the people and that we ultimately got along very well with those countries, those three countries and many countries throughout the world, because they respected us again. They didn’t respect us. They couldn’t believe what they were getting away with. But now, Joe Biden has wrecked this great deal, wrecked it. And they’re already doing what they were doing before and they’re taking the money. And that’s just a small portion of what’s going on.","https://www.rev.com/blog/transcripts/donald-trump-cpac-2021-speech-transcript","Donald Trump CPAC 2021 Speech Transcript","18:38"
"Donald Trump","To top it all off, the Biden people are pushing a bill that would grant mass amnesty for millions of illegal aliens while massively expanding chain migration. That’s where you come in and everybody comes in, your grandmother, your father, your mother, your brother, your cousins. They come in so easily. So, so crazy. So crazy. It even requires that the US government provide a legal border crosses with taxable funded lawyers, lawyers, everybody need a good lawyer? You can’t have one. They get the lawyers, they get lawyers. They’re probably very good too.","https://www.rev.com/blog/transcripts/donald-trump-cpac-2021-speech-transcript","Donald Trump CPAC 2021 Speech Transcript","19:18"
"Donald Trump","The Democrat immigration bill is a globalist corp. You take a look at the corporatist, big tech attack on hardworking citizens of every race, religion, color, and creed. And Republicans must ensure that it never is allowed to become federal law, which is what they want to do.","https://www.rev.com/blog/transcripts/donald-trump-cpac-2021-speech-transcript","Donald Trump CPAC 2021 Speech Transcript","19:55"
"Donald Trump","We must stand tall in the party. We have to do this. We have to stand tall as the party for law abiding Americans and others, when they’re in our country. Border security is just one of the many issues on which the new administration has already betrayed the American people. He didn’t talk about this stuff. I debated him. He wasn’t talking about this. What he signed with those executive orders, they weren’t things that were discussed. We didn’t know all about him and the press because they’re fake news. They’re the fakest fakers there are.","https://www.rev.com/blog/transcripts/donald-trump-cpac-2021-speech-transcript","Donald Trump CPAC 2021 Speech Transcript","20:18"
"Donald Trump","The press refused to ask the questions. And when I asked the questions on television, on the debate, Chris Wallace, in this case, and others refused to let him answer. They refused to let them answer the questions. Maybe we could have found something. Or if the media did its job, which they don’t, they’re callous indifference to working family is equally clear when it comes to the critical matter of getting America’s children back to school. And they must get back and get back right now, right now, crazy. Terrible. Terrible.","https://www.rev.com/blog/transcripts/donald-trump-cpac-2021-speech-transcript","Donald Trump CPAC 2021 Speech Transcript","20:56"
"Donald Trump","The Biden administration is actually bragging about the classroom education they are providing to migrant children on the border. While at the same time, millions of American children are having their futures destroyed by Joe Biden’s anti-science school closures. Think of it. We’re educating students on the border, but our own people, children of our citizens, citizens themselves are not getting the education that they deserve. There’s no reason whatsoever why the vast majority of young Americans should not be back in school immediately. The only reason that most parents do not have that choice is because Joe Biden has sold out America’s children to the teacher’s unions.","https://www.rev.com/blog/transcripts/donald-trump-cpac-2021-speech-transcript","Donald Trump CPAC 2021 Speech Transcript","21:49"
"Donald Trump","His position is morally inexcusable. You know that. Joe Biden has shamefully betrayed America’s youth. And he is cruelly keeping our children locked in their homes, no reason for it whatsoever. They want to get out. They’re cheating the next generations of Americans out of the future that they deserve. And they do deserve this future. They’re going to grow up and they’re going to have a scar.","https://www.rev.com/blog/transcripts/donald-trump-cpac-2021-speech-transcript","Donald Trump CPAC 2021 Speech Transcript","22:48"
"Donald Trump","It’s a scandal of the highest order. And one of the most graven acts by any president in our lifetimes. It’s the teacher’s union, it’s the votes and it shouldn’t happen. And nobody has more respect for teachers than I do. And I’ll bet you, a lot of the people within that union, they agree with everything I’m saying. Even the New York Times is calling out the Democrats. The mental and physical health of these young people is reaching a breaking point. Tragically, suicide attempts have skyrocketed and student depression is now commonplace and at levels that we’ve never seen before.","https://www.rev.com/blog/transcripts/donald-trump-cpac-2021-speech-transcript","Donald Trump CPAC 2021 Speech Transcript","23:14"
"Donald Trump","The Democrats now say we have to pass their $1.9 trillion boondoggle to open schools, but a very small part of it has to do with that. You know where it’s going, it’s going-","https://www.rev.com/blog/transcripts/donald-trump-cpac-2021-speech-transcript","Donald Trump CPAC 2021 Speech Transcript","23:53"
"Donald Trump","Well, part of it has to do with that, you know where it’s going, it’s going to bail out badly run Democrats, that is so much of it. But billions of dollars for schools remain unspent from the COVID relief bills that were passed last year. So on behalf of the moms, dads, and children of America, I call on Joe Biden to get the schools open and get them open now. They’re a great thing to do. When I left office and we’re very proud of this because this was something that they said could not be done. The FDA said it, everybody said it. Any article you read said it couldn’t be done. It would be years and years, I handed the new administration what everyone is now calling a modern day medical miracle. Some say, it’s the greatest thing to happen in hundreds of years, two vaccines produced in record time with numerous others on the way, including the Johnson and Johnson vaccine that was approved just yesterday.","https://www.rev.com/blog/transcripts/donald-trump-cpac-2021-speech-transcript","Donald Trump CPAC 2021 Speech Transcript","24:03"
"Donald Trump","And therapeutic relief also, if you’re sick, we have things now that are incredible. What has taken place over the last year under our administration would have taken any other precedent at least five years. And we got it done in nine months. Everyone says five years, oh, five years.","https://www.rev.com/blog/transcripts/donald-trump-cpac-2021-speech-transcript","Donald Trump CPAC 2021 Speech Transcript","25:15"
"Donald Trump","Can you imagine if you had to go through what all of the countries of the world who are now getting the vaccine or soon will be getting it from various companies, but can you imagine if all of those countries had to go through what they’ve been going through over the last year? You’d lose hundreds of millions of people. I pushed the FDA like they have never been pushed before. They told me that loud and clear. They have never been pushed like I pushed them. I didn’t like them at all, but once we got it done, I said, I now love you very much. What the Trump administration has done with vaccines has in many respects, perhaps saved large portions of the world. Not only our country, but large portions of the world.","https://www.rev.com/blog/transcripts/donald-trump-cpac-2021-speech-transcript","Donald Trump CPAC 2021 Speech Transcript","25:40"
