"speaker","transcription","url","headlin","timing"
"Jon","Thank you. Thank you so much.","https://www.rev.com/blog/transcripts/donald-trump-speech-transcript-at-the-hope-for-prisoners-graduation-ceremony","Donald Trump Speech Transcript at the Hope for Prisoners Graduation Ceremony","00:00"
"Donald Trump","Thank you. Great gentleman. That’s first thing they said to me when I walked in, “But everybody knows who you are.” I know who you are. 11 years of this. That’s fantastic. What a tremendous story. Thank you very much. Congratulations because I’m going to give him an early congratulations, all right? That’s big stuff. That’s big stuff. So, thank you very much, Jon.","https://www.rev.com/blog/transcripts/donald-trump-speech-transcript-at-the-hope-for-prisoners-graduation-ceremony","Donald Trump Speech Transcript at the Hope for Prisoners Graduation Ceremony","00:02"
"Donald Trump","Two years I was honored to celebrate your story of faith and transformation as you stood with me in the Rose Garden of the White House. It was a great day, a beautiful day. Now, I’m thrilled to come to Las Vegas Police Department. Thank you very much for being what a group that is. That’s some job you guys do. Some job you do. Lot of friends, too, lot of friends, to take part in your organization’s HOPE for Prisoners graduation ceremony.","https://www.rev.com/blog/transcripts/donald-trump-speech-transcript-at-the-hope-for-prisoners-graduation-ceremony","Donald Trump Speech Transcript at the Hope for Prisoners Graduation Ceremony","00:31"
"Donald Trump","We are here to reaffirm that America is a nation that believes in redemption. That’s what it’s about, redemption. We believe in second chances and we want to bring returning citizens, great people, great people. In many cases, great people. And not in all cases. I’m not going to be too politically correct, fellows, right? Not in all cases. But in many cases, we want to rebuild their lives, they want to rebuild their lives. They want to help us and rebuild our country. And please, everybody, please sit down. It was a little bit late with that one, wasn’t it? Thank you. That feels better, doesn’t it, huh?","https://www.rev.com/blog/transcripts/donald-trump-speech-transcript-at-the-hope-for-prisoners-graduation-ceremony","Donald Trump Speech Transcript at the Hope for Prisoners Graduation Ceremony","01:04"
"Donald Trump","But to the 29 graduates who returning to your families, you have paid your debt to society and shown a commitment to change. You’ve overcome many challenges, broken free of addiction, learned new skills and replaced old habits with fresh resolve. And Jon told us just outside little while ago that it’s an incredible class. Incredible class of talent. That word talent is very important. And now you have a chance to begin a new chapter that you are proud to call your own. And I have little doubt you’re going to be very, very successful. Your future does not have to be defined by the mistakes of the past. Today, we declare that you are made by God for a great and noble purpose and you understand that. I mean, it’s a great and noble purpose on your valued members of our American family. And we are determined to help you succeed and we’re going to work with you and you’re going to work with Jon and everybody else in this really incredible place that you’ve all put together, Jon. And you’re going to be so successful. You’re going to say, “I’m going to be more successful than Trump.” I’m going to be more … and I’ll be happy if you do it. I’ll tell you what. I’ll be very happy about it. But as long as you work hard and follow the law and do your part, you contribute to your communities, your best days are just beginning. Best part of your life is beginning. I really believe that. And your greatest years are just ahead. And to all of the family members and loved ones who have been through so much of the graduates’ who joined us today, we know your journey has not been an easy one but your love and support make all of the difference. And we are tremendously grateful for the families, the loved ones. And I know they’re even more grateful because without them, you wouldn’t be here. You wouldn’t be here. So, I want to thank you.","https://www.rev.com/blog/transcripts/donald-trump-speech-transcript-at-the-hope-for-prisoners-graduation-ceremony","Donald Trump Speech Transcript at the Hope for Prisoners Graduation Ceremony","01:52"
"Donald Trump","And joining us for this ceremony are two leaders who have devoted so much to advancing medical cures to help people overcome the stranglehold of addiction. Sheldon and Miriam Adelson, and they’ve been great friends of mine for a long time. Stand up, Sheldon. What a family. What a family. And Miriam is a doctor. A great doctor. She doesn’t have to be a doctor. You can trust me. Her husband doesn’t need the money. But she devotes her life, it’s the most important thing to her, to addiction. And every time she learns something new, and there’s still plenty to learn, but she’ll call me and tell me what they’re learning about addiction and the job you do, Miriam, what you’ve done, Sheldon, just overall is incredible. Really good. Two great people. Just great people.","https://www.rev.com/blog/transcripts/donald-trump-speech-transcript-at-the-hope-for-prisoners-graduation-ceremony","Donald Trump Speech Transcript at the Hope for Prisoners Graduation Ceremony","03:58"
"Donald Trump","And they like a place called Israel very much. Would you say that’s correct?","https://www.rev.com/blog/transcripts/donald-trump-speech-transcript-at-the-hope-for-prisoners-graduation-ceremony","Donald Trump Speech Transcript at the Hope for Prisoners Graduation Ceremony","05:08"
"Speaker 1","Amen.","https://www.rev.com/blog/transcripts/donald-trump-speech-transcript-at-the-hope-for-prisoners-graduation-ceremony","Donald Trump Speech Transcript at the Hope for Prisoners Graduation Ceremony","05:14"
"Donald Trump","Maybe I have to use the word love a place called Israel, right? Your case.","https://www.rev.com/blog/transcripts/donald-trump-speech-transcript-at-the-hope-for-prisoners-graduation-ceremony","Donald Trump Speech Transcript at the Hope for Prisoners Graduation Ceremony","05:15"
"Donald Trump","Thank you as well to Las Vegas mayor, Carolyn Goodman, for being here. Carolyn, thank you very much. Great, great job. And also the tireless advocate because Carolyn has been very much involved with criminal justice reform along with Jared Kushner, who’s been very, very much involved. I don’t know. I think … I think, Jared, I’m starting … Where’s Jared? Thank you, Jared. Never wants any credit. He does a lot. He works hard. But that’s working out very well, isn’t it, Carolyn? And it’s working out well for everybody and tremendous support. And we had liberal support, we had conservative support and they came to me and they needed some help, and we got help from some very unexpected places. Votes, we needed votes. And we got some great people.","https://www.rev.com/blog/transcripts/donald-trump-speech-transcript-at-the-hope-for-prisoners-graduation-ceremony","Donald Trump Speech Transcript at the Hope for Prisoners Graduation Ceremony","05:20"
"Donald Trump","Republicans, in all cases in this case, but we got some great people to vote for criminal justice reform. So, in fact, very conservative republicans, so that was a good sign. Very bipartisan and it was a terrific thing, and we really, we did something that they been trying to do for a long time, and we got it done. We get a lot of things done. Get a lot of things done.","https://www.rev.com/blog/transcripts/donald-trump-speech-transcript-at-the-hope-for-prisoners-graduation-ceremony","Donald Trump Speech Transcript at the Hope for Prisoners Graduation Ceremony","06:13"
"Donald Trump","Now you see a lot of press back there, so before we go any further, I want to address today’s sentencing of a man, Roger Stone. Roger Stone, he’s become big part of the news over the last little while. And I’m following this very closely, and I want to see it play out to its fullest because Roger has a very good chance of exoneration in my opinion. I’ve known, and you people understand it probably better than anybody in the room, I’ve known Roger Stone and his wife, who’s really a terrific woman, for a long time. And Roger’s definitely a character. Everybody sort of knows Roger. Everybody knows him. And most people like him. Some people probably don’t. But I do, and I always have. He’s a smart guy. He’s a little different. But those are sometimes the most interesting. But he’s a good person. His family is fantastic. He’s got a fantastic family. And there’s always a reason for that, isn’t there?","https://www.rev.com/blog/transcripts/donald-trump-speech-transcript-at-the-hope-for-prisoners-graduation-ceremony","Donald Trump Speech Transcript at the Hope for Prisoners Graduation Ceremony","06:40"
"Donald Trump","Roger was never involved in the Trump campaign for president. He wasn’t involved. I think early on, long before I announced, he may have done a little consulting work or something, but he was not involved when I ran for president. And he’s a person who, again, he knows a lot of people having to do with politics. His whole life is politics. That’s what he is. And it’s my strong opinion that the forewoman of the jury, the woman who was in charge of the jury is totally tainted. When you take a look, how can you have a person like this? She was a anti-Trump activist. Can you imagine this? Now you wouldn’t know about a bad jury. Anybody here know about a bad … No?","https://www.rev.com/blog/transcripts/donald-trump-speech-transcript-at-the-hope-for-prisoners-graduation-ceremony","Donald Trump Speech Transcript at the Hope for Prisoners Graduation Ceremony","07:48"
"Donald Trump","These people know more about bad juries than everybody here including the sheriff and the mayor and everybody. They know about bad juries. We’re not going to say it too much, though. Let’s not say it in front of more cameras than this. But you’re my experts, okay? No, but this is a woman who was an anti-Trump person, totally. Now, I don’t know if this is a fact, but she had a horrible social media account. The things she said on the account were unbelievable. She didn’t reveal that when she was chosen. And she’s, I guess from what I hear, a very strong woman, a very dominant person, so she can get people to do whatever she wants. And she got on, then she became the foreperson, forewoman, on the jury.","https://www.rev.com/blog/transcripts/donald-trump-speech-transcript-at-the-hope-for-prisoners-graduation-ceremony","Donald Trump Speech Transcript at the Hope for Prisoners Graduation Ceremony","08:37"
"Donald Trump","And I assumed they asked her a question. ” Do you have any bias? Do you have any …” She didn’t say that. So, is that a defrauding of the court? You tell me. But does this undermine our fair system of justice? How can you have a person like this? Did she delete her social account? And when Roger was determined by this same jury to be guilty before the judge issued a sentence, and he was determined to be guilty, and she started going a little wild. She’s very happy. And she started saying things and people said, “That’s strange. That’s strange.” And then they started looking in … How can you have a jury pool tainted so badly? It’s not fair. It’s not fair.","https://www.rev.com/blog/transcripts/donald-trump-speech-transcript-at-the-hope-for-prisoners-graduation-ceremony","Donald Trump Speech Transcript at the Hope for Prisoners Graduation Ceremony","09:26"
"Donald Trump","And you know, it’s not happening to a lot of other people because you can look, I won’t name names, but everybody knows who I’m talking about. What’s happening over there? Nobody. Nobody. There are people that are, even in Roger Stone’s basic business of politics, that were going to be in big trouble, well-known people, the biggest people, big trouble. They were forced to leave their firm. One man was forced to leave his firm and he was going to … Bad things were going to happen to him the following day. Nothing happened. Nothing happened. He was the biggest. Nothing happened. But it happened to Roger Stone, and it happened to General Flynn, and it happened to … I won’t name names. It happened to a lot of people. And destroyed a lot of people’s lives. And I’m here to make a fair system.","https://www.rev.com/blog/transcripts/donald-trump-speech-transcript-at-the-hope-for-prisoners-graduation-ceremony","Donald Trump Speech Transcript at the Hope for Prisoners Graduation Ceremony","10:21"
"Donald Trump","Again, Roger is not somebody who worked on my campaign. I know Roger but a lot of people know Roger. Everybody sort of knows Roger. And what happened to him is unbelievable. They say he lied. But other people lie too. Just to mention, Comey lied. McCabe lied. Lisa Page lied. Her lover, Strzok, Peter Strzok, lied. You don’t know who these people are? Just trust me. They all lied. You had people that forged documents. You had people that wrote fake dossiers and brought them to the FBI and used people in the Justice Department to get them to the FBI. And these people know in the front row, you know better than anybody in this room what the hell I’m talking about probably. So, I’m only responding to you. I’m not even talking to the folks over here. But they get it better than anybody, too. Lot of bad things are happening. We’re cleaning it out. We’re cleaning the swamp. We’re draining the swamp. I just never knew how deep the swamp was. So, if this woman was tainted, I hope the judge will find that she was tainted. And if she isn’t tainted, that will be fine too. But I’m not going to do anything in terms of the great powers bestowed upon a president of the United States. I want the process to play out. I think that’s the best thing to do because I’d love to see Roger exonerated, and I’d love to see it happen because I personally think he was treated very unfairly. They talk about witness tampering. But the man that he was tampering didn’t seem to have much of a problem with it. In fact, they know each other for years.","https://www.rev.com/blog/transcripts/donald-trump-speech-transcript-at-the-hope-for-prisoners-graduation-ceremony","Donald Trump Speech Transcript at the Hope for Prisoners Graduation Ceremony","11:17"
"Donald Trump","And, it’s not like the tampering that I see on television when you watch a movie. That’s called tampering, with guns to people’s heads and lots of other things. So, we’re going to see what it is. Maybe there was tampering and maybe there wasn’t. But, I can tell you that it was tremendous lying, really lying and leaking classified documents, that you don’t know about. But they leaked classified documents. You know, there was a young sailor who took pictures of their old submarine and sent them to his mother and a friend and it destroyed his life. I let him out. They were considered classified. Now Russia and China, I guarantee you, have the pictures of the submarine for long time. The submarine was like 30 years old. They had them in the first year. They didn’t have to wait for the 30th year.","https://www.rev.com/blog/transcripts/donald-trump-speech-transcript-at-the-hope-for-prisoners-graduation-ceremony","Donald Trump Speech Transcript at the Hope for Prisoners Graduation Ceremony","13:24"
"Donald Trump","But this is a famous story. And they had these pictures, and they put him in jail. He sent them to his mother and to his friend. His friend was not interested in what you’re thinking, and there are many other cases where documents were leaked, even accidentally. It’s so … Classified documents are so important that even if they are leaked accidentally … Hell, Hillary Clinton leaked more classified documents than any human being, I believe, in the history of the United States of America, right? And she deleted 33,000 emails. And she said, “Oh …” And by the way, if you did it? Five years, maybe more, okay? But you’d never have access to classified. Very few people have access.","https://www.rev.com/blog/transcripts/donald-trump-speech-transcript-at-the-hope-for-prisoners-graduation-ceremony","Donald Trump Speech Transcript at the Hope for Prisoners Graduation Ceremony","14:25"
"Donald Trump","She deleted 33,000 emails. I kept waiting because you know, they can talk Benghazi, they can talk 100 different things. What people understand is when you get rid of this kind of evidence so the United States Congress said, they subpoenaed her. They wanted to see her emails. After getting the subpoena, she deleted 33,000 emails. And they said, “You remember this?” Yes, the emails were about her yoga classes, her exercising and her daughter’s wedding. 33,000 about her daughter’s wedding? That must have been the greatest wedding of all time. And nothing happened to her and yet they’ll put a young sailor in an old submarine with a picture, couple of pictures, they’ll put him into jail. And I pardoned him because it was unfair that she was able to do it at the highest level and his level wasn’t … what he did, it was confidential. Confidential’s a much lower class than classified.","https://www.rev.com/blog/transcripts/donald-trump-speech-transcript-at-the-hope-for-prisoners-graduation-ceremony","Donald Trump Speech Transcript at the Hope for Prisoners Graduation Ceremony","15:23"
"Donald Trump","So, I tell you this because it’s interesting. This is part of our nation. This is what’s going on now. So, I’m going to let this process play out. And, we want to have a great and fair court system and I hope you had a fair and wonderful court system, but perhaps you didn’t. Perhaps you didn’t. And if you didn’t, we want to straighten it out but we have to straighten it out also at the top level. So, we had a lot of dirty cops, FBI is phenomenal. I love the people in the FBI. But the people at the top were dirty cops. And if you would have read the report written about Comey, 78 pages of kill, with a reference of, “Go get him.” They really said it. “Go get him.” And then you read about McCabe, and you see what they said. So bad. And we’re just waiting. I’m not doing anything. I’m just sitting here, standing here, talking to you. We’re waiting.","https://www.rev.com/blog/transcripts/donald-trump-speech-transcript-at-the-hope-for-prisoners-graduation-ceremony","Donald Trump Speech Transcript at the Hope for Prisoners Graduation Ceremony","16:40"
"Donald Trump","So, I just want to let the fake news media know that … I just want to let them know, because there’s few people more dishonest than these people, I will tell you that. And you have some very good ones. Hell of a lot more dishonest than most of you in the audience were.","https://www.rev.com/blog/transcripts/donald-trump-speech-transcript-at-the-hope-for-prisoners-graduation-ceremony","Donald Trump Speech Transcript at the Hope for Prisoners Graduation Ceremony","17:43"
"Donald Trump","Hell of a lot more dishonest than most of you in the audience were. But I’m going to let the media know that I’m going to watch the process. I’m going to watch it very closely. And at some point I’ll make a determination. But Roger Stone and everybody has to be treated fairly. And this has not been a fair process. Okay? Thank you.","https://www.rev.com/blog/transcripts/donald-trump-speech-transcript-at-the-hope-for-prisoners-graduation-ceremony","Donald Trump Speech Transcript at the Hope for Prisoners Graduation Ceremony","18:02"
"Donald Trump","So when I ran for president, I pledged to fight for those who have been forgotten, neglected, overlooked, and ignored by politicians in our nation’s capitol, and you understand that very well. For decades, no one was more forgotten than citizens coming out of prison who were ready to go into a brand new, beautiful start, but couldn’t find a job. They couldn’t find people who believed in them.","https://www.rev.com/blog/transcripts/donald-trump-speech-transcript-at-the-hope-for-prisoners-graduation-ceremony","Donald Trump Speech Transcript at the Hope for Prisoners Graduation Ceremony","18:26"
"Donald Trump","And one of the great things that happened is I and my administration and a lot of very talented people that work with me, we created the strongest economy in the history of our country. We have the best unemployment numbers. We have the best unemployment numbers for African American, best in history. Asian American, best in history. Hispanic American, best in history. Our country is booming. We’d never done better. It’s the best economy we’ve ever had.","https://www.rev.com/blog/transcripts/donald-trump-speech-transcript-at-the-hope-for-prisoners-graduation-ceremony","Donald Trump Speech Transcript at the Hope for Prisoners Graduation Ceremony","18:53"
"Donald Trump","So when people come out, as an example yourselves, you’re going to get great jobs. I’ll tell you the end result, and we do studies on this. People with businesses are going to hire you. They want you more than you want them. This is the first time this has happened. Okay? This is the first time. They want you to do it and they wouldn’t have given you that second chance. We call it second chance, but they wouldn’t have given you that second, some cases a third chance. That’s okay. But they wouldn’t have given you that second chance. Now they’re doing it because they need people, because the economy is so good.","https://www.rev.com/blog/transcripts/donald-trump-speech-transcript-at-the-hope-for-prisoners-graduation-ceremony","Donald Trump Speech Transcript at the Hope for Prisoners Graduation Ceremony","19:22"
"Donald Trump","And I’ll tell you the end result. Employers are calling the numbers that we’re getting, the respect that you’re getting from people that are doing the hiring, they can’t even believe it. I had one gentleman, I talked to him, he had seven people came out of prison. He’s got seven people working for him. He said, “They’re among my best.” He said, “They are among my best people.” He said, “I cannot believe it.” And you know what? Some businesses don’t always work out. I’m not going to say everybody is perfect, because it’s not. Nobody’s… you take a group, there’s always going to be somebody who doesn’t work out. But he said, “I can’t believe it. They are…” he’s got seven now. They’ve been with him for quite a while. He said “They’re are among the best people I’ve ever employed.” He is so happy. It’s going to happen with you. It’s going to happen with them. What do you think? I think it’s going to happen with this group.","https://www.rev.com/blog/transcripts/donald-trump-speech-transcript-at-the-hope-for-prisoners-graduation-ceremony","Donald Trump Speech Transcript at the Hope for Prisoners Graduation Ceremony","19:58"
"Donald Trump","So once I came into office, leaders from all different backgrounds asked me to make changes to our criminal justice and the more I learned about the issue, big issue, the more I knew that criminal justice reform was really not about politics, because you have people that are for and against it on all different levels. Republican, Democrat, conservative, independent, liberal. Some love it, some don’t love it, but they’re starting to love it. We’re having tremendous success with it.","https://www.rev.com/blog/transcripts/donald-trump-speech-transcript-at-the-hope-for-prisoners-graduation-ceremony","Donald Trump Speech Transcript at the Hope for Prisoners Graduation Ceremony","20:52"
"Donald Trump","And it’s about doing the right thing, because Alice Johnson and I’ve really gotten to know her well and she’s an incredible person. And because of Alice, we’re taking in… we’ve just let out three other people that she knew. And I say to people, and you may have references and recommendations when you were wherever you may have been. Frankly, you know some people that were really good people who… Alice was in for 22 years. She had another 18 years to serve and for a crime, but not that kind of a crime. And I learned about Alice Johnson and when I learned it really is really something special. She’s an incredible woman. She came out of prison.","https://www.rev.com/blog/transcripts/donald-trump-speech-transcript-at-the-hope-for-prisoners-graduation-ceremony","Donald Trump Speech Transcript at the Hope for Prisoners Graduation Ceremony","21:22"
"Donald Trump","You’ve seen the whole thing. We actually did a commercial on it. I did the commercial for people to see what this is all about. She came out… you couldn’t hire an actor in Hollywood to have the emotion and the love and the tears and everything. She came out and she saw her family who had totally grown up without her, and some big strong young men, some wonderful women, just all family. And she was grabbing them and they were all hugging and kissing outside of this massive prison wall. And they were just screaming with joy. It was an incredible thing to see. You couldn’t do it. It had to be natural. It had to come from the heart. It had to come from the heart. So it was nice. And I said to Alice and I said to other people, and I’ll say to you, and I’ll say to you, you’re going to have some recommendations. You think I’m making a mistake with him? What do you think?","https://www.rev.com/blog/transcripts/donald-trump-speech-transcript-at-the-hope-for-prisoners-graduation-ceremony","Donald Trump Speech Transcript at the Hope for Prisoners Graduation Ceremony","22:09"
