"speaker","transcription","url","headlin","timing"
"President Donald Trump","So here’s where we have. We have the Democrats. Now we have big tech. Now we also have the rhinos. Now the rhinos in many ways are worse than all of them. And most of the rhinos I beat because they were all representing one of the 17, because we had 18 running, but they were … who most of whom I get along with. Some of them I don’t like, I can tell you the good ones and the bad ones, but I beat all of these guys. And they ended up being rhinos and bad people. And here we are. And we’re President. I think we’re going to have something that’s even better than what we did four years ago. I really believe that. I really believe it. Because you don’t have crowds like this and be on the losing side. You leave here, he said, “Gee, that doesn’t sound like a second place. You can’t even see the end of the crowd. That doesn’t look like a second place finisher.” So when you hear about suppression, you have some very nice people up there, about two of them. But when you hear that, that’s right, I know every one of them there, some of them are great, actually, but we’re going to have a big victory.","https://www.rev.com/blog/transcripts/donald-trump-rally-speech-transcript-green-bay-wisconsin-october-30","Donald Trump Rally Speech Transcript Green Bay, Wisconsin October 30","21:51"
"President Donald Trump","And this election is the most important election of our lifetime. This is a more important election than the last one, and I never thought I’d say it because they have gone so far radical left that we have to make this final step. And we’re going to be normalizing our country, really normalizing our country.","https://www.rev.com/blog/transcripts/donald-trump-rally-speech-transcript-green-bay-wisconsin-october-30","Donald Trump Rally Speech Transcript Green Bay, Wisconsin October 30","22:57"
"President Donald Trump","And you know what else normalizes it? Success. I’ll tell you, before the plague came in from China, they should have never let it happen. But before the plague came in from China, I was getting calls from people that you would least expect. It was time. We had the best numbers, the best employment, the best everything, the stock market all time high, everything was the best. And they were like, “Let’s talk,” and it was happening. Then we got hit with the plague. Success brings this country together, and we’re going to have success next year. We’re going to have success next year.","https://www.rev.com/blog/transcripts/donald-trump-rally-speech-transcript-green-bay-wisconsin-october-30","Donald Trump Rally Speech Transcript Green Bay, Wisconsin October 30","23:19"
"President Donald Trump","The most successful year Wisconsin ever had was last year. You’re going to have a year. I mean, unless some guy gets in that wants to quadruple your taxes, which he wants to do. He’s the only guy I’ve ever seen, “We will raise your taxes.” All my life I’ve seen politicians say, we’re going to cut your taxes. He’s the only guy ever campaigning on. He’s going to increase your taxes. In 2016, Wisconsin voted to fire this corrupt political establishment. And you elected an outsider as President who is finally putting America first.","https://www.rev.com/blog/transcripts/donald-trump-rally-speech-transcript-green-bay-wisconsin-october-30","Donald Trump Rally Speech Transcript Green Bay, Wisconsin October 30","23:57"
"President Donald Trump","If I don’t sound like a typical politician is because I’m not a politician, if that’s okay. And if I don’t always play by the rules of Washington and the Washington establishment, it’s because I was elected to fight for you. And I fight harder for you than any President at any time in the history of our country.","https://www.rev.com/blog/transcripts/donald-trump-rally-speech-transcript-green-bay-wisconsin-october-30","Donald Trump Rally Speech Transcript Green Bay, Wisconsin October 30","24:35"
"Audience","We love you. We love you. We love you. We love you. We love you. We love you. We love you. We love you.","https://www.rev.com/blog/transcripts/donald-trump-rally-speech-transcript-green-bay-wisconsin-october-30","Donald Trump Rally Speech Transcript Green Bay, Wisconsin October 30","25:01"
"President Donald Trump","That’s so nice. Thank you. That’s a chant that has never been heard politically. Nobody’s ever … even these people, they have … there’s never been a time. We like Ronald Reagan. We like people, but they’ve never had that chant, so it’s an honor. Don’t keep it going too long, because I’ll start to cry. I’ll get a little. And we can’t tell President Xi of China that the President was crying because they said they loved him. Right?","https://www.rev.com/blog/transcripts/donald-trump-rally-speech-transcript-green-bay-wisconsin-october-30","Donald Trump Rally Speech Transcript Green Bay, Wisconsin October 30","25:15"
"President Donald Trump","And the fake news would report it, “President Trump broke down in tears, as they shouted,” somehow it doesn’t work for us. Right? We can’t do that. Right. Look at him. He goes, “No way, you can’t do it.” No, we appreciate it. It is. It’s a chant that nobody’s ever heard before. It started happening like six weeks ago. And I said, “Man, that’s very unusual,” but it’s a beautiful chant and I appreciate it.","https://www.rev.com/blog/transcripts/donald-trump-rally-speech-transcript-green-bay-wisconsin-october-30","Donald Trump Rally Speech Transcript Green Bay, Wisconsin October 30","25:41"
"President Donald Trump","I’m not just running against sleepy Joe Biden. I’m running against the left wing media, the big tech giants and the Washington swamp, and it’s deep and vicious. And they can’t believe what’s happening. They can’t believe it. They would have taken most people out. Almost anybody would have been taken out.","https://www.rev.com/blog/transcripts/donald-trump-rally-speech-transcript-green-bay-wisconsin-october-30","Donald Trump Rally Speech Transcript Green Bay, Wisconsin October 30","26:05"
"President Donald Trump","And I have been helped a lot by that man right there named Ron Johnson. I have. It’s true. He’s a tough guy and he’s a smart guy. And I knew it earlier than anybody else. I knew it. I had a meeting with Ron Johnson and we were going to have a very complex tax. Most people had no idea what we were even talking about. He understood it so good. I mean, so he really understood it. So I knew a long time ago, what you had. Don’t lose him. Don’t ever lose him.","https://www.rev.com/blog/transcripts/donald-trump-rally-speech-transcript-green-bay-wisconsin-october-30","Donald Trump Rally Speech Transcript Green Bay, Wisconsin October 30","26:24"
"President Donald Trump","You need to show up in record numbers and deliver a blistering defeat to these corrupt forces. And they are corrupt as hell. They’re trying to take over our country, and we caught them. They’re coming for your guns. They’re coming for your jobs, and they’re coming for your freedom. Think about it. Your vote will stop them on November 3rd, get out there. You got to vote. It’s the most important issue. One of the most truly important issues.","https://www.rev.com/blog/transcripts/donald-trump-rally-speech-transcript-green-bay-wisconsin-october-30","Donald Trump Rally Speech Transcript Green Bay, Wisconsin October 30","26:51"
"President Donald Trump","You don’t like to even mention it, but as law and order. And I mentioned that to Biden during one of the debates, I said, “Hey, Joe, say the words law and order, can you do it?” He wouldn’t do it because he didn’t want to lose the radical left. He didn’t want to lose them. Joe Biden and his party have spent the entire year inciting violence and hatred against our police officers. He refuses to say, you got to stop it. You cannot run through Portland to destroy the city.","https://www.rev.com/blog/transcripts/donald-trump-rally-speech-transcript-green-bay-wisconsin-october-30","Donald Trump Rally Speech Transcript Green Bay, Wisconsin October 30","27:22"
"President Donald Trump","I mean, it’s been going on. We could stop it in 30 minutes. In Seattle, I said, “I don’t care. We waited and waited. The Governor never called. We waited. I said, “You got to go in.” They took over a part of the city. I mean, this is even … to even talk about this, who would think of this? Seattle. And we were going in and we told them, “We’re coming in the morning,” and you know what they did? That evening they raised their hand and they left. That was the end of it. And a lot of people are paying a big price, by the way, but they raised their hands and they left.","https://www.rev.com/blog/transcripts/donald-trump-rally-speech-transcript-green-bay-wisconsin-october-30","Donald Trump Rally Speech Transcript Green Bay, Wisconsin October 30","27:48"
"President Donald Trump","Or the statues. We signed a law, you knock down statutes … They were knocking down statues all over the country. You knock down statues, you go to jail for 10 years. It’s an old law. It’s amazing how we haven’t seen too much trouble with statutes. There were groups that formed. They wanted to do it. They wanted, and then they said, “Let’s get the hell out of here.” 10 years, 10 years. It says 10 years in prison, old law that we reenacted. You could never get that passed today with this crazy group, Nancy Pelosi and crying Chuck Schumer.","https://www.rev.com/blog/transcripts/donald-trump-rally-speech-transcript-green-bay-wisconsin-october-30","Donald Trump Rally Speech Transcript Green Bay, Wisconsin October 30","28:17"
"President Donald Trump","Crying Chuck Schumer and Nancy would never pass anything like that. They’d say, “No, you’re allowed to rip down anything you want.” We have a DC mayor that set up a commission, to talk about all of the things, cancel culture let’s talk about. They don’t like the Washington monument. They want it renamed or taken down. This was their recommendation. But don’t worry about it. We’re not doing, I promise you. They don’t like the Thomas Jefferson Memorial because they don’t like it. They don’t even know why. Tell me why. And they don’t like even the Lincoln Memorial, right? They don’t like the Lincoln.","https://www.rev.com/blog/transcripts/donald-trump-rally-speech-transcript-green-bay-wisconsin-october-30","Donald Trump Rally Speech Transcript Green Bay, Wisconsin October 30","28:54"
"President Donald Trump","So they wanted recommendations to change the name or take them down. And I said, “I think this commission should be immediately disbanded because it’s not going anywhere.” But they are. I mean, this is a fact. Take down the Washington monument. These people are stone cold crazy. You have to go out and you have to vote.","https://www.rev.com/blog/transcripts/donald-trump-rally-speech-transcript-green-bay-wisconsin-october-30","Donald Trump Rally Speech Transcript Green Bay, Wisconsin October 30","29:30"
"President Donald Trump","Biden stands with the rioters and looters, and Biden wouldn’t say anything about the report. They asked him about the report, he didn’t want to comment. “I have no comment.” Do you want to take down the Washington monument? “I have no comment on that.” Oy yoy yoy, he has no clue. He never had much of a clue. Now we know he …","https://www.rev.com/blog/transcripts/donald-trump-rally-speech-transcript-green-bay-wisconsin-october-30","Donald Trump Rally Speech Transcript Green Bay, Wisconsin October 30","29:50"
"President Donald Trump","I stand with the heroes of law enforcement. These are great people. We have to help them. If Biden wins, the rioters in the streets, they’ll be running your Federal government. There’ll be running your government. No city, no family and no community will be safe. The Biden-Harris. How about Harris? Kamala. Kamala. And you have to say her name right or she gets very upset, right? Even though she doesn’t say it right.","https://www.rev.com/blog/transcripts/donald-trump-rally-speech-transcript-green-bay-wisconsin-october-30","Donald Trump Rally Speech Transcript Green Bay, Wisconsin October 30","30:09"
"President Donald Trump","But the Biden-Harris plan would end cash bail releasing 400,000 dangerous criminals immediately onto your streets, murderers and rapists. What’s going on is crazy. When the violent mob came to a place known as Kenosha, did you ever hear of Kenosha? Because I did. Remember what I did? If I didn’t activate immediately, Kenosha would not be there any longer. They were going to take it down. Biden opposed sending in the National Guard and I insisted on it. And I frankly wish the Governor asked me sooner, but at least he asked me, but we came in and that was over at about another 15 minutes, right? That didn’t take long. That didn’t take long. And we saved Kenosha. So you still have Kenosha.","https://www.rev.com/blog/transcripts/donald-trump-rally-speech-transcript-green-bay-wisconsin-october-30","Donald Trump Rally Speech Transcript Green Bay, Wisconsin October 30","30:45"
"President Donald Trump","They knocked down and they burned a couple of buildings down. I went, I met with the people, and really good people. What was there 100 years? It was a photography store, was 100 years. They burned down the store, but it’s going to get rebuilt. But we stopped it. That whole area would have been burned to the ground. So we came in and it was so easy too. It’s easy, but you sometimes have to meet force with force. You can’t just stand back, sit back and watch it take place like they did in Minneapolis. Then we went in and it took place very quickly.","https://www.rev.com/blog/transcripts/donald-trump-rally-speech-transcript-green-bay-wisconsin-october-30","Donald Trump Rally Speech Transcript Green Bay, Wisconsin October 30","31:36"
"President Donald Trump","Usually if it takes like more than a half an hour to wipe the whole thing out, I say, you’re not doing a very good job. Biden’s running mate, the most liberal Senator in America, even urged their supporters to donate to a fund that bailed out the rioters, took them right out of jail, including a cop killer or an attempted cop killer.","https://www.rev.com/blog/transcripts/donald-trump-rally-speech-transcript-green-bay-wisconsin-october-30","Donald Trump Rally Speech Transcript Green Bay, Wisconsin October 30","32:08"
"President Donald Trump","Biden wants to lock down your homes. He’s ready to lock it down. I mean, you guys are already in a lock down, so you might not notice it as much. Hey, Governor, you got to open up your state here. You got to open it up. You’ve got to open up your state. Got to open it up.","https://www.rev.com/blog/transcripts/donald-trump-rally-speech-transcript-green-bay-wisconsin-october-30","Donald Trump Rally Speech Transcript Green Bay, Wisconsin October 30","32:30"
"President Donald Trump","It’s sad. It’s sad, you got to go back. You understand? You’re going to socially distance. You’re going to do all the things you want to do. But I mean, we’re having these outdoor rallies. They say outdoor. Outdoor, normally would go into an arena. I actually like this stuff better. Although sometimes it’s snowing and sleet. I loved that last stop, but it was, the rain was pouring like sideways. It was going, “Sss,” that stuff. That’s when you say, I love the indoor arenas, but I like these. With a day like this it’s so beautiful. It’s great. Is there any place better to be that a Trump rally? No, seriously. It’s great.","https://www.rev.com/blog/transcripts/donald-trump-rally-speech-transcript-green-bay-wisconsin-october-30","Donald Trump Rally Speech Transcript Green Bay, Wisconsin October 30","32:52"
"President Donald Trump","But this election is a choice between a Trump super boom or a Biden depression. That’s what it is. And it’s also between opening up and keeping it closed. You see what’s happening in Europe? They’re trying it again. They’re going to close up. They closed up and they destroyed their economy. Our economy is so much better, so much stronger. Went down so much less. And now it’s come up faster than any country in the world. But ours is between a safe vaccine, which is coming very shortly, it’s momentarily, or a devastating lockdown. That’s what Biden wants to do because he has no choice.","https://www.rev.com/blog/transcripts/donald-trump-rally-speech-transcript-green-bay-wisconsin-october-30","Donald Trump Rally Speech Transcript Green Bay, Wisconsin October 30","33:34"
"President Donald Trump","He will not call the shots. He will not call the shots, and everybody knows it. Thanks to our historic campaign to slash red tape and mobilize industry, we will deliver a safe vaccine to the American people in literally over the next few weeks we think, over the next few weeks. There was a lot of pressure. There was a lot of pressure on everybody, including on the FDA, not to let this happen before the election.","https://www.rev.com/blog/transcripts/donald-trump-rally-speech-transcript-green-bay-wisconsin-october-30","Donald Trump Rally Speech Transcript Green Bay, Wisconsin October 30","34:12"
"President Donald Trump","So let me tell you, if Biden was in charge of this vaccine, just like the swine flu. He was in charge of H1N1, right? Which he can never get right. He can’t remember it. It’s always messed up. Sometime he does N1H1. And I say, “No.” But it’s the swine flu. I said, “Just call it the swine flu. It’s easier.” Right? It’s the same thing. Call it the swine flu. That was a catastrophe. And his own Chief of Staff said it was the dumbest run thing they’ve ever done. And the lethality is much less than what this was and is, was, and sort of was because we have therapeutics now that are incredible. In fact, here I am. I’m here, right?","https://www.rev.com/blog/transcripts/donald-trump-rally-speech-transcript-green-bay-wisconsin-october-30","Donald Trump Rally Speech Transcript Green Bay, Wisconsin October 30","34:39"
"President Donald Trump","They gave me a shot, Regeneron it’s called, and now there’s Eli Lilly now have the antibody stuff. And I’d like to say it had no impact, but I wasn’t feeling good. I like to say, because of my physical power, my strength, my young age. I made the case. I made the case. CNN got very angry. I said, “I’m not concerned.” No, I said, “When I got better, I got better quick.”","https://www.rev.com/blog/transcripts/donald-trump-rally-speech-transcript-green-bay-wisconsin-october-30","Donald Trump Rally Speech Transcript Green Bay, Wisconsin October 30","35:21"
"Audience","Superman. Superman. Superman. Superman. Superman.","https://www.rev.com/blog/transcripts/donald-trump-rally-speech-transcript-green-bay-wisconsin-october-30","Donald Trump Rally Speech Transcript Green Bay, Wisconsin October 30","35:45"
"President Donald Trump","No, CNN got very angry. Fake news. CNN is totally fake. I said, “No, I beat it because I’m in perfect physical shape,” and I’m a very young …","https://www.rev.com/blog/transcripts/donald-trump-rally-speech-transcript-green-bay-wisconsin-october-30","Donald Trump Rally Speech Transcript Green Bay, Wisconsin October 30","35:54"
"President Donald Trump","I beat it because I’m in perfect physical shape, and I’m a very young person. Well, our First Lady got it. She got better. Barron got it. He got better so fast, we didn’t even know. We said, the doctor said, “Sir, Barron has tested positive.” I said, “For what?” He’s very young and very tall. He’s seriously tall. He’s a good kid, but he’s a strong kid, but he’s a kid and the immune systems, so they said, Dr. Shaw, and he’s great. He’s White House physician. He said, “Barron tested positive.” I said, “For what?” He said, “For COVID.” There’s like 30 different names. I happened to call it the China plague or the China virus, because it’s more accurate. Right?","https://www.rev.com/blog/transcripts/donald-trump-rally-speech-transcript-green-bay-wisconsin-october-30","Donald Trump Rally Speech Transcript Green Bay, Wisconsin October 30","36:03"
"President Donald Trump","About 14 minutes later, I said, “How’s Barron doing? “Well, he’s recovered, fully.” I said, “Barron, were you feeling bad?” “I didn’t know anything, Dad. What was wrong, Dad?” By the way, speaking to that, get back to school. Get back to school. Okay? Get back to school, right? Look, Ron [inaudible 00:37:13] agrees. Seniors be the first in line to get it, and we will, we’re making it available free, because it’s not your fault that this thing happened. The vaccine, by the way, with or without the vaccine, we’re rounding the turn, but the vaccine makes it go faster. The vaccines are going to be out very soon. Very, very soon. Our vaccine will eradicate the virus and the pandemic, quickly restore normal life. I just want normal life. You do too.","https://www.rev.com/blog/transcripts/donald-trump-rally-speech-transcript-green-bay-wisconsin-october-30","Donald Trump Rally Speech Transcript Green Bay, Wisconsin October 30","36:52"
"President Donald Trump","All we want is normal life. I’m looking up to the sky. A friend of mine said, “You’re the most famous man in the world.” I said, “No, I’m not. No, I’m not.” “No,” he said, “No, who’s more famous than you. You are the most famous man in the world. What are you talking about? Who’s more famous?” I said, “Jesus Christ.” I don’t want to take any chances. I looked up and I said, “It’s not even close.” All right. But, next year will be the greatest economic year in the history of our country. Joe Biden’s plan will delay the vaccine, postpone therapies, crash the economy and lock down the entire country. He doesn’t mind locking down the country. The country could not stand it. You know, we locked it down shortly. We did it. We figured it out. We protect our elderly people, et cetera, but he thinks it’s fine.","https://www.rev.com/blog/transcripts/donald-trump-rally-speech-transcript-green-bay-wisconsin-october-30","Donald Trump Rally Speech Transcript Green Bay, Wisconsin October 30","37:41"
"President Donald Trump","He loves that whole deal. I’ll tell you. All he talks about is COVID. He gets up today. He’s talking COVID, COVID, COVID, COVID, COVID, COVID, COVID. The truth is, we have done an incredible job with the ventilators, the vaccines, the therapeutics, but all he does, because he’s got nothing else he can talk about, because no administration in the history of our country has done what we’ve done. I say it all the time. In the first three and a half years, what we’ve done with tax cuts and regulation cuts and rebuilding our military, which was totally depleted and a disaster. What we’ve done with our military, and so many other things, you know them all. Nobody’s done, and they never even questioned me.","https://www.rev.com/blog/transcripts/donald-trump-rally-speech-transcript-green-bay-wisconsin-october-30","Donald Trump Rally Speech Transcript Green Bay, Wisconsin October 30","38:46"
"President Donald Trump","The fake news with all the cameras, it’s never like where they come, “Oh, you shouldn’t have said that.” Nobody’s done … You think of it, Space Force. We could name, right, we could name so many different things. Under the Biden lockdown, countless Americans will die from suicide, drug overdoses, deferred medical care, and you’ll have no school, no graduations, no weddings, no Thanksgiving, no Christmas, no 4th of July, no future. Other than that, he’s doing a fantastic job. Biden wants to keep everyone locked up, even young Americans who are extremely low risk, like we talked about. He wants to steal the dreams and the future of our young people. One thing we’ve learned, the the computers are great and the laptops, everything’s great.","https://www.rev.com/blog/transcripts/donald-trump-rally-speech-transcript-green-bay-wisconsin-october-30","Donald Trump Rally Speech Transcript Green Bay, Wisconsin October 30","39:28"
"President Donald Trump","For telehealth, it’s been great, where people can stay in, and that’s really been, I think it’s up like 7000% or something. It’s a great thing. But you know, for school learning, it’s terrible. It doesn’t work. It can’t compare to a class or a campus. They’re trying so hard to say, “Oh gee, this is wonderful.” It doesn’t compare. It’s well-documented. You’re taking a large percentage of a young life out of play. It’s a terrible thing you’re doing to young kids. It’s a terrible thing that’s happening with the parents too, because the kid’s at school and the parents are working now. The parents don’t know what to do. Many of their jobs are gone, anyway. Now, you got to open up your state. You got to do it fast. You got to do it fast.","https://www.rev.com/blog/transcripts/donald-trump-rally-speech-transcript-green-bay-wisconsin-october-30","Donald Trump Rally Speech Transcript Green Bay, Wisconsin October 30","40:25"
