"speaker","transcription","url","headlin","timing"
"David Hines","Everyone supports protecting the environment, but the EPA seems too focused on complex regulations, fines, fees, and lawsuits. What can you do to lead the EPA to focus more on proactive compliance, instead of punitive enforcement to protect the environment?","https://www.rev.com/blog/transcripts/donald-trump-fox-news-town-hall-transcript","Donald Trump Fox News Town Hall Transcript","timed text issue"
"President Donald Trump","David, I love the question, because our EPA is much different. We’re very tough, but we get things done and we’re taking regulations off like nobody has ever seen. And I say very simply, I want to have the cleanest air on the planet. I want to have the most crystal clear, beautiful water on the planet. And our conditions now are much better than they were three years ago. But you know very well, David, because you’re into the world of regulation, I think it was maybe one of the biggest things we’ve done. I’ve cut regulations more than any President, whether they have eight years, four years, or in one case, quite a bit more than eight years. I cut more than any other President in the history of our country, and I did it in less than three years. So it’s a great question.","https://www.rev.com/blog/transcripts/donald-trump-fox-news-town-hall-transcript","Donald Trump Fox News Town Hall Transcript","timed text issue"
"President Donald Trump","The EPA was … This is why I was able to get the country going because so many jobs were stopped by not only EPA, so many other agencies, where you’d have to go get 11 different permits for essentially the same thing. I opened up LNG plants in Louisiana where they were for years for 10, 12, 14 years and longer trying to get permits. They couldn’t get permits. I got them built. A 10-billion-dollar plant in Louisiana, the Keystone XL pipeline. I gave it in my first week. I got approval. The Dakota Access Pipeline, I got the approval. 48,000 jobs. And, frankly, it’s more environmentally, it’s better than having a train going up and down tracks, and you don’t know what happens with the train.","https://www.rev.com/blog/transcripts/donald-trump-fox-news-town-hall-transcript","Donald Trump Fox News Town Hall Transcript","timed text issue"
"President Donald Trump","Plenty of bad things happen with those trains. Here, you’re underground, environmentally better. So I think it’s a great question. One of the reasons the economy is so strong is because of what we did with regulations. If the other side, we’ll call it the other side, affectionately got in, they would have made regulations much, much tougher. Thank you. [crosstalk 00:15:42]","https://www.rev.com/blog/transcripts/donald-trump-fox-news-town-hall-transcript","Donald Trump Fox News Town Hall Transcript","timed text issue"
"Martha MacCallum","I want to ask David, actually-","https://www.rev.com/blog/transcripts/donald-trump-fox-news-town-hall-transcript","Donald Trump Fox News Town Hall Transcript","timed text issue"
"Bret Baier","They’re talking about the rain tax here in Pennsylvania.","https://www.rev.com/blog/transcripts/donald-trump-fox-news-town-hall-transcript","Donald Trump Fox News Town Hall Transcript","timed text issue"
"Martha MacCallum","A follow-up question because you are really the typical voter. I think you were a life-long Democrat who crossed over and voted for President Trump in 2016 in areas like we are in right now, in Luzerne and Lackawanna County. So, obviously, now Joe Biden or Bernie Sanders, whoever it is, is going to try to get your vote back. So I’m curious, is there anything or any issue that they could answer for you that would change your mind, do you think?","https://www.rev.com/blog/transcripts/donald-trump-fox-news-town-hall-transcript","Donald Trump Fox News Town Hall Transcript","timed text issue"
"David Hines","I’m focused on the economy and on regulation and deregulation. And I like what’s happened in the country in the last four years.","https://www.rev.com/blog/transcripts/donald-trump-fox-news-town-hall-transcript","Donald Trump Fox News Town Hall Transcript","timed text issue"
"President Donald Trump","Thank you.","https://www.rev.com/blog/transcripts/donald-trump-fox-news-town-hall-transcript","Donald Trump Fox News Town Hall Transcript","timed text issue"
"David Hines","Thankful for your efforts, sir. And I hope we can continue on that.","https://www.rev.com/blog/transcripts/donald-trump-fox-news-town-hall-transcript","Donald Trump Fox News Town Hall Transcript","timed text issue"
"Bret Baier","So the answer is no.","https://www.rev.com/blog/transcripts/donald-trump-fox-news-town-hall-transcript","Donald Trump Fox News Town Hall Transcript","timed text issue"
"Martha MacCallum","So the answer would be no? Nothing would change your mind? No, he’s shaking his head. No, nothing.","https://www.rev.com/blog/transcripts/donald-trump-fox-news-town-hall-transcript","Donald Trump Fox News Town Hall Transcript","timed text issue"
"President Donald Trump","I think they thought you were going to give them a different answer, and that’s why they asked you that question.","https://www.rev.com/blog/transcripts/donald-trump-fox-news-town-hall-transcript","Donald Trump Fox News Town Hall Transcript","timed text issue"
"Martha MacCallum","No, I wanted to hear, because I do think it’s very-","https://www.rev.com/blog/transcripts/donald-trump-fox-news-town-hall-transcript","Donald Trump Fox News Town Hall Transcript","timed text issue"
"President Donald Trump","That sounded like a set-up question. But, David, you’re my man. David is my man. I like that.","https://www.rev.com/blog/transcripts/donald-trump-fox-news-town-hall-transcript","Donald Trump Fox News Town Hall Transcript","timed text issue"
"Martha MacCallum","I said I’m very interested in this voter because we want to know how voters like you are going to vote next time around because we love to follow the story of the movement of the electoral. And I think it’s fascinating that you answered as you did.","https://www.rev.com/blog/transcripts/donald-trump-fox-news-town-hall-transcript","Donald Trump Fox News Town Hall Transcript","timed text issue"
"President Donald Trump","Well, Martha, this area of Pennsylvania and Pennsylvania itself has the best numbers it’s ever had. It’s got the best economy it’s ever had. It has the best unemployment numbers it’s ever had. And Scranton has the lowest and best unemployment numbers and employment numbers too that they’ve ever had by far. So we’re very happy about the job. The people in Pennsylvania, they’re very happy with the job. You know, it was 30 years since a Republican won Pennsylvania, and based on results, I think we’ll win it again very easily.","https://www.rev.com/blog/transcripts/donald-trump-fox-news-town-hall-transcript","Donald Trump Fox News Town Hall Transcript","timed text issue"
"Martha MacCallum","Yeah. President Trump, I mentioned Joe Biden and Bernie Sanders because Elizabeth Warren dropped out today, and I want to know what your reaction to that was.","https://www.rev.com/blog/transcripts/donald-trump-fox-news-town-hall-transcript","Donald Trump Fox News Town Hall Transcript","timed text issue"
"President Donald Trump","Well, look, if she’s a true progressive, which probably she is, she should have dropped out three days ago. It would have been a whole different race. Texas was close. She got votes. She didn’t do well, but she got a lot of votes, far more than the difference. Think about Maine. Maine was almost a tie. They had to wait a day and a half before they could even call it, it was so close. She, I guess, came in third, and it was very distant third, but she got a lot of votes. Maine would have gone to … I think he would have gotten everything, right? Bernie Sanders would have won five, six, seven states. Would’ve won Minnesota. Would’ve won, at least, another two or three states. So when you look at it, she did him no favors. That was not a good friendship. We started to see that during the debates, by the way. That one became unhinged.","https://www.rev.com/blog/transcripts/donald-trump-fox-news-town-hall-transcript","Donald Trump Fox News Town Hall Transcript","timed text issue"
"Martha MacCallum","Yeah.","https://www.rev.com/blog/transcripts/donald-trump-fox-news-town-hall-transcript","Donald Trump Fox News Town Hall Transcript","timed text issue"
"President Donald Trump","But if she would have gone out, she didn’t even have to endorse him. If she just dropped out of the race, without an endorsement, he would have won a tremendous number of states that he lost. You know, he lost states by not very much, and she got enough votes that it would have made a big difference. I think he would be leading by a lot right now had she not been in the race.","https://www.rev.com/blog/transcripts/donald-trump-fox-news-town-hall-transcript","Donald Trump Fox News Town Hall Transcript","timed text issue"
"Bret Baier","Tonight, you’re in the boyhood home, obviously, of Joe Biden, who is sort of like a phoenix from the ashes in this Democratic race. And tonight, it looks likely that he could get the Democratic nomination. Now, Democrats insist that you were impeached because you were trying to damage Joe Biden. Were you?","https://www.rev.com/blog/transcripts/donald-trump-fox-news-town-hall-transcript","Donald Trump Fox News Town Hall Transcript","timed text issue"
"President Donald Trump","So it was a fake impeachment. We had a hundred … Think of it. And the Republicans in the House, we had 196 votes in favor, zero from the Republicans. Zero against. We picked up three Democrat votes on top of that. And we had one Democrat was so angry by it, that he left the party and became a Republican which I think is a first time, because he left a majority and went into a minority. Van Drew. And it was a whole fake deal. And everybody knows that. I made a phone call. It was a perfect phone call. There was nothing wrong with it. And they said, “Let’s impeach.” Now, the real backstory is when the phony whistleblower, who’s a total phony, he heard the call, supposedly through somebody, through the informant.","https://www.rev.com/blog/transcripts/donald-trump-fox-news-town-hall-transcript","Donald Trump Fox News Town Hall Transcript","timed text issue"
"President Donald Trump","Do you notice the way everybody disappeared? Thank goodness I had a transcriber. We had more than one. Thank goodness we had that call transcribed, because the transcripts of the call revealed that it was a perfect call. By that time, they were already talking about impeachment. And they were going by a phony whistleblower rendition of a call that didn’t exist. Just like Adam Schiff, he goes before Congress and he starts talking about eight quid pro quos and “Don’t call me, I’ll call you.” Well, that’s a mob expression. “Don’t call me …” And everybody saying, “That’s a terrible call.” He made it up. It was totally made up. And I said, “Good. We’ll sue him. We’ll take him down.” And then I find out he’s got immunity because he made it in Congress. It should almost be the opposite. You should almost have to be more honest if you’re in Congress.","https://www.rev.com/blog/transcripts/donald-trump-fox-news-town-hall-transcript","Donald Trump Fox News Town Hall Transcript","timed text issue"
"Bret Baier","Do you think Biden is damaged? Do you think he’s damaged?","https://www.rev.com/blog/transcripts/donald-trump-fox-news-town-hall-transcript","Donald Trump Fox News Town Hall Transcript","timed text issue"
"President Donald Trump","I think that Biden has been damaged, yeah. A lot of people. I saw a couple of statements very strong statements by very respected people in your world, saying they aimed at Trump but they took Biden down. And, really, that’s what happened, when you think. Because you look at the son, here’s a guy, didn’t have a job, who was unfortunately sadly, the military was a very sad experience for him. He goes out, he gets $3 million plus $183,000 a month to be a board member of a company that a lot of people said was corrupt.","https://www.rev.com/blog/transcripts/donald-trump-fox-news-town-hall-transcript","Donald Trump Fox News Town Hall Transcript","timed text issue"
"President Donald Trump","Worse just as bad China, I just made a great China deal. China is paying us billions and billions of dollars because of what I did to them with tariffs. Billions of dollars. I mean, to a point where my farmers are in love with me because I took some of that money and gave it to them. But his son walks out of China with a billion and a half dollars for a fund. Now, a billion and a half dollars for fund meaning he’s going to make hundreds of thousands of dollars a year, and much more than that.","https://www.rev.com/blog/transcripts/donald-trump-fox-news-town-hall-transcript","Donald Trump Fox News Town Hall Transcript","timed text issue"
"Bret Baier","So you want to face Joe Biden or Bernie Sanders? That’s my question.","https://www.rev.com/blog/transcripts/donald-trump-fox-news-town-hall-transcript","Donald Trump Fox News Town Hall Transcript","timed text issue"
"President Donald Trump","I’ll tell you, I was all set for Bernie, because I thought it was going to happen. You know, we get ready for things, right? So, mentally, I’m all set for Bernie. Communist, I had everything down. He’s a communist. I was all set. And then we have this crazy thing that happened, right? On Tuesday, which he thought was Thursday. But he also said 150 million people were killed with guns and he was running for the United States Senate. “Support me, I’m running for the United States.” There’s something going on there. But I was all set. I was all set. And when I focus and we all focus, sometimes you do well and some people choke. I watched Mini Mike choke. When Mini Mike was hit by a very mean woman, he said, “Get me off this stage. Just get me off.” And that wasn’t a pretty sight to be … But I was all set to take on Bernie. I was ready.","https://www.rev.com/blog/transcripts/donald-trump-fox-news-town-hall-transcript","Donald Trump Fox News Town Hall Transcript","timed text issue"
"President Donald Trump","And then all of a sudden, I say, “Guess what?” I went to the First Lady, who people love. I go in to the First Lady, and I said, “He just won Texas. He just won …” Et cetera, et cetera. By the way, so close. It was a whole different thing because of her. So now I’m ready for Bernie and now all of a sudden I have a whole different, you know, it’s a whole different deal. Two very different people. I think, in a certain way, Bernie would be tougher because he’s got a base. It’s a much smaller base than my base. I think a lot of my people are here because, and I did nothing to do that, but we have a lot of support in Pennsylvania and I think we have a lot of support everywhere. Look at the rallies. Look at the rallies. But I was all set for Bernie. I was ready to go. And then I say, “You know, I don’t think I’m running against Bernie.” I think it’s going to be very hard for him to come back.","https://www.rev.com/blog/transcripts/donald-trump-fox-news-town-hall-transcript","Donald Trump Fox News Town Hall Transcript","timed text issue"
"Martha MacCallum","Let’s go right to Audrey who has a question for President Trump. Audrey.","https://www.rev.com/blog/transcripts/donald-trump-fox-news-town-hall-transcript","Donald Trump Fox News Town Hall Transcript","timed text issue"
"Audrey Strein","Right here.","https://www.rev.com/blog/transcripts/donald-trump-fox-news-town-hall-transcript","Donald Trump Fox News Town Hall Transcript","timed text issue"
"Martha MacCallum","There we go. Hi Audrey.","https://www.rev.com/blog/transcripts/donald-trump-fox-news-town-hall-transcript","Donald Trump Fox News Town Hall Transcript","timed text issue"
"Audrey Strein","Mr. President. Thank you. Pennsylvania thanks you. Bucks County thanks you for everything you’re doing for our country.","https://www.rev.com/blog/transcripts/donald-trump-fox-news-town-hall-transcript","Donald Trump Fox News Town Hall Transcript","timed text issue"
"Donald Trump","Thank you very much.","https://www.rev.com/blog/transcripts/donald-trump-fox-news-town-hall-transcript","Donald Trump Fox News Town Hall Transcript","timed text issue"
"Audrey Strein","We look at your energy and makes me get up and say if he can do it, I can definitely get up and do everything I got to do.","https://www.rev.com/blog/transcripts/donald-trump-fox-news-town-hall-transcript","Donald Trump Fox News Town Hall Transcript","timed text issue"
"Donald Trump","Thank you very much.","https://www.rev.com/blog/transcripts/donald-trump-fox-news-town-hall-transcript","Donald Trump Fox News Town Hall Transcript","timed text issue"
"Audrey Strein","I want to say Republicans have failed to come up with an alternative plan to Obamacare. How do you plan to rally the Republicans around a plan and what would be included in that?","https://www.rev.com/blog/transcripts/donald-trump-fox-news-town-hall-transcript","Donald Trump Fox News Town Hall Transcript","timed text issue"
"Donald Trump","Thank you very much. It’s a great question and very important, healthcare and I think it’s probably the thing that I’m most disappointed that I haven’t been able to say what a good job we’ve done. I haven’t been able to sell what a great job we’ve done.","https://www.rev.com/blog/transcripts/donald-trump-fox-news-town-hall-transcript","Donald Trump Fox News Town Hall Transcript","timed text issue"
"Donald Trump","First of all, I get rid of the individual mandate, which was the worst part of Obamacare. That’s where you paid a fortune not to pay for horrible healthcare and insurance, and it had a tremendous impact. Preexisting conditions, 100% we take care of. But we have many healthcare plans now where it’s 60%, even 65% less expensive than Obamacare. It’s better than Obamacare, and what we really have left is the carcass of Obamacare or you could call it new healthcare, because without preexisting… without the whole thing with the individual mandate, it’s a whole different ball game. It’s a much different plan.","https://www.rev.com/blog/transcripts/donald-trump-fox-news-town-hall-transcript","Donald Trump Fox News Town Hall Transcript","timed text issue"
"Donald Trump","And what we’d like to do is totally kill it, but come up, before we do that, with something that’s great. What we’ve done is we’ve really managed Obamacare, the remaining portion, we get rid of the bad part, but the remaining portion really well. And before I got involved, you know what was happening with the rates on Obamacare. They were going up at levels that nobody’s ever seen before. We are managing it.","https://www.rev.com/blog/transcripts/donald-trump-fox-news-town-hall-transcript","Donald Trump Fox News Town Hall Transcript","timed text issue"
"Donald Trump","And I had a decision to make. This was very important. I said to my people, and we have great people, [Sema 00:01:47], Azar, I mean great people that are so good at it. I said, “You know, I have a little problem. Do we manage it great until we get something much better? Or do we manage it poorly and say Obamacare’s horrible.” And I said, “We’ve got to do the right thing. We’ve got to manage it really, really good.” So it’s not great healthcare, but we’re managing it fantastically and you don’t see all those stories about the rates going through the roof anymore because we know what we’re doing.","https://www.rev.com/blog/transcripts/donald-trump-fox-news-town-hall-transcript","Donald Trump Fox News Town Hall Transcript","timed text issue"
"Donald Trump","At the same time, we want to get you really fantastic healthcare. If we can win back the house, we’ll be able to do that. We have to win back the House, keep the Senate, keep the White House. [inaudible 00:02:24]. Thank you. Thank you for the question.","https://www.rev.com/blog/transcripts/donald-trump-fox-news-town-hall-transcript","Donald Trump Fox News Town Hall Transcript","timed text issue"
"Martha MacCallum","Mr. President, I just want to follow up quickly on that because the issue of preexisting conditions, you say you’re going to protect them, but your administration is also fighting Obamacare and the courts. So how do you promise people that you’re going to protect them based on that?","https://www.rev.com/blog/transcripts/donald-trump-fox-news-town-hall-transcript","Donald Trump Fox News Town Hall Transcript","timed text issue"
"Donald Trump","That’s what I said. Yeah, that’s what I said, we want to terminate Obamacare because it’s bad. Look, we’re running it really well, but we know it’s defective. It’s very defective. We got rid of the worst part and that was a very important thing. Getting rid of the individual mandate was a very important thing. But we want to get something… if we can get the House, you’ll have the best healthcare, health insurance anywhere on the planet, but we have to get the House back. Now that means we have to hold the Senate, we have to get the House, we have to obviously keep the White House. But what we’re doing is managing it really well.","https://www.rev.com/blog/transcripts/donald-trump-fox-news-town-hall-transcript","Donald Trump Fox News Town Hall Transcript","timed text issue"
"Donald Trump","Now it’s a case, it’s called Texas versus… you understand, it’s Texas is suing. They want to terminate it, but everybody there is also saying… and everybody, we have our great Senator from Pennsylvania, thank you very much, Pat, for being here. And Pat Toomey, but very important… and by the way, our great Congressman, I have to say they were warriors, right? Real warriors in terms of the fake impeachment. I will tell you that.","https://www.rev.com/blog/transcripts/donald-trump-fox-news-town-hall-transcript","Donald Trump Fox News Town Hall Transcript","timed text issue"
"Donald Trump","Texas is, and it’s Texas and many states, they’re tried to terminate, but they want to put something that’s much better. They’re terminating it to put much better. And they’ve all pledged that preexisting conditions 100% taken care of.","https://www.rev.com/blog/transcripts/donald-trump-fox-news-town-hall-transcript","Donald Trump Fox News Town Hall Transcript","timed text issue"
"Bret Baier","Immigration. That next question is from Jennifer and she has a question about this issue. Hi.","https://www.rev.com/blog/transcripts/donald-trump-fox-news-town-hall-transcript","Donald Trump Fox News Town Hall Transcript","timed text issue"
"Jennifer Nolan","Hi, thank you Mr. President. This is truly an honor and one of the best days of my life, just don’t tell my husband.","https://www.rev.com/blog/transcripts/donald-trump-fox-news-town-hall-transcript","Donald Trump Fox News Town Hall Transcript","timed text issue"
"Donald Trump","Wow.","https://www.rev.com/blog/transcripts/donald-trump-fox-news-town-hall-transcript","Donald Trump Fox News Town Hall Transcript","timed text issue"
"Jennifer Nolan","And I want to know how are you going to control the illegal immigration without support from the democratic party?","https://www.rev.com/blog/transcripts/donald-trump-fox-news-town-hall-transcript","Donald Trump Fox News Town Hall Transcript","timed text issue"
"Donald Trump","Well, you know it’s been hard, but we’ve done it incredibly. It could have been… we have things called loopholes and the loopholes are terrible, like lottery where you give lotteries, they pick lotteries and they have people coming into our country. We have ended catch and release. We have right now 27,000 Mexican soldiers on our border saying that if they don’t do that, we’re going to have to be very tough on Mexico and they’re doing it, because our soldiers aren’t allowed to be there for a lot of reasons and we’re very politically correct as a nation. Mexico, perhaps a slightly less politically correct. And we have the best numbers that we’ve had in many, many months. We’ve had, I guess, it’s now 9 or 10 months where the numbers are way down and we’ve been keeping them down.","https://www.rev.com/blog/transcripts/donald-trump-fox-news-town-hall-transcript","Donald Trump Fox News Town Hall Transcript","timed text issue"
"Donald Trump","But we need the wall. And most importantly, the wall is way under construction. We’re up to 129 miles already. Where we have a wall, by the way, nobody’s coming through. Practically nobody. We will have by early next year almost 500 miles of wall. And once we have that wall, it’s going to stop drugs, it’s going to stop big percentages of everything coming in. Okay.","https://www.rev.com/blog/transcripts/donald-trump-fox-news-town-hall-transcript","Donald Trump Fox News Town Hall Transcript","timed text issue"
