"speaker","transcription","url","headlin","timing"
"Donald Trump","Thomas Moriarty, CVS. We all know CVS. Thank you.","https://www.rev.com/blog/transcripts/donald-trump-speech-transcript-declares-coronavirus-national-emergency","Donald Trump Speech Transcript: Declares Coronavirus National Emergency","14:03"
"Thomas Moriarty","Thanks.","https://www.rev.com/blog/transcripts/donald-trump-speech-transcript-declares-coronavirus-national-emergency","Donald Trump Speech Transcript: Declares Coronavirus National Emergency","14:08"
"Donald Trump","Thank you, Thomas.","https://www.rev.com/blog/transcripts/donald-trump-speech-transcript-declares-coronavirus-national-emergency","Donald Trump Speech Transcript: Declares Coronavirus National Emergency","14:09"
"Thomas Moriarty","Thank you, Mr. President. We have been focused since the start of making sure our patients and the customers we serve have the information they need, the safety they need as well. We are committed to working with the administration and local public health officials to make this work as well. And thank you sir for the honor.","https://www.rev.com/blog/transcripts/donald-trump-speech-transcript-declares-coronavirus-national-emergency","Donald Trump Speech Transcript: Declares Coronavirus National Emergency","14:09"
"Donald Trump","Thank you very much.","https://www.rev.com/blog/transcripts/donald-trump-speech-transcript-declares-coronavirus-national-emergency","Donald Trump Speech Transcript: Declares Coronavirus National Emergency","14:27"
"Thomas Moriarty","Thank you.","https://www.rev.com/blog/transcripts/donald-trump-speech-transcript-declares-coronavirus-national-emergency","Donald Trump Speech Transcript: Declares Coronavirus National Emergency","14:28"
"Donald Trump","Thanks. Great job. And Bruce Greenstein, LHC Group. Tremendously talented people. Thank you very much.","https://www.rev.com/blog/transcripts/donald-trump-speech-transcript-declares-coronavirus-national-emergency","Donald Trump Speech Transcript: Declares Coronavirus National Emergency","14:29"
"Bruce Greenstein","Mr. President, thank you for the honor of being here. And the home health industry has been treating patients and seniors in the safety and comfort of their own home for decades. We’re very proud to be part of the equation for testing in their own home. For Americans that can’t get to a test site or live in rural areas far away from a retail establishment, we’re here to help and to partner with our hospitals and physicians as well as the people we have here today that will be doing testing around the country. Thank you.","https://www.rev.com/blog/transcripts/donald-trump-speech-transcript-declares-coronavirus-national-emergency","Donald Trump Speech Transcript: Declares Coronavirus National Emergency","14:38"
"Donald Trump","Thanks very much. [crosstalk 00:15:02].","https://www.rev.com/blog/transcripts/donald-trump-speech-transcript-declares-coronavirus-national-emergency","Donald Trump Speech Transcript: Declares Coronavirus National Emergency","15:03"
"Bruce Greenstein","We’ll practice that.","https://www.rev.com/blog/transcripts/donald-trump-speech-transcript-declares-coronavirus-national-emergency","Donald Trump Speech Transcript: Declares Coronavirus National Emergency","15:03"
"Donald Trump","Okay. I like that. That’s good. We’re also announcing the following emergency executive actions today. To help our students and their families, I’ve waived interest in all student loans held by the federal government agencies and that will be until further notice. That’s a big thing for a lot of students that are left in the middle right now. Many of those schools have been closed. Based on the price of oil, I’ve also instructed the Secretary of Energy to purchase, at a very good price, large quantities of crude oil for storage in the US, strategic reserve.","https://www.rev.com/blog/transcripts/donald-trump-speech-transcript-declares-coronavirus-national-emergency","Donald Trump Speech Transcript: Declares Coronavirus National Emergency","15:06"
"Donald Trump","We’re going to fill it right up to the top, saving the American taxpayer billions and billions of dollars, helping our oil industry and making us even further toward that wonderful goal which we’ve achieved, which nobody thought was possible of energy independence. It puts us in a position that’s very strong and we’re buying it at the right price. And that’s something that would have not even been possible a week ago. The price of oil went down quite a bit, so we’re going to fill it up. It’s a good time to fill it up. I’d like to ask Mike Pence to say a few words please. VP.","https://www.rev.com/blog/transcripts/donald-trump-speech-transcript-declares-coronavirus-national-emergency","Donald Trump Speech Transcript: Declares Coronavirus National Emergency","15:44"
"Mike Pence","Thank you, Mr. President. This day should be an inspiration to every American, because thanks to your leadership from early on, not only are we bringing a whole of government approach to confronting the coronavirus, we’re bringing an all of America approach. Mr. President, from early on you took decisive action. You suspended all travel from China, you created travel advisories to South Korea and Italy. We screened all travelers from all airports in both of those countries. And on the unanimous recommendation of your health experts, you at midnight tonight will effectively suspend all travel from Europe and Americans that were returning will be screened and asked to voluntarily participate in a 14-day quarantine.","https://www.rev.com/blog/transcripts/donald-trump-speech-transcript-declares-coronavirus-national-emergency","Donald Trump Speech Transcript: Declares Coronavirus National Emergency","16:23"
"Mike Pence","Throughout this process, Mr. President, you’ve put the health of America first, but you brought the best of America to address it. And it’s not just at the federal level. As you said, Mr. President, we’ve been working with states across the country. We issued broad guidelines from the CDC for every American. But this week at your direction, we tailored specific recommendations from CDC for New York, Washington State, California, Massachusetts and Florida. And we’ve been in continuous contact, as you said, with governors around the country. Mr. President, you have forged a seamless partnership with every state and every territory in this country to put the health of our nation first.","https://www.rev.com/blog/transcripts/donald-trump-speech-transcript-declares-coronavirus-national-emergency","Donald Trump Speech Transcript: Declares Coronavirus National Emergency","17:17"
"Mike Pence","But today, I trust that people around the country that are looking on at this extraordinary public and private partnership to address the issue of testing with particular inspiration. After you tapped me to lead the White House Corona Taskforce, Mr. President, you said this is all hands on deck and you directed us to immediately reach out to the American business sector, commercial labs to meet what we knew then would be the need for testing across the spectrum. And today, with this historic public- private partnership, we have laid the foundation to meet that need. For Americans looking on, by this Sunday evening, we’ll be able to give specific guidance on when the website will be available.","https://www.rev.com/blog/transcripts/donald-trump-speech-transcript-declares-coronavirus-national-emergency","Donald Trump Speech Transcript: Declares Coronavirus National Emergency","17:59"
"Mike Pence","You can go to the website, as the President said. You’ll type in your symptoms and be given direction whether or not a test is indicated. And then at the same website you’ll be directed to one of these incredible companies that are going to give a little bit of their parking lot so that people can come by and do a drive by test. Mr. President, I want to join you in thanking Walmart, and CVS, and Target, and Walgreen. These are companies that are synonymous with communities, large and small, where people come together and now they’re going to come together to meet the needs of the American public. These commercial laboratories, LabCorp, and Quest, and Roche have just done an incredible job stepping forward and they’re going to literally make, literally make hundreds and thousands of tests available and being processed with results to patients in the very near future.","https://www.rev.com/blog/transcripts/donald-trump-speech-transcript-declares-coronavirus-national-emergency","Donald Trump Speech Transcript: Declares Coronavirus National Emergency","18:42"
"Mike Pence","But it’s all a result of you tasking us with bringing together not just government resources, which all state labs can now test across the country. CDC is testing. But you said, Mr. President, that we wanted to bring all the resources of the country together and that’s what this partnership really means. Truth is that we have coronavirus cases now in 46 American states and while the risk of serious illness of the coronavirus remains low, we want to encourage every American to practice common sense, practice good hygiene, go to the CDC’s website to see what the guidance is for your community, or for the American people broadly. And as the President has said, it’s especially important now that we look after senior citizens with chronic underlying health conditions.","https://www.rev.com/blog/transcripts/donald-trump-speech-transcript-declares-coronavirus-national-emergency","Donald Trump Speech Transcript: Declares Coronavirus National Emergency","19:33"
"Mike Pence","Last week the President directed the Center for Medicaid and Medicare Services to raise the standards in our nursing homes, increase inspections at our nursing homes. And today, we’re offering very specific guidance, which Seema Verma will articulate about visitations at nursing homes. It’s important to remember that they were there for us when we were growing up, Mr. President. They helped us with our homework. They tucked us in at night, they cheered us on as we pursued educations, cheered us on in our careers. Now it’s time for us to be there for them and to recognize that seniors with chronic health conditions are the most vulnerable and Americans can make a difference. So wash your hands. Use common sense. Look after the most vulnerable. And Mr. President, I know I join you in saying that every American should be proud of this incredible public private partnership that’s going to be speeding access of testing to millions of Americans in the weeks ahead. And together, as you’ve said many times, together we’ll get through this, together we’ll put the health of America first.","https://www.rev.com/blog/transcripts/donald-trump-speech-transcript-declares-coronavirus-national-emergency","Donald Trump Speech Transcript: Declares Coronavirus National Emergency","20:22"
"Donald Trump","Thank you.","https://www.rev.com/blog/transcripts/donald-trump-speech-transcript-declares-coronavirus-national-emergency","Donald Trump Speech Transcript: Declares Coronavirus National Emergency","21:26"
"Mike Pence","[inaudible 00:21:28].","https://www.rev.com/blog/transcripts/donald-trump-speech-transcript-declares-coronavirus-national-emergency","Donald Trump Speech Transcript: Declares Coronavirus National Emergency","21:26"
"Donald Trump","Seema? Where’s Seema? I’d like you to maybe take that a step further please on nursing homes.","https://www.rev.com/blog/transcripts/donald-trump-speech-transcript-declares-coronavirus-national-emergency","Donald Trump Speech Transcript: Declares Coronavirus National Emergency","21:29"
"Seema Verma","Thank you.","https://www.rev.com/blog/transcripts/donald-trump-speech-transcript-declares-coronavirus-national-emergency","Donald Trump Speech Transcript: Declares Coronavirus National Emergency","21:35"
"Donald Trump","Thanks.","https://www.rev.com/blog/transcripts/donald-trump-speech-transcript-declares-coronavirus-national-emergency","Donald Trump Speech Transcript: Declares Coronavirus National Emergency","21:36"
"Seema Verma","Thank you. Well, thank you to the President for the declaration. It allows my agency, CMS, that runs Medicare and Medicaid and has oversight of all of the nation’s healthcare facilities to suspend regulations that could get in the way of treating patients during this time. These temporary national blanket waivers are reserved for the rarest of circumstances and they represent a massive mobilization of our country’s resources to combat this terrible virus. And the flexibilities we are offering will be a Godsend to the providers, clinicians, and facilities on the front lines of this fight.","https://www.rev.com/blog/transcripts/donald-trump-speech-transcript-declares-coronavirus-national-emergency","Donald Trump Speech Transcript: Declares Coronavirus National Emergency","21:36"
"Seema Verma","And later, CMS is going to be issuing guidance, directing nursing homes to temporarily restrict all visitors and non-essential personnel with a few exceptions such as end of life situations. We fully appreciate that this measure represents a severe trial for residents of nursing homes and those who love them, but we are doing what we must to protect our vulnerable elderly. Thank you.","https://www.rev.com/blog/transcripts/donald-trump-speech-transcript-declares-coronavirus-national-emergency","Donald Trump Speech Transcript: Declares Coronavirus National Emergency","22:14"
"Donald Trump","Thank you very much. As I said in my address to the nation the other night, all Americans have a role to play in defeating this virus. Our most effective weapon right now is to limit the damage to our people and our country and slow the spread of the virus itself. The choice we make-","https://www.rev.com/blog/transcripts/donald-trump-speech-transcript-declares-coronavirus-national-emergency","Donald Trump Speech Transcript: Declares Coronavirus National Emergency","22:41"
"Donald Trump","… spread of the virus itself. The choice we make, the precautions we put into place, are critical to overcoming the virus, reducing its spread and shortening the duration of the pandemic which is what it is. The CDC has published guidelines on the coronavirus.gov to enable… It’s coronavirus.gov. It’s very heavily used right now, I will say, to enable every American to respond to this epidemic and to protect themselves, their families and their communities. While the risks to young and healthy Americans remains very low, we’ve learned a lot about this over the last two weeks. Anyone can be a carrier for the virus and risk transmission to older Americans and those with underlying health conditions. And those who are most at risk, they have not done very well. Older Americans, especially if they have a health problem, they have not done well.","https://www.rev.com/blog/transcripts/donald-trump-speech-transcript-declares-coronavirus-national-emergency","Donald Trump Speech Transcript: Declares Coronavirus National Emergency","23:03"
"Donald Trump","We must take all precautions and be responsible for the actions that we take, and that we see other people take. We want to prevent the spread and transmission of the disease. It’s incredible what’s happening with the sporting world, where so many of the great sports that we’ve gotten so used to at this time of the year, they’re not going to be meeting. They’ve done a great service, actually. But that would be another way that problems could be caused.","https://www.rev.com/blog/transcripts/donald-trump-speech-transcript-declares-coronavirus-national-emergency","Donald Trump Speech Transcript: Declares Coronavirus National Emergency","24:06"
"Donald Trump","But this is why I outlined on Wednesday night, my administration’s… The fact that we’ve issued a requirement suspending all medically unnecessary visits to various places. But in particular, nursing homes. We should all be working off the same playbook when it comes to protecting Americans. We have to. We need to be consistent in adopting measures to limit the spread of the virus. The virus is the same whether it’s spreading in cities, towns, or rural communities. The tools and tactics for attacking it are similar, no matter where you go. No matter where you go, you have some hotspots throughout the world right now that people would have never thought possible, and they’re being very seriously affected.","https://www.rev.com/blog/transcripts/donald-trump-speech-transcript-declares-coronavirus-national-emergency","Donald Trump Speech Transcript: Declares Coronavirus National Emergency","24:40"
"Donald Trump","Key among these efforts, are breaking chains of transmission between people. These measures have been adopted by many companies, universities and schools. We want to protect the safety and the health of their employees and their students. I encourage everyone to follow the guidelines we’ve issued by CDC, and these common sense measures. A lot of it is common sense. For the areas where the virus is spreading, the CDC is advising communities to postpone large gatherings, postpone assemblies, social functions and sporting events, stagger recess and lunch for schools that aren’t canceled, limit in-person meetings, increase scheduled cleanings, and cancel work-sponsored travel, among numerous other steps that can be taken.","https://www.rev.com/blog/transcripts/donald-trump-speech-transcript-declares-coronavirus-national-emergency","Donald Trump Speech Transcript: Declares Coronavirus National Emergency","25:27"
"Donald Trump","Americans are the strongest and most resilient people on Earth. And in the coming weeks, we will all have to make changes and sacrifices. But these short term sacrifices will produce long term gain. Again, I’ve said we’re learning a lot for the future and future problems like this, or worse. Or worse, it could get worse. The next eight weeks are critical. We can learn, and we will turn a corner on this virus. Some of the doctors say it will wash through and will flow through, in interesting terms, very accurate. I think you’re going to find in a number of weeks, it’s going to be a very accurate term.","https://www.rev.com/blog/transcripts/donald-trump-speech-transcript-declares-coronavirus-national-emergency","Donald Trump Speech Transcript: Declares Coronavirus National Emergency","26:17"
"Donald Trump","In times of hardship. The true character of America always shines through. We live in the company of the greatest heroes and the most inspiring citizens anywhere in the world. We want to take care of our people. We want to draw on the strength of our history, draw on the strength of our people. Then we will get through this. All together, we will just get through it. So much progress has already been made. And frankly, the numbers because the steps that have been taken, are at a level that a lot of people are surprised… especially when you compare them with other places with far smaller populations.","https://www.rev.com/blog/transcripts/donald-trump-speech-transcript-declares-coronavirus-national-emergency","Donald Trump Speech Transcript: Declares Coronavirus National Emergency","27:02"
"Donald Trump","The spirit and the will of our nation is unbreakable. We will defeat this threat. When America is tested, America rises to the occasion. And to those families and citizens who are worried and concerned for themselves and their loved ones, I want you to know that your federal government will unleash every authority, resource and tool at its disposal, to safeguard the lives and health of our people. So we’re with you every step of the way. No nation is more prepared or more equipped to face down this crisis.","https://www.rev.com/blog/transcripts/donald-trump-speech-transcript-declares-coronavirus-national-emergency","Donald Trump Speech Transcript: Declares Coronavirus National Emergency","27:41"
"Donald Trump","As you know, we are rated number one in the world. We’re also helping other nations. Many of the nations, we’re helping them a lot. And they are doing okay in some cases. In some cases, they are not doing well at all. But we’re working with a lot of groups of people and a lot of other nations. With faith and heart and hope and love and determination, we will succeed. We will prevail. We will be very, very successful. And we’ll learn for the future. Thank you all very much. If you have any questions, we can take some. Go ahead, John, please. And if you’d like to ask some of the folks up here, it would be fine. Please.","https://www.rev.com/blog/transcripts/donald-trump-speech-transcript-declares-coronavirus-national-emergency","Donald Trump Speech Transcript: Declares Coronavirus National Emergency","28:13"
"John","Mr. President, where are you with the House bill? Yesterday, we talked to you in the Oval Office. You were opposed to it. What has happened since then, and what’s the holdup on that?","https://www.rev.com/blog/transcripts/donald-trump-speech-transcript-declares-coronavirus-national-emergency","Donald Trump Speech Transcript: Declares Coronavirus National Emergency","28:53"
"Donald Trump","Well, we just don’t think they’re giving enough. We don’t think the Democrats are giving enough. We’re negotiating. We thought we had something. But all of a sudden, they didn’t agree to certain things that they agreed to. So we could have something, but we don’t think they’re giving enough. They’re not doing what’s right for the country.","https://www.rev.com/blog/transcripts/donald-trump-speech-transcript-declares-coronavirus-national-emergency","Donald Trump Speech Transcript: Declares Coronavirus National Emergency","29:01"
"John","And if I could ask Dr. Fauci.","https://www.rev.com/blog/transcripts/donald-trump-speech-transcript-declares-coronavirus-national-emergency","Donald Trump Speech Transcript: Declares Coronavirus National Emergency","29:19"
"Donald Trump","Go ahead, please.","https://www.rev.com/blog/transcripts/donald-trump-speech-transcript-declares-coronavirus-national-emergency","Donald Trump Speech Transcript: Declares Coronavirus National Emergency","29:21"
"Speaker 1","Thank you, Mr. President. You just mentioned waiving interest for student loans.","https://www.rev.com/blog/transcripts/donald-trump-speech-transcript-declares-coronavirus-national-emergency","Donald Trump Speech Transcript: Declares Coronavirus National Emergency","29:23"
"Donald Trump","Yeah.","https://www.rev.com/blog/transcripts/donald-trump-speech-transcript-declares-coronavirus-national-emergency","Donald Trump Speech Transcript: Declares Coronavirus National Emergency","29:27"
"Speaker 1","You talked about buying oil from the SPR, or adding to the SPR. What other specific targeted measures is your administration thinking about taking? The Treasury Secretary, Steve Mnuchin, said today that you’re just in the second inning of things that you might be undergoing.","https://www.rev.com/blog/transcripts/donald-trump-speech-transcript-declares-coronavirus-national-emergency","Donald Trump Speech Transcript: Declares Coronavirus National Emergency","29:28"
"Donald Trump","Yeah. Well, that’s true. We are looking at many different things, as you know. Some of them, they’ve been written about very widely. But we’re going to be releasing a paper in about two hours stating quite a few other steps, very important ones. Please, go ahead.","https://www.rev.com/blog/transcripts/donald-trump-speech-transcript-declares-coronavirus-national-emergency","Donald Trump Speech Transcript: Declares Coronavirus National Emergency","29:41"
"Speaker 1","One more sir, if you wouldn’t mind.","https://www.rev.com/blog/transcripts/donald-trump-speech-transcript-declares-coronavirus-national-emergency","Donald Trump Speech Transcript: Declares Coronavirus National Emergency","29:55"
"Donald Trump","Please, go ahead.","https://www.rev.com/blog/transcripts/donald-trump-speech-transcript-declares-coronavirus-national-emergency","Donald Trump Speech Transcript: Declares Coronavirus National Emergency","29:56"
"Speaker 2","Thank you so much, Mr. President. I want to know if you are in contact with the Brazilian President, Bolsonaro, after a member of his delegation who was with you Saturday, was tested positive. And also, I want to ask another question if you’ll let me. Senators Lindsey Graham and also Senator Scott, Rick Scott, are self-isolating. Are you planning to take any kind of precautionary measure to protect you, and also your staff who was there?","https://www.rev.com/blog/transcripts/donald-trump-speech-transcript-declares-coronavirus-national-emergency","Donald Trump Speech Transcript: Declares Coronavirus National Emergency","29:57"
"Donald Trump","No. We have a no symptoms, whatsoever. We had a great meeting with the President of Brazil, Bolsonaro. Great guy, a very tremendous… He’s doing a fantastic job for Brazil. As you know, he tested negative. Meaning, nothing wrong this morning, and we got that word too. Because we did have dinner with him. We were sitting next to each other for a long period of time.","https://www.rev.com/blog/transcripts/donald-trump-speech-transcript-declares-coronavirus-national-emergency","Donald Trump Speech Transcript: Declares Coronavirus National Emergency","30:26"
"Speaker 2","But are you in contact with him over the coronavirus crisis?","https://www.rev.com/blog/transcripts/donald-trump-speech-transcript-declares-coronavirus-national-emergency","Donald Trump Speech Transcript: Declares Coronavirus National Emergency","30:51"
