"speaker","transcription","url","headlin","timing"
"Donald Trump","This is the country where anyone can make a comeback. We made a comeback with our country. We call it the Great American Comeback. This is the Great American Comeback and you’re doing the same thing. This is a nation where anyone can rise and this is the time when anyone can reach for the American dream, that beautiful American dream. That’s what you’re doing and whenever you have any doubt, whenever the road gets tough and it will, you’ll have those days. I’ve had those days. I mean, I didn’t do anything wrong and they impeached to me a few weeks ago, right? They impeached. I said, “What happened? What did I do?” [Aye Yai Yai 00:08:36] You think that was fun? Mary, you think that’s great to be impeached? The good news, my numbers went through the roof. I mean, you explain this to me. Explain this to me.","https://www.rev.com/blog/transcripts/donald-trump-speech-transcript-at-the-hope-for-prisoners-graduation-ceremony","Donald Trump Speech Transcript at the Hope for Prisoners Graduation Ceremony","43:48"
"Donald Trump","But you’ll have those days, right? You’re going to have those days but you’re Americans and you’re great Americans and Americans meet challenges. You defy expectations. You never give up. You never lose faith in the redeeming power of Almighty God and from this day forward, I’m here. I’m the president. I don’t have to do this. I could be someplace else but I want it to be here and I had plenty of choices.","https://www.rev.com/blog/transcripts/donald-trump-speech-transcript-at-the-hope-for-prisoners-graduation-ceremony","Donald Trump Speech Transcript at the Hope for Prisoners Graduation Ceremony","44:48"
"Donald Trump","One thing, as president, the American tells you, we have plenty of choices, right? We are a lot of choices. I wanted to be here but I ask each of you to seize your unlimited future. If you do, you will make the most of your incredible new found freedom. You’re pioneers in a way because you’re at a point in the country when it’s just all come together. You will unlock your unique talents and skill and aspirations. You’ll join a great project of national renewal and together we will make our country stronger than ever before.","https://www.rev.com/blog/transcripts/donald-trump-speech-transcript-at-the-hope-for-prisoners-graduation-ceremony","Donald Trump Speech Transcript at the Hope for Prisoners Graduation Ceremony","45:15"
"Donald Trump","Thank you very much for being here. God bless you and God bless America.","https://www.rev.com/blog/transcripts/donald-trump-speech-transcript-at-the-hope-for-prisoners-graduation-ceremony","Donald Trump Speech Transcript at the Hope for Prisoners Graduation Ceremony","45:52"
"Donald Trump","Thank you. Thank you.","https://www.rev.com/blog/transcripts/donald-trump-speech-transcript-at-the-hope-for-prisoners-graduation-ceremony","Donald Trump Speech Transcript at the Hope for Prisoners Graduation Ceremony","45:55"
"Speaker 3","I’m going to ask the graduates to line up as we issue the certificates.","https://www.rev.com/blog/transcripts/donald-trump-speech-transcript-at-the-hope-for-prisoners-graduation-ceremony","Donald Trump Speech Transcript at the Hope for Prisoners Graduation Ceremony","45:56"
"Speaker 3","Gary White, [Maceo Bells 00:47:41], Demarcus Webb, Richard [Fella 00:11: 57], Amanda [Stankowitz 00:48:06], [Gerard 00:48:15] Robinson, Nathan Rab, Troy Price, Frank Provato, Kira Pozzo, Robert Petrosino, Herman [Pacheco 00:13:07], [Sidney 00:49:14] Morris, Casey Mix, Heath McCurdy, [Payhon Macask 00:49:39], [Keandre 00:50:07] Houston, [Delirious 00:50:13] Hernandez, [Lay 00:50:20] Harris, Michael Hargraves, Aaron Harriston, [Osi 00:50:47] Gwen, Saul Guevara, Jared Gibson, Glenn Fennel, Sarah Campbell, Willie [Bro 00:00:51:31], Rory Allen.","https://www.rev.com/blog/transcripts/donald-trump-speech-transcript-at-the-hope-for-prisoners-graduation-ceremony","Donald Trump Speech Transcript at the Hope for Prisoners Graduation Ceremony","47:47"
"Speaker 3","Ladies and gentlemen, as I present to you the February special graduating Class of 2020 and Mr. President, we just want to thank you several so very, very much. It is an honor for us to have you in this building. Thank you so very much.","https://www.rev.com/blog/transcripts/donald-trump-speech-transcript-at-the-hope-for-prisoners-graduation-ceremony","Donald Trump Speech Transcript at the Hope for Prisoners Graduation Ceremony","52:26"
