"speaker","transcription","url","headlin","timing"
"Donald Trump","And remember, they say we don’t have it, we do have it. They understand that, they just don’t want to say it. We have a ban, you know that. We have a ban on people coming into our country illegally, we have a ban on countries, because we want people to come into our country who love our country, who can love our country, who respect our country, and who are going to come in on merit, merit, merit, which is the exact opposite of what was happening. Many of them hated our country and they didn’t come in on merit. All they do is complain. Do you know anybody like that? They just complain. Does anybody know anybody like that? Do you know anybody? One of your colleagues? You call her a colleague? All she does is complain. I won’t mention the name, because you’ll never guess, complains, complains, complains. I don’t like that. I don’t like it. All she does is complain, “Not good enough!” Oh really? Tell us about it.","https://www.rev.com/blog/transcripts/donald-trump-speech-transcript-minnesota-august-17","Donald Trump Speech Transcript Minnesota August 17","45:09"
"Donald Trump","To protect our security, my administration instituted a travel ban on the world’s most dangerous regions. Biden has pledged to immediately end this travel ban and allow unlimited migration from terror zones, including Syria, Somalia, Libya, Iran, and Yemen. Trouble, trouble. I also kept the promise I made to Minnesota four years ago. I signed an executive order requiring state and local consent before any refugees are admitted. Biden would immediately shred that executive order, overriding local communities like yours, you know that. Did you know I signed that? You have to give approval now. Little different than the old days, isn’t it, huh? A little bit different. The old days was a lot different, and I signed that approval. They have to go through a process now, and you have to approve it. Why should we send everybody up to Minnesota or any place else?","https://www.rev.com/blog/transcripts/donald-trump-speech-transcript-minnesota-august-17","Donald Trump Speech Transcript Minnesota August 17","46:07"
"Donald Trump","In recent weeks, Democrat-controlled cities have shown the Democrats’ plan and what they plan for America. In Minneapolis, 700 buildings were burned, damaged, or destroyed, costing more than $1 billion. I just left, incredible people. We were on a runway like this, and I introduced them. Their businesses were burned down, gone, and they don’t know what they’re going to do, but we’re going to try helping them to get them rebuilt. But five groups of people that were just incredible people, successful, wonderful people, their stores and businesses were burned down, destroyed. Dozens of business owners have announced they are considering moving hundreds of jobs out of Democrat run Minneapolis, you know that. You know that. Criminals are terrorizing civilians in-","https://www.rev.com/blog/transcripts/donald-trump-speech-transcript-minnesota-august-17","Donald Trump Speech Transcript Minnesota August 17","47:12"
"Donald Trump","You know that, criminals are terrorizing civilians in Chicago, Portland, and now New York City. This radical left Mayor de Blasio has let our beautiful diamond, I loved it, I left it four years ago. I could see there were the seeds of problems. He was there, but I left and it was wonderful. Four years ago I left it, and over the last year, especially over the last six months, crime has gone up hundreds of percentage points, hundreds. 273 points, 368 points. Numbers that you wouldn’t believe. And we’re talking about shootings, murders, you saw what happened this weekend. You saw that, Jason. Terrible. My city, I love that city, but it has great potential and we’re going to do something. We’re going to do something strong. They just let it go to hell and I don’t know is it because they’re bad people or they have no common sense, or they just don’t know what they’re doing? But our beautiful diamond, of this country, has been let go to hell.","https://www.rev.com/blog/transcripts/donald-trump-speech-transcript-minnesota-august-17","Donald Trump Speech Transcript Minnesota August 17","48:03"
"Donald Trump","Top Democrats have demanded the defunding of police departments. Biden even referred to the police at the enemy. And that’s what it is. He’s not going to control… look, he’s not going to control the situation. He’s dealing with… how about the congress woman that I watched over weekend, right? Saying, “I have total control over Biden. He’ll do anything I say. I have total control.” What she’s saying is, “I have total control over this jerk. He’ll do whatever the hell I want.” That’s putting it in more common language. But she said just as mean as that.","https://www.rev.com/blog/transcripts/donald-trump-speech-transcript-minnesota-august-17","Donald Trump Speech Transcript Minnesota August 17","49:06"
"Donald Trump","You know who I’m talking about, right? You saw that? What a horrible statement to make and frankly Kamala, nobody treated Joe Biden worse than Kamala. I mean, nobody. He was called a racist and just about everything else under the book. Then all of a sudden she saying, “He’s such a fine man.” Look nobody treated him, including Pocahontas, nobody on the debate stage, nobody treated Joe Biden worse than Kamala Harris and she’s got some big issues.","https://www.rev.com/blog/transcripts/donald-trump-speech-transcript-minnesota-august-17","Donald Trump Speech Transcript Minnesota August 17","49:42"
"Donald Trump","Congress woman Ilhan Omar-","https://www.rev.com/blog/transcripts/donald-trump-speech-transcript-minnesota-august-17","Donald Trump Speech Transcript Minnesota August 17","50:15"
"Speaker 2","No.","https://www.rev.com/blog/transcripts/donald-trump-speech-transcript-minnesota-august-17","Donald Trump Speech Transcript Minnesota August 17","50:21"
"Donald Trump","I mean I hear the boo’s. How the hell did she win the primary? How did she win the… [Lacey 00:50:26], what the hell happened Lacey?","https://www.rev.com/blog/transcripts/donald-trump-speech-transcript-minnesota-august-17","Donald Trump Speech Transcript Minnesota August 17","50:21"
"Speaker 3","[inaudible 00:50:28]-","https://www.rev.com/blog/transcripts/donald-trump-speech-transcript-minnesota-august-17","Donald Trump Speech Transcript Minnesota August 17","50:28"
"Donald Trump","Huh? It’s Jason’s fault. How the hell did she win? This woman is crazy. She’s a horrible woman who hates our country. Yeah, mail in vote, you might be right. We’ll have to check it. Let’s check the mail in vote. No, seriously how does a woman who hates our country, who says nothing but bad things about our country and Israel and other of our allies, how does this woman win? Where are the people that would vote for her? Omar called the Minneapolis police the cancer and said they were rotten to the root, but Joe Biden did not condemn the comments. He didn’t want to talk about it. He didn’t disavow her endorsement. He displays it proudly on his website. This is what’s going to be running the country.","https://www.rev.com/blog/transcripts/donald-trump-speech-transcript-minnesota-august-17","Donald Trump Speech Transcript Minnesota August 17","50:29"
"Donald Trump","This is the biggest change between what happened between now and Crooked Hillary. Crooked Hillary was bad news, right? Remember she said, “Will you accept the results of the election? Will you accept the results of this election?” And I sort of said, “Yeah, maybe.” But she didn’t accept them, right? I remember that question. That was probably the toughest question I had out of all of them. But she hasn’t been exactly a gracious loser. She’s a loser, but not a gracious one.","https://www.rev.com/blog/transcripts/donald-trump-speech-transcript-minnesota-august-17","Donald Trump Speech Transcript Minnesota August 17","51:18"
"Donald Trump","If Joe Biden and the radical Dems take power, they will pass legislation gutting every single police department in America. That’s going to happen. The Biden Bernie manifesto calls for appointing far left prosecutors, judges, and justices of the United States Supreme Court.","https://www.rev.com/blog/transcripts/donald-trump-speech-transcript-minnesota-august-17","Donald Trump Speech Transcript Minnesota August 17","51:54"
"Donald Trump","Look, we have a big thing with the court. The next president has a chance to do three, four, could even be five. You will change this country around. It will be irreversible. It will be irreversible and they’ll coddle criminals and punish law abiding citizens, these judges will. They’ll take away your guns while letting criminal gangs like MS-13 roam free. Your Second Amendment will… look it was under siege, but not really, because they had never… right fellows? They played the game with… they had no chance. When I’m here, they have no chance. Your Second Amendment is cherished. You need your Second Amendment. They will either take it away, or obliterate it into meaningless nothing.","https://www.rev.com/blog/transcripts/donald-trump-speech-transcript-minnesota-august-17","Donald Trump Speech Transcript Minnesota August 17","52:21"
"Donald Trump","In Joe Biden’s America, the protections of American citizenship will be stripped away and your community will be left at the mercy of the mob. I mean I’m saying these things, but I mean them. When I look at what happened in Minneapolis, when you look at what’s going on in different cities that are just unbelievable cities. Remember this though, most of the country is very safe. In fact, crime stats, outside of Chicago, New York, a couple of the crime stats are a record low. Our country’s… even during the pandemic we’re doing well, but where they’re run by the Liberal Democrats, we’re not doing well. And we have to get in. They have to ask us. We had to be asked here. They have to ask us unless we take a very severe action which ideally you don’t want to take. But every time we go in, we solve the problem and we solve it very quickly.","https://www.rev.com/blog/transcripts/donald-trump-speech-transcript-minnesota-august-17","Donald Trump Speech Transcript Minnesota August 17","53:11"
"Donald Trump","Seattle, look at what’s going on with Seattle. I mean this is a city. This is a real city and they took over a large portion of that city and they knew we were going in the following day. They knew it. So they sent their police in and it was like nobody ever gave up so easily as those characters. But they’re radical left anarchists. Whether you’re registered as a Democrat, Independent, or Republican, I’m asking for the vote of every American who believes that police officers are not enemies, but heroes who keep us safe.","https://www.rev.com/blog/transcripts/donald-trump-speech-transcript-minnesota-august-17","Donald Trump Speech Transcript Minnesota August 17","54:08"
"Donald Trump","I also want to send our special thanks to the members of the Minnesota National Guard who did such an incredible job stopping the rioting, violence, mayhem in Minneapolis. They were great. They were great. I love them. I love that. It’s just a beautiful thing. It’s the way it’s supposed to work. They cause problems, you have to do it. And the sooner you do it the easier it is to do.","https://www.rev.com/blog/transcripts/donald-trump-speech-transcript-minnesota-august-17","Donald Trump Speech Transcript Minnesota August 17","54:42"
"Donald Trump","My administration had made clear to every mayor and governor in the country that the federal government is ready to send the National Guard and federal reinforcements. We will wipe out the problem within minutes. You saw it happening right here. You wouldn’t have a city if we didn’t demand that that take place. You wouldn’t have a city.","https://www.rev.com/blog/transcripts/donald-trump-speech-transcript-minnesota-august-17","Donald Trump Speech Transcript Minnesota August 17","55:15"
"Donald Trump","All you have to do is say the word. Every voter should ask themselves a simple question, do you want the radical left policies of Chicago, Minneapolis, San Francisco imposed on the entire country? Look at Nancy Pelosi. San Francisco’s going to hell and she’s in Congress saying what we should be doing. Look at the homeless problem in San Francisco. Look at what’s happening in San Francisco and then she’s telling us about the post office. She has no clue and I must tell you this, does she love our country? Does she love our country? I don’t think so, to be honest with you. What she’s done is a disgrace to our country. What she’s done, and Schumer Crying Chuck. Crying Chuck. He cries whenever its important to cry. You want the failed policies of Mayor Bill de Blasio? Or Mayor Lori Lightfoot in Chicago?","https://www.rev.com/blog/transcripts/donald-trump-speech-transcript-minnesota-august-17","Donald Trump Speech Transcript Minnesota August 17","55:38"
"Speaker 2","No.","https://www.rev.com/blog/transcripts/donald-trump-speech-transcript-minnesota-august-17","Donald Trump Speech Transcript Minnesota August 17","56:32"
"Donald Trump","Or mayor Jacob Frey?","https://www.rev.com/blog/transcripts/donald-trump-speech-transcript-minnesota-august-17","Donald Trump Speech Transcript Minnesota August 17","56:33"
"Speaker 2","No.","https://www.rev.com/blog/transcripts/donald-trump-speech-transcript-minnesota-august-17","Donald Trump Speech Transcript Minnesota August 17","56:35"
"Donald Trump","Brought to every city and town in this nation? If left wing Democrats can’t run a city, why on earth would you let them run your country? We have such incredibly run cities. Such incredibly run cities. The problems with have are the radical left and now she wants one trillion dollars and she’s holding it up using a phony excuse of the post office because she wants a trillion dollars to go… and you guys all know this, she wants one trillion dollars to go to these badly run democrat cities and states. That’s what she wants and she’s using the post office. We want to fix the post office and make it better. Should have been fixed 30 years ago.","https://www.rev.com/blog/transcripts/donald-trump-speech-transcript-minnesota-august-17","Donald Trump Speech Transcript Minnesota August 17","56:37"
"Donald Trump","Over the next four years, we’re going to implement an aggressive strategy to fight violent crime. It’s already been implemented and we’ll expand the surge of federal law enforcement into crime plagued cities and we can do that at will. We just have to hear from your governor. Just call up, let us know, we’ll be there. We are ready, willing, and able.","https://www.rev.com/blog/transcripts/donald-trump-speech-transcript-minnesota-august-17","Donald Trump Speech Transcript Minnesota August 17","57:19"
"Donald Trump","… American child is safe on our streets. In which every American family is secure in their homes, and in which all of the American people are confident in our destiny. But to achieve this vision, we must finish the job and drain the Washington swamp once and for all. And get Jason in there please, Jason Lewis, get him in. Jason, you got to win. Get Jason Lewis. Jason Lewis. Got to win Jason. You’re certainly against a weak opponent. You got to win.","https://www.rev.com/blog/transcripts/donald-trump-speech-transcript-minnesota-august-17","Donald Trump Speech Transcript Minnesota August 17","57:42"
"Donald Trump","For years left wing politicians like Joe Biden talked about supporting American workers. Then they got elected and gave away your jobs, shipped away your factories, and they sold off your dreams, your beautiful, beautiful American dreams. They sold them off to the highest bidder. But under this administration, those days are over. Now you have a president who is fighting for you.","https://www.rev.com/blog/transcripts/donald-trump-speech-transcript-minnesota-august-17","Donald Trump Speech Transcript Minnesota August 17","58:20"
"Donald Trump","Over the next four years, we will fully restore America’s manufacturing independence. We will again rebuild the greatest economy in history. It’s happening very fast. You’re going to see it very soon. I’d lift it to even more incredible heights than what we had last year. You had the greatest year in the history of your state last year. We will revitalize police departments and reclaim our cities for law abiding Americans. We will protect religious liberty, defend the lives of our beautiful unborn children, appoint conservative judges, uphold free speech on college campuses, and safeguard the Second Amendment. The right to keep and bear arms.","https://www.rev.com/blog/transcripts/donald-trump-speech-transcript-minnesota-august-17","Donald Trump Speech Transcript Minnesota August 17","58:49"
"Donald Trump","We will ensure American dominance in space and in military and pave the way to becoming the first nation to plant its flag on Mars. We’re working on that, we’re doing very well. By the way when I took over NASA, it was dead. It was gone, right? It was gone. There was nothing. There was grass growing on the runways… grass, through the crevices on the runway. It was terrible and now it’s the most vital space program anywhere in the world. Not only the jobs, but the importance of it and the psychology of it, and by the way, for military defense. And we created Space Force. Think of that, we created another one of many, many things. First time in 78 years. Last one was the Air Force, right? Space Force, that’s a big deal. By itself. If a president did that, they would have achieved something. We did that and we did hundreds of other things.","https://www.rev.com/blog/transcripts/donald-trump-speech-transcript-minnesota-august-17","Donald Trump Speech Transcript Minnesota August 17","59:40"
"Donald Trump","We will teach our children to love our country, to honor our history, and to respect our great American flag. We will never waiver in defense of our families, our values, our faith, our jobs, our borders, our rights, or our freedoms. Together we will unite citizens of every race, color, religion, and creed as one people, one family, and one glorious nation under God.","https://www.rev.com/blog/transcripts/donald-trump-speech-transcript-minnesota-august-17","Donald Trump Speech Transcript Minnesota August 17","01:00:34"
"Donald Trump","I want to thank you, you are incredible people, Minnesota. Thank you very much. I’ll be back. November 3rd, we have to win. God bless you, God bless the great state of Minnesota and God bless America. Thank you all very much.","https://www.rev.com/blog/transcripts/donald-trump-speech-transcript-minnesota-august-17","Donald Trump Speech Transcript Minnesota August 17","01:01:07"
