"speaker","transcription","url","headlin","timing"
"Robert Wilkie","I’ve thanked Mrs. Pence. I want to thank two other people. First is our executive director, Barbara Van Dahlen, who took this burden on herself, but took it joyfully, and is not only opening the aperture when it comes to a discussion of this last tragic act in a veteran’s life, but also opening the aperture on a discussion, finally having a discussion on mental health and addiction. So Barbara, I thank you very much for what you do. And last but not least, I want to thank our Deputy Secretary Colonel, Pamela Powers, who took this on when she was Chief of Staff and has carried it across the finish line. I thank you very much, ma’am.","https://www.rev.com/blog/transcripts/donald-trump-speech-transcript-announcing-task-force-on-veteran-suicide-prevention","Donald Trump Speech Transcript Announcing Task Force on Veteran Suicide Prevention","24:04"
"Robert Wilkie","Mr. President, I’ll go back to that history in the 1890s, of one of your predecessors whose portrait hangs in the Green Room, was alarmed at the reports he was receiving from the frontier army of countless deaths amongst officers and men on the far outposts of the American West. He was the first president to begin taking a look at those sad numbers, and it has taken these 130 plus years for another president to finally say, “Enough is enough.” On any given day, 20 American warriors take their own lives. Those are active duty, Guardsman, Reservist. The largest part of that number is from my father’s generation in Vietnam, but another reason why this task force is so important is that it will point the way from the rest of the country.","https://www.rev.com/blog/transcripts/donald-trump-speech-transcript-announcing-task-force-on-veteran-suicide-prevention","Donald Trump Speech Transcript Announcing Task Force on Veteran Suicide Prevention","24:52"
"Robert Wilkie","Growing up as a youngster at Fort Bragg, the leading cause of death amongst my classmates in junior high and high school was automobile accidents. Today, it is suicide. It is a scourge that is impacting every, every segment of this country. So I want to thank the president for having the vision to identify the real solution to this national problem, and that is us. Each one of us. Each one of us can help end the stigma that has prevented America from taking on the important issue of mental health. Each one of us can work to change the culture that made it acceptable to ignore the signs of mental health and distress. Each one of us can learn to identify the signs amongst our friends, our neighbors, and our coworkers. So this day is the beginning of one of the most important national discussions America has seen. It is an effort to find a solution to a problem that does not discriminate amongst its victims: The poor, the rich, people of all races and creeds.","https://www.rev.com/blog/transcripts/donald-trump-speech-transcript-announcing-task-force-on-veteran-suicide-prevention","Donald Trump Speech Transcript Announcing Task Force on Veteran Suicide Prevention","25:49"
"Robert Wilkie","So I’m going to end with a story that I’ve told before, and it was one that I was very familiar with growing up at Fort Bragg. The looming presence in the home of the airborne was Matthew Ridgway. In fact, he was so powerful that even the minor league baseball team’s mascot is named after him in Fayetteville. General Ridgway commanded the All American Division to victory in North Africa and Sicily, and then General Eisenhower tasked him with leading the airborne assault on Hitler’s fortress, Europe on the night of D-Day. General Ridgway planned the operations for the All Americans, the Screaming Eagles and the Red Devils of the British 1st Airborne. But on the night of the invasion, he couldn’t sleep. He fell out of his cot, and he reached for sustenance in the Old Testament, and he looked to the Book of Joshua, and God’s promise to Joshua on the eve of the great battle of Jericho. And the Lord promised the General, “I will not fail nor forsake thee.”","https://www.rev.com/blog/transcripts/donald-trump-speech-transcript-announcing-task-force-on-veteran-suicide-prevention","Donald Trump Speech Transcript Announcing Task Force on Veteran Suicide Prevention","27:10"
"Robert Wilkie","Mr. President, that is what you have sent to the American people today, and to the 20 million Americans who are in uniform and who have left uniform, that we will not fail nor forsake the people of the United States who have always carried, without question, our freedom on their shoulders. So Mr. President, I thank you very, very much.","https://www.rev.com/blog/transcripts/donald-trump-speech-transcript-announcing-task-force-on-veteran-suicide-prevention","Donald Trump Speech Transcript Announcing Task Force on Veteran Suicide Prevention","28:12"
"Donald Trump","Great job you’re doing. So Karen Pence has stated beautifully just a little while ago that the two words, anxiety and stress, and all I can say, Mike, is thank goodness we don’t have any anxiety or stress in this job, with these people back there. But I will tell you, we’re working very hard on this problem, and I think we’ve made a tremendous amount of progress. I even noticed your number, 20. 20 is different than 24. You know what that means. Each day. Hard to believe. Each day, but 20 is a big difference, and we’re getting it way down, and with some of the treatments that we’re talking about, I think it’ll go a lot lower than that.","https://www.rev.com/blog/transcripts/donald-trump-speech-transcript-announcing-task-force-on-veteran-suicide-prevention","Donald Trump Speech Transcript Announcing Task Force on Veteran Suicide Prevention","28:45"
"Donald Trump","And Barbara, I want to thank you very much. I want to thank Chad. I want to thank you very much. That was a beautiful, beautiful statement. You’ve done such a fantastic job. I see General Kellogg. He’s one of our great generals. He’s done a fantastic job for me, and he’s doing some very important things for me right now. So General, thank you very much. Really fantastic job. And we will have another meeting soon, and that meeting will be a meeting of progress, because I know with Karen in charge and with the Surgeon General working along with Karen, and the group that you have, I know every one of them, you’re going to make big, big progress, very, very fast. So thank you very much. Thank you, Karen. Thank you very much, Mike. Thank you.","https://www.rev.com/blog/transcripts/donald-trump-speech-transcript-announcing-task-force-on-veteran-suicide-prevention","Donald Trump Speech Transcript Announcing Task Force on Veteran Suicide Prevention","29:26"
