"speaker","transcription","url","headlin","timing"
"Donald Trump","We’re doing very well in our negotiations with Afghanistan with getting out. We’re down to a much smaller number of people left there and I greet men and women coming home and coming home after they’ve been hit. I’ve also greeted many, many at Dover, greeted many bodies coming back in and we’ve been there 19 years and we’re basically policemen. We’re acting as police as opposed to soldiers and they’re going to have to police their own states and they’ve been doing that for thousands of years. But it’s time after 19 years that our soldiers come home. They’ve done an incredible job, but they’re not allowed to fight to win and maybe they shouldn’t be because a lot of the people, it’s not their fault. But with the Taliban and with going to Iraq again, we’re down in Afghanistan, very low numbers and that’ll be taking place and I let them know, do anything and you’ll be hit like you’ve never been hit before. We’re doing very well. Syria the same thing. Remember when I took all of the soldiers off of the border between Syria and Turkey, right? And everybody said, “Oh, that was two years ago. That was a long time ago.” They said, “Oh, this is terrible, terrible, terrible.” We’re going to leave. Why do we have our soldiers between Syria and Turkey? Turkey can definitely take care of itself. I have a very good relationship with President Erdogan and Syria’s been fighting forever. And I say, “Why are we guarding their border?” And I brought our soldiers back home. I got them out, and guess what? Nothing’s happened. They’ve been fighting like they have been for a thousand years okay? Nothing’s happened. And nobody mentions that. Everybody said, “This is going to be a disaster.” There’s no disaster, nothing’s happened.","https://www.rev.com/blog/transcripts/donald-trump-press-conference-transcript-august-19","Donald Trump August 19 White House Press Conference Transcript","21:22"
"Donald Trump","We’re getting out of the endless wars and we are building a military the likes of which the world has never seen. Two and a half trillion dollars we’ve spent. And we hopefully don’t ever have to use it. But we want to focus on a much bigger picture, because we have a much bigger picture. It’s when you look at what China’s doing, when you look at what Russia’s doing, when you look at what some other countries are doing. We want to be ready just in case there is a catastrophe. We don’t want to see that. We don’t want to ever use it. We’ve rebuilt our military. New missiles, new rockets, and new tanks, and new everything. Two and a half trillion… all made in the USA and we’ve upgraded in-","https://www.rev.com/blog/transcripts/donald-trump-press-conference-transcript-august-19","Donald Trump August 19 White House Press Conference Transcript","23:18"
"Donald Trump","Made in the USA and we’ve upgraded incredibly our nuclear capability and some of our nuclear needed nourishment, it needed new strength, and we’ve upgraded it very, very significantly. I mean to a level that nobody would even believe and hopefully we don’t, you pray to God, we never have to use it, okay? But we’ve never been in a position where we’ve been this strong, please.","https://www.rev.com/blog/transcripts/donald-trump-press-conference-transcript-august-19","Donald Trump August 19 White House Press Conference Transcript","24:03"
"Speaker 5","Mr. President, thank you so much. I wanted to ask you about the Middle East. I have a couple of questions. You mentioned that other countries are interested in following suit.","https://www.rev.com/blog/transcripts/donald-trump-press-conference-transcript-august-19","Donald Trump August 19 White House Press Conference Transcript","24:31"
"Donald Trump","Yes. Having to do with UAE and Israel.","https://www.rev.com/blog/transcripts/donald-trump-press-conference-transcript-august-19","Donald Trump August 19 White House Press Conference Transcript","24:36"
"Speaker 5","Exactly. So, do you expect that Saudi Arabia will join and-","https://www.rev.com/blog/transcripts/donald-trump-press-conference-transcript-august-19","Donald Trump August 19 White House Press Conference Transcript","24:39"
"Donald Trump","I do.","https://www.rev.com/blog/transcripts/donald-trump-press-conference-transcript-august-19","Donald Trump August 19 White House Press Conference Transcript","24:44"
"Speaker 5","Yes. And also the Emeratis have expressed interest in the F35. Do you think that that should be something that they could look forward to in the future? Is there some sort of timeline?","https://www.rev.com/blog/transcripts/donald-trump-press-conference-transcript-august-19","Donald Trump August 19 White House Press Conference Transcript","24:45"
"Donald Trump","I think, look, they’ve definitely got the money to pay for it. It’s nice because usually what we, a lot of times we make deals they don’t have 25 cents, these countries we deal with. We give it to them like, “How about paying us back later?” But they never pay because they don’t have the money. Now they have the money and they would like to order quite a few F35s. It’s the greatest fighter jet in the world, as you know, by stealth, totally stealth. You can’t see. It makes it very difficult. I was asking a pilot, “What do you think is better? This one, this one, that one,” talking about Russian planes, Chinese planes.","https://www.rev.com/blog/transcripts/donald-trump-press-conference-transcript-august-19","Donald Trump August 19 White House Press Conference Transcript","24:57"
"Donald Trump","He said, “Well, the advantage we have is you can’t see it, so when we’re fighting, they can’t see us.” I say, “That sounds like a really big advantage to me,” to these guys.","https://www.rev.com/blog/transcripts/donald-trump-press-conference-transcript-august-19","Donald Trump August 19 White House Press Conference Transcript","25:31"
"Donald Trump","You know, they look, by the way, I said to these pilots that I meet, they look better than Tom Cruise, and they’re definitely tougher. He’s a nice guy, but these people are amazing and I speak to him a lot about it. What do you think, as I go around to the various places, I saved the big one in Florida as an example. That was a big one, knocked down pretty much by the hurricane. So, I spent a lot of time on that. And it’s the greatest plane in the world.","https://www.rev.com/blog/transcripts/donald-trump-press-conference-transcript-august-19","Donald Trump August 19 White House Press Conference Transcript","25:43"
"Donald Trump","One thing about that kind of thing, technology, high technology, greatest plane doesn’t last long if somebody comes up with something else, but we’re always the one to come up with something else. So yeah, they’d like to buy F35s, we’ll see what happens. It’s under review, but they made a great advance in peace in the Middle East, even the New York Times thought it was an incredible deal. Can you imagine that. Tom Friedman had a very nice thing to say about it. I spoke to him about it. He thought it was terrific and it is terrific.","https://www.rev.com/blog/transcripts/donald-trump-press-conference-transcript-august-19","Donald Trump August 19 White House Press Conference Transcript","26:15"
"Donald Trump","I see a lot of countries coming in fairly quickly and when you have them all in, ultimately Iran will come in too, there’ll be peace in the Middle East. That’ll be a nice. Iran will be very much neutralized. They never thought this could have happened. With the horrendously stupid Iran deal signed by Obama, this could have never happened.","https://www.rev.com/blog/transcripts/donald-trump-press-conference-transcript-august-19","Donald Trump August 19 White House Press Conference Transcript","26:46"
"Speaker 6","On the Goodyear issue, you ride on Goodyear tires in the presidential limousine.","https://www.rev.com/blog/transcripts/donald-trump-press-conference-transcript-august-19","Donald Trump August 19 White House Press Conference Transcript","27:15"
"Donald Trump","Yep. You’re right.","https://www.rev.com/blog/transcripts/donald-trump-press-conference-transcript-august-19","Donald Trump August 19 White House Press Conference Transcript","27:19"
"Speaker 6","If there were an alternative, would you want those tires swapped out?","https://www.rev.com/blog/transcripts/donald-trump-press-conference-transcript-august-19","Donald Trump August 19 White House Press Conference Transcript","27:20"
"Donald Trump","Yeah, I would do that. I would swap them out based on what I heard. We’ll see what happens. Look, you’re going to have a lot of people not wanting to buy that product anymore and they’ll buy from a competitor made in the USA too, okay? Please.","https://www.rev.com/blog/transcripts/donald-trump-press-conference-transcript-august-19","Donald Trump August 19 White House Press Conference Transcript","27:23"
"Speaker 4","Mr. President, excerpts from Obama’s speech that he’ll give later at the Democratic Convention show that he says that he hoped that you would take the being president more seriously once you had the job and discover reverence for democracy. And then he said, I quote, “But he never did.” What is your reaction to that?","https://www.rev.com/blog/transcripts/donald-trump-press-conference-transcript-august-19","Donald Trump August 19 White House Press Conference Transcript","27:37"
"Donald Trump","When I listened to that, and then I see the horror that he’s left us, the stupidity of the transactions that he made, look what we’re doing. We have our great border wall, we have security, we have the UAE deal, which has been universally praised. Praised by people that aren’t exactly fans of Donald Trump for various reasons. I don’t know why, can’t be my personality, but they’re not fans. When I look at what we have. Now, look at how bad he was, how ineffective a president he was. He was so ineffective, so terrible, slowest growing recovery in the history, I guess since 1929, on the economy. Don’t forget until the China virus came in, we had the greatest economy in the history of the world, and now we’re doing it again. I’m going to have to do it a second time, we’re doing it again. Hard to believe we’re doing very well. You heard the numbers they’re way, way down on the virus. But when you look at the kind of numbers that we’re producing on the stock markets, we’re almost at the level, in fact, NASDAQ and S&P are higher than they were at the highest point prior to the China virus coming and the plague coming in.","https://www.rev.com/blog/transcripts/donald-trump-press-conference-transcript-august-19","Donald Trump August 19 White House Press Conference Transcript","27:55"
"Donald Trump","Now, president Obama did not do a good job and the reason I’m here is because of President Obama and Joe Biden, because if they did a good job, I wouldn’t be here and probably if they did a good job, I wouldn’t have even run. I would have been very happy. I enjoyed my previous life very much, but they did such a bad job that I stand before you as president. Thank you all very much.","https://www.rev.com/blog/transcripts/donald-trump-press-conference-transcript-august-19","Donald Trump August 19 White House Press Conference Transcript","29:14"
