"speaker","transcription","url","headlin","timing"
"Donald Trump","Let me provide a brief update on the China virus as well as our economic recovery, which is going really, very well as you probably have been hearing. Nearly 85% of jurisdictions all across our country are reporting a very steep decline in cases. And that’s despite the fact that we have the #1 testing program anywhere in the world. We’re up to almost 70 million tests, far beyond any other country. This week, cases nationwide have declined by 6%. The test positivity rate has fallen to just 6.5%, a 71% reduction from April and a 15% reduction from mid-July. That’s a big reduction. The hospitalization rate for the virus has been reduced by half since April. And I urge everyone to apply common sense mitigation. We know that and we are all doing that, and I want to thank the American people for rally doing such a great job. The United States has now administered over 70 million tests, more than all of the European Union combined. If you combine all of Europe, it’s less than what we do. Millions of point-of-care tests are processed in less than 24 hours and many in under 15 minutes. Nearly 80% of all commercial lab test results are now returned within 3 days, so we’ve gotten that number down from about 8 days to 3 days. And that’s only in the longer term lab cases. But we have many 15 minute tests, we have some 5 minute tests. The turnaround time for federal surge testing sites is just 2 days. So when you send them out, despite the fact that you have a delivery time, which you can’t do anything about, it’s all the way down to 2 days, that’s a very substantial reduction. A great job by the people that do it. We are focused on aggressively shielding the highest risk individuals, those living in nursing homes and long term care facilities, are less than 1% of the US population but account for nearly half of all fatalities. That’s an incredible thing. That’s why we have rush nursing home funding, protective gear, rapid testing equipment and we will announce additional measures to protect nursing home residents in the coming days. We’ve worked very hard with nursing home companies and also with the governors, 50 governors all around the United States and we have developed a very good relationship with most of the governors and I think for the most part they’re doing a really good job. They’re focused very heavily on nursing homes and when they need equipment that they can’t get, remember they’re supposed to get it but when they can’t get it we have tremendous amounts of equipment in stock. Thanks to my administration’s decisive action to save American jobs we are currently witnessing the fastest economic recovery in American history and that’s because the foundation that we set previously before the virus came and hit our shore, the foundation was so strong. We had such a strong foundation that we are recovering much faster than anybody anticipated. It turns out that it will be a very, very strong V and you’ll see that in just a second.","https://www.rev.com/blog/transcripts/donald-trump-august-15-press-conference-transcript-in-nj-talks-mark-esper-postmaster-general-dejoy-and-snowden","Donald Trump August 15 Press Conference Transcript in NJ: Talks Mark Esper, Postmaster General DeJoy, and Snowden","00:00"
"Donald Trump","So retail spending has fully recovered and is now at an all-time high. That’s not all-time for this month or last month, that’s at an all-time high and you see that with the chart. This was previous to the plague I call it, the plague coming into our land and really affected 188 … We’re dealing with 188 countries, and if you see, we’ve not only recovered but we’re at a much higher level than we were even then, that’s an incredible number that nobody thought would even be possible. So we’re currently witnessing the fastest economic recovery in American history. That’s an amazing statement. So retail spending is great and now if they would put up auto production has surged 28% and that’s your auto production which is right there so you’ll see that that’s now about even to where it was and that was at an all-time record high and we’re already even and if you had a chart for used cars you’d see that used car sales are setting a record and that’s great for production because when the used cars are practically not available, they’re very, very tight, that means you’re going to make a lot of new cars so that number is going to go up even beyond what it is right now but that’s a fantastic number. That’s a number that’s the equivalent of where it was and that was a record.","https://www.rev.com/blog/transcripts/donald-trump-august-15-press-conference-transcript-in-nj-talks-mark-esper-postmaster-general-dejoy-and-snowden","Donald Trump August 15 Press Conference Transcript in NJ: Talks Mark Esper, Postmaster General DeJoy, and Snowden","01:04"
"Donald Trump","So you see what’s happening with respect to the economy and the recovery and the stock market is almost at an all-time high in fact NASDAQ is at an all-time high. It’s at 14 days where we broke the record already over the last two months, so a lot of great things are happening. Through the historic relief package that I signed into law, we saved over 50 million American jobs, 50 million American jobs and the unemployment rate is rapidly going down, you see that, you’ve seen that and I think you’ll see it over the next two months and you’ll have a good report even prior to the election. You’re going to have a very good report. I think you’re going to have an incredible GDP, you’re going to have a tremendous report on business and a lot of it’s going to be released which is very fortunate prior to the election. I think the Democrats are going out of their way to try and do whatever they can to stop these kind of numbers, they don’t like these kind of numbers because they think it’ll hurt them in the election.","https://www.rev.com/blog/transcripts/donald-trump-august-15-press-conference-transcript-in-nj-talks-mark-esper-postmaster-general-dejoy-and-snowden","Donald Trump August 15 Press Conference Transcript in NJ: Talks Mark Esper, Postmaster General DeJoy, and Snowden","02:31"
"Donald Trump","I think we all have to pull together and we have to do the right job and we have to do what’s good for the American people. We were unfairly treated by China because they could have stopped it. With that being said China’s purchased the most amount of corn in history. Last week they purchased the two largest days in the history of corn purchase and a massive amount of soybeans, also cattle, so China’s been buying a lot of things and they are doing that to keep me happy but they’re dreaming about Joe Biden, they would love to have that happen but I don’t think that’s going to happen. They are dreaming about him and so is Iran dreaming about Joe and so are numerous other countries. They dream about it because if that happens they’ll own the United States and China I can tell you specifically will own the United States. We can’t let that happen.","https://www.rev.com/blog/transcripts/donald-trump-august-15-press-conference-transcript-in-nj-talks-mark-esper-postmaster-general-dejoy-and-snowden","Donald Trump August 15 Press Conference Transcript in NJ: Talks Mark Esper, Postmaster General DeJoy, and Snowden","03:31"
"Donald Trump","If you remember China had the worst year they’ve had in 67 years prior to the plague coming to our shores and we are now starting to do really well. We’re going to have a very good third quarter, maybe a great third quarter and we’re going to have an incredible next year unless somebody comes up and quadruples taxes which is what they’re talking about doing and also regulations, we’ve done more in terms of cutting regulations than any administration in history by far, whether it was four years or eight years or in one case more than eight years. We have in less than four years done more regulation cutting by far and we’re doing more as we go. Some of it’s statutory, you can only do it at a certain pace, you have to wait 90 days, you have to wait 120 days before you can take the next step.","https://www.rev.com/blog/transcripts/donald-trump-august-15-press-conference-transcript-in-nj-talks-mark-esper-postmaster-general-dejoy-and-snowden","Donald Trump August 15 Press Conference Transcript in NJ: Talks Mark Esper, Postmaster General DeJoy, and Snowden","04:27"
"Donald Trump","We have tremendous regulation cutting coming. With that being said we’re going to have certain regulations to protect the environment and also safety. Small business optimism has come surging back in June. It was higher than any month under the previous administration, think of that. So small business optimism was higher than any month under the previous administration and that is while we’re going through a pandemic, a worldwide pandemic, you have a number like that and when you see the numbers that we quoted just now as to what’s happening with cases and all of the other hospitalization rates, a lot of tremendous things are happening. Industrial production is increasing at the fastest rate ever recorded. I mean think of these numbers. I mean how does that happen. Industrial production is increasing at the fastest rate on record which is ever recorded. Consumer spending is expected to grow at an astronomical rate this quarter so we don’t have the number yet but it looks like it’s going to be at an astronomical rate.","https://www.rev.com/blog/transcripts/donald-trump-august-15-press-conference-transcript-in-nj-talks-mark-esper-postmaster-general-dejoy-and-snowden","Donald Trump August 15 Press Conference Transcript in NJ: Talks Mark Esper, Postmaster General DeJoy, and Snowden","05:16"
"Donald Trump","I want to say that I want college football to come back. These are strong, healthy, incredible people. These are people that want to play football very badly, a great, great talent, quarterback Trevor Lawrence called me two days ago. I spoke to him a couple of times. They said, “Sir, I want to just tell you we want it back, we want to play,” and he’s an incredible quarterback as you know from an incredible school, Clemson and he’s going to have a very good future in the NFL. He’s got everything, he’s got height, accuracy, a strong arm, and he’s fast. Other than that I guess he’s got some problems, but he’s got the whole package. I watched him last year running. He’s faster than the backs that were guarding. I think he’s going to be great, but he’s just a great young man. I talked to him actually for a long time. They want to play football. He made the statement that he feels he’s safer on the field, he’s safer on the field than he is outside of the field.","https://www.rev.com/blog/transcripts/donald-trump-august-15-press-conference-transcript-in-nj-talks-mark-esper-postmaster-general-dejoy-and-snowden","Donald Trump August 15 Press Conference Transcript in NJ: Talks Mark Esper, Postmaster General DeJoy, and Snowden","06:24"
"Donald Trump","He feels very safe and if you look, the SEC, the Big 12 and the ACC are back. They want to come back and I think they’re coming back. The Big 10, the Pac-12 are not and I wish they would and I just want to say it’s sort of sad because I’ve been fighting for football to come back. We’re trying to help the NFL, as long as they stand for our national anthem, as long as they honor our flag and our country, if they start kneeling I’m not going to be helping them much. Might come back but I won’t be watching. Neither will a lot of other people.","https://www.rev.com/blog/transcripts/donald-trump-august-15-press-conference-transcript-in-nj-talks-mark-esper-postmaster-general-dejoy-and-snowden","Donald Trump August 15 Press Conference Transcript in NJ: Talks Mark Esper, Postmaster General DeJoy, and Snowden","07:27"
"Donald Trump","Much might come back, but I won’t be watching. Neither will a lot of other people. I think what the NBA did was atrocious. I thought it was disgraceful the way they kneeled and their ratings are reflective of that. I think football has to get smart. It’s the NFL. Let’s see what happens, but if they do it, they learned their lesson I thought two years ago when people started not watching and when people really weren’t going to the games so much. A lot of empty seats all of a sudden. So they’re going to learn that lesson again if they don’t wise up. I just want to say so Trevor Lawrence, great. Some of the great people, SEC big 12, ACC. I want to thank them and I want to congratulate them for coming back. I want to also mention that CNN had a story that will they blame Trump for football in the swing states. What a dishonest story that is. Well, they blame me.","https://www.rev.com/blog/transcripts/donald-trump-august-15-press-conference-transcript-in-nj-talks-mark-esper-postmaster-general-dejoy-and-snowden","Donald Trump August 15 Press Conference Transcript in NJ: Talks Mark Esper, Postmaster General DeJoy, and Snowden","08:03"
"Donald Trump","I’m the one that’s pushing them to come back. So they want to try and blame me. So them and I guess the New York Times reported one person. It was one person in the story. One person said maybe it’s Trump’s fault. I’m the one pushing it back. So I’d like to see college football come back. I’d like to see them come back proud and strong. I was very impressed by Trevor. I was very impressed by other people that called me. Players called me, coaches called me, Coach O. You want to coach who’s central casting for a movie if you’re doing a movie, you have to put Coach O as the head because this guy is central casting.","https://www.rev.com/blog/transcripts/donald-trump-august-15-press-conference-transcript-in-nj-talks-mark-esper-postmaster-general-dejoy-and-snowden","Donald Trump August 15 Press Conference Transcript in NJ: Talks Mark Esper, Postmaster General DeJoy, and Snowden","08:55"
"Donald Trump","When you have guys like Nick Saban and others calling for it to come back, they want it to come back. These are great athletes. These are not people that seem to be at all susceptible to this horrible disease and they want to play football and we have great testing. So you’ll be able to test. The New York Times quoted one person, one person, and I’m the one pushing. So we’ll get it straight. I’m the one pushing for football to come back. I think if I wasn’t pushing, you wouldn’t have anything happening. So with that, we’ll take a few questions Steve please.","https://www.rev.com/blog/transcripts/donald-trump-august-15-press-conference-transcript-in-nj-talks-mark-esper-postmaster-general-dejoy-and-snowden","Donald Trump August 15 Press Conference Transcript in NJ: Talks Mark Esper, Postmaster General DeJoy, and Snowden","09:33"
"Steve","The US effort to extend the Iran arms embargo at the UN Security Council fell apart yesterday. When will you trigger a snapback of sanctions on Iran?","https://www.rev.com/blog/transcripts/donald-trump-august-15-press-conference-transcript-in-nj-talks-mark-esper-postmaster-general-dejoy-and-snowden","Donald Trump August 15 Press Conference Transcript in NJ: Talks Mark Esper, Postmaster General DeJoy, and Snowden","10:11"
"Donald Trump","Well we knew what thee vote was going to be, but we’ll be doing a snapback. You’ll be watching it next week. Yeah, you’ll be watching it next week.","https://www.rev.com/blog/transcripts/donald-trump-august-15-press-conference-transcript-in-nj-talks-mark-esper-postmaster-general-dejoy-and-snowden","Donald Trump August 15 Press Conference Transcript in NJ: Talks Mark Esper, Postmaster General DeJoy, and Snowden","10:20"
"Steve","I’d like a follow up. President Putin wants to hold a video summit on this subject. Are you wanting to do that?","https://www.rev.com/blog/transcripts/donald-trump-august-15-press-conference-transcript-in-nj-talks-mark-esper-postmaster-general-dejoy-and-snowden","Donald Trump August 15 Press Conference Transcript in NJ: Talks Mark Esper, Postmaster General DeJoy, and Snowden","10:28"
"Donald Trump","Probably not. No. I think we want to wait until after the election. Look, Iran wants me to lose so badly because if they do, Iran is a whole different ball game right now. They haven’t been sponsoring terror because they don’t have very much money to sponsor terror. They know we just captured four Iranian ships as you know, and we brought them into Houston. They were going to Venezuela. They’re not supposed to be doing that. Iran would love to have me defeated. If I win, which I hope to win, how can you not? When you see numbers like this, both on the virus and on the economy, I mean, we should win. We should all keep this incredible thing going.","https://www.rev.com/blog/transcripts/donald-trump-august-15-press-conference-transcript-in-nj-talks-mark-esper-postmaster-general-dejoy-and-snowden","Donald Trump August 15 Press Conference Transcript in NJ: Talks Mark Esper, Postmaster General DeJoy, and Snowden","10:33"
"Donald Trump","I built it once and I’ll build it again. I think the hardest part is done in terms of the economy and that’s with or without additional funds from Nancy Pelosi. They should have put the things in, whether you call it the Care Act or phase one, phase two, phase three, but they didn’t do that. They put it at the end. Things that they’re asking for that have nothing to do with corona. That have everything to do with radical left politics.","https://www.rev.com/blog/transcripts/donald-trump-august-15-press-conference-transcript-in-nj-talks-mark-esper-postmaster-general-dejoy-and-snowden","Donald Trump August 15 Press Conference Transcript in NJ: Talks Mark Esper, Postmaster General DeJoy, and Snowden","11:14"
"Speaker 1","Mr. President more than 40 states received letters from your postal service saying that those ballots for November 3rd might not make it in time. As president isn’t it your responsibility since this is your postal service to meet this critical need?","https://www.rev.com/blog/transcripts/donald-trump-august-15-press-conference-transcript-in-nj-talks-mark-esper-postmaster-general-dejoy-and-snowden","Donald Trump August 15 Press Conference Transcript in NJ: Talks Mark Esper, Postmaster General DeJoy, and Snowden","11:41"
"Donald Trump","Well we have a man in there for two months. He’s a very talented man. He’s a brilliant business person. He’s done great. He’s a very nice man also. Louis, he is working very hard, but as you know the Democrats aren’t approving the proper funding for postal and they’re not approving the proper funding for this ridiculous thing that they want to do, which is all mail in voting. If universal, you could call it mail in voting. Again, absentee voting is great. You request. I’m an absentee voter because I requested, I got, and then I sent in my vote. So that works out very well. That’s what we’ve had, but now they want to send in millions and millions of ballots and you see what’s happening. They’re being lost. They’re being discarded. They’re finding them in piles. It’s going to be a catastrophe. This is beyond the post office. Louis, DeJoy is working very hard.","https://www.rev.com/blog/transcripts/donald-trump-august-15-press-conference-transcript-in-nj-talks-mark-esper-postmaster-general-dejoy-and-snowden","Donald Trump August 15 Press Conference Transcript in NJ: Talks Mark Esper, Postmaster General DeJoy, and Snowden","11:55"
"Donald Trump","The post office has for decades lost billions and billions of dollars. I read numbers today that are unthinkable. What they want to do now is hit the post office with millions of ballots from certain states. If you look at what happened in New York and Virginia and various other places, it’s a catastrophe. They’re losing 20% of the votes. Nobody knows what’s happened. So we’re going to see what happens. I do say this universal mail in voting is going to be catastrophic. It’s going to make our country a laughingstock all over the world. You can’t send out millions of ballots and look at all of the tests. Look, you’ve seen them. There are many. Just look at New York. Look at New Jersey. Look at the catastrophe in New Jersey and New Jersey had more than just Patterson. Look at what’s going on in Virginia. Look at what’s happening with this mail in voting.","https://www.rev.com/blog/transcripts/donald-trump-august-15-press-conference-transcript-in-nj-talks-mark-esper-postmaster-general-dejoy-and-snowden","Donald Trump August 15 Press Conference Transcript in NJ: Talks Mark Esper, Postmaster General DeJoy, and Snowden","12:48"
"Donald Trump","It’s a disgrace. Absentee is good. Mail in universal is very, very bad. There’s no way they’re going to get it accurately. They’re off by 20 and 30%. This is beyond post office. Now with that being said, they want money for the universal mail in ballots and they’re not getting. Why? Because of them. We want money to go to people. They want money in order to bail out states that have done very poorly. The states that have done poorly, you know them as well as I do. These are run by Democrats, usually radical left Democrats. You take a look at what’s happening in Portland and we’ll go into Portland.","https://www.rev.com/blog/transcripts/donald-trump-august-15-press-conference-transcript-in-nj-talks-mark-esper-postmaster-general-dejoy-and-snowden","Donald Trump August 15 Press Conference Transcript in NJ: Talks Mark Esper, Postmaster General DeJoy, and Snowden","13:40"
"Donald Trump","We have to be asked. We’ll go into Portland, straighten it out in one hour like happened in Minneapolis. We’ll go straighten it out in one hour. We will straighten it out so fast, but they have to ask us. So they need money, but they’re not willing to approve the money that they need. If they can’t get the money that they need for universal mail in voting, I don’t see how they can have it. That’s not only post office. It’s also for the voting itself.","https://www.rev.com/blog/transcripts/donald-trump-august-15-press-conference-transcript-in-nj-talks-mark-esper-postmaster-general-dejoy-and-snowden","Donald Trump August 15 Press Conference Transcript in NJ: Talks Mark Esper, Postmaster General DeJoy, and Snowden","14:20"
"Speaker 1","Follow on that Mr. President. Does postmaster DeJoy have your backing for the actions that he’s taken in the last several months?","https://www.rev.com/blog/transcripts/donald-trump-august-15-press-conference-transcript-in-nj-talks-mark-esper-postmaster-general-dejoy-and-snowden","Donald Trump August 15 Press Conference Transcript in NJ: Talks Mark Esper, Postmaster General DeJoy, and Snowden","14:53"
"Donald Trump","Yeah, he’s a fantastic man. He wants to make the post office great again. Did you ever hear the expression? He wants to make the post office great again. The post office is a catastrophe.","https://www.rev.com/blog/transcripts/donald-trump-august-15-press-conference-transcript-in-nj-talks-mark-esper-postmaster-general-dejoy-and-snowden","Donald Trump August 15 Press Conference Transcript in NJ: Talks Mark Esper, Postmaster General DeJoy, and Snowden","14:55"
"Speaker 1","Mail sorting machines nationwide. That’s one of the-","https://www.rev.com/blog/transcripts/donald-trump-august-15-press-conference-transcript-in-nj-talks-mark-esper-postmaster-general-dejoy-and-snowden","Donald Trump August 15 Press Conference Transcript in NJ: Talks Mark Esper, Postmaster General DeJoy, and Snowden","15:06"
"Donald Trump","I don’t know. I don’t know what he’s doing. I can only tell you he’s a very smart man. He’ll be a great postmaster general. Obviously, if you’re going to do these millions of ballots out of nowhere, he’s going to obviously need funding. What the Democrats aren’t willing to provide other things and therefore they’re not going to get the funding for that, but you are going to have a catastrophic situation with universal mail in votes and on top of it, the Democrats aren’t willing to give the people the money and the post office the money.","https://www.rev.com/blog/transcripts/donald-trump-august-15-press-conference-transcript-in-nj-talks-mark-esper-postmaster-general-dejoy-and-snowden","Donald Trump August 15 Press Conference Transcript in NJ: Talks Mark Esper, Postmaster General DeJoy, and Snowden","15:10"
"Speaker 1","Mr President you said a catastrophic situation is going to happen, but what are you doing to ensure that that doesn’t happen because wouldn’t these problems raise questions about the election results if you win?","https://www.rev.com/blog/transcripts/donald-trump-august-15-press-conference-transcript-in-nj-talks-mark-esper-postmaster-general-dejoy-and-snowden","Donald Trump August 15 Press Conference Transcript in NJ: Talks Mark Esper, Postmaster General DeJoy, and Snowden","15:42"
"Donald Trump","Well, the problem with the mail in voting number one, you’re never going to know when the election’s over. Okay. I mean, they called the election in New York for Carolyn Maloney. They shouldn’t have done that. I think you should redo that election.","https://www.rev.com/blog/transcripts/donald-trump-august-15-press-conference-transcript-in-nj-talks-mark-esper-postmaster-general-dejoy-and-snowden","Donald Trump August 15 Press Conference Transcript in NJ: Talks Mark Esper, Postmaster General DeJoy, and Snowden","15:53"
