"speaker","transcription","url","headlin","timing"
"Donald Trump","But you heard it from me. That includes cracking down on sanctuary cities that defy federal law, shield visa overstays, and that release dangerous criminals back into the United States communities. That’s what’s happening. They’re releasing them so many deaths where they release somebody back into the community, and they know it’s going to end that way. That’s the sad… They know it’s going to end that way. We’re ending those procedures. We have to secure… Thank you. I spoke to parents, incredible parents. I got to know so many parents of children that were so horribly killed, burned to death, beaten to death, just the worst kind of death you can ever… Stuffed in barrels. And the person that did it was released. And you would look at the file, and they were letter after letter, after letter of people begging not to let this animal back into society, that this would happen.","https://www.rev.com/blog/transcripts/donald-trump-speech-transcript-gang-violence-law-enforcement-police","Donald Trump Speech Transcript on Gang Violence to Law Enforcement Officers","25:07"
"Donald Trump","It would happen quickly. It wasn’t even like it would happen over a long period of time. They were saying it would happen quickly. It’s total violence. He’s a totally violent person. You cannot let this person out. They let the person out. And sometimes it would happen on the first day. And then you have to talk to the parents and hold the parents and hug them and they’re crying. I mean, crying, their lives are destroyed. And nobody thinks about those people. They don’t think about those people. They’re devastated, but we’re ending so much of that. We’re ending hopefully all of that. The laws are tough. The laws are stacked against us, but we’re ending them.","https://www.rev.com/blog/transcripts/donald-trump-speech-transcript-gang-violence-law-enforcement-police","Donald Trump Speech Transcript on Gang Violence to Law Enforcement Officers","26:17"
"Donald Trump","So we’re going to secure our border against illegal entry, and we will build the wall. That I can tell you. In fact last night, you don’t read about this too much, but it was approved, 1.6 billion for the phase one of the wall, which is not only design but the start of construction over a period of about two years, but the start of construction for a great border wall. And we’re going to build it. The wall is vital, and vital as a tool for ending the humanitarian disaster, really brought on by drug smugglers, and new words that we haven’t heard too much of human traffickers. This is a term that’s been going on from the beginning of time, and they say it’s worse now than it ever was. You go back a thousand years, when you think of human trafficking, you go back 500 years, 200 years, 100 years, human trafficking they say, think of it, what they do. Human trafficking is worse now maybe than it’s ever been in the history of this world.","https://www.rev.com/blog/transcripts/donald-trump-speech-transcript-gang-violence-law-enforcement-police","Donald Trump Speech Transcript on Gang Violence to Law Enforcement Officers","27:06"
"Donald Trump","We need a wall. We also need it though for the drugs, because the drugs aren’t going through walls very easily, especially the walls that I build. I’m a very good builder. You people know that better than most because you live in the area. That’s why I’m here. We’ll build a good wall. We’re going to build a real wall. We’re going to build a wall that works, and it’s going to have a huge impact on the inflow of drugs coming across. The wall is almost … that could be one of the main reasons you have to have it. It’s an additional tool to stop the inflow of drugs into our country.","https://www.rev.com/blog/transcripts/donald-trump-speech-transcript-gang-violence-law-enforcement-police","Donald Trump Speech Transcript on Gang Violence to Law Enforcement Officers","28:20"
"Donald Trump","The previous administration enacted an open door policy to illegal immigrants from Central America. Welcome in, come in please, please. As a result, MS-13 surge into the country and scoured and just absolutely destroyed so much in front of it. New arrivals came in and they were all made recruits of each other, and they fought with each other and then they fought outside of each other and it got worse and worse. We’ve turned that back. In the three years before I took office, more than 150,000 unaccompanied alien minors arrived at the border and were released all throughout our country into United States communities, at a tremendous monetary cost to local taxpayers, and also a great cost to life and safety. Nearly 4,000 from this wave were released into Suffolk County. Congratulations. Including seven who are now indicted for murder. You know about that. In Washington DC region, at least 42 alien minors from the border surge have been recently implicated in MS-13 related violence, including 19 charged in killings or attempted killings. You say, “What happened to the old days where people came into this country, they worked and they worked and they worked and they had families and they paid taxes and they did all sorts of things and their families got stronger and they were closely knit.” We don’t see that. Failure to enforce our immigration laws had predictable results: drugs, gangs, and violence. But that’s all changing now. Under the Trump administration, America is once more a nation of laws and once again a nation that stands up for our law enforcement officers. We will defend our country, protect our communities and put the safety of the American people first. And I’m doing that with law enforcement and we’re doing that with trade and we’re doing that with so much else. It’s called America first. It’s called that expression I’m sure you’ve never heard of, make America great again. Has anybody heard that expression? Have you heard that? That is my promise to each of you. That is the oath I took as president. And that is my sacred pledge to the American people. Thank you everyone here today. You are really special, special Americans. And thank you in particular to the great police sheriffs and ICE officers. You do a spectacular job. The country loves you. The country respects you. You don’t hear it, but believe me, they respect you as much as they respect anything. There is the respect about our country. You are spectacular people.","https://www.rev.com/blog/transcripts/donald-trump-speech-transcript-gang-violence-law-enforcement-police","Donald Trump Speech Transcript on Gang Violence to Law Enforcement Officers","28:58"
"Donald Trump","Because of the danger of your job, which people also understand fully, I leave you with the following. Thank you and may God bless you. May God bless the United States of America. Thank you very much. Thank you. Thank you very much.","https://www.rev.com/blog/transcripts/donald-trump-speech-transcript-gang-violence-law-enforcement-police","Donald Trump Speech Transcript on Gang Violence to Law Enforcement Officers","33:14"
