"speaker","transcription","url","headlin","timing"
"Mike Pence","Mr. President we gathered today with the news of more than 98,000 of our countrymen have succumb to the coronavirus and their families are in our prayers and in our hearts. But because of the cooperation and the compassion of the American people who have heeded your guidelines for America who have listened and continue to listen to state and local authorities, we know that there are tens of thousands of American families that have been spared that heartbreak and loss. And we express our gratitude to the American people for your incredible cooperation, the social distancing, the steps that you have embraced the way you have been willing to forfeit aspects of your personal freedom to put the health of others first. But the good news is Mr. President that because of the steps the American people have taken heeding your leadership and the guidance of state and local officials we’re getting there and we’re starting to reopen America as we speak in a safe and responsible way.","https://www.rev.com/blog/transcripts/donald-trump-transcript-on-protecting-seniors-with-diabetes-may-26","Transcript: Donald Trump Remarks on Protecting Seniors with Diabetes May 26","20:22"
"Mike Pence","In fact Mr. President, every state in the nation has now taken at least some steps to reopen their economies. 52 states and territories have opened retail curbside to go with reduced capacity. 44 states we’re glad to note have opened up elective medical procedures in hospitals and clinics around the state. 38 states and territories have reopened personal care under strict hygiene protocols. 37 states have reopened restaurants. 34 states have reopened non-essential businesses and the list goes on and I think most meaningful to you Mr. President is so far 30 States and territories have reopened houses of worship under guidance of reduced capacity while allowing people to come back together in fellowship and prayer. This has all been made possible because of the whole of government, whole of America approach Mr. President that you initiated when you launched the white house coronavirus taskforce back in January.","https://www.rev.com/blog/transcripts/donald-trump-transcript-on-protecting-seniors-with-diabetes-may-26","Transcript: Donald Trump Remarks on Protecting Seniors with Diabetes May 26","21:30"
"Mike Pence","And before I step down, let me at least share a few encouraging words that we shared with America’s governors today, about the progress that we all have been making. Because to continue to safely reopen, we believe it’s absolutely essential that we increase visibility by expanding testing across the country so that we can ensure that we can identify outbreaks where they occur. It’s interesting as you watch the daily numbers, new cases are declining around the country and even more dramatically when you realize that a significant portion of new cases every day are actually in outbreaks in specific businesses. Or as we’ve discussed today in nursing homes or in meat packing plants. But I’m proud to report Mr. President because of the partnership that you’ve forged with commercial laboratories around the country, 14.1 million tests have been performed.","https://www.rev.com/blog/transcripts/donald-trump-transcript-on-protecting-seniors-with-diabetes-may-26","Transcript: Donald Trump Remarks on Protecting Seniors with Diabetes May 26","22:37"
"Mike Pence","And I heard again today from governors across America how they have been in many cases exceeding the demand in the testing that they’ve made available. In fact, a governor Phil Murphy of New Jersey informed me that he had promised the people in New Jersey that he would be doing 20,000 tests a day but in partnership with the federal government, as we’ve been providing testing supplies and accessing resources he told me that they actually have cleared 30,000 tests a day in New Jersey.","https://www.rev.com/blog/transcripts/donald-trump-transcript-on-protecting-seniors-with-diabetes-may-26","Transcript: Donald Trump Remarks on Protecting Seniors with Diabetes May 26","23:36"
"Mike Pence","And most importantly in that state where at one point nearly 40% of those tested had tested positive for the coronavirus and now the governor of New Jersey informed us that they’re less than 5%. but they’re hardly alone Mr. President 42 states are now testing at less than 10% positive rate. And 20 states are testing at less than 5% positive rate. The reality is that now all 50 states with the support that we’ve been providing, sending swabs and test tubes and medium on a weekly basis at your direction, now all 50 States have tested more than 2% of their population giving us a much greater capacity to identify outbreaks as they occur and protect our citizens.","https://www.rev.com/blog/transcripts/donald-trump-transcript-on-protecting-seniors-with-diabetes-may-26","Transcript: Donald Trump Remarks on Protecting Seniors with Diabetes May 26","24:06"
"Mike Pence","And the progress and evidence is clear all across America. We see hospitalizations continuing to decline. New hospitalizations have declined steadily in the chart that you see before you from April until today. And most importantly, well the president often says that one loss is too many, we welcome word that fatalities are declining precipitously all across the country. In fact, yesterday in America there were just 505 Americans who succumbed to the coronavirus and we hadn’t seen that number in daily losses since March. The reality is because of the cooperation and the compassion of the American people we’re getting there. We’re getting there America and Mr. President at your direction we’re going to continue to work closely with states around the country to expand testing and resources.","https://www.rev.com/blog/transcripts/donald-trump-transcript-on-protecting-seniors-with-diabetes-may-26","Transcript: Donald Trump Remarks on Protecting Seniors with Diabetes May 26","24:59"
"Mike Pence","We’re going to continue to make sure personal protective equipment flows. But finally, what we’re going to continue to do is focus on the most vulnerable. Even as we begin to see evidence that we are starting to put this coronavirus epidemic in the past, all the more we are going to continue to surge the resources and surge the kind of testing and partnership with states and healthcare providers to ensure that our seniors and anyone with an underlying immune deficiency, anyone that’s vulnerable to the coronavirus is immediately identified and protected by every measure that’s possible. So Mr. President I thank you for the opportunity. We heard great enthusiasm from governors all across the country in both political parties today. We’re making great progress and I truly do believe that with the continued partnership that we have forged with state and local governments, with the tremendous efforts of our healthcare workers around America and with God’s help we will reopen America and we will continue to reopen our country safely and protect our most vulnerable as we do. So thank you, Mr. President.","https://www.rev.com/blog/transcripts/donald-trump-transcript-on-protecting-seniors-with-diabetes-may-26","Transcript: Donald Trump Remarks on Protecting Seniors with Diabetes May 26","26:02"
"Donald Trump","Thank you Mike very much. And I think I’ll just add on to what Mike said. If we didn’t act quickly and smartly, we would have had in my opinion and in the opinion of others, anywhere from 10 to 20 and maybe even 25 times the number of deaths. We closed the border to China, meaning we put on the ban people coming in from China. That was a very big moment as Dr. Fauci said, we saved thousands and thousands of lives when we did that. And that’s true, but I think we would have had anywhere from 10 to 20 or 25 times the number of deaths if we didn’t act the way we did. And also if we didn’t act swiftly. So we’re very proud of our team and our taskforce and Mike, great job.","https://www.rev.com/blog/transcripts/donald-trump-transcript-on-protecting-seniors-with-diabetes-may-26","Transcript: Donald Trump Remarks on Protecting Seniors with Diabetes May 26","27:20"
"Donald Trump","… Proud of our team and our task force and Mike, great job. Seema, please.","https://www.rev.com/blog/transcripts/donald-trump-transcript-on-protecting-seniors-with-diabetes-may-26","Transcript: Donald Trump Remarks on Protecting Seniors with Diabetes May 26","28:03"
"Seema Verma","Good afternoon. I want to start with thanking the one person that’s responsible for today’s announcement and that’s President Trump. He’s been steadfast in his commitment to lowering the cost of drugs and protecting the Medicare program and making sure it works best for seniors. The president also knows that it’s the free market that leverages competition and negotiation, that that is what can lower costs and improve quality for the American patient.","https://www.rev.com/blog/transcripts/donald-trump-transcript-on-protecting-seniors-with-diabetes-may-26","Transcript: Donald Trump Remarks on Protecting Seniors with Diabetes May 26","28:10"
"Seema Verma","And because of that, we’ve been working to slash Medicare’s anti-competitive regulations, and it’s worked. In the Medicare part D program, as the president said, we are seeing low premiums, a seven year low, and in the Medicare advantage program, we’re seeing a 13 year low in premiums. So we’re putting money back in the pockets of seniors. And that means $3 billion in savings for patients and $6 billion in savings for taxpayers.","https://www.rev.com/blog/transcripts/donald-trump-transcript-on-protecting-seniors-with-diabetes-may-26","Transcript: Donald Trump Remarks on Protecting Seniors with Diabetes May 26","28:39"
"Seema Verma","And in absence of a congressional solution, we applied those same principles to lowering the cost of insulin. We are waiving Obamacare laws that disincentivize plans from lowering cost sharing for our Medicare beneficiaries. And this is important because we know that beneficiaries struggle to pay their insulin costs. It’s patients like Cindy from Rochester, New York. She told us that the high cost of insulin has impacted her health and that she’s been forced to ration her insulin. She said, “I know that it’s not good at all for my health. And I’m sure that I have affected some organs negatively because of that lack of money to purchase insulin.” But no longer thanks to the president’s leadership, Medicare seniors will pay no more than $35 for their insulin and that’s per month. And that’s for all forms of insulin through all phases of the Medicare part D program.","https://www.rev.com/blog/transcripts/donald-trump-transcript-on-protecting-seniors-with-diabetes-may-26","Transcript: Donald Trump Remarks on Protecting Seniors with Diabetes May 26","29:11"
"Seema Verma","I also will say that some plans are free to even go below the $35. And so they could even see lower premiums as well. I’m also proud to say that we have over 88 health plans that are participating in this model, and that represents over 1, 750 plans that will offer this low cost insulin. These plans will be available during this year’s open enrollment, which starts in October.","https://www.rev.com/blog/transcripts/donald-trump-transcript-on-protecting-seniors-with-diabetes-may-26","Transcript: Donald Trump Remarks on Protecting Seniors with Diabetes May 26","30:13"
"Seema Verma","And I want to thank the manufacturers and the health plans for stepping up to the plate, for coming together to negotiate this great senior savings model. It’s going to make such a difference to the lives of many seniors across the country. And I am optimistic that this could be a model to lower the costs of many other drugs in the Medicare program. And thank you again, President Trump for bringing lower cost priced insulin. Our seniors are going to be saving an average of 66% in their insulin costs. And this is nothing short of a godsend. And with that, I think we’re going to hear from one of our Medicare beneficiaries. Thank you.","https://www.rev.com/blog/transcripts/donald-trump-transcript-on-protecting-seniors-with-diabetes-may-26","Transcript: Donald Trump Remarks on Protecting Seniors with Diabetes May 26","30:42"
"Donald Trump","Thank you, Seema.","https://www.rev.com/blog/transcripts/donald-trump-transcript-on-protecting-seniors-with-diabetes-may-26","Transcript: Donald Trump Remarks on Protecting Seniors with Diabetes May 26","31:26"
"Allen","Hi, my name’s Allen [inaudible 00:03:28]. I live in the Hudson Valley in New York. I’m 68 years old and I rely on Medicare part D. I’ve been a diabetic for over 10 years. And during that time I’ve watched insulin prices rise dramatically. I pay $400 a month now for insulin. I appreciate President Trump putting a policy in place that will help people like myself for the future as far as insulin products. Thank you.","https://www.rev.com/blog/transcripts/donald-trump-transcript-on-protecting-seniors-with-diabetes-may-26","Transcript: Donald Trump Remarks on Protecting Seniors with Diabetes May 26","31:27"
"Donald Trump","That’s very nice. And many, many people feel the same way. They can’t actually believe it. $35 and less. And less. And they were being ripped off at a level that nobody’s seen before. But that’s true with a lot of other things and we’re taking care of them, too. So I want to thank everybody for being here. In particular, these great executives. Thank you very much. Thank you very much. You were very impressive in your speech by the way. Thank you very much. John, please.","https://www.rev.com/blog/transcripts/donald-trump-transcript-on-protecting-seniors-with-diabetes-may-26","Transcript: Donald Trump Remarks on Protecting Seniors with Diabetes May 26","31:55"
"John","Mr. President, can you tell us what you plan to do regarding sanctions against China for its pending actions against Hong Kong? And do you also intend to put restrictions on F and J visas for students and researchers coming into the United States from China?","https://www.rev.com/blog/transcripts/donald-trump-transcript-on-protecting-seniors-with-diabetes-may-26","Transcript: Donald Trump Remarks on Protecting Seniors with Diabetes May 26","32:25"
"Donald Trump","Your questions early. We’re doing it now. We’re doing something now. I think you’ll find it very interesting, but I won’t be talking about it today. I’ll be talking about it over the next couple of days, John, okay? But it’s a very important question. Yes, please. Anybody? Yeah, please.","https://www.rev.com/blog/transcripts/donald-trump-transcript-on-protecting-seniors-with-diabetes-may-26","Transcript: Donald Trump Remarks on Protecting Seniors with Diabetes May 26","32:42"
"Speaker 2","Mr. President two questions about a couple of things you’ve tweeted about in the last few days, were you meaning to criticize Vice President Biden for wearing a mask yesterday? And can you explain why you’ve been tweeting about a conspiracy theory that has been proven to not be true?","https://www.rev.com/blog/transcripts/donald-trump-transcript-on-protecting-seniors-with-diabetes-may-26","Transcript: Donald Trump Remarks on Protecting Seniors with Diabetes May 26","32:59"
"Donald Trump","No, Biden can wear a mask, but he was standing outside with his wife, perfect conditions, perfect weather. They’re inside, they don’t wear masks. And so I thought it was very unusual that he had one on. But I thought that was fine. I wasn’t criticizing them at all. Why would I ever do a thing like that? And your second question was? I couldn’t hear you.","https://www.rev.com/blog/transcripts/donald-trump-transcript-on-protecting-seniors-with-diabetes-may-26","Transcript: Donald Trump Remarks on Protecting Seniors with Diabetes May 26","33:15"
"Speaker 2","The second-","https://www.rev.com/blog/transcripts/donald-trump-transcript-on-protecting-seniors-with-diabetes-may-26","Transcript: Donald Trump Remarks on Protecting Seniors with Diabetes May 26","33:34"
"Donald Trump","Can you take it off because I cannot hear you.","https://www.rev.com/blog/transcripts/donald-trump-transcript-on-protecting-seniors-with-diabetes-may-26","Transcript: Donald Trump Remarks on Protecting Seniors with Diabetes May 26","33:34"
"Speaker 2","I’ll just speak louder, sir.","https://www.rev.com/blog/transcripts/donald-trump-transcript-on-protecting-seniors-with-diabetes-may-26","Transcript: Donald Trump Remarks on Protecting Seniors with Diabetes May 26","33:36"
"Donald Trump","Okay. Because you want to be politically correct. Go ahead.","https://www.rev.com/blog/transcripts/donald-trump-transcript-on-protecting-seniors-with-diabetes-may-26","Transcript: Donald Trump Remarks on Protecting Seniors with Diabetes May 26","33:37"
"Speaker 2","No, sir. I just want to wear the mask.","https://www.rev.com/blog/transcripts/donald-trump-transcript-on-protecting-seniors-with-diabetes-may-26","Transcript: Donald Trump Remarks on Protecting Seniors with Diabetes May 26","33:39"
"Donald Trump","Go ahead, go ahead, go ahead.","https://www.rev.com/blog/transcripts/donald-trump-transcript-on-protecting-seniors-with-diabetes-may-26","Transcript: Donald Trump Remarks on Protecting Seniors with Diabetes May 26","33:41"
"Speaker 2","The second question was about your tweets about the woman who died, who you’re suggesting that Joe Scarborough was responsible.","https://www.rev.com/blog/transcripts/donald-trump-transcript-on-protecting-seniors-with-diabetes-may-26","Transcript: Donald Trump Remarks on Protecting Seniors with Diabetes May 26","33:42"
"Donald Trump","Yeah. A lot of people suggest that and hopefully someday people are going to find out. Certainly a very suspicious situation. Very sad. Very sad and very suspicious. Question, please?","https://www.rev.com/blog/transcripts/donald-trump-transcript-on-protecting-seniors-with-diabetes-may-26","Transcript: Donald Trump Remarks on Protecting Seniors with Diabetes May 26","33:49"
"Speaker 2","[inaudible 00:34:02] has asked you not to tweet about it anymore, sir.","https://www.rev.com/blog/transcripts/donald-trump-transcript-on-protecting-seniors-with-diabetes-may-26","Transcript: Donald Trump Remarks on Protecting Seniors with Diabetes May 26","34:02"
"Donald Trump","Go ahead, please go.","https://www.rev.com/blog/transcripts/donald-trump-transcript-on-protecting-seniors-with-diabetes-may-26","Transcript: Donald Trump Remarks on Protecting Seniors with Diabetes May 26","34:03"
"Speaker 3","Mr. President, though have you seen the letter that was written by her husband begging Twitter to delete your tweets? Talking about how hard it’s been for his family, for him to deal with that.","https://www.rev.com/blog/transcripts/donald-trump-transcript-on-protecting-seniors-with-diabetes-may-26","Transcript: Donald Trump Remarks on Protecting Seniors with Diabetes May 26","34:04"
"Donald Trump","Yeah, I have, but I’m sure that ultimately they want to get to the bottom of it. And it’s a very serious situation. I also saw a clip with Joe and Imus where they were having a lot of fun at her expense. And I thought it was totally inappropriate. Now it’s a very suspicious thing. And I hope somebody gets to the bottom of it. It’ll be a very good thing. As you know, there’s no statute of limitations. So it would be a very good, very good thing to do. Okay. Who’s next? Any questions on insulin? Yeah, please.","https://www.rev.com/blog/transcripts/donald-trump-transcript-on-protecting-seniors-with-diabetes-may-26","Transcript: Donald Trump Remarks on Protecting Seniors with Diabetes May 26","34:13"
"Speaker 4","Mr. President. There’s a bill in Congress that’s related to the [weakers 00:34:52]. It passed the Senate. It’s going to be up to the house. Are you willing to sign that?","https://www.rev.com/blog/transcripts/donald-trump-transcript-on-protecting-seniors-with-diabetes-may-26","Transcript: Donald Trump Remarks on Protecting Seniors with Diabetes May 26","34:47"
"Donald Trump","We’re taking a look at it very strongly. They’re going to report this afternoon. I’ll be looking at it this afternoon.","https://www.rev.com/blog/transcripts/donald-trump-transcript-on-protecting-seniors-with-diabetes-may-26","Transcript: Donald Trump Remarks on Protecting Seniors with Diabetes May 26","34:57"
"Speaker 4","Something special that you mentioned on China. Does that include sanctions?","https://www.rev.com/blog/transcripts/donald-trump-transcript-on-protecting-seniors-with-diabetes-may-26","Transcript: Donald Trump Remarks on Protecting Seniors with Diabetes May 26","35:04"
"Donald Trump","No, it’s something you’re going to be hearing about before the end of the week. Very powerfully, I think. Yeah please.","https://www.rev.com/blog/transcripts/donald-trump-transcript-on-protecting-seniors-with-diabetes-may-26","Transcript: Donald Trump Remarks on Protecting Seniors with Diabetes May 26","35:08"
"Speaker 5","Is there any reason why someone who does not have diabetes would take insulin? Is there any sort of medical reason for that?","https://www.rev.com/blog/transcripts/donald-trump-transcript-on-protecting-seniors-with-diabetes-may-26","Transcript: Donald Trump Remarks on Protecting Seniors with Diabetes May 26","35:18"
"Donald Trump","I could ask that question to anybody like to discuss that. Do you want to discuss it, please? Go ahead. Do you know the answer? Either one of you or both. Come on and let’s get these highly paid executives up here to give the answer. Seema, please. Jerome. We picked a good one. We got it right.","https://www.rev.com/blog/transcripts/donald-trump-transcript-on-protecting-seniors-with-diabetes-may-26","Transcript: Donald Trump Remarks on Protecting Seniors with Diabetes May 26","35:24"
"Jerome Adams","Well, thank you Mr. President. I think it’s important for everyone to know that as Tracy Brown highlighted earlier, one in three Americans is actually either diabetic or prediabetic. And I would encourage folks to go to diabetes.org/risk-test. So diabetes.org/risk-test to find out if you are at risk for diabetes. As far as insulin goes, we know that again, 7 million people actually are dependent on insulin. We know that from a type one diabetes standpoint, 1.6 million Americans have type one diabetes and most, all of them are dependent on insulin. Your body, Mr. President actually makes insulin endogenously and people such as you and I, we make our own insulin. So yes, we do utilize insulin, but we make it ourselves.","https://www.rev.com/blog/transcripts/donald-trump-transcript-on-protecting-seniors-with-diabetes-may-26","Transcript: Donald Trump Remarks on Protecting Seniors with Diabetes May 26","35:47"
"Jerome Adams","Other people who have diabetes oftentimes need exogenous insulin made by many of these great manufacturers here so that they can be healthy and live long and successful lives. And make no mistake about it, if they can get affordable insulin, they can live a long and healthy life. And that’s what we’re here for today. Today is a very important day. It is a monumental day because Tracy, we’ve been working for years to try to address the price of insulin. For years. This is an important day. And I want to thank you Mr. President, and I want to thank all the people here for making that insulin affordable to more people.","https://www.rev.com/blog/transcripts/donald-trump-transcript-on-protecting-seniors-with-diabetes-may-26","Transcript: Donald Trump Remarks on Protecting Seniors with Diabetes May 26","36:41"
"Donald Trump","Thank you very much. And Tracy, do you agree with that?","https://www.rev.com/blog/transcripts/donald-trump-transcript-on-protecting-seniors-with-diabetes-may-26","Transcript: Donald Trump Remarks on Protecting Seniors with Diabetes May 26","37:17"
"Donald Trump","And the question I found to be a very interesting one, but is that an unusual question or an unusual circumstance?","https://www.rev.com/blog/transcripts/donald-trump-transcript-on-protecting-seniors-with-diabetes-may-26","Transcript: Donald Trump Remarks on Protecting Seniors with Diabetes May 26","37:21"
"Tracy","I’m not sure that it’s an unusual question, there are many people who are not clear on [inaudible 00:37:36].","https://www.rev.com/blog/transcripts/donald-trump-transcript-on-protecting-seniors-with-diabetes-may-26","Transcript: Donald Trump Remarks on Protecting Seniors with Diabetes May 26","37:37"
"Donald Trump","Right. Okay, good. I thought it was a very good question, actually. Please go ahead.","https://www.rev.com/blog/transcripts/donald-trump-transcript-on-protecting-seniors-with-diabetes-may-26","Transcript: Donald Trump Remarks on Protecting Seniors with Diabetes May 26","37:38"
"Speaker 6","Thank you, Mr. President, we see in Europe slowly from one country through the other, they are opening their borders and letting people moving from one country to another. Are you considering for the good of the US economy, are you considering lifting the flight ban from Europe in the next weeks?","https://www.rev.com/blog/transcripts/donald-trump-transcript-on-protecting-seniors-with-diabetes-may-26","Transcript: Donald Trump Remarks on Protecting Seniors with Diabetes May 26","37:45"
