"speaker","transcription","url","headlin","timing"
"Speaker 5","Do you take any responsibility for these 50,000 deaths that have happened in this country?","https://www.rev.com/blog/transcripts/transcript-donald-trump-signs-relief-bill-says-comments-on-injecting-disinfectant-were-sarcastic","Transcript: Donald Trump Signs Relief Bill, Says Comments on Injecting Disinfectant Were “Sarcastic”","00:09"
"Donald Trump","I think we’ve done a great job. As you know, minimal numbers were going to be 100,000 people. Minimal numbers were going to be 100,000 people and we’re going to be hopefully far below that. If we didn’t take quick action, you could have lost many millions of people. So we’re really being given a lot of credit for a lot of people. I’m not looking for credit for myself, but I am looking for credit for people in the federal government that have done such a great job and for the doctors and nurses and everybody else. Please.","https://www.rev.com/blog/transcripts/transcript-donald-trump-signs-relief-bill-says-comments-on-injecting-disinfectant-were-sarcastic","Transcript: Donald Trump Signs Relief Bill, Says Comments on Injecting Disinfectant Were “Sarcastic”","00:15"
"Steve","Mr. President, do you have any comment on Rick Wright who says he’s going to file a whistleblower complaint?","https://www.rev.com/blog/transcripts/transcript-donald-trump-signs-relief-bill-says-comments-on-injecting-disinfectant-were-sarcastic","Transcript: Donald Trump Signs Relief Bill, Says Comments on Injecting Disinfectant Were “Sarcastic”","00:45"
"Donald Trump","I don’t know the gentleman. I’m sorry. I don’t know. I don’t know how you sign a whistleblower complaint. Is that a whistleblower complaint you’re talking about? [crosstalk 00:00:59]. How do you sign a whistleblower complaint when everybody knows who he is? I know nothing about him.","https://www.rev.com/blog/transcripts/transcript-donald-trump-signs-relief-bill-says-comments-on-injecting-disinfectant-were-sarcastic","Transcript: Donald Trump Signs Relief Bill, Says Comments on Injecting Disinfectant Were “Sarcastic”","00:50"
"Ayesha Rascoe","He says he was retaliated against because he refused to promote hydroxychloroquine.","https://www.rev.com/blog/transcripts/transcript-donald-trump-signs-relief-bill-says-comments-on-injecting-disinfectant-were-sarcastic","Transcript: Donald Trump Signs Relief Bill, Says Comments on Injecting Disinfectant Were “Sarcastic”","01:03"
"Donald Trump","That, I don’t know. I don’t know anything about it. I don’t know-","https://www.rev.com/blog/transcripts/transcript-donald-trump-signs-relief-bill-says-comments-on-injecting-disinfectant-were-sarcastic","Transcript: Donald Trump Signs Relief Bill, Says Comments on Injecting Disinfectant Were “Sarcastic”","01:09"
"Ayesha Rascoe","Did you ever ask a scientist to promote it?","https://www.rev.com/blog/transcripts/transcript-donald-trump-signs-relief-bill-says-comments-on-injecting-disinfectant-were-sarcastic","Transcript: Donald Trump Signs Relief Bill, Says Comments on Injecting Disinfectant Were “Sarcastic”","01:09"
"Donald Trump","Easy. Easy. Just take it nice and easy. I don’t know anything about him. Until yesterday, I never heard of the gentleman. Okay? [crosstalk 00:01:19].","https://www.rev.com/blog/transcripts/transcript-donald-trump-signs-relief-bill-says-comments-on-injecting-disinfectant-were-sarcastic","Transcript: Donald Trump Signs Relief Bill, Says Comments on Injecting Disinfectant Were “Sarcastic”","01:11"
"Speaker 5","Have you asked anyone to look into what happened to him?","https://www.rev.com/blog/transcripts/transcript-donald-trump-signs-relief-bill-says-comments-on-injecting-disinfectant-were-sarcastic","Transcript: Donald Trump Signs Relief Bill, Says Comments on Injecting Disinfectant Were “Sarcastic”","01:18"
"Donald Trump","What?","https://www.rev.com/blog/transcripts/transcript-donald-trump-signs-relief-bill-says-comments-on-injecting-disinfectant-were-sarcastic","Transcript: Donald Trump Signs Relief Bill, Says Comments on Injecting Disinfectant Were “Sarcastic”","01:22"
"Speaker 5","Have you asked anyone to look into the circumstances around him?","https://www.rev.com/blog/transcripts/transcript-donald-trump-signs-relief-bill-says-comments-on-injecting-disinfectant-were-sarcastic","Transcript: Donald Trump Signs Relief Bill, Says Comments on Injecting Disinfectant Were “Sarcastic”","01:22"
"Donald Trump","I have not yet. At some point I will. I guess they moved him to a different group.","https://www.rev.com/blog/transcripts/transcript-donald-trump-signs-relief-bill-says-comments-on-injecting-disinfectant-were-sarcastic","Transcript: Donald Trump Signs Relief Bill, Says Comments on Injecting Disinfectant Were “Sarcastic”","01:25"
"Speaker 6","What price China should pay for spreading this virus and covering it up and lying about it?","https://www.rev.com/blog/transcripts/transcript-donald-trump-signs-relief-bill-says-comments-on-injecting-disinfectant-were-sarcastic","Transcript: Donald Trump Signs Relief Bill, Says Comments on Injecting Disinfectant Were “Sarcastic”","01:30"
"Donald Trump","Well, we’re looking into it. We’re studying it. We’re investigating and we’ll see what happens. But it is something that should have been stopped early on. It could have been stopped easily in China and we don’t understand why they didn’t do it. So we’re looking into it. We’re not happy about it.","https://www.rev.com/blog/transcripts/transcript-donald-trump-signs-relief-bill-says-comments-on-injecting-disinfectant-were-sarcastic","Transcript: Donald Trump Signs Relief Bill, Says Comments on Injecting Disinfectant Were “Sarcastic”","01:35"
"Ayesha Rascoe","Why don’t you know about-","https://www.rev.com/blog/transcripts/transcript-donald-trump-signs-relief-bill-says-comments-on-injecting-disinfectant-were-sarcastic","Transcript: Donald Trump Signs Relief Bill, Says Comments on Injecting Disinfectant Were “Sarcastic”","01:52"
"Donald Trump","Who are you with?","https://www.rev.com/blog/transcripts/transcript-donald-trump-signs-relief-bill-says-comments-on-injecting-disinfectant-were-sarcastic","Transcript: Donald Trump Signs Relief Bill, Says Comments on Injecting Disinfectant Were “Sarcastic”","01:53"
"Ayesha Rascoe","I’m with NPR. Ayesha Rascoe.","https://www.rev.com/blog/transcripts/transcript-donald-trump-signs-relief-bill-says-comments-on-injecting-disinfectant-were-sarcastic","Transcript: Donald Trump Signs Relief Bill, Says Comments on Injecting Disinfectant Were “Sarcastic”","01:54"
"Donald Trump","Okay, go ahead. You opened that up. Go ahead, please. Question?","https://www.rev.com/blog/transcripts/transcript-donald-trump-signs-relief-bill-says-comments-on-injecting-disinfectant-were-sarcastic","Transcript: Donald Trump Signs Relief Bill, Says Comments on Injecting Disinfectant Were “Sarcastic”","01:56"
"Speaker 5","Do you support any money for the postal service?","https://www.rev.com/blog/transcripts/transcript-donald-trump-signs-relief-bill-says-comments-on-injecting-disinfectant-were-sarcastic","Transcript: Donald Trump Signs Relief Bill, Says Comments on Injecting Disinfectant Were “Sarcastic”","02:01"
"Steve","I can comment on that, Mr. President.","https://www.rev.com/blog/transcripts/transcript-donald-trump-signs-relief-bill-says-comments-on-injecting-disinfectant-were-sarcastic","Transcript: Donald Trump Signs Relief Bill, Says Comments on Injecting Disinfectant Were “Sarcastic”","02:04"
"Speaker 5","Go ahead, postal service.","https://www.rev.com/blog/transcripts/transcript-donald-trump-signs-relief-bill-says-comments-on-injecting-disinfectant-were-sarcastic","Transcript: Donald Trump Signs Relief Bill, Says Comments on Injecting Disinfectant Were “Sarcastic”","02:05"
"Steve","So we authorized in the last Care Act over $10 billion of a loan. My team is already actively working on that with the postal service if they need the money, and we’re dealing with that.","https://www.rev.com/blog/transcripts/transcript-donald-trump-signs-relief-bill-says-comments-on-injecting-disinfectant-were-sarcastic","Transcript: Donald Trump Signs Relief Bill, Says Comments on Injecting Disinfectant Were “Sarcastic”","02:06"
"Donald Trump","The postal service is a joke because they’re handing out packages for Amazon and other internet companies, and every time they bring a package, they lose money on it. So Amazon and other internet companies and delivery companies are dropping all of their, not all of them, but a big portion of packages and whatever else they’re doing into a post office, and the post office is supposed to deliver the packages, and they lose a lot of money. The post office should raise the price of a package by approximately four times because they don’t raise them. These have been in there for a long time, but for some reason they’re very cozy with some of these companies and they don’t raise the price of a package.","https://www.rev.com/blog/transcripts/transcript-donald-trump-signs-relief-bill-says-comments-on-injecting-disinfectant-were-sarcastic","Transcript: Donald Trump Signs Relief Bill, Says Comments on Injecting Disinfectant Were “Sarcastic”","02:18"
"Donald Trump","And if they raise the price of a package like they should four or five times, that’s what it should be or let Amazon build their own post office, which would be an impossible thing to do because the post office is massive and serves every little piece of the country, the post office, if they raise the price of a package by approximately four times, it would be a whole new ball game, but they don’t want to raise because they don’t want to insult Amazon and they don’t want to insult other companies perhaps that they like. The post office should raise the price of the packages to the companies, not to the people. To the companies. And if they did that it would be a whole different story. Do you agree with that, Steve?","https://www.rev.com/blog/transcripts/transcript-donald-trump-signs-relief-bill-says-comments-on-injecting-disinfectant-were-sarcastic","Transcript: Donald Trump Signs Relief Bill, Says Comments on Injecting Disinfectant Were “Sarcastic”","03:09"
"Steve","I do. And actually we are going to put certain criteria for our postal reform program as part of the loan, and we’re looking forward to the board is recruiting a new postmaster general and doing postal reform.","https://www.rev.com/blog/transcripts/transcript-donald-trump-signs-relief-bill-says-comments-on-injecting-disinfectant-were-sarcastic","Transcript: Donald Trump Signs Relief Bill, Says Comments on Injecting Disinfectant Were “Sarcastic”","03:49"
"Donald Trump","Well, I’ll go a step further. If they don’t raise the price of the service they give, which is a tremendous service, and they do a great job, and the postal workers are fantastic, but this thing’s losing billions of dollars. It has for years because for whatever reason you can imagine, they don’t want to insult Amazon and these other groups. If they don’t raise the price, I’m not signing anything. So they’ll raise the price so that they become maybe even profitable, but so they lose much less money. Okay? And if they don’t do it, I’m not signing anything and I’m not authorizing you to do anything, Steve.","https://www.rev.com/blog/transcripts/transcript-donald-trump-signs-relief-bill-says-comments-on-injecting-disinfectant-were-sarcastic","Transcript: Donald Trump Signs Relief Bill, Says Comments on Injecting Disinfectant Were “Sarcastic”","04:02"
"Ayesha Rascoe","Mr. President, can you clarify your comments about injections of disinfectant? They were quite provocative.","https://www.rev.com/blog/transcripts/transcript-donald-trump-signs-relief-bill-says-comments-on-injecting-disinfectant-were-sarcastic","Transcript: Donald Trump Signs Relief Bill, Says Comments on Injecting Disinfectant Were “Sarcastic”","04:39"
"Donald Trump","No, I was asking a question sarcastically to reporters like you just to see what would happen. Now, disinfectant for doing this maybe on the hands would work. And I was asking the question of the gentleman who was there yesterday, Bill, because when they say that something will last three, or four hours, or six hours, but if the sun is out or if they use disinfectant, it goes away in less than a minute. Did you hear about this yesterday? But I was asking a very sarcastic question to the reporters in the room about disinfectant on the inside. But it does kill it and it would kill it on the hands and that would make things much better. That was done in the form of a sarcastic question to the reporters. Okay?","https://www.rev.com/blog/transcripts/transcript-donald-trump-signs-relief-bill-says-comments-on-injecting-disinfectant-were-sarcastic","Transcript: Donald Trump Signs Relief Bill, Says Comments on Injecting Disinfectant Were “Sarcastic”","04:45"
"Ayesha Rascoe","But you were asking your medical experts to look into it.","https://www.rev.com/blog/transcripts/transcript-donald-trump-signs-relief-bill-says-comments-on-injecting-disinfectant-were-sarcastic","Transcript: Donald Trump Signs Relief Bill, Says Comments on Injecting Disinfectant Were “Sarcastic”","05:32"
"Donald Trump","No, no, no.","https://www.rev.com/blog/transcripts/transcript-donald-trump-signs-relief-bill-says-comments-on-injecting-disinfectant-were-sarcastic","Transcript: Donald Trump Signs Relief Bill, Says Comments on Injecting Disinfectant Were “Sarcastic”","05:32"
"Ayesha Rascoe","Were you being sarcastic with them?","https://www.rev.com/blog/transcripts/transcript-donald-trump-signs-relief-bill-says-comments-on-injecting-disinfectant-were-sarcastic","Transcript: Donald Trump Signs Relief Bill, Says Comments on Injecting Disinfectant Were “Sarcastic”","05:32"
"Donald Trump","To look into whether or not sun and disinfectant on the hands, but whether or not sun can help us because he came in yesterday and he said they’ve done a big study. This is a study. This isn’t where he hasn’t done it. This is where they’ve come in with a final report that sun has a massive impact negatively on this virus. In other words, it does not live well with humidity and it doesn’t live well with sun, sunlight, heat. It doesn’t live well with heat, and sun, and disinfectant. And that’s what I brought out, and I thought it was clear. Okay, anything else?","https://www.rev.com/blog/transcripts/transcript-donald-trump-signs-relief-bill-says-comments-on-injecting-disinfectant-were-sarcastic","Transcript: Donald Trump Signs Relief Bill, Says Comments on Injecting Disinfectant Were “Sarcastic”","05:32"
"Jeff","Mr. President, could you comment a little bit on what you’re considering right now for helping the oil and gas industry? [crosstalk 00:06:17].","https://www.rev.com/blog/transcripts/transcript-donald-trump-signs-relief-bill-says-comments-on-injecting-disinfectant-were-sarcastic","Transcript: Donald Trump Signs Relief Bill, Says Comments on Injecting Disinfectant Were “Sarcastic”","06:09"
"Donald Trump","Yeah, I want to help that industry. That industry got unnecessarily hurt by massive amounts of oil being produced by very big countries, oil producing countries, and they got carried away. And I got involved with those two countries to have them make peace with each other, but by the time we get involved, all of a sudden, they have billions of barrels. They never saw anything like it. Every tanker is loaded up with oil sitting out in the ocean. Oil is less than water. Nobody’s ever seen anything like it. Now in many respects for our country, automobiles and airplanes and all of the things that you have to do with the airlines, we’re tying to make the airlines work again. And we will, we just provided financing for them, which was great. We’re going to keep our airlines and all those employees totally intact.","https://www.rev.com/blog/transcripts/transcript-donald-trump-signs-relief-bill-says-comments-on-injecting-disinfectant-were-sarcastic","Transcript: Donald Trump Signs Relief Bill, Says Comments on Injecting Disinfectant Were “Sarcastic”","06:15"
"Donald Trump","So in some ways, fuel cost is very low. But I’m an energy person, I love the energy business. We’re energy independent, we’re going to stay that way. We’re also filling up, as you know, John, our national strategic reserves and we’re filling up like never before and we’re frankly getting very good prices, as we should. Very good prices. So we’re filling up the reserve. That’s 75 million barrels and we’re going to have that filled up pretty soon. So it’ll be filled for the first time in a long time. And we’re doing it at a very, very low cost. So it’s good. Now, it’ll come back when the virus is gone. They lost 40% of their market because of the virus. In all fairness to even the producers and even the countries, they lost 40% of their market because people aren’t driving automobiles, they’re not doing anything.","https://www.rev.com/blog/transcripts/transcript-donald-trump-signs-relief-bill-says-comments-on-injecting-disinfectant-were-sarcastic","Transcript: Donald Trump Signs Relief Bill, Says Comments on Injecting Disinfectant Were “Sarcastic”","07:11"
"Donald Trump","They’re not flying in airplanes. The airline business was essentially shut down. So all of this massive amount of fuel, and this is all over the world, this isn’t here. This is in virtually every country. As you know, I’ve been talking about 184 countries. It’s probably more than that now. 184. A friend of mine, a very sophisticated friend said, “I never knew you had 184 countries.” We actually have more than that, but 184 countries that we know of have been affected by this. So the oil business lost 40 to 50% of their market and who would’ve seen a thing like that coming? As soon as this comes back and with the cutting, the energy business will come back and it’ll come back strong. So we’re working. The energy business is very important to me and we’re going to build it up. This really hurt the energy business as much as any other business because it totally knocked out…","https://www.rev.com/blog/transcripts/transcript-donald-trump-signs-relief-bill-says-comments-on-injecting-disinfectant-were-sarcastic","Transcript: Donald Trump Signs Relief Bill, Says Comments on Injecting Disinfectant Were “Sarcastic”","08:01"
"Donald Trump","The supply kept coming, and by the way, there was a lot of oil when this hit. Before it hit, there was a lot of oil. Prices were pretty low, which is a very good thing. But then we got hit by this and it was devastating to the energy business all over the world. Once this straightens out and once you get some demand and then you’re going to reduce the supply a little bit, it’ll equalize and it’s going to be great again. We will make the energy business great again [crosstalk 00:09:28], and we want to remain independent. We’re independent now. We’re totally independent on energy. We want to keep it that way. Go ahead.","https://www.rev.com/blog/transcripts/transcript-donald-trump-signs-relief-bill-says-comments-on-injecting-disinfectant-were-sarcastic","Transcript: Donald Trump Signs Relief Bill, Says Comments on Injecting Disinfectant Were “Sarcastic”","08:57"
"Jeff","Could your secretary of the nation perhaps clarify whether the government is considering taking space and energy companies?","https://www.rev.com/blog/transcripts/transcript-donald-trump-signs-relief-bill-says-comments-on-injecting-disinfectant-were-sarcastic","Transcript: Donald Trump Signs Relief Bill, Says Comments on Injecting Disinfectant Were “Sarcastic”","09:34"
"Steve","The president has asked me to work with the secretary of energy and we’re looking at a whole bunch of alternatives. It would be premature for me to comment on any one of them, but the president has asked us to look at the range of alternatives.","https://www.rev.com/blog/transcripts/transcript-donald-trump-signs-relief-bill-says-comments-on-injecting-disinfectant-were-sarcastic","Transcript: Donald Trump Signs Relief Bill, Says Comments on Injecting Disinfectant Were “Sarcastic”","09:40"
"Jeff","Is that one of the alternatives?","https://www.rev.com/blog/transcripts/transcript-donald-trump-signs-relief-bill-says-comments-on-injecting-disinfectant-were-sarcastic","Transcript: Donald Trump Signs Relief Bill, Says Comments on Injecting Disinfectant Were “Sarcastic”","09:53"
"Steve","Again, you can assume that’s one of the alternatives, but there’s many of them. [crosstalk 00:09:59].","https://www.rev.com/blog/transcripts/transcript-donald-trump-signs-relief-bill-says-comments-on-injecting-disinfectant-were-sarcastic","Transcript: Donald Trump Signs Relief Bill, Says Comments on Injecting Disinfectant Were “Sarcastic”","09:55"
"Donald Trump","Well, what are the alternatives we can think about Steve and just in sitting here watching, the United States is the largest user of oil. We could buy oil at a great price into the future that gives them the infusion they need. And we have oil at a great price into the future. So that’s something I’d like you to think about.","https://www.rev.com/blog/transcripts/transcript-donald-trump-signs-relief-bill-says-comments-on-injecting-disinfectant-were-sarcastic","Transcript: Donald Trump Signs Relief Bill, Says Comments on Injecting Disinfectant Were “Sarcastic”","09:58"
"Steve","It is, Mr. President, as you’ve suggested.","https://www.rev.com/blog/transcripts/transcript-donald-trump-signs-relief-bill-says-comments-on-injecting-disinfectant-were-sarcastic","Transcript: Donald Trump Signs Relief Bill, Says Comments on Injecting Disinfectant Were “Sarcastic”","10:20"
"Donald Trump","Likewise, I told Steve we’re the biggest user of the airlines, United States government, and one of the ways we can help the airlines is buy tickets at a very large discount, maybe 50% off or maybe more, and you buy into four or five years worth of tickets and you infuse them with some cash. And in the meantime, we’re flying the people of our country for a fraction of the cost than it would be when the airlines get back. They will get back. So we’re thinking in terms of as additional, because the airlines are all set right down, but as an additional incentive where we buy tickets in advance at a very big discount, which I’ve liked really from the beginning. And we’re not up there. Look, the fact is that the airlines are going to be fine the way it is now, but I like that as an additional help for the airlines. I like it both ways. I like it for us too. We’re the largest user of the airlines. So you buy tickets. I don’t know. This sounds good, right, if we get a good discount?","https://www.rev.com/blog/transcripts/transcript-donald-trump-signs-relief-bill-says-comments-on-injecting-disinfectant-were-sarcastic","Transcript: Donald Trump Signs Relief Bill, Says Comments on Injecting Disinfectant Were “Sarcastic”","10:24"
"Speaker 9","Wyoming appreciates what you’re doing for the energy industry as well.","https://www.rev.com/blog/transcripts/transcript-donald-trump-signs-relief-bill-says-comments-on-injecting-disinfectant-were-sarcastic","Transcript: Donald Trump Signs Relief Bill, Says Comments on Injecting Disinfectant Were “Sarcastic”","11:25"
"Donald Trump","Well, Wyoming is great.","https://www.rev.com/blog/transcripts/transcript-donald-trump-signs-relief-bill-says-comments-on-injecting-disinfectant-were-sarcastic","Transcript: Donald Trump Signs Relief Bill, Says Comments on Injecting Disinfectant Were “Sarcastic”","11:27"
"Speaker 9","Thank you.","https://www.rev.com/blog/transcripts/transcript-donald-trump-signs-relief-bill-says-comments-on-injecting-disinfectant-were-sarcastic","Transcript: Donald Trump Signs Relief Bill, Says Comments on Injecting Disinfectant Were “Sarcastic”","11:28"
"Donald Trump","They’re great. And they’re lucky to have you. [crosstalk 00:11:30].","https://www.rev.com/blog/transcripts/transcript-donald-trump-signs-relief-bill-says-comments-on-injecting-disinfectant-were-sarcastic","Transcript: Donald Trump Signs Relief Bill, Says Comments on Injecting Disinfectant Were “Sarcastic”","11:28"
"John","Mr. President, can I make a comment on the energy, sir? Sorry to interrupt.","https://www.rev.com/blog/transcripts/transcript-donald-trump-signs-relief-bill-says-comments-on-injecting-disinfectant-were-sarcastic","Transcript: Donald Trump Signs Relief Bill, Says Comments on Injecting Disinfectant Were “Sarcastic”","11:28"
"Donald Trump","Yes, please. Go ahead.","https://www.rev.com/blog/transcripts/transcript-donald-trump-signs-relief-bill-says-comments-on-injecting-disinfectant-were-sarcastic","Transcript: Donald Trump Signs Relief Bill, Says Comments on Injecting Disinfectant Were “Sarcastic”","11:32"
