"speaker","transcription","url","headlin","timing"
"Reporters","… to President Obama. President Obama.","https://www.rev.com/blog/transcripts/transcript-donald-trump-says-hell-ban-tiktok-with-executive-action","Transcript: Donald Trump Says He May Ban TikTok, Talks Low Income Housing","00:00"
"Donald Trump","Yeah. Go ahead. Please, go ahead.","https://www.rev.com/blog/transcripts/transcript-donald-trump-says-hell-ban-tiktok-with-executive-action","Transcript: Donald Trump Says He May Ban TikTok, Talks Low Income Housing","00:03"
"Reporters","Your reaction to President Obama, sir?","https://www.rev.com/blog/transcripts/transcript-donald-trump-says-hell-ban-tiktok-with-executive-action","Transcript: Donald Trump Says He May Ban TikTok, Talks Low Income Housing","00:06"
"Donald Trump","Yeah.","https://www.rev.com/blog/transcripts/transcript-donald-trump-says-hell-ban-tiktok-with-executive-action","Transcript: Donald Trump Says He May Ban TikTok, Talks Low Income Housing","00:10"
"Reporters","Your reaction to President Obama? He said that you’re targeting minorities and attacking voting rights.","https://www.rev.com/blog/transcripts/transcript-donald-trump-says-hell-ban-tiktok-with-executive-action","Transcript: Donald Trump Says He May Ban TikTok, Talks Low Income Housing","00:11"
"Donald Trump","Well, he did a bad job for minorities. I did much more for minorities than he did. And if you look at our numbers prior to the plague coming in, and those numbers will soon be back, you’ll see I did a much better job than Obama did by far for African Americans, for Asian Americans, for women, for anything group you look at, far better than Obama did. Yeah.","https://www.rev.com/blog/transcripts/transcript-donald-trump-says-hell-ban-tiktok-with-executive-action","Transcript: Donald Trump Says He May Ban TikTok, Talks Low Income Housing","00:17"
"Reporters","Mr. President, why weren’t you at John Lewis’s funeral?","https://www.rev.com/blog/transcripts/transcript-donald-trump-says-hell-ban-tiktok-with-executive-action","Transcript: Donald Trump Says He May Ban TikTok, Talks Low Income Housing","00:49"
"Donald Trump","Yeah, go ahead please.","https://www.rev.com/blog/transcripts/transcript-donald-trump-says-hell-ban-tiktok-with-executive-action","Transcript: Donald Trump Says He May Ban TikTok, Talks Low Income Housing","00:49"
"Reporters","What do you say to the people [inaudible 00:00:50]-","https://www.rev.com/blog/transcripts/transcript-donald-trump-says-hell-ban-tiktok-with-executive-action","Transcript: Donald Trump Says He May Ban TikTok, Talks Low Income Housing","00:50"
"Donald Trump","Well, we don’t want that to happen. [crosstalk 00:00:53] Yeah, we don’t want that to happen. But people have to come into our country legally. Right now we have 267 miles of wall. We’re doing very well on keeping the drugs out and keeping people out that aren’t supposed to be here. But people have to come into our country legally. [crosstalk 00:01:09] Go ahead.","https://www.rev.com/blog/transcripts/transcript-donald-trump-says-hell-ban-tiktok-with-executive-action","Transcript: Donald Trump Says He May Ban TikTok, Talks Low Income Housing","00:50"
"Reporters","[inaudible 00:01:17].","https://www.rev.com/blog/transcripts/transcript-donald-trump-says-hell-ban-tiktok-with-executive-action","Transcript: Donald Trump Says He May Ban TikTok, Talks Low Income Housing","01:17"
"Donald Trump","We’re taking a look at it very strongly. We’re working with representatives of DACA, and we’re also working on a big immigration bill, which is merit-based and something that people are going to be very happy with. We’re doing a very big immigration bill and we’re doing a very big healthcare bill. The other thing we’re working on very strongly, and it’s very important, is prescription drug prices. The drug companies are not exactly happy. In fact, I assume they’ll be taking ads. But we’re doing a drug prescription bill, in a sense. We’ve already signed it for the most part. One goes into effect very soon, that’s going to get us to be tied with or lower than the lowest drug prices anywhere in the world. Right now, the United States, because of what has happened over years, we have the highest prescription drug prices in the world. We will soon have the lowest.","https://www.rev.com/blog/transcripts/transcript-donald-trump-says-hell-ban-tiktok-with-executive-action","Transcript: Donald Trump Says He May Ban TikTok, Talks Low Income Housing","01:17"
"Reporters","Mr. President [crosstalk 00:02:14]","https://www.rev.com/blog/transcripts/transcript-donald-trump-says-hell-ban-tiktok-with-executive-action","Transcript: Donald Trump Says He May Ban TikTok, Talks Low Income Housing","02:14"
"Donald Trump","Go ahead, Jennifer.","https://www.rev.com/blog/transcripts/transcript-donald-trump-says-hell-ban-tiktok-with-executive-action","Transcript: Donald Trump Says He May Ban TikTok, Talks Low Income Housing","02:14"
"Jennifer","Are we expecting a TikTok decision today?","https://www.rev.com/blog/transcripts/transcript-donald-trump-says-hell-ban-tiktok-with-executive-action","Transcript: Donald Trump Says He May Ban TikTok, Talks Low Income Housing","02:14"
"Donald Trump","We’re looking at TikTok. We may be banning TikTok. We may be doing some other things. There are a couple of options, but a lot of things are happening. So we’ll see what happens. But we are looking at a lot of alternatives with respect to TikTok.","https://www.rev.com/blog/transcripts/transcript-donald-trump-says-hell-ban-tiktok-with-executive-action","Transcript: Donald Trump Says He May Ban TikTok, Talks Low Income Housing","02:19"
"Reporters","Mr. President, the suburban lifestyle dream [crosstalk 00:02:38]-","https://www.rev.com/blog/transcripts/transcript-donald-trump-says-hell-ban-tiktok-with-executive-action","Transcript: Donald Trump Says He May Ban TikTok, Talks Low Income Housing","02:33"
"Reporters","What is your feeling about-","https://www.rev.com/blog/transcripts/transcript-donald-trump-says-hell-ban-tiktok-with-executive-action","Transcript: Donald Trump Says He May Ban TikTok, Talks Low Income Housing","02:39"
"Donald Trump","About what?","https://www.rev.com/blog/transcripts/transcript-donald-trump-says-hell-ban-tiktok-with-executive-action","Transcript: Donald Trump Says He May Ban TikTok, Talks Low Income Housing","02:40"
"Reporters","The delay on election on Hong Kong.","https://www.rev.com/blog/transcripts/transcript-donald-trump-says-hell-ban-tiktok-with-executive-action","Transcript: Donald Trump Says He May Ban TikTok, Talks Low Income Housing","02:40"
"Donald Trump","We’re going to have a report for you tomorrow on that.","https://www.rev.com/blog/transcripts/transcript-donald-trump-says-hell-ban-tiktok-with-executive-action","Transcript: Donald Trump Says He May Ban TikTok, Talks Low Income Housing","02:44"
"Reporters","Suburban lifestyle dream, why would low income housing in the suburbs destroy the suburban lifestyle dream?","https://www.rev.com/blog/transcripts/transcript-donald-trump-says-hell-ban-tiktok-with-executive-action","Transcript: Donald Trump Says He May Ban TikTok, Talks Low Income Housing","02:47"
"Donald Trump","So we ended a rule that was a very horrible rule for people in suburbia and the suburbs. That rule has been a very unfair rule for a long time, and it was going to be made a lot worse by Biden and Cory Booker. It’s a rule that basically you build low-income housing and you build other forms of housing. Also having to do with zoning and destroy people that have lived in communities in suburbia for years, they’ve lived there and they want to destroy their lives and destroy what they have. That has been going on for a long time. I ended the rule, so people living in the suburbs will no longer have that problem. Thank you. Thank you very much.","https://www.rev.com/blog/transcripts/transcript-donald-trump-says-hell-ban-tiktok-with-executive-action","Transcript: Donald Trump Says He May Ban TikTok, Talks Low Income Housing","02:55"
"Reporters","[crosstalk 00:03:36] they share the dream, sir.","https://www.rev.com/blog/transcripts/transcript-donald-trump-says-hell-ban-tiktok-with-executive-action","Transcript: Donald Trump Says He May Ban TikTok, Talks Low Income Housing","03:36"
"Reporters","Are you worried Herman Cain caught COVID in Tulsa? [crosstalk 00:03:39]","https://www.rev.com/blog/transcripts/transcript-donald-trump-says-hell-ban-tiktok-with-executive-action","Transcript: Donald Trump Says He May Ban TikTok, Talks Low Income Housing","03:36"
"Donald Trump","Herman Cain was a great man. He did a fantastic job. He was respected by everybody. He was loved by everybody, and we will miss Herman Cain.","https://www.rev.com/blog/transcripts/transcript-donald-trump-says-hell-ban-tiktok-with-executive-action","Transcript: Donald Trump Says He May Ban TikTok, Talks Low Income Housing","03:42"
"Reporters","[crosstalk 00:03:51] Are you worried he caught COVID in Tulsa?","https://www.rev.com/blog/transcripts/transcript-donald-trump-says-hell-ban-tiktok-with-executive-action","Transcript: Donald Trump Says He May Ban TikTok, Talks Low Income Housing","03:51"
"Donald Trump","No. I don’t think he did, no. Thank you. [crosstalk 00:03:57]","https://www.rev.com/blog/transcripts/transcript-donald-trump-says-hell-ban-tiktok-with-executive-action","Transcript: Donald Trump Says He May Ban TikTok, Talks Low Income Housing","03:54"
