"speaker","transcription","url","headlin","timing"
"John","But first I want to thank you and your administration. Your involvement on the OPEC deal was incredible, vital. It wouldn’t have happened without what you did. Your whole team has been very focused on energy. I do think one issue that a number of us are starting to have concerns about is there are big American financial institutions that the federal government has helped many times. They’re going to do well with regard to facilitating some of the Cares Act stuff. They’re starting to discriminate against American energy companies, discriminate against investment in my state, in Alaska, and I think it’s going to be really important.","https://www.rev.com/blog/transcripts/transcript-donald-trump-signs-relief-bill-says-comments-on-injecting-disinfectant-were-sarcastic","Transcript: Donald Trump Signs Relief Bill, Says Comments on Injecting Disinfectant Were “Sarcastic”","11:34"
"Donald Trump","I don’t like that. That’s-","https://www.rev.com/blog/transcripts/transcript-donald-trump-signs-relief-bill-says-comments-on-injecting-disinfectant-were-sarcastic","Transcript: Donald Trump Signs Relief Bill, Says Comments on Injecting Disinfectant Were “Sarcastic”","12:13"
"John","These big Wall Street banks that want the federal government to help support them, and then they discriminate against a critical sector of the U.S. economy. By the way, the sector in the 2008, 2009 recession that really drove us out of our recession. I don’t think they should be allowed to do that, sir, and I know you have concerns about that.","https://www.rev.com/blog/transcripts/transcript-donald-trump-signs-relief-bill-says-comments-on-injecting-disinfectant-were-sarcastic","Transcript: Donald Trump Signs Relief Bill, Says Comments on Injecting Disinfectant Were “Sarcastic”","12:14"
"Donald Trump","I like the idea of looking into that. You’re right. That got where they were pushed by the radical left and so they’re afraid of the radical left. They shouldn’t be afraid of the radical left. They’re very nice people, AOC plus three and all of her friends. But you shouldn’t be afraid of them. You should reason with them. And if they don’t reason, you do what’s right. You cannot be discriminating against these great energy companies. And there is. I’ve heard that from them that it’s very hard. One of the banks, I think they said we want to be out of energy by 2050. That’s a long time, but they want to be out of energy. What’s that all about, they want to be out of energy? So we’re blessed in this country because we’re sitting on top of tremendous wealth. Very few countries have that kind of wealth.","https://www.rev.com/blog/transcripts/transcript-donald-trump-signs-relief-bill-says-comments-on-injecting-disinfectant-were-sarcastic","Transcript: Donald Trump Signs Relief Bill, Says Comments on Injecting Disinfectant Were “Sarcastic”","12:35"
"Donald Trump","We’re bigger than Saudi Arabia, we’re bigger than Russia. We’re bigger than any other country in terms of our energy. And a lot of things like The Paris Accord, The Paris Accord basically took your wealth away. It didn’t give you the advantage. And I said I won’t sign it because it took the wealth of this country away because they didn’t want us to use our energy. They didn’t want me to use our our great asset. We have tremendous wealth. One of the interesting things, if you look at Iran, and you look at Saudi Arabia, and you look at the big, vast waterways that we patrol, years, and years, and years gratis, for nothing so that other people got rich, so that we could get oil out of there, but so that other people got rich. We never got anything. Now we get things for it, but we don’t have ships very much in there anymore.","https://www.rev.com/blog/transcripts/transcript-donald-trump-signs-relief-bill-says-comments-on-injecting-disinfectant-were-sarcastic","Transcript: Donald Trump Signs Relief Bill, Says Comments on Injecting Disinfectant Were “Sarcastic”","13:20"
"Donald Trump","And with all of the conflict and all of the things, they kept saying, “Where are the American ships?” We have so much energy now, we’re sitting on so much, and it’s happened really over the last three years, three and a half years, we’ve made it. One thing that happened, John, if you look John, you were even in favor of it because you’re an energy person. But we helped Alaska, but we really helped the United States with ANWR for Dan. They did a fantastic job. Ronald Reagan tried to get it approved, he couldn’t do it. Every president tried to get ANWR, they couldn’t do it. I got it approved.","https://www.rev.com/blog/transcripts/transcript-donald-trump-signs-relief-bill-says-comments-on-injecting-disinfectant-were-sarcastic","Transcript: Donald Trump Signs Relief Bill, Says Comments on Injecting Disinfectant Were “Sarcastic”","14:11"
"John","Yes, sir. Great.","https://www.rev.com/blog/transcripts/transcript-donald-trump-signs-relief-bill-says-comments-on-injecting-disinfectant-were-sarcastic","Transcript: Donald Trump Signs Relief Bill, Says Comments on Injecting Disinfectant Were “Sarcastic”","14:45"
"Donald Trump","People don’t even talk about it, and that’s okay. They don’t have to talk about it. That’s why I talk about that.","https://www.rev.com/blog/transcripts/transcript-donald-trump-signs-relief-bill-says-comments-on-injecting-disinfectant-were-sarcastic","Transcript: Donald Trump Signs Relief Bill, Says Comments on Injecting Disinfectant Were “Sarcastic”","14:46"
"John","We love you in Alaska. I’ll tell you that.","https://www.rev.com/blog/transcripts/transcript-donald-trump-signs-relief-bill-says-comments-on-injecting-disinfectant-were-sarcastic","Transcript: Donald Trump Signs Relief Bill, Says Comments on Injecting Disinfectant Were “Sarcastic”","14:52"
"Donald Trump","But ANWR’s perhaps the largest find in the world, right? It could be, but it’s certainly one of them, but it’s been talked about for years. Maybe the largest finds anywhere in the world. And we got it approved a year ago, and you’re working on it, and it’s incredible. But Ronald Reagan could not do it. He said that was one of his big disappointments. He could not get ANWR approved. They couldn’t get it through. And we got it through, we got it passed. And that was a great achievement for everybody in this room, but it was a great achievement actually for the two of you, the big oil guys. Right? And I have to say, these senators and the people in this room, they love energy. Not that they love it, they love the jobs it produces and they like what it represents, and it gives us total independence. So it’s very important. Okay. Any other questions?","https://www.rev.com/blog/transcripts/transcript-donald-trump-signs-relief-bill-says-comments-on-injecting-disinfectant-were-sarcastic","Transcript: Donald Trump Signs Relief Bill, Says Comments on Injecting Disinfectant Were “Sarcastic”","14:54"
"Speaker 6","Mr. President, just to follow up on energy, Just to put up on energy, are you satisfied with the current output by the Russians and the Saudis, or do you want them further to cut production?","https://www.rev.com/blog/transcripts/transcript-donald-trump-signs-relief-bill-says-comments-on-injecting-disinfectant-were-sarcastic","Transcript: Donald Trump Signs Relief Bill, Says Comments on Injecting Disinfectant Were “Sarcastic”","15:44"
"Donald Trump","You have the mask on. Yeah, that’s great. Just for a second. See the men in front of you? Are you worried about her? Are you worried? He’s not worried. Look, he’s protected. Go ahead.","https://www.rev.com/blog/transcripts/transcript-donald-trump-signs-relief-bill-says-comments-on-injecting-disinfectant-were-sarcastic","Transcript: Donald Trump Signs Relief Bill, Says Comments on Injecting Disinfectant Were “Sarcastic”","15:54"
"Speaker 6","Are you satisfied with the current cut from the Saudis and the Russians, or do you want them to further cut their production?","https://www.rev.com/blog/transcripts/transcript-donald-trump-signs-relief-bill-says-comments-on-injecting-disinfectant-were-sarcastic","Transcript: Donald Trump Signs Relief Bill, Says Comments on Injecting Disinfectant Were “Sarcastic”","16:03"
"Donald Trump","Well, it could be that they further cut. I think it’s going to be natural though, really isn’t it? It’s going to be natural at this point. So I think I got them to cut maybe, what would you say? I would say-","https://www.rev.com/blog/transcripts/transcript-donald-trump-signs-relief-bill-says-comments-on-injecting-disinfectant-were-sarcastic","Transcript: Donald Trump Signs Relief Bill, Says Comments on Injecting Disinfectant Were “Sarcastic”","16:10"
"John","9.5 barrels.","https://www.rev.com/blog/transcripts/transcript-donald-trump-signs-relief-bill-says-comments-on-injecting-disinfectant-were-sarcastic","Transcript: Donald Trump Signs Relief Bill, Says Comments on Injecting Disinfectant Were “Sarcastic”","16:23"
"Donald Trump","Well they say 10 million, but I think it’s 15 million barrels. I even heard 20 million, but it’s going to be natural. And in all fairness, Texas and Oklahoma, and if you go to North Dakota, and all of our places, it’s going to be natural. Canada’s cutting. They’ve got to cut. Right now, they’ve got to cut. [crosstalk 00:16:46]. Supply and demand is a beautiful thing, but what happened is one day, all of our demand just… Not all, 50% of our demand disappeared with this virus. They say from 40 to 50%. So you’re producing and it’s going good, price is good, price is good enough for these companies and really good for the countries. It was really good and the consumer. And then one day in, one day, it stopped. I guess you could always say it’s somebody’s fault, but it happened. Something happened that nobody thought would ever happen. Okay, yes.","https://www.rev.com/blog/transcripts/transcript-donald-trump-signs-relief-bill-says-comments-on-injecting-disinfectant-were-sarcastic","Transcript: Donald Trump Signs Relief Bill, Says Comments on Injecting Disinfectant Were “Sarcastic”","16:24"
"Ayesha Rascoe","Just a couple more on hydroxychloroquine.","https://www.rev.com/blog/transcripts/transcript-donald-trump-signs-relief-bill-says-comments-on-injecting-disinfectant-were-sarcastic","Transcript: Donald Trump Signs Relief Bill, Says Comments on Injecting Disinfectant Were “Sarcastic”","17:22"
"Donald Trump","Go ahead.","https://www.rev.com/blog/transcripts/transcript-donald-trump-signs-relief-bill-says-comments-on-injecting-disinfectant-were-sarcastic","Transcript: Donald Trump Signs Relief Bill, Says Comments on Injecting Disinfectant Were “Sarcastic”","17:23"
"Ayesha Rascoe","Have you or a Secretary Azar pressured or asked scientists in the administration to promote it, and are you taking-","https://www.rev.com/blog/transcripts/transcript-donald-trump-signs-relief-bill-says-comments-on-injecting-disinfectant-were-sarcastic","Transcript: Donald Trump Signs Relief Bill, Says Comments on Injecting Disinfectant Were “Sarcastic”","17:24"
"Donald Trump","Well, I never spoke to a scientist, but I will tell you this, I did speak with the president of Honduras just a little while ago and I didn’t bring it up. He brought it up. He said they used the hydroxychloroquine. Then he said, “The results are so incredible with hydroxychloroquine.” This happened an hour ago. I just spoke to him, the president of Honduras. And I guess we made some available to them or whatever. He was thanking me and I said, “How has the result been?” He said, “It’s been incredible.” Now, I don’t know, he’s not a doctor I don’t think, but he thanked me and he said, “The results have been very good.” So you hear it both ways. I’ve seen all negative other than the other day I saw some study, which wasn’t good, but I saw very positive coming out of France and coming out of a lot. But here’s the president of Honduras saying how good it was. I didn’t even bring up the subject, he brought it up. So the study has to be there.","https://www.rev.com/blog/transcripts/transcript-donald-trump-signs-relief-bill-says-comments-on-injecting-disinfectant-were-sarcastic","Transcript: Donald Trump Signs Relief Bill, Says Comments on Injecting Disinfectant Were “Sarcastic”","17:32"
"Ayesha Rascoe","Are you taking it?","https://www.rev.com/blog/transcripts/transcript-donald-trump-signs-relief-bill-says-comments-on-injecting-disinfectant-were-sarcastic","Transcript: Donald Trump Signs Relief Bill, Says Comments on Injecting Disinfectant Were “Sarcastic”","18:30"
"Donald Trump","Look, I’m not a doctor. The study has to be done, and maybe it’s helping. If it helps, it’s great. If it doesn’t help, don’t do it. It does work with, as you know, malaria, lupus, etc., and it’s a very powerful drug. And I would say this, if it works, I think everybody would be in favor of it, but check with him. Call him, the president of Honduras, a really nice guy. We were just on the phone. You know what he needed? Ventilators. He said, “Can you give?” I said, “We can help you” because we’re going to have 110,000 made in a very short period of time, and they’ve been making them by the thousands.","https://www.rev.com/blog/transcripts/transcript-donald-trump-signs-relief-bill-says-comments-on-injecting-disinfectant-were-sarcastic","Transcript: Donald Trump Signs Relief Bill, Says Comments on Injecting Disinfectant Were “Sarcastic”","18:30"
"Donald Trump","Mike Pence went out to a factory in Wisconsin just the other day, three days ago, and he came back. He could not believe how incredible the factory was. They’re making thousands of ventilators every couple of months, thousands. And countries are calling us now. France, Italy. We’re sending to Italy, France, Spain. We are making thousands and thousands of very high grade ventilators. There’s a big difference between high grade and not high grade when it comes to what those do, and we’re sending them to countries as they call. As they need them, we’re sending them all over the world. And when we asked the governors, “Do you need ventilators?” The answer is no. In fact, New York was nice. I think they sent them to Massachusetts. Yeah, please, Jeff?","https://www.rev.com/blog/transcripts/transcript-donald-trump-signs-relief-bill-says-comments-on-injecting-disinfectant-were-sarcastic","Transcript: Donald Trump Signs Relief Bill, Says Comments on Injecting Disinfectant Were “Sarcastic”","19:10"
"Jeff","Mr. President, just to follow up on the comments from yesterday, you said you were being sarcastic, but some people may have misunderstood you. Do you want to just clarify?","https://www.rev.com/blog/transcripts/transcript-donald-trump-signs-relief-bill-says-comments-on-injecting-disinfectant-were-sarcastic","Transcript: Donald Trump Signs Relief Bill, Says Comments on Injecting Disinfectant Were “Sarcastic”","19:59"
"Donald Trump","Well, I think I did.","https://www.rev.com/blog/transcripts/transcript-donald-trump-signs-relief-bill-says-comments-on-injecting-disinfectant-were-sarcastic","Transcript: Donald Trump Signs Relief Bill, Says Comments on Injecting Disinfectant Were “Sarcastic”","20:06"
"Jeff","Do you want to just clarify for Americans that you don’t want people doing that?","https://www.rev.com/blog/transcripts/transcript-donald-trump-signs-relief-bill-says-comments-on-injecting-disinfectant-were-sarcastic","Transcript: Donald Trump Signs Relief Bill, Says Comments on Injecting Disinfectant Were “Sarcastic”","20:07"
"Donald Trump","Yeah, I do think the disinfectant on the hands could have a very good effect. Now, Bill is going back to check that in the laboratory. It’s an amazing laboratory, by the way. It’s amazing the work they do. So he’s going to check because a hard surface, this is a hard surface, I guess maybe depending on whose hands you’re talking about, but this is a hard surface, and the disinfectant has an unbelievable, it wipes it out. You saw it. Sun, and heat, and humidity wipe it out. And this is from tests. They’ve been doing these tests for a number of months and the result… So then I said, “Well, how do we do it inside the body or even outside the body with the hands? And disinfectant, I think would work. He thinks it would work. But you use it when you’re doing your hands. I guess that’s one of the reasons they say wash your hands, but whether it’s washing your hands or disinfectant on your hands, it’s very good.”","https://www.rev.com/blog/transcripts/transcript-donald-trump-signs-relief-bill-says-comments-on-injecting-disinfectant-were-sarcastic","Transcript: Donald Trump Signs Relief Bill, Says Comments on Injecting Disinfectant Were “Sarcastic”","20:09"
"Donald Trump","So they’re going to start looking at that. And there is a way of if light, if sun, sun itself, that sun has a tremendous impact on it. It kills it like in one minute. It goes from, what was it, hours to like one minute it’s dead. So I said, “You got to go back and look.” But I’d like them now to look as it pertains to the human body. Not just sitting on a railing or sitting on a wall. I’d like them to look as it pertains, because maybe there’s something there. I’m not a doctor. They have to work with the doctors, but maybe there is something to light, and the human body, and helping people that are dying. Okay?","https://www.rev.com/blog/transcripts/transcript-donald-trump-signs-relief-bill-says-comments-on-injecting-disinfectant-were-sarcastic","Transcript: Donald Trump Signs Relief Bill, Says Comments on Injecting Disinfectant Were “Sarcastic”","21:10"
"Jeff","But just to clarify that, sir, you’re not encouraging Americans to inject disinfectant?","https://www.rev.com/blog/transcripts/transcript-donald-trump-signs-relief-bill-says-comments-on-injecting-disinfectant-were-sarcastic","Transcript: Donald Trump Signs Relief Bill, Says Comments on Injecting Disinfectant Were “Sarcastic”","21:50"
"Donald Trump","No, of course not. Interior wise, it was said sarcastically. It was put in the form of a question to a group of extraordinarily hostile people, namely the fake news media. Okay? So-","https://www.rev.com/blog/transcripts/transcript-donald-trump-signs-relief-bill-says-comments-on-injecting-disinfectant-were-sarcastic","Transcript: Donald Trump Signs Relief Bill, Says Comments on Injecting Disinfectant Were “Sarcastic”","21:57"
"Jeff","Some doctors felt they needed to clarify that after your comment.","https://www.rev.com/blog/transcripts/transcript-donald-trump-signs-relief-bill-says-comments-on-injecting-disinfectant-were-sarcastic","Transcript: Donald Trump Signs Relief Bill, Says Comments on Injecting Disinfectant Were “Sarcastic”","22:11"
"Donald Trump","Well, of course. All they had to do was see. You know the way it was asked, I was looking at you.","https://www.rev.com/blog/transcripts/transcript-donald-trump-signs-relief-bill-says-comments-on-injecting-disinfectant-were-sarcastic","Transcript: Donald Trump Signs Relief Bill, Says Comments on Injecting Disinfectant Were “Sarcastic”","22:13"
"Jeff","No, sir. I wasn’t here yesterday.","https://www.rev.com/blog/transcripts/transcript-donald-trump-signs-relief-bill-says-comments-on-injecting-disinfectant-were-sarcastic","Transcript: Donald Trump Signs Relief Bill, Says Comments on Injecting Disinfectant Were “Sarcastic”","22:18"
"Donald Trump","I know. I know.","https://www.rev.com/blog/transcripts/transcript-donald-trump-signs-relief-bill-says-comments-on-injecting-disinfectant-were-sarcastic","Transcript: Donald Trump Signs Relief Bill, Says Comments on Injecting Disinfectant Were “Sarcastic”","22:18"
"Ayesha Rascoe","You were looking at Dr. Birx.","https://www.rev.com/blog/transcripts/transcript-donald-trump-signs-relief-bill-says-comments-on-injecting-disinfectant-were-sarcastic","Transcript: Donald Trump Signs Relief Bill, Says Comments on Injecting Disinfectant Were “Sarcastic”","22:18"
"Donald Trump","What’s that?","https://www.rev.com/blog/transcripts/transcript-donald-trump-signs-relief-bill-says-comments-on-injecting-disinfectant-were-sarcastic","Transcript: Donald Trump Signs Relief Bill, Says Comments on Injecting Disinfectant Were “Sarcastic”","22:18"
"Ayesha Rascoe","You were looking at Dr. Birx.","https://www.rev.com/blog/transcripts/transcript-donald-trump-signs-relief-bill-says-comments-on-injecting-disinfectant-were-sarcastic","Transcript: Donald Trump Signs Relief Bill, Says Comments on Injecting Disinfectant Were “Sarcastic”","22:18"
"Donald Trump","I was looking at a Bill, I was looking at the doctor, I was looking at some of the reporters. I don’t know if you were there. Were you there? I don’t think you were there.","https://www.rev.com/blog/transcripts/transcript-donald-trump-signs-relief-bill-says-comments-on-injecting-disinfectant-were-sarcastic","Transcript: Donald Trump Signs Relief Bill, Says Comments on Injecting Disinfectant Were “Sarcastic”","22:25"
"Ayesha Rascoe","I was there and I watched you ask her.","https://www.rev.com/blog/transcripts/transcript-donald-trump-signs-relief-bill-says-comments-on-injecting-disinfectant-were-sarcastic","Transcript: Donald Trump Signs Relief Bill, Says Comments on Injecting Disinfectant Were “Sarcastic”","22:33"
"Donald Trump","No, not you. You were there. If you’re there, I never forget. You were.","https://www.rev.com/blog/transcripts/transcript-donald-trump-signs-relief-bill-says-comments-on-injecting-disinfectant-were-sarcastic","Transcript: Donald Trump Signs Relief Bill, Says Comments on Injecting Disinfectant Were “Sarcastic”","22:34"
"Jeff","I wasn’t there yesterday.","https://www.rev.com/blog/transcripts/transcript-donald-trump-signs-relief-bill-says-comments-on-injecting-disinfectant-were-sarcastic","Transcript: Donald Trump Signs Relief Bill, Says Comments on Injecting Disinfectant Were “Sarcastic”","22:38"
"Donald Trump","You were not?","https://www.rev.com/blog/transcripts/transcript-donald-trump-signs-relief-bill-says-comments-on-injecting-disinfectant-were-sarcastic","Transcript: Donald Trump Signs Relief Bill, Says Comments on Injecting Disinfectant Were “Sarcastic”","22:40"
"Jeff","No, sir.","https://www.rev.com/blog/transcripts/transcript-donald-trump-signs-relief-bill-says-comments-on-injecting-disinfectant-were-sarcastic","Transcript: Donald Trump Signs Relief Bill, Says Comments on Injecting Disinfectant Were “Sarcastic”","22:40"
"Donald Trump","I didn’t think you were there. Okay.","https://www.rev.com/blog/transcripts/transcript-donald-trump-signs-relief-bill-says-comments-on-injecting-disinfectant-were-sarcastic","Transcript: Donald Trump Signs Relief Bill, Says Comments on Injecting Disinfectant Were “Sarcastic”","22:41"
"Speaker 5","Mr. President, I know you continue to say you’re obviously-","https://www.rev.com/blog/transcripts/transcript-donald-trump-signs-relief-bill-says-comments-on-injecting-disinfectant-were-sarcastic","Transcript: Donald Trump Signs Relief Bill, Says Comments on Injecting Disinfectant Were “Sarcastic”","22:48"
"Donald Trump","Okay. Hold it one second. Any other questions from any other people? Okay. Thank you very much everybody.","https://www.rev.com/blog/transcripts/transcript-donald-trump-signs-relief-bill-says-comments-on-injecting-disinfectant-were-sarcastic","Transcript: Donald Trump Signs Relief Bill, Says Comments on Injecting Disinfectant Were “Sarcastic”","22:49"
