"speaker","transcription","url","headlin","timing"
"Donald Trump","Well, we’re just putting a ban on, as you know, going on immediately, essentially, almost immediately to Brazil and from Brazil into our country. So from Brazil to the United States, having a very hard time in Brazil. We’ll be doing certain announcements on other countries, including Europe, as we move along and where they’re making progress, we’ll start to open it up. But only where they’re making progress. They’re making some good progress. I think we’re making very good progress.","https://www.rev.com/blog/transcripts/donald-trump-transcript-on-protecting-seniors-with-diabetes-may-26","Transcript: Donald Trump Remarks on Protecting Seniors with Diabetes May 26","38:02"
"Donald Trump","We’re making very good progress on the economy. The numbers are better than anybody would have anticipated. And certainly I think that’s been reflected in the stock market, which had a very big day. And it’s over 25,000. And when you think 25,000 is a very high number, when you think that it was at 29,000 and now it’s at 25, that’s a very big day. It’s up very substantially over the last six months. So we had a very big day. But people are seeing what’s happening. And they’re seeing there is a pent up demand as I was predicting and you’re going to see it more and more. We call it the transition to greatness and it really is. We’re going to have a third quarter that’s going to be good. We’re going to have a fourth quarter that has the potential to be really good. And we’re going to have one of the best years we’ve ever had next year. That’s what we see. Yeah. John, go ahead.","https://www.rev.com/blog/transcripts/donald-trump-transcript-on-protecting-seniors-with-diabetes-may-26","Transcript: Donald Trump Remarks on Protecting Seniors with Diabetes May 26","38:30"
"John","Mr. President, is it your intention to bring American forces home from Afghanistan by Thanksgiving day? And is the Pentagon drawing up plans to that effect?","https://www.rev.com/blog/transcripts/donald-trump-transcript-on-protecting-seniors-with-diabetes-may-26","Transcript: Donald Trump Remarks on Protecting Seniors with Diabetes May 26","39:19"
"Donald Trump","Well, I think everyone knows we’re down to less than 8,000 troops, we’re with leadership in many different fields and in many different parts of that country, we’re dealing with the Taliban, we’re dealing with the president, the president now has gotten themselves straightened out with the two presidents. But we’re dealing with because as yo know, they had competing factors in factions.","https://www.rev.com/blog/transcripts/donald-trump-transcript-on-protecting-seniors-with-diabetes-may-26","Transcript: Donald Trump Remarks on Protecting Seniors with Diabetes May 26","39:30"
"Donald Trump","Yeah. I think we want to get … we’re there 19 years. We’re really not acting as soldiers. We’re acting as police. And we’re not set over there to be policemen, but we’re there 19 years. And yeah, I think that’s enough. And they understand we’re having a very positive talks. We want to bring our soldiers back home. We want to bring them back home. And we’re not only talking about there. We’re talking about other countries, also. We bring our soldiers back home.","https://www.rev.com/blog/transcripts/donald-trump-transcript-on-protecting-seniors-with-diabetes-may-26","Transcript: Donald Trump Remarks on Protecting Seniors with Diabetes May 26","39:57"
"Donald Trump","We can always go back if we have to. We have to go back, we’ll go back and we’ll go back raging. And they will go back as warriors, fighters. But right now we’re policing and we’re not meant to be a police force. We’re meant to be a fighting force.","https://www.rev.com/blog/transcripts/donald-trump-transcript-on-protecting-seniors-with-diabetes-may-26","Transcript: Donald Trump Remarks on Protecting Seniors with Diabetes May 26","40:25"
"John","Is Thanksgiving day the target?","https://www.rev.com/blog/transcripts/donald-trump-transcript-on-protecting-seniors-with-diabetes-may-26","Transcript: Donald Trump Remarks on Protecting Seniors with Diabetes May 26","40:38"
"Donald Trump","No. I have no target, but as soon as reasonable over a period of time. But as soon as reasonable. We’re down to 7,000, some odd soldiers right now. And in Iraq, we’re down to 4,000 soldiers. So we’re making a lot of progress. In Syria, you remember John on the border when I took the soldiers out of the border, everyone said, “Oh, that’s so terrible. Well, I spoke to President [Erdogan 00:41:03] yesterday of Turkey. The border has been fine without us. They’d been policing that border for 2,000 years. All of a sudden we had thousands of soldiers there doing their work. For what? Guarding Syria and Turkey on a border, a very long border. No, we want our trips back home. We took them out. That was a year ago. I was criticized. Nothing happened except they’re watching their own borders now. We kept the oil, but at some point we’ll take care of the Kurds with respect to the oil and get out.","https://www.rev.com/blog/transcripts/donald-trump-transcript-on-protecting-seniors-with-diabetes-may-26","Transcript: Donald Trump Remarks on Protecting Seniors with Diabetes May 26","40:40"
"Donald Trump","Yeah, please go ahead.","https://www.rev.com/blog/transcripts/donald-trump-transcript-on-protecting-seniors-with-diabetes-may-26","Transcript: Donald Trump Remarks on Protecting Seniors with Diabetes May 26","41:35"
"Speaker 4","Mr. President, quickly on your meeting with Governor Cuomo tomorrow.","https://www.rev.com/blog/transcripts/donald-trump-transcript-on-protecting-seniors-with-diabetes-may-26","Transcript: Donald Trump Remarks on Protecting Seniors with Diabetes May 26","41:37"
"Donald Trump","Yeah, he’s coming in.","https://www.rev.com/blog/transcripts/donald-trump-transcript-on-protecting-seniors-with-diabetes-may-26","Transcript: Donald Trump Remarks on Protecting Seniors with Diabetes May 26","41:41"
"Speaker 4","Can you say what you’re going to be discussing? Do you have a particular agenda? Do you think you’ll discuss the gateway project that the Hudson river tunnel project-","https://www.rev.com/blog/transcripts/donald-trump-transcript-on-protecting-seniors-with-diabetes-may-26","Transcript: Donald Trump Remarks on Protecting Seniors with Diabetes May 26","41:42"
"Donald Trump","I would imagine we would, but he asked for the meeting, so we’ll see what he wants. But he asked for the meeting, Governor Cuomo and will be coming in sometime tomorrow.","https://www.rev.com/blog/transcripts/donald-trump-transcript-on-protecting-seniors-with-diabetes-may-26","Transcript: Donald Trump Remarks on Protecting Seniors with Diabetes May 26","41:48"
"Donald Trump","Yeah. Please go ahead.","https://www.rev.com/blog/transcripts/donald-trump-transcript-on-protecting-seniors-with-diabetes-may-26","Transcript: Donald Trump Remarks on Protecting Seniors with Diabetes May 26","41:58"
"Speaker 7","What can you tell us about the documents reportedly declassified by Rick …","https://www.rev.com/blog/transcripts/donald-trump-transcript-on-protecting-seniors-with-diabetes-may-26","Transcript: Donald Trump Remarks on Protecting Seniors with Diabetes May 26","41:59"
"Speaker 8","Can you tell us about the documents reportedly declassified by Rick Grenell just before he stepped down as DNI? Are you prepared to release the transcripts of the Flynn Kislyak conversations?","https://www.rev.com/blog/transcripts/donald-trump-transcript-on-protecting-seniors-with-diabetes-may-26","Transcript: Donald Trump Remarks on Protecting Seniors with Diabetes May 26","42:03"
"Donald Trump","Yeah. I’d like to hear it too. I mean, I’d like to hear the FBI agent said that he didn’t lie and certainly the conversation almost regardless, it was a good conversation. He was allowed to do it and the Mueller people who have been proven very bad, very bad things they did. A lot of bad things of being found out about the hoax. Greatest hoax in the history of our country and it was an illegal hoax and a very dangerous hoax and a lot of bad things have been found out about Mueller and the gang.","https://www.rev.com/blog/transcripts/donald-trump-transcript-on-protecting-seniors-with-diabetes-may-26","Transcript: Donald Trump Remarks on Protecting Seniors with Diabetes May 26","42:11"
"Donald Trump","So I would like to hear that conversation. Yeah. I would like to hear it personally, so whatever they want me to do, I’ll do, I think Rick Grinell has done an incredible job and things are happening now that I always knew this was the answer. This was an attempted coup by a bunch of dirty cops and others. These are dirty cops, dishonest slime bags.","https://www.rev.com/blog/transcripts/donald-trump-transcript-on-protecting-seniors-with-diabetes-may-26","Transcript: Donald Trump Remarks on Protecting Seniors with Diabetes May 26","42:46"
"Donald Trump","All right. Yeah. Question. Go ahead, Jeff.","https://www.rev.com/blog/transcripts/donald-trump-transcript-on-protecting-seniors-with-diabetes-may-26","Transcript: Donald Trump Remarks on Protecting Seniors with Diabetes May 26","43:10"
"Jeff","Thank you, sir. Mr. President, on Friday, you announced that you wanted governors to reopen churches and synagogues and mosques, and you said you would overrule them if they declined to do so.","https://www.rev.com/blog/transcripts/donald-trump-transcript-on-protecting-seniors-with-diabetes-may-26","Transcript: Donald Trump Remarks on Protecting Seniors with Diabetes May 26","43:12"
"Jeff","Can you explain what authority you had in mind when you said that you would do that?","https://www.rev.com/blog/transcripts/donald-trump-transcript-on-protecting-seniors-with-diabetes-may-26","Transcript: Donald Trump Remarks on Protecting Seniors with Diabetes May 26","43:22"
"Donald Trump","I can absolutely do it if I want to and I don’t think I’m going to have to because it’s starting to open up. We need our churches and our synagogues and our mosques. We want them open. Churches, synagogues, mosques, and other, we want them open and we want them open as soon as possible.","https://www.rev.com/blog/transcripts/donald-trump-transcript-on-protecting-seniors-with-diabetes-may-26","Transcript: Donald Trump Remarks on Protecting Seniors with Diabetes May 26","43:26"
"Donald Trump","Now I can tell you, I know a lot of pastors, a lot of rabbis, Imams, and they want to take care of their people. They want to take care. They don’t want anyone getting hurt or sick and they’re going to take care of their people. We need these people. We need people that are going to be leading us in faith that we’re opening them up and if I have to, I will override any governor that wants to play games.","https://www.rev.com/blog/transcripts/donald-trump-transcript-on-protecting-seniors-with-diabetes-may-26","Transcript: Donald Trump Remarks on Protecting Seniors with Diabetes May 26","43:42"
"Donald Trump","If they want to play games, that’s okay, but we will win. We have many different ways where I can override them and if I have to I’ll do that but we want our churches and our synagogues and our mosques, et cetera., we want them open.","https://www.rev.com/blog/transcripts/donald-trump-transcript-on-protecting-seniors-with-diabetes-may-26","Transcript: Donald Trump Remarks on Protecting Seniors with Diabetes May 26","44:09"
"Donald Trump","Now, there may be some areas by the way, where the pastor or whoever may feel that it’s not quite ready and that’s okay. That’s okay but let that be the choice of the congregation and the pastor.","https://www.rev.com/blog/transcripts/donald-trump-transcript-on-protecting-seniors-with-diabetes-may-26","Transcript: Donald Trump Remarks on Protecting Seniors with Diabetes May 26","44:25"
"Donald Trump","John, go ahead,","https://www.rev.com/blog/transcripts/donald-trump-transcript-on-protecting-seniors-with-diabetes-may-26","Transcript: Donald Trump Remarks on Protecting Seniors with Diabetes May 26","44:37"
"John","Mr. President, how long will you give North Carolina Governor Roy Cooper to provide you with the information that you and the RNC are asking for before you decide to look elsewhere for a venue for the RNC convention in August?","https://www.rev.com/blog/transcripts/donald-trump-transcript-on-protecting-seniors-with-diabetes-may-26","Transcript: Donald Trump Remarks on Protecting Seniors with Diabetes May 26","44:40"
"Donald Trump","Well, as you know, we don’t have much time because we have to know that if we’re going to spend millions of dollars on an arena, we want to be in North Carolina. I love North Carolina. I won North Carolina. We just had a big two races that we won recently for Congress in North Carolina; two very big races that the press didn’t want to report on. If we would have lost them, it would have been the biggest story in political history, but we just won two races. It’s a very important place to me. I love North Carolina.","https://www.rev.com/blog/transcripts/donald-trump-transcript-on-protecting-seniors-with-diabetes-may-26","Transcript: Donald Trump Remarks on Protecting Seniors with Diabetes May 26","44:54"
"Donald Trump","In fact, my son, Eric and Laura named a baby Carolina and came from, I think both, but she was born in North Carolina as you know, Laura. So it’s a very important place to me. But at the same time, and I think that people understand this, we have a governor that doesn’t want to open up the state and we have a date of August, at the end of August, and we have to know before we spend millions and millions of dollars on an arena to make it magnificent for the convention and we have tremendous people. I mean the economic development consequences are tremendous for the state. We have to know that when the people come down, they’re going to have the doors open.","https://www.rev.com/blog/transcripts/donald-trump-transcript-on-protecting-seniors-with-diabetes-may-26","Transcript: Donald Trump Remarks on Protecting Seniors with Diabetes May 26","45:20"
"Donald Trump","Now, if the governor can’t tell us very soon, unfortunately, we’ll have no choice. This has nothing to do with us. This is between the governor and North Carolina and the people of North Carolina. But the people want it and we’ll have to see whether or not the governor… Now he’s a Democrat and a lot of the Democrats for political reasons, don’t want to open up their states. So we’ll see if that works but I don’t think it will. I’d love to have it in North Carolina. That was why I chose it, Charlotte, but we’re going to see, we’re going to see and at the end, we need a fast decision from the governor. He’s going to have to get, because he’s been acting very, very slowly and very suspiciously, but we’ll find out.","https://www.rev.com/blog/transcripts/donald-trump-transcript-on-protecting-seniors-with-diabetes-may-26","Transcript: Donald Trump Remarks on Protecting Seniors with Diabetes May 26","46:03"
"Donald Trump","Question, please.","https://www.rev.com/blog/transcripts/donald-trump-transcript-on-protecting-seniors-with-diabetes-may-26","Transcript: Donald Trump Remarks on Protecting Seniors with Diabetes May 26","46:42"
"John","So in terms of soon, are we talking a week?","https://www.rev.com/blog/transcripts/donald-trump-transcript-on-protecting-seniors-with-diabetes-may-26","Transcript: Donald Trump Remarks on Protecting Seniors with Diabetes May 26","46:43"
"Donald Trump","Yeah. We’re talking about a very short period of time. It’s a massive expenditure and we have to know. Yeah, I would say within a week that certainly we have to know. Now if he can’t do it, if he feels that he’s not going to do it, all he has to do is tell us and then we’ll have to pick another location. And I will tell you a lot of locations want it but I picked North Carolina because I do love that state and it would have been a perfect place for it and it still would be. But he’s got to say that when thousands of people come to the arena that they’ll be able to get in. Does that make sense?","https://www.rev.com/blog/transcripts/donald-trump-transcript-on-protecting-seniors-with-diabetes-may-26","Transcript: Donald Trump Remarks on Protecting Seniors with Diabetes May 26","46:46"
"Donald Trump","I mean we’ll spend millions and millions of dollars on this magnificent design, but in the end, they have to be able to get in. I don’t want to have it where we get there and then they announced after all the money was spent, all the work was done, all the people travel in, guess what? You can’t put anybody in the arena or you can put a tiny number of people in the arena. We can’t do that, John. Yeah, please go ahead.","https://www.rev.com/blog/transcripts/donald-trump-transcript-on-protecting-seniors-with-diabetes-may-26","Transcript: Donald Trump Remarks on Protecting Seniors with Diabetes May 26","47:19"
"Speaker 9","There are now more than still more than a dozen states in this country where case numbers are rising. So why is it suspicious if a governor says, “Look, we don’t want to move that quickly. We still think we need to shut down.”","https://www.rev.com/blog/transcripts/donald-trump-transcript-on-protecting-seniors-with-diabetes-may-26","Transcript: Donald Trump Remarks on Protecting Seniors with Diabetes May 26","47:45"
"Donald Trump","I think it’s fine. Look, the governors in certain ways have to do what they want to do but they have to tell me what they’re doing. When it comes to churches, et cetera, they will be overwritten by me. When it comes to other things and many other things they want. If I think some things being done incorrectly or wrong, I’m going to do it. But you have different governors and they have very different views on where they are and where they’re going. So we’ll see what happens. Please. Go ahead.","https://www.rev.com/blog/transcripts/donald-trump-transcript-on-protecting-seniors-with-diabetes-may-26","Transcript: Donald Trump Remarks on Protecting Seniors with Diabetes May 26","47:56"
"Speaker 10","I’m sorry. I’m sure you saw the images from over the weekend of people out on Memorial Day weekend. They were crowding pools, crowding boardwalks. Do you have any message for those people?","https://www.rev.com/blog/transcripts/donald-trump-transcript-on-protecting-seniors-with-diabetes-may-26","Transcript: Donald Trump Remarks on Protecting Seniors with Diabetes May 26","48:23"
"Donald Trump","Yeah. Always be safe. You want to be safe. We’re opening up but you want to be safe? Go ahead, please.","https://www.rev.com/blog/transcripts/donald-trump-transcript-on-protecting-seniors-with-diabetes-may-26","Transcript: Donald Trump Remarks on Protecting Seniors with Diabetes May 26","48:31"
"Speaker 11","Thank you about mail-in voting. You’ve been speaking out against that a lot.","https://www.rev.com/blog/transcripts/donald-trump-transcript-on-protecting-seniors-with-diabetes-may-26","Transcript: Donald Trump Remarks on Protecting Seniors with Diabetes May 26","48:36"
"Donald Trump","You mean mail-in voting?","https://www.rev.com/blog/transcripts/donald-trump-transcript-on-protecting-seniors-with-diabetes-may-26","Transcript: Donald Trump Remarks on Protecting Seniors with Diabetes May 26","48:40"
"Speaker 11","Yeah. You’ve been speaking a lot about that. Why should somebody who is afraid of getting coronavirus, going to public places, standing in a line, et cetera, why should they not be allowed to mail-in?","https://www.rev.com/blog/transcripts/donald-trump-transcript-on-protecting-seniors-with-diabetes-may-26","Transcript: Donald Trump Remarks on Protecting Seniors with Diabetes May 26","48:42"
"Donald Trump","Well, that’s going to be in a long time from now, number one. It’s quite a ways away, number one. But when you do a all mail-in voting ballots, you’re asking for fraud. People steal them out of mailboxes. People print them and then they sign them and they give them in. People don’t even know where the double counted. People take them away. They force people to vote.","https://www.rev.com/blog/transcripts/donald-trump-transcript-on-protecting-seniors-with-diabetes-may-26","Transcript: Donald Trump Remarks on Protecting Seniors with Diabetes May 26","48:54"
"Donald Trump","They harvest. You know what harvesting is? They take many, many ballots and they put them all together and then they just dump them and nobody has any idea whether they’re crooked or not. Look, you do mail-in voting.","https://www.rev.com/blog/transcripts/donald-trump-transcript-on-protecting-seniors-with-diabetes-may-26","Transcript: Donald Trump Remarks on Protecting Seniors with Diabetes May 26","49:16"
"Donald Trump","Now it’s another thing to do absentee voting or if somebody has a medical condition where they go through a process and they get an absentee ballot, that’s okay. That’s different. But in California, the governor sent, I hear or sending millions of ballots all over the state. Millions to anybody. To anybody. People that aren’t citizens, illegals, anybody that walks in California is going to get a ballot. We’re not going to destroy this country by allowing things like that to happen. We’re not destroying our country. This has more to do with fairness and honesty and really our country itself because when that starts happening, you don’t have a fare. You have a rigged system. You have a rigged system and that’s what would happen.","https://www.rev.com/blog/transcripts/donald-trump-transcript-on-protecting-seniors-with-diabetes-may-26","Transcript: Donald Trump Remarks on Protecting Seniors with Diabetes May 26","49:27"
"Donald Trump","So mail-in ballots and the governor of California did better than any, that I could ever do in terms of explaining. When he sent out or will send out, and I don’t know, I think it’s maybe partially already done, millions and millions of ballots to anybody in California, that’s walking or breathing, many of those people don’t have the right to vote. Well, they’ll be voting and you know what? We’re not going to let it happen because you’re subverting our process and you’re making our country a joke and the Democrats are doing it because in theory, it’s good for them. Although last week we two big races. We won in Wisconsin and one in California. California, 25. We won a tremendous race in California.","https://www.rev.com/blog/transcripts/donald-trump-transcript-on-protecting-seniors-with-diabetes-may-26","Transcript: Donald Trump Remarks on Protecting Seniors with Diabetes May 26","50:15"
"Donald Trump","That was interesting because at the end of the race, they brought in the Democrat governor, same governor. He brought in voting booths, not mail-in. Voting booths because they were losing. They saw that through the ballots. But no, you can’t do that. You can’t do the mail-in ballots because you’re going to have tremendous fraud.","https://www.rev.com/blog/transcripts/donald-trump-transcript-on-protecting-seniors-with-diabetes-may-26","Transcript: Donald Trump Remarks on Protecting Seniors with Diabetes May 26","51:04"
"Donald Trump","Remember what I said, there’ll be grabbing them from mailboxes. They’ll even be printing them. They’ll use the same paper, the same machines and they’ll be printing ballots illegally and there’ll be sending them in by the hundreds of thousands and nobody’s going to know the difference. We can’t do that. You want to vote. You really have to. Absentee is okay. You’re sick. As an example, I have to do an absentee because I’m voting in Florida and I happened to be president. I live in that very beautiful house over there. That’s painted white. So that’s okay and it’s okay for people that are sick and they can’t get up something. But voting is a great honor. It’s a great honor and people love to go out and vote and I want to keep it that way. If we don’t keep it that way, we’ll have nothing but a rigged system of this country. We can’t do that. Thank you very much, everybody. Thank you.","https://www.rev.com/blog/transcripts/donald-trump-transcript-on-protecting-seniors-with-diabetes-may-26","Transcript: Donald Trump Remarks on Protecting Seniors with Diabetes May 26","51:22"
"Speaker 12","I was trying to advertise him for it. They got on TV.","https://www.rev.com/blog/transcripts/donald-trump-transcript-on-protecting-seniors-with-diabetes-may-26","Transcript: Donald Trump Remarks on Protecting Seniors with Diabetes May 26","52:25"
