"speaker","transcription","url","headlin","timing"
"Donald Trump","And welcome to the Rose Garden as we take powerful action to lower healthcare costs for America’s seniors. Today, I’m proud to announce that we have reached a breakthrough agreement to dramatically slash the out-of-pocket costs of insulin. You know what’s happened to insulin over the years, right? Through the roof. Insulin, so many people, so necessary. For hundreds and thousands of seniors enrolled in Medicare, that’s a big deal, participating plans will cap costs at just $35 a month per type of insulin. And some plans may offer it free. So for everybody that was getting ripped off and paying tremendous prices as senior citizens… And Seema, I want to thank you because you brought this to my attention a long time ago. And you worked very hard on this day. And the press won’t even cover it, but they’ll cover things that are unimportant.","https://www.rev.com/blog/transcripts/donald-trump-transcript-on-protecting-seniors-with-diabetes-may-26","Transcript: Donald Trump Remarks on Protecting Seniors with Diabetes May 26","00:01"
"Donald Trump","But this is a big day for seniors. This is a tremendous saving, and it allows people that… If you don’t take insulin… I just wrote this down. You go blind, stroke, amputation, kidney failure, and other things. So we’re getting it down $35 per month. And it would be anywhere from 50 to 150 to over $200 a month. So it’s a massive cut, I guess 60-70. Nobody’s seen anything like this for a long time. Sleepy Joe, can’t do this, that I can tell you. In fact, it was his problem with Obamacare that caused part of your problem. This will save impacted Americans am average of minimum $ 446 just on insulin costs a year. We’re pleased to be joined by Vice President Mike Pence and Surgeon General Jerome Adams. I also want to thank Seema again. Thank you very much for the job you’ve done helping achieve the incredible victory for Medicare patients nationwide.","https://www.rev.com/blog/transcripts/donald-trump-transcript-on-protecting-seniors-with-diabetes-may-26","Transcript: Donald Trump Remarks on Protecting Seniors with Diabetes May 26","01:11"
"Donald Trump","In the past, Obamacare prevented insurance providers from competing to offer lower costs for seniors. There was no competition. There was no anything. And they ran away with what took place and the seniors were horribly hurt. Many people couldn’t take insulin. They couldn’t even think about it. As a result, Medicare beneficiaries with prescription drug coverage paid an average of $675 for a year’s supply of insulin. And sometimes as high as $1500. Harmful laws also meant that seniors often paid a different amount almost every single month. They had no idea what they were paying. They were billed. Every month they were billed a different amount and it was a massive amount. One in every three, seniors on Medicare has diabetes and over 3.3 million beneficiaries use at least one type of insulin. Over the past 10 years, these seniors have seen their out-of-pocket cost for this life-saving treatment almost double. I don’t use insulin. Should I be? Huh? I never thought about it. But I know a lot of people are very, very badly affected. Unbelievable.","https://www.rev.com/blog/transcripts/donald-trump-transcript-on-protecting-seniors-with-diabetes-may-26","Transcript: Donald Trump Remarks on Protecting Seniors with Diabetes May 26","02:21"
"Donald Trump","That’s why my administration acted decisively. We slashed Obamacare’s crippling requirements and opened up competition like they’ve never seen before. They’ve never seen competition like this. Between transparency and all of the other things we’re doing, nobody’s ever had a competitive situation created like we’ve done it. And the prices, you will see very soon, they’re going to come tumbling down. Then we brought all the parties to the table, insurer, manufacturers, and other key players. And reached an agreement to deliver insulin at stable and drastically lower out-of-pocket costs for our seniors. I hope the seniors are going to remember it. Because Biden is the one that put us into the jam, because they didn’t know what they were doing. They were incompetent. Soon, nearly half of all eligible Part D and Medicare Advantage Prescription Drug Plans will offer this low-cost option. And when you say low cost, you’re really talking low cost. It’s giving seniors the freedom and choice to pick the plan that’s right for them.","https://www.rev.com/blog/transcripts/donald-trump-transcript-on-protecting-seniors-with-diabetes-may-26","Transcript: Donald Trump Remarks on Protecting Seniors with Diabetes May 26","03:38"
"Donald Trump","Nothing will ever stop me from fulfilling my solemn duty to America’s seniors. I’ll use every power at my disposal to lower drug prices. And my administration will always protect Medicare and social security, and, by the way, preexisting conditions. And we got rid of the individual mandate, which is a disaster. The worst part of Obamacare was the individual mandate. When we got rid of the individual mandate, essentially, we got rid of Obamacare. If you want to know the truth. You can say that in the truest form. But we got rid of a horrible, horrible condition called the individual mandate, but we’ll always protect you on preexisting conditions. Much more so than the Democrats.","https://www.rev.com/blog/transcripts/donald-trump-transcript-on-protecting-seniors-with-diabetes-may-26","Transcript: Donald Trump Remarks on Protecting Seniors with Diabetes May 26","04:46"
"Donald Trump","Here with us today is Bruce Broussard, President and CEO of a big powerful healthcare company, Humana. And I’d like to have Bruce come up and say a few words, please. Bruce? Thank you. That’s a big company. Look how young he is too. That’s very young to be running such a big company.","https://www.rev.com/blog/transcripts/donald-trump-transcript-on-protecting-seniors-with-diabetes-may-26","Transcript: Donald Trump Remarks on Protecting Seniors with Diabetes May 26","05:33"
"Bruce Broussard ","Thank you very much, Mr. President.","https://www.rev.com/blog/transcripts/donald-trump-transcript-on-protecting-seniors-with-diabetes-may-26","Transcript: Donald Trump Remarks on Protecting Seniors with Diabetes May 26","05:54"
"Donald Trump","Thank you, Bruce.","https://www.rev.com/blog/transcripts/donald-trump-transcript-on-protecting-seniors-with-diabetes-may-26","Transcript: Donald Trump Remarks on Protecting Seniors with Diabetes May 26","05:56"
"Bruce Broussard ","Well, I speak on behalf of our 50000 teammates that work at Humana. We are thankful of being here and honored. The demo that you are describing just recently is an example of the strength of public-private partnerships in dealing with large issues such as the affordability of prescription drugs. Insulin is by far the one that is used the most. Another great example of that is the response to COVID and the crisis. And I think about one of our customers Gwen that just recently we served, was blind, did not have access to food, no one could support her because no one was in the vicinity to help her, and in addition, didn’t have access to her prescriptions. And through a strong, private-public partnership, we were able to offer her food and prescriptions delivered to her home. So I want to thank the administration for continuing to pick on large issues like this and bringing in the private enterprise to assist in that. So thank you, Seema, and everybody, everything you’ve done. So thank you.","https://www.rev.com/blog/transcripts/donald-trump-transcript-on-protecting-seniors-with-diabetes-may-26","Transcript: Donald Trump Remarks on Protecting Seniors with Diabetes May 26","05:57"
"Donald Trump","What a job you’ve done, too. Really an amazing job.","https://www.rev.com/blog/transcripts/donald-trump-transcript-on-protecting-seniors-with-diabetes-may-26","Transcript: Donald Trump Remarks on Protecting Seniors with Diabetes May 26","07:07"
"Bruce Broussard ","Well, thank you.","https://www.rev.com/blog/transcripts/donald-trump-transcript-on-protecting-seniors-with-diabetes-may-26","Transcript: Donald Trump Remarks on Protecting Seniors with Diabetes May 26","07:10"
"Donald Trump","You’re also in the right business, right?","https://www.rev.com/blog/transcripts/donald-trump-transcript-on-protecting-seniors-with-diabetes-may-26","Transcript: Donald Trump Remarks on Protecting Seniors with Diabetes May 26","07:11"
"Bruce Broussard ","Well, if we can help any senior, we’re always in the right business. Thank you.","https://www.rev.com/blog/transcripts/donald-trump-transcript-on-protecting-seniors-with-diabetes-may-26","Transcript: Donald Trump Remarks on Protecting Seniors with Diabetes May 26","07:13"
"Donald Trump","That’s good. Well, you’ve really helped. We appreciate it very much. Thank you, Bruce. We’re also joined by Tracey Brown, the CEO of American Diabetes Association. A lot of bad things can happen without insulin in terms of diabetes and other things. Please, Tracey? Thank you very much. Hi, Tracey.","https://www.rev.com/blog/transcripts/donald-trump-transcript-on-protecting-seniors-with-diabetes-may-26","Transcript: Donald Trump Remarks on Protecting Seniors with Diabetes May 26","07:16"
"Speaker 1","Thank you, Mr. President. Thank you Administrator Verma for making this afternoon one that we can focus on. The 34 million Americans like myself, who’s living with diabetes. 7 million of which need insulin to live. 25% of these individuals have told us that they ration or skip doses of their medicine because they simply cannot afford it. And so this effort, CMI MMI demonstration project that brings together the government, industry, and public health advocacy from the American Diabetes Association, is the right thing to do. And we’re thrilled to take this challenge head on. Today, together, we are helping millions of seniors access insulin affordably. This is a very big deal. The American Diabetes Association is the nation’s leading organization that fights for people living with diabetes. And we are committed to continue to partner to make sure every American, and especially our seniors, have access to the medicine that they need to live. So thank you Mr. President, and thank you Administrator Verma.","https://www.rev.com/blog/transcripts/donald-trump-transcript-on-protecting-seniors-with-diabetes-may-26","Transcript: Donald Trump Remarks on Protecting Seniors with Diabetes May 26","07:40"
"Donald Trump","So Tracey, are you surprised at how much we’ve gotten the price down? To what extent and to the level that we brought it down to?","https://www.rev.com/blog/transcripts/donald-trump-transcript-on-protecting-seniors-with-diabetes-may-26","Transcript: Donald Trump Remarks on Protecting Seniors with Diabetes May 26","09:01"
"Speaker 1","This is a very exciting day for people living with diabetes. And so, any step to bring this lower is good news. We know that we need to do more, but I’m so confident that, together, we are going to be able to help all people living with diabetes thrive.","https://www.rev.com/blog/transcripts/donald-trump-transcript-on-protecting-seniors-with-diabetes-may-26","Transcript: Donald Trump Remarks on Protecting Seniors with Diabetes May 26","09:07"
"Donald Trump","Good. Thank you much.","https://www.rev.com/blog/transcripts/donald-trump-transcript-on-protecting-seniors-with-diabetes-may-26","Transcript: Donald Trump Remarks on Protecting Seniors with Diabetes May 26","09:26"
"Speaker 1","Thank you.","https://www.rev.com/blog/transcripts/donald-trump-transcript-on-protecting-seniors-with-diabetes-may-26","Transcript: Donald Trump Remarks on Protecting Seniors with Diabetes May 26","09:27"
"Donald Trump","Appreciate it, Tracey. I’d like to also invite up David Ricks, Chairman CEO of Eli Lilly and Company, a very big and a very great company. Please. He’s another young guy.","https://www.rev.com/blog/transcripts/donald-trump-transcript-on-protecting-seniors-with-diabetes-may-26","Transcript: Donald Trump Remarks on Protecting Seniors with Diabetes May 26","09:28"
"David Ricks","Thank you, Mr. President.","https://www.rev.com/blog/transcripts/donald-trump-transcript-on-protecting-seniors-with-diabetes-may-26","Transcript: Donald Trump Remarks on Protecting Seniors with Diabetes May 26","09:42"
"Donald Trump","Thank you very much, David.","https://www.rev.com/blog/transcripts/donald-trump-transcript-on-protecting-seniors-with-diabetes-may-26","Transcript: Donald Trump Remarks on Protecting Seniors with Diabetes May 26","09:43"
"David Ricks","Pleasure to be here. Really an honor, to be a part of this announcement to improve the lives of so many patients who live with diabetes in our Part D program. For several years, Lilly’s worked hard to improve insulin affordability, and this has been a missing piece that’s now been filled in by the great collaboration from our plan companies like Bruce’s who are here, Seema Verma, your administration, Vice President Pence, President Trump. Thank you for your leadership to make this happen. This is the kind of collaboration that solves real problems for people with serious issues like diabetes. Today, if you take Lilly insulin, you will not pay more than $35 except for in the Part D program. And we’re pleased to add this missing part to that equation, so that starting next year, seniors will benefit from that same savings level. Just a little bit more than a dollar a day for insulin.","https://www.rev.com/blog/transcripts/donald-trump-transcript-on-protecting-seniors-with-diabetes-may-26","Transcript: Donald Trump Remarks on Protecting Seniors with Diabetes May 26","09:43"
"David Ricks","That same spirit of collaboration is also being applied to a collaboration around COVID-19. And I think everyone’s aware that there’s thousands of scientists working in our industry, along with NIH and other experts, to speed around the clock, new therapies for patients suffering from COVID-19, and to arrest and extinguish this pandemic. I’ve never been more proud to be a part of that effort as well, and the same spirit of collaboration is being applied in that incredibly important crisis as well. By working together, I think we proved today, we can solve longterm problems and I hope I can come back someday and show that we’ve solved the immediate problem of COVID-19 working as an industry along with government. So thanks for having me here today. Appreciate it.","https://www.rev.com/blog/transcripts/donald-trump-transcript-on-protecting-seniors-with-diabetes-may-26","Transcript: Donald Trump Remarks on Protecting Seniors with Diabetes May 26","10:37"
"Donald Trump","Yeah, and I think we will. Thank you very much. Thanks, David. Appreciate it. Really good job. I also want to thank the companies with us today for rising to the occasion in our fight against the invisible enemy. Humana and other insurers have agreed to waive copays, which is a very great thing to do. It’s a big deal. Thank you very much. Co-insurance, deductibles, coronavirus treatments for most enrollees. People that aren’t in the business or even in business period, they wouldn’t realize how big a thing that is, but it’s a very big thing and we appreciate it very much.","https://www.rev.com/blog/transcripts/donald-trump-transcript-on-protecting-seniors-with-diabetes-may-26","Transcript: Donald Trump Remarks on Protecting Seniors with Diabetes May 26","11:22"
"Donald Trump","Coronavirus treatment for most enrollees, we’ve been moving along and we’re doing well. We’re going to be reporting on it in just a second. Sanofi is working at breakneck speed to create a vaccine. Eli Lilly has been developing therapeutics for coronavirus and expanding a free drive-through testing operations. And thank you all for the work. It’s been great. We’re battling the virus on every front, speeding relief to our work workers and pursuing therapies and vaccines at record speed. We have many companies right now, I think we can say, very far down the line on vaccines and therapeutics… And cures frankly, I think cures are going to be in there very shortly… Manufacturing, vast quality quantities and medical equipment supplies. All of the different things that you need. We’ve energized our military. Our military is ready logistically to go out and distribute whatever it is we come up with. And I think we’re going to come up with a lot. I think we’re going to have therapeutic remedies and I think we’re going to have vaccines very shortly. I’ve been saying it, “very shortly”. I think I’ll be proven correct. If I’m not, I’m sure the media will let us know about it.","https://www.rev.com/blog/transcripts/donald-trump-transcript-on-protecting-seniors-with-diabetes-may-26","Transcript: Donald Trump Remarks on Protecting Seniors with Diabetes May 26","12:03"
"Donald Trump","We’re safely reopening our country while aggressively protecting the vulnerable, especially our seniors. We’re telling our seniors to stay back a little bit. Stay back, let this thing pass. We’re not only keeping older Americans safe from the virus, we’re also ensuring that they have the best medical care on earth at a price that they can afford. That’s what happened with insulin. Nobody can believe it when they hear the price of the insulin. It’s been an amazing difference, and Seema’s going to be talking about that. That’s not just like a 10% drop or a 5% drop, which by itself would be good. That’s a big drop. That’s a really big drop. We approved a record number of generics and reversed the trend of soaring drug prices…","https://www.rev.com/blog/transcripts/donald-trump-transcript-on-protecting-seniors-with-diabetes-may-26","Transcript: Donald Trump Remarks on Protecting Seniors with Diabetes May 26","13:17"
"Donald Trump","A good number of generics and reverse the trend of soaring drug prices for the first time in over 50 years. First time we’ve ever had prices go down. Average basic part D premiums drop 13.5% the lowest level in seven years. And we’re going down very substantially from that level. It’s going down very, very substantial unless you have a new administration in which case it’ll go up very substantially that I can guarantee you they’ve been doing it to you for years. Average Medicare advantage premiums have plummeted 28% to the lowest level in over a decade. And that’s despite everything that’s been happening, which would normally make things go up. And we have more than let’s see 1200 more Medicare advantage plans today than we did think of that two years ago. So we have 1200 more Medicare advantage plans than we did two years ago. That’s something. I signed an executive order to crack down on fraud in Medicare, and to give beneficiaries faster access to the latest medical devices and therapies and to take all of the fraud money.","https://www.rev.com/blog/transcripts/donald-trump-transcript-on-protecting-seniors-with-diabetes-may-26","Transcript: Donald Trump Remarks on Protecting Seniors with Diabetes May 26","14:03"
"Donald Trump","We’re finding a lot of it, all of that money that we’re finding in Florida reduced prices. We provided nearly $1 billion in grants to support home delivered meals and in home care for elderly patients and disabled people during the pandemic. We expanded tele-health, which has really turned out to be a very hot subject, right? People that never thought about it, people that didn’t like the idea, right Tracy? They’re loving telehealth, it’s speedy and it’s a lot less expensive. We expanded telehealth for Medicare beneficiaries and the number of patients using it has increased from roughly 11,000 a week to nearly 1.3 million. So we went from 11,000 people to 1.3 million people a week. But very big where you’ll be seeing it price transparency, some people think it’s bigger than healthcare. When you look at it, it’s going to be bigger than healthcare price transparency.","https://www.rev.com/blog/transcripts/donald-trump-transcript-on-protecting-seniors-with-diabetes-may-26","Transcript: Donald Trump Remarks on Protecting Seniors with Diabetes May 26","15:07"
"Donald Trump","It was signed approximately nine months ago. It’s going through the process and it’ll be here by the first of the year. So I hope you’re going to remember me just in case the unthinkable happens. But nobody else would’ve gotten it but this administration. Price transparency it’s going to cut your costs tremendously. And that literally one of the biggest people in the field said it’s going to be a bigger thing, price transparency, bigger than healthcare in a true sense. The cost of healthcare is going to come down very, very substantially. We’re always working on preexisting conditions and saving your preexisting conditions. And as long as I’m president, you’ll always be protected on preexisting conditions. And surprise medical billing is something people are surprised, never in a positive sense and we’ve written that out and that’s going to be very quickly ended.","https://www.rev.com/blog/transcripts/donald-trump-transcript-on-protecting-seniors-with-diabetes-may-26","Transcript: Donald Trump Remarks on Protecting Seniors with Diabetes May 26","16:09"
"Donald Trump","So you’re not going to be surprised, meaning badly surprised, very negatively surprised. It’s a big thing, people go in they go for an operation they end up literally losing all of their money, losing everything over something that should not happen. Surprise medical billing. We’re using every tool at our disposal to protect our nursing homes from outbreaks. You saw the disaster of how badly some of the governors handled nursing homes. It’s a disgrace what they’ve done, what the governors, what some of the governors have done is a disgrace. We provided states more resources to step up inspections, added shipments of personal protective equipment to all 15,400 Medicaid and Medicare certified nursing homes and issued a strict new guideline that every nursing home resident and staff are to be tested immediately and that all staff be tested weekly. So we’re making it very, very tough.","https://www.rev.com/blog/transcripts/donald-trump-transcript-on-protecting-seniors-with-diabetes-may-26","Transcript: Donald Trump Remarks on Protecting Seniors with Diabetes May 26","17:08"
"Donald Trump","Every day of my administration we’re fighting for our seniors like never before. Our seniors are very special people, all of our citizens are special, but our seniors we’d have to take care of our seniors. Our senior citizens have spent their entire lives working hard, supporting their communities and families and paying into the system. We will not rest until they get the kind of care and support that they have earned and that they deserve. Now I’d like to ask vice president Mike Pence to come up and say a few words, followed by administrator Verma. And I would just like to thank you again for the great job you’ve done. So we’ll have Mike speak and then you’ll speak and thank you very much. Go ahead, Mike. Thank you.","https://www.rev.com/blog/transcripts/donald-trump-transcript-on-protecting-seniors-with-diabetes-may-26","Transcript: Donald Trump Remarks on Protecting Seniors with Diabetes May 26","18:10"
"Mike Pence","Thank you Mr. President. And let me say what a privilege it is to be here with business leaders and activists who have been standing with you, standing with the white house coronavirus task force from the very beginning. It truly has been a public private partnership that’s marshaled not just a whole of government approach, but a whole of America approach. And we see that evident today in this historic step for America seniors. And let me join the president in expressing our profound gratitude to the servant heart that each one of you have brought and all of your employees have brought. The importance of today’s announcement cannot be overstated Mr. President. As you observed early on, we recognized that the coronavirus represented a particular threat to seniors with underlying health conditions and diabetes being among them. And today’s step ensures that as we continue to work to safely reopen our country, we’re going to make sure that our seniors have access to affordable healthcare, to insulin and treatment to be able to meet that moment along with us.","https://www.rev.com/blog/transcripts/donald-trump-transcript-on-protecting-seniors-with-diabetes-may-26","Transcript: Donald Trump Remarks on Protecting Seniors with Diabetes May 26","18:56"
